rank,uri,artist_names,track_name,source,peak_rank,previous_rank,days_on_chart,streams
1,"spotify:track:0c82YIGpQ5dCaXpTNCk4sb","Tiago PZK, Anitta, Emilia","Alegría","WEA Latina",1,1,79,"429065"
2,"spotify:track:0SoBfYjQHvL6cuWHtPUYnq","Valentino Merlo, The La Planta","Hoy","TLP Records",1,5,156,"386039"
3,"spotify:track:5AkLEnorFvb7WIJOGqKYVT","Big One, Emanero, Valentino Merlo","Si Un Día Estás Sola | CROSSOVER #7","Fifty One",3,6,53,"385921"
4,"spotify:track:6WatFBLVB0x077xWeoVc2k","KAROL G","Si Antes Te Hubiera Conocido","Bichota/Interscope Records",1,4,128,"385026"
5,"spotify:track:7yrTny7FLWLbfIzsxoicWj","Emilia","noviogangsta <3","Sony Music Latin",3,3,14,"364015"
6,"spotify:track:0Sr7ssScx54yxdM2ols7nW","Omar Courtz, De La Rose","Q U E V A S H A C E R H O Y ?","Mr. 305 Records / Rimas Entertainment",1,2,32,"360376"
7,"spotify:track:6kPCcIAGoTeRrh8qrmKa90","Tiago PZK, Ke Personajes","Piel","WEA Latina",2,7,268,"344179"
8,"spotify:track:4dLLdfiniBhDP9dlJQIOi4","Los Ángeles Azules, Emilia","Perdonarte, ¿Para Qué?","OCESA Seitrack",1,10,156,"308390"
9,"spotify:track:5MKbWaXeSQSmzmo7gPQha1","La T y La M, Malandro","Amor de Vago","GraceMusic",9,9,54,"286806"
10,"spotify:track:0EVxchTHYIgx618OrpcrdQ","Maria Becerra","AGORA","WEA Latina",1,8,44,"284431"
11,"spotify:track:1db75lVrSgDFZI1gZh8JlV","Paulo Londra, Luck Ra, Valentino Merlo","Princesa","Paulo Londra / DALE PLAY Records",9,11,44,"275062"
12,"spotify:track:5aZ8rf2aPfZrnRWLA7bByo","Big One, Tiago PZK, La Joaqui","Pa´Que Te Acuerdes | CROSSOVER #8","Fifty One",10,12,24,"254388"
13,"spotify:track:1TyBUtMxdmRfXhW3MmbxtQ","Luck Ra, Abel Pintos","QUE ME FALTE TODO","Sony Music Entertainment Chile S.A",2,17,366,"238747"
14,"spotify:track:5DSMm0BZXlSvqArsTX00Ge","Luck Ra, Nicki Nicole","DOCTOR","Sony Music Latin",2,13,58,"236882"
15,"spotify:track:2N0hVk2Ant8751xPZUjCV2","ECKO, Los Turros, DobleP, Cristian Di Marco","Loquita - Remix","WM Chile",9,16,158,"230237"
16,"spotify:track:6ViJgiKfyqfs52x2pGhuPF","Hernan y La Champion's Liga, Callejero Fino, BM","Despójate Vol.2","Impronta Music",15,15,23,"218420"
17,"spotify:track:42wdz3j7gstgUuhoFLCXqd","FloyyMenor","PELIGROSA","FloyyMenor under exclusive license to UnitedMasters LLC",9,14,102,"209997"
18,"spotify:track:4eqXTlaHeK6xkM1fRx9wR5","Pinky SD, Un Poco de Ruido, Uriel Lozano","Conmigo Te Gustó","Pinky SD",11,31,75,"200365"
19,"spotify:track:3OJDtCdYs8QJnui708tEU3","Shakira","Soltera","Sony Music Latin",15,19,30,"198905"
20,"spotify:track:3cWo162YkfLIFyB3DWbVoH","Q' Lokura, Valentino Merlo","Tu Foto - En Vivo","Q' Lokura",1,25,164,"197162"
21,"spotify:track:5QjmUqgpPQgXgg4606DqZF","Kapo","UWAIE","Sony Music Latin/La Industria",11,20,68,"191938"
22,"spotify:track:42mrOMjkQb7jRKatu0bqg4","Q' Lokura, Luck Ra","Mil Preguntas","Q' Lokura",11,26,198,"191527"
23,"spotify:track:3KeYEr9ogMBemsOfQIJmZp","Big One, Maria Becerra, Trueno","Cuando Te Vi | CROSSOVER #5","Fifty One",1,21,121,"191290"
24,"spotify:track:2AFC9ad4nGauS1cgm7FCqU","Luck Ra, Chayanne","UN SIGLO SIN TI","Sony Music Latin",3,28,93,"187250"
25,"spotify:track:2xbH0CuDbid800YW5nMPzR","Emanero, Karina, j mena, Angela Torres","SINVERGÜENZA - con Angela Torres","Fifty One",13,32,326,"186075"
26,"spotify:track:2RmtEc2ZNDCzAU3vH0AbKx","Nicki Nicole","Ojos Verdes","Sony Music Latin/DALE PLAY Records",3,27,185,"181831"
27,"spotify:track:7k59eQ9b5KXWUNQIMrA7nI","Duki","Barro","DALE PLAY Records / SSJ Records",10,18,9,"179118"
28,"spotify:track:6Es8Sk3xe1HiJ2MXCfHHwR","Emilia, TINI","La_Original.mp3","Sony Music Latin",1,33,359,"179040"
29,"spotify:track:7bywjHOc0wSjGGbj04XbVi","Feid, ATL Jacob","LUNA","UMLE - Latino",4,22,326,"178651"
30,"spotify:track:32fRErxI6gKskZXSbEAAAn","Lali","FANÁTICO","Sony Music Argentina",5,23,30,"172886"
31,"spotify:track:1MCArCVJUgBUrBnzUoZqmq","Salastkbron, Omar Varela","Dimelo Mami","WEA Latina",29,30,59,"171310"
32,"spotify:track:6PhRhocBXP4y7NpciGmzra","Cris Mj, FloyyMenor, LOUKI","Después De La 1","Sonar LLC.",10,24,44,"166824"
33,"spotify:track:0Cs2ANiGsCOQLKnCrNJ6hA","Emilia","La_Playlist.mpeg","Sony Music Latin",8,34,129,"165644"
34,"spotify:track:1HRUB9L0IRcRHzLVD4pk6C","La Joaqui, DobleP, Gusty dj","TERAPIA DE CHOQUE","LA JOAQUI / DALE PLAY Records",6,39,97,"163964"
35,"spotify:track:2wEhjcnre2PU36KQNBLXCC","DobleP, Tuti DJ, Pereiraremix","SE DICE DE MI","DALE PLAY Records / Wesaisons Records",26,40,45,"160360"
36,"spotify:track:4jn3R3KF5hx2fCiXlj89yE","YSY A, Bhavi, Milo j","FLECHAZO EN EL CENTRO","Ysy A",7,29,416,"159700"
37,"spotify:track:0qeIFEGRQqHoaJtLCl0U73","Myke Towers, benny blanco","DEGENERE 👑 (feat. benny blanco)","WEA Latina",37,37,7,"152112"
38,"spotify:track:3oNnzH6hmqIGIhJ1NcHlrh","Maria Becerra","CORAZÓN VACÍO","WEA Latina",1,36,492,"151896"
39,"spotify:track:1pymWRCuZfCd0zdiBJo0Hj","Trueno","REAL GANGSTA LOVE","Sony Music Latin",1,43,156,"143158"
40,"spotify:track:5f4mOETLngamMDTJnbF9s7","Emilia","Exclusive.mp3","Sony Music Latin",3,45,359,"142961"
41,"spotify:track:7eNwwoxDR8KVzNAuGvliAO","Omar Courtz, De La Rose, Haze","Kyoto","House of Haze",29,38,96,"139411"
42,"spotify:track:39Pc4a04VgCtcc7m0XKi9M","Myke Towers","TAMBIÉN","WEA Latina",39,41,49,"137038"
43,"spotify:track:2plbrEY59IikOBgBGLjaoe","Lady Gaga, Bruno Mars","Die With A Smile","Interscope",29,35,69,"136479"
44,"spotify:track:6vRQqxOhUFd78p5tL8jXr7","Luck Ra, BM","La Morocha","Sony Music Entertainment Chile S.A",1,52,478,"134705"
45,"spotify:track:16iLGYXMiLUhvqTEIu4pKB","Milo j","3 PECADOS DESPUES…","DALE PLAY Records",19,42,107,"134118"
46,"spotify:track:5rQSQlZXXjMcevPGoAfE1z","Salastkbron, Diel Paris","Un Besito Más","WEA Latina",2,49,226,"133568"
47,"spotify:track:6a9Z1jUms915w4O7N1PxjY","Rvssian, Rauw Alejandro, Ayra Starr","Santa","Sony Music Latin",1,44,193,"133240"
48,"spotify:track:7JKptWv4YXmievid0HajID","Luck Ra, KHEA","HOLA PERDIDA","Sony Music Entertainment Chile S.A",1,53,296,"132074"
49,"spotify:track:3sra6aEWWDXUiy46fWQobH","Maria Becerra","IMAN (Two Of Us)","WEA Latina",3,50,163,"124790"
50,"spotify:track:4YnmQG1fnJR9LnTZtix70T","J Abdiel, De La Rose, Yan Block, iZaak, Jay Wheeler","WYA REMIX RED","SONAR LLC.",15,46,138,"124478"
51,"spotify:track:7MVIfkyzuUmQ716j8U7yGR","Milo j, Taiu","Rara Vez","Universal Music Argentina S.A.",2,48,623,"124253"
52,"spotify:track:3tiJUOfAEqIrLFRQgGgdoY","Big One, FMK, Ke Personajes","Un Finde | CROSSOVER #2","Fifty One",1,58,571,"121963"
53,"spotify:track:0CgpCtEPvyDizcg2p47VrU","No Te Va Gustar","A las Nueve","Elefante Blanco",25,47,2051,"121930"
54,"spotify:track:5g2Jqe1D2qnZc6LcvWL3e1","Pinky SD, Un Poco de Ruido, El Mago Y La Nueva","Te Vas a Arrepentir","Pinky SD",39,70,60,"120596"
55,"spotify:track:3pCkC3Ahgl7MShJbafchZz","Los Ángeles Azules, Maria Becerra","El Amor de Mi Vida","OCESA Seitrack",11,61,436,"117564"
56,"spotify:track:11PV8CaPqlto9Uejx92C35","Grupo Frontera, Ke Personajes","OJITOS ROJOS","Grupo Frontera",3,65,464,"116505"
57,"spotify:track:0u6JsFiEEXb6kaF0oqyeFi","Luck Ra, La K'onga, Ke Personajes","Ya No Vuelvas (Versión Cuarteto)","Sony Music Entertainment Chile S.A",1,71,695,"114504"
58,"spotify:track:7khla88C1xwKeI6qzwcOuH","Pinky SD, Un Poco de Ruido, Uriel Lozano","No Va a Venir","Pinky SD",35,80,67,"113619"
59,"spotify:track:3tt9i3Hhzq84dPS8H7iSiJ","Manuel Turizo","La Bachata","Sony Music Latin/La Industria",1,54,870,"112445"
60,"spotify:track:3KZCP2StVGdWkOKyRZNWA4","Plan B","Es un Secreto","Pina Records",24,51,703,"111733"
61,"spotify:track:1R3ubqAHKHE6f64Hz37q8h","La T y La M","Un Montón de Estrellas - En Vivo Gran Rex","GraceMusic",51,63,31,"109280"
62,"spotify:track:6VbNzSrjWjTMfrDLJ6Jt5D","Pinky SD, Un Poco de Ruido, Uriel Lozano","La Piel Bien Caliente","Pinky SD",38,83,68,"106817"
63,"spotify:track:0u605hoZG0qHfjqxoE8Cro","Pinky SD, Un Poco de Ruido, Uriel Lozano","Pechos Calientes","Pinky SD",46,102,60,"101773"
64,"spotify:track:5HYUrHf4TAHzMs30T84NZd","Pinky SD, Un Poco de Ruido, Uriel Lozano","Mojada Por Dentro","Pinky SD",41,94,68,"99419"
65,"spotify:track:5Uptvz6j1sjDKxidAcnH2L","Cris Mj","SI NO ES CONTIGO","Sonar LLC.",11,59,156,"99307"
66,"spotify:track:6MuJUSYCqA4FpMogUHzb2R","No Te Va Gustar","Ese Maldito Momento","Elefante Blanco",26,62,1034,"99010"
67,"spotify:track:61qPUnazSdkvua4wgA4L8C","Babasonicos","Como Eran Las Cosas","Universal Music Argentina S.A.",52,56,584,"98925"
68,"spotify:track:5vHWh24GAsXJ7tnIu8v7UN","Airbag","Por Mil Noches","DALE PLAY Records / Airbag",23,60,1761,"97408"
69,"spotify:track:1LiN0Z98FkR1t0m8KmLcAH","Anuel AA, Haze","Amanece","House of Haze",10,72,824,"97259"
70,"spotify:track:4dWzA1JJ0QOTUNBrYv8K9N","DJ Tao, DobleP","DOBLE P | DJ TAO Turreo Sessions #21","WM Chile",54,81,136,"97092"
71,"spotify:track:35ttE4t8lQZA2vuCYDg4G7","Milo j","M.A.I","DALE PLAY Records",10,68,331,"96340"
72,"spotify:track:3ezO8gfskSWM3rk0GTfhFl","Emanero, Ulises Bueno, Migrantes, Los Palmeras","ATORRANTE - con Los Palmeras","Fifty One",12,100,479,"96210"
73,"spotify:track:1Hs1uUl8o2VtDp1DABFq0O","LIT killah, Tiago PZK, Maria Becerra, Duki, Emilia, Rusherking, Big One, FMK","Los del Espacio","WEA Latina",1,78,513,"95849"
74,"spotify:track:2gCdlkqAvzMsmoWd2UfpID","Pinky SD, Un Poco de Ruido, El Mago Y La Nueva","Tu Presa Fácil","Pinky SD",57,111,46,"95787"
75,"spotify:track:2n0NCtkvHx1oPqgiAvexiB","Tan Bionica","Loca","Pirca Records",52,67,385,"94967"
76,"spotify:track:0EhmTBq33eARyOz3SIi4P2","Yami Safdie, Lasso","En Otra Vida","WM Chile",53,55,12,"94629"
77,"spotify:track:7tI8dRuH2Yc6RuoTjxo4dU","Jimin","Who","BIGHIT MUSIC",30,57,100,"94284"
78,"spotify:track:2gmd7lY3QSzLh0xIY4cRvi","Maisak, Feid","SE ME OLVIDA","Universal Music Latino",25,69,63,"93608"
79,"spotify:track:3GD6eImRvT0zgr8cQnokUq","Bhavi, Seven Kayne, Milo j, Tiago PZK, KHEA, Neo Pistea","BESAME (feat. Tiago PZK, Khea & Neo Pistea) - Remix","GMR",1,64,193,"93513"
80,"spotify:track:2UIFEzinNxkSv9fY93SYhx","Emanero, Abel Pintos, The La Planta","BORRACHO Y LOCO","Fifty One",78,87,23,"93457"
81,"spotify:track:2Xetks48zQL2K7xUbJBHRn","Q' Lokura, Los Herrera","Cuidado Que Te Supero","Q' Lokura",62,92,146,"93422"
82,"spotify:track:1fTjqf10accJCDYstPwwZ6","Kapo","Ohnana","Sony Music Latin/La Industria",30,79,95,"92812"
83,"spotify:track:1kqH58eGh2ZTOHwqBIB2tM","Mesita, Nicki Nicole, Tiago PZK, Emilia","Una Foto Remix (feat. Emilia)","Mesita",1,85,296,"92563"
84,"spotify:track:2btNsI4OvcVl7SAHQQDHFB","Blessd, Ovy On The Drums","Mírame","WEA Latina",47,66,117,"92541"
85,"spotify:track:1yg1tWFaYajN4b7vsKtYRE","La T y La M","El Doctorado","GraceMusic",63,76,48,"92371"
86,"spotify:track:6IRRoV7AbjHT8JWP4uFrD5","El Turko, Mandale Flow","30 Grados","FLOW BR",1,89,261,"91951"
87,"spotify:track:2RxJ9U2Pj7TsiocDXtjowg","Luck Ra","ROBAME UN BESO","Sony Music Latin",65,88,16,"90491"
88,"spotify:track:67Q93kXygxCskeQiIP0V0j","Ciro y los Persas","Me Gusta","300 Producciones",54,74,2686,"90332"
89,"spotify:track:5gx39tUko6htjixWpIMqzM","Emanero, La K'onga, Antonio Rios","ADICTO","Fifty One",60,123,353,"89229"
90,"spotify:track:1AX4aybSRyXHWrjg27wTFE","Ke Personajes, Onda Sabanera","Pobre Corazón - En Vivo","Ke Personajes",2,113,553,"88253"
91,"spotify:track:7w7BrPbOjF5OxChs2dxFve","Big One, Emilia, Callejero Fino","En La Intimidad | CROSSOVER #1","Fifty One",1,104,633,"88110"
92,"spotify:track:6ebo7CQn4ILLGvXRmXHhQz","TINI, Maria Becerra","Miénteme","5020 Records",1,86,1261,"87815"
93,"spotify:track:2Ii4Yw4phq3dYpcrH15BSQ","Q' Lokura","Cuarteto Sessions #3","Q' Lokura",23,110,274,"86825"
94,"spotify:track:4sl3IoHskl2Kbdy27gZ4yn","Mesita","Una Foto","Turbo Diesel Records",3,95,429,"85190"
95,"spotify:track:54zcJnb3tp9c5OVKREZ1Is","KAROL G","MI EX TENÍA RAZÓN","Bichota/Interscope Records",29,97,442,"84946"
96,"spotify:track:6Z28dALKtAgZ7AZRfjMQjY","Big One, Ulises Bueno, Rusherking","Mentiras | CROSSOVER #3","Fifty One",4,119,459,"84621"
97,"spotify:track:0RD94y2DlYTzEePb4WuVbU","Nicki Nicole, Rels B","qué le pasa conmigo?","Sony Music Latin/DALE PLAY Records",23,75,451,"84069"
98,"spotify:track:44m9PAUZYeOEGeaTYh6NAl","No Te Va Gustar, Juan Casanova","Tan Lejos","Elefante Blanco",52,73,867,"83425"
99,"spotify:track:0mJRX0WnqWlu8Boe7gpQ1P","Salastkbron, Omar Varela","Tal Para Cual","WEA Latina",4,108,289,"83266"
100,"spotify:track:5XUWO8VqwE4PEkLYAtt7h7","Emilia","Jagger.mp3","Sony Music Latin",6,120,513,"83253"
101,"spotify:track:2mYlSgPvC5Np4mDg9DU5Mc","Ana Mena, Emilia","CARITA TRISTE","Sony Music Entertainment",31,90,58,"82323"
102,"spotify:track:6rKOEyg05nKSRRErDmBWjy","Ponte Perro, COLORS","Mi santo - A COLORS SHOW","COLORSxSTUDIOS",95,99,16,"81582"
103,"spotify:track:0ZS96pPRLyGUViVi5PWCAR","FloyyMenor, Lewis Somes","APAGA EL CEL","FloyyMenor under exclusive license to UnitedMasters LLC",7,106,161,"81361"
104,"spotify:track:0pj1P1kA7Tgeg9PVEeYIFA","Angela Leiva","Amiga Traidora","World Music",88,135,23,"80579"
105,"spotify:track:4buQ1OSw1JwfU2Qj9Cq2MY","Olivia Wald, Q' Lokura","en la cara - En Vivo","Cascabel",94,114,26,"80546"
106,"spotify:track:2iIBpwP4FyQ95xgVail3yr","Emilia, LUDMILLA, ZECCA","No_se_ve.mp3","2023 WK Records",5,115,542,"79480"
107,"spotify:track:6DUdDIRgLqCGq1DwkNWQTN","Maluma","Borro Cassette","Sony Music Latin",13,91,572,"79259"
108,"spotify:track:6uiCq7VixbvjdDNigtDBvE","Pinky SD, Un Poco de Ruido, El Mago Y La Nueva","Hojita Seca","Pinky SD",70,176,34,"79118"
109,"spotify:track:5vNRhkKd0yEAg8suGBpjeY","ROSÉ, Bruno Mars","APT.","Atlantic Records",60,77,8,"78921"
110,"spotify:track:0ZAJ660VP57lLK4U7NlGOy","Intoxicados","Nunca quise","Pop Art",59,93,2819,"77874"
111,"spotify:track:4ZXZub1pPCWib6xlSHiTj6","Luck Ra, La T y La M, Rusherking","Quiero Creer","Sony Music Entertainment Chile S.A",9,143,627,"77807"
112,"spotify:track:4OWh4q7qfZpVFFXmmbnLbd","Valentino Merlo","Loco","Parulo Records",88,130,53,"77053"
113,"spotify:track:5n2XTRsYFlZwNBp06KAjDX","Cosculluela, Bad Bunny","Madura","Rottweilas, Inc.",6,84,466,"77008"
114,"spotify:track:0c3yMhYOayhN9GjGeNNuI7","R Jota, Llego ponte perro 23","El Malandraje","Kriterio Music",114,126,17,"76014"
115,"spotify:track:6gV8ALkSHfJi7Bprabr1FC","Roze Oficial, Peipper","Inocente","Sony Music Uruguay",3,151,307,"75977"
116,"spotify:track:6sIvFhsKL8by5feYLeqawQ","The La Planta, Marcela Morelo, La T y La M","Lo Mismo Que A Mí","TLP Records",116,117,7,"75662"
117,"spotify:track:6hv8hai0yo19JF2c6pppj6","Emilia","GTA.mp3","Sony Music Latin",2,134,395,"75574"
118,"spotify:track:1p7m9H4H8s0Y7SgRm7j3ED","Andrés Calamaro","Flaca","DRO/EastWest Spain",57,96,2260,"75316"
119,"spotify:track:2fMiCHqLXMKC54sbfYugJK","Pinky SD, Un Poco de Ruido, Uriel Lozano","Tu La Más Bella","Pinky SD",73,192,35,"74414"
120,"spotify:track:2wK7D7i9bfVt3uLjFsZSEU","YSY A","FULL ICE (prod. ORODEMBOW)","Ysy A",68,82,209,"73946"
121,"spotify:track:5KbBVSj6AJZ5662fO8EYFh","Marshmello, Manuel Turizo","El Merengue","Sony Music Latin",26,124,486,"73594"
122,"spotify:track:2pmHBQiIjVfTyn3p1rRbSB","Intoxicados","Esta Saliendo El Sol","Universal Music Argentina S.A.",61,118,243,"73357"
123,"spotify:track:0OEBOJhSObnFuHuasXdt52","Shakira","Dia de Enero","Epic",63,105,173,"72926"
124,"spotify:track:4YntVuBqggRsASIbBoWT3F","The La Planta, Luana","Mil Preguntas","TLP Records",9,158,232,"72908"
125,"spotify:track:6TnZSXypAbIozg8BlodtWe","Q' Lokura, La K'onga","La Última Granada - En Vivo","Q'Lokura",85,156,60,"72794"
126,"spotify:track:4bw8mcDUSRWfQo63ZTYRnU","Maluma, Carin Leon","Según Quién","Sony Music Latin",56,109,312,"72573"
127,"spotify:track:4kGGnJmqYqn6RQ9LMfvPcv","elaggume, Fauna Music, Coco Palmer","TATTOO","Fauna Music",14,144,172,"72512"
128,"spotify:track:0H9WU0OIXPpbOVgzzOanXb","BM","Ni Una Ni Dos","DALE PLAY Records / Wesaisons Records",1,153,485,"71880"
129,"spotify:track:2YNMRnIJMCxDQWYfXRxJmB","Tan Bionica","Obsesionario en La Mayor","Pirca Records",61,101,513,"71479"
130,"spotify:track:23FJGRug9hlYUIBnrmkIBX","Airbag","Cicatrices","DALE PLAY Records / Airbag",54,98,195,"70084"
131,"spotify:track:29iIRrSuANyjnwag69PHOJ","Charly García","Demoliendo Hoteles","Universal Music Argentina S.A.",76,103,228,"69734"
132,"spotify:track:7EASmjkD3fAMypq49FCLNY","Thomy DJ","Tumba","Thomy DJ",9,172,172,"69698"
133,"spotify:track:2esZG2XFtuoWWA9AfDvSxy","FloyyMenor, Cris Mj","Gata Only","FloyyMenor under exclusive license to UnitedMasters LLC",1,139,266,"69612"
134,"spotify:track:505v13epFXodT9fVAJ6h8k","KAROL G","AMARGURA","BICHOTA RECORDS / INTERSCOPE RECORDS / UNIVERSAL MUSIC LATINO",65,127,514,"69365"
135,"spotify:track:7M0mBls29IohQIPGqegcyE","Emilia, Duki","como si no importara","Sony Music Latin",1,132,1126,"68915"
136,"spotify:track:0lzuBAXVjN5TkgrAd7yLEX","Pinky SD, Un Poco de Ruido, Uriel Lozano","Me Dejó de Querer","Pinky SD",82,-1,31,"68883"
137,"spotify:track:6Soxxi73U6SO4rOGJwYYxI","Los Piojos","Tan Solo","El Farolito Discos",53,131,714,"68226"
138,"spotify:track:7HrgGbnNKZKhBL70aFKpXk","Marka Akme, DJ Tao, Lauty Gram, Migrantes, Peipper","Linda - Remix","NES Play",3,164,345,"68205"
139,"spotify:track:0EOynYGvn9TbAyKPyMAStL","La Joaqui","SAN TURRONA","LA JOAQUI / DALE PLAY Records",5,177,149,"67998"
140,"spotify:track:7iUtQNMRB8ZkKC4AmEuCJC","Myke Towers","LA FALDA","WEA Latina",11,129,332,"67936"
141,"spotify:track:6abr2lKyMZTy21gSPWm7aG","Ke Personajes","Entre Beso y Beso","Ke Personajes",28,165,415,"67113"
142,"spotify:track:4Q3Z4jdLtxmztZ4gTsvxFj","Q' Lokura","(Bailando Bachata) Cuarteto Sessions #2","Q' Lokura",114,194,59,"67110"
143,"spotify:track:2EglN6u9s2KJvtiY9WhutN","Q' Lokura","Yo Era","Q' Lokura",113,184,113,"66763"
144,"spotify:track:4VikOud5ZmdmHH6h7uQeDB","Charly García","Nos Siguen Pegando Abajo","Universal Music Argentina S.A.",61,122,108,"66758"
145,"spotify:track:14rcLGX83RpsORAIzC4U4g","Patricio Rey y sus Redonditos de Ricota","Un Poco de Amor Francés","Patricio Rey Discos",68,121,1271,"66726"
146,"spotify:track:4pHdHimCLvD4nx8lh6uQyx","Los Abuelos De La Nada","Mil Horas - 1994 Remastered Version","Universal Music Argentina S.A.",82,137,1697,"66268"
147,"spotify:track:6q6aChVJ5LLXFUSfakwpxW","Maria Becerra, Chencho Corleone, Ovy On The Drums","Piscina","WEA Latina",19,149,263,"65890"
148,"spotify:track:7upAH0ezzsThyvr33YKn4u","Turf","Pasos Al Costado","Pop Art",68,147,2204,"65754"
149,"spotify:track:4waqcUQWdj0yH26STWl2Rq","La Oreja de Van Gogh","Rosas","Columbia",55,116,149,"65698"
150,"spotify:track:2qBirMakpTdz9ymxrZEyzg","Luis Alberto Spinetta","Seguir Viviendo Sin Tu Amor","EMI Argentina",55,128,2496,"65527"
151,"spotify:track:3eaI7pm5Epr3Wurhe36sfG","Q' Lokura, Valentina Olguin","Aventura - En Vivo","Q' Lokura",105,173,18,"65402"
152,"spotify:track:2F3j0BgLcRjuAd7gAvrlQp","The La Planta, Pablito HC, Pushi","Si Esta Casa Hablara","The La Planta",122,-1,87,"65232"
153,"spotify:track:4MAv7MqIlcaTBHGiUXIWiw","Cris Mj, Kali Uchis, JHAYCO","SI NO ES CONTIGO - REMIX","SONAR LLC",81,163,9,"65187"
154,"spotify:track:2PkTjm1QAJCZbJ9MqC4RqA","Fito Paez","11 Y 6","EMI Argentina",57,142,805,"64862"
155,"spotify:track:5wcghdKONQcc5TKx9jCcns","DJ Tao, Roze Oficial","ROZE | DJ TAO Turreo Sessions #22","WM Chile",4,-1,311,"64348"
156,"spotify:track:6ZVLfXr015ogdhov4FW4pG","Emilia","IConic.mp3","Sony Music Latin",31,157,231,"64307"
157,"spotify:track:5RqSsdzTNPX1uzkmlHCFvK","KAROL G, Peso Pluma","QLONA","Bichota/Interscope Records",13,148,438,"64205"
158,"spotify:track:6dOtVTDdiauQNBQEDOtlAB","Billie Eilish","BIRDS OF A FEATHER","Darkroom/Interscope Records",53,112,163,"63819"
159,"spotify:track:0T25HZGE0WwyELWBlXQVbY","DJ Tao, Ponte Perro","PONTE PERRO | DJ TAO Turreo Sessions #24","WM Chile",40,-1,144,"63787"
160,"spotify:track:1y9pPW5hmmlLRLOc2h8HWD","Pinky SD, Un Poco de Ruido, Uriel Lozano","Voy a Morir Dentro Tuyo","Pinky SD",103,-1,8,"63509"
161,"spotify:track:3qoCOROhkDhf242FvEOmAC","Pinky SD, Un Poco de Ruido, Uriel Lozano","Y Se Arrepentirá","Pinky SD",100,-1,5,"63351"
162,"spotify:track:5ISajXj2M1yvkrC0KsgbR5","Los del Fuego","Jurabas Tu","Los del Fuego",39,-1,335,"63160"
163,"spotify:track:1RKBRNLdt9nNri2wraNAzn","The La Planta, Valentino Merlo","De 100 a 0","NES Play",102,195,53,"63125"
164,"spotify:track:6I86RF3odBlcuZA9Vfjzeq","Romeo Santos","Eres Mía","Sony Music Latin",112,125,4,"62658"
165,"spotify:track:2HRqTpkrJO5ggZyyK6NPWz","Sabrina Carpenter","Espresso","Island Records",44,133,192,"62466"
166,"spotify:track:2bNCiY24Eh4saMcc23bvUN","Maria Becerra","ADIÓS","300 Entertainment",4,-1,684,"62364"
167,"spotify:track:4gqE9uHLnRq4DPgXIuXu5j","LIT killah, TULI","MALA SUERTE","Mawz Records",152,152,2,"62222"
168,"spotify:track:2MXqrO1RBfek6RoijghYYp","Charly García","Promesas Sobre El Bidet","Universal Music Argentina S.A.",117,138,7,"62180"
169,"spotify:track:6kUopck7LHVadAjAFcXiTj","Patricio Rey y sus Redonditos de Ricota","Un Ángel para Tu Soledad","Patricio Rey Discos",95,145,754,"61914"
170,"spotify:track:4HuCvSUsveC5jCbYE5qllc","La T y La M, Sael","Aquellos Tiempos","GraceMusic",162,-1,7,"61530"
171,"spotify:track:6HegiTRemAAx7CN8tHqRta","Emanero, Peipper, Q' Lokura","ME DUELE TU TRAICIÓN","Fifty One LLC",103,-1,57,"61493"
172,"spotify:track:3RPsA16IQlvfgC9lXErE8y","La T y La M","Siguiendo La Luna","GraceMusic",152,181,4,"61240"
173,"spotify:track:0kVpyCPMT52a05026zHGiq","Fer Vazquez, Flor Alvarez","Sin Querer","Fermazel LLC",11,-1,271,"60973"
174,"spotify:track:1hZsWUnLbqRw09jLAMQSsb","Feid, Young Miko","CLASSY 101","UMLE - Latino",3,171,576,"60917"
175,"spotify:track:2CeKVsFFXG4QzA415QygGb","Feid","Feliz Cumpleaños Ferxxo","UMLE - Latino",18,170,756,"60501"
176,"spotify:track:0aPs3kmiqmt9QG7gWXdefA","Bizarrap, Milo j","No soy Eterno","DALE PLAY Records",8,140,361,"60364"
177,"spotify:track:1OEZzIyMUzSU8ZZc9C6OdD","Ulises Bueno, DesaKTa2","No Puedo Fingirlo","Almenara Network",166,-1,11,"60247"
178,"spotify:track:7ABLbnD53cQK00mhcaOUVG","Myke Towers","LALA","WEA Latina",1,166,407,"60162"
179,"spotify:track:2J9B63FawlTaPdg4eH5X03","Beéle","Loco","Hear This Music",14,150,293,"60124"
180,"spotify:track:2o0qEJLFTlR3NPxLy7Hz0T","Koino Yokan","Lo Que Hoy Quieras","Koino Yokan",87,155,181,"59819"
181,"spotify:track:2kz1YOhJiNubjigR1gB1VX","Rauw Alejandro","DILUVIO","Sony Music Latin/Duars Entertainment",40,161,236,"59645"
182,"spotify:track:6YUYwOLhR01HusDZkttH7k","Los Ángeles Azules, Nicki Nicole","Otra Noche","OCESA Seitrack",10,-1,929,"59639"
183,"spotify:track:2kB1rqoTaZ3j6ChtIWGurm","Viejas Locas","Me Gustas Mucho","Universal Music S.A.",87,175,173,"59433"
184,"spotify:track:6OICQoNsUIcYsirqoDo08Y","Coldplay, Burna Boy, Elyanna, TINI, Little Simz","WE PRAY - (TINI Version)","Parlophone UK",62,159,50,"59416"
185,"spotify:track:48H3BsuIXKMYRTuFtxkRhh","YSY A","El Amanecer","Ysy A",65,136,214,"59304"
186,"spotify:track:56mbNpJVn5WQhOlsOvb2A0","Bersuit Vergarabat","La Soledad","Int'l Latin America",102,154,102,"58592"
187,"spotify:track:0QWVUw5wIoqVEu94F8dquj","La Delio Valdez, Ke Personajes","Adiós Amor","Delirio Valdez",50,-1,275,"58361"
188,"spotify:track:7iQXYTyuG13aoeHxGG28Nh","Bad Bunny, Feid","PERRO NEGRO","Rimas Entertainment LLC",7,189,379,"57877"
189,"spotify:track:0T2pB7P1VdXPhLdQZ488uH","Feid","Normal","UMLE - Latino",26,188,821,"57826"
190,"spotify:track:2CHRH34SWRjo1hvvbnpDww","Turf, Milo j","Pasos Al Costado","Pop Art",80,168,20,"57675"
191,"spotify:track:4JagWLF38FFHxt6ogYoBe5","Pinky SD, Un Poco de Ruido, El Mago Y La Nueva","Y Ahora Te Vas","Pinky SD",126,-1,8,"57322"
192,"spotify:track:5G2f63n7IPVPPjfNIGih7Q","Sabrina Carpenter","Taste","Island Records",35,141,62,"57319"
193,"spotify:track:6mmPpaltUZK7xjNlBPQQ0p","Rauw Alejandro, Chencho Corleone","Desesperados","Sony Music Latin/Duars Entertainment",1,185,768,"57149"
194,"spotify:track:2WFrChyI5KlmxunG45Sqws","La K'onga, Matías Valdez","Latidos","Leader Music",83,-1,346,"57002"
195,"spotify:track:2hi1aFllOFRNH8gIHxQvD9","Cosculluela, Nicky Jam","Te Busco","Rottweilas, Inc.",145,180,45,"56612"
196,"spotify:track:0DWdj2oZMBFSzRsi2Cvfzf","KAROL G, Shakira","TQG","BICHOTA RECORDS / INTERSCOPE RECORDS / UNIVERSAL MUSIC LATINO",2,-1,452,"56508"
197,"spotify:track:6XbtvPmIpyCbjuT0e8cQtp","Quevedo","Columbia","Quevedo",1,-1,475,"56483"
198,"spotify:track:2Qcbspnftnon37jibwyvMU","Jin","I'll Be There","BIGHIT MUSIC",107,107,2,"56462"
199,"spotify:track:1WH3iquIQXnSPwUzlROT8R","Manuel Turizo","Quiéreme Mientras Se Pueda","Sony Music Latin/La Industria",30,160,415,"56428"
200,"spotify:track:0N361WhEqVunVl5ZBkfd70","Árbol","El Fantasma","Surco",81,182,167,"56322"
