rank,uri,artist_names,track_name,source,peak_rank,previous_rank,days_on_chart,streams
1,"spotify:track:5MKbWaXeSQSmzmo7gPQha1","La T y La M, Malandro","Amor de Vago","GraceMusic",1,1,118,"468444"
2,"spotify:track:7yif9yIhSCxhcPExFOktCp","Gordo, Emilia","Olvidarte (feat. Emilia)","Ultra Records, LLC",2,2,16,"384216"
3,"spotify:track:5AGnkbWCiF9u4ra54N9X1a","Bizarrap, Luck Ra","Luck Ra: Bzrp Music Sessions, Vol. 61","DALE PLAY Records",3,3,2,"319137"
4,"spotify:track:0qeIFEGRQqHoaJtLCl0U73","Myke Towers, benny blanco","DEGENERE 👑 (feat. benny blanco)","WEA Latina",1,5,71,"316469"
5,"spotify:track:6WatFBLVB0x077xWeoVc2k","KAROL G","Si Antes Te Hubiera Conocido","Bichota/Interscope Records",1,4,192,"307204"
6,"spotify:track:6kPCcIAGoTeRrh8qrmKa90","Tiago PZK, Ke Personajes","Piel","WEA Latina",2,6,332,"305744"
7,"spotify:track:0c82YIGpQ5dCaXpTNCk4sb","Tiago PZK, Anitta, Emilia","Alegría","WEA Latina",1,7,143,"296199"
8,"spotify:track:1TyBUtMxdmRfXhW3MmbxtQ","Luck Ra, Abel Pintos","QUE ME FALTE TODO","Sony Music Entertainment Chile S.A",2,10,430,"282076"
9,"spotify:track:4xXvGEiTkoaIkOMWa4u3Mn","Renzo ED, elaggume","COLOCARTELO","Forez Producciones 2024",3,9,54,"273834"
10,"spotify:track:5AkLEnorFvb7WIJOGqKYVT","Big One, Emanero, Valentino Merlo","Si Un Día Estás Sola | CROSSOVER #7","Fifty One",2,8,117,"273679"
11,"spotify:track:69vi5SUSJJF0CQJCZngFFS","Jombriel, Alex Krack, Jøtta","Parte & Choke","WEA Latina",9,11,37,"273282"
12,"spotify:track:1R3ubqAHKHE6f64Hz37q8h","La T y La M","Un Montón de Estrellas - En Vivo Gran Rex","GraceMusic",12,15,95,"254037"
13,"spotify:track:5rQSQlZXXjMcevPGoAfE1z","Salastkbron, Diel Paris","Un Besito Más","WEA Latina",2,13,290,"247838"
14,"spotify:track:4dLLdfiniBhDP9dlJQIOi4","Los Ángeles Azules, Emilia","Perdonarte, ¿Para Qué?","OCESA Seitrack",1,12,220,"243626"
15,"spotify:track:0SoBfYjQHvL6cuWHtPUYnq","Valentino Merlo, The La Planta","Hoy","TLP Records",1,14,220,"228357"
16,"spotify:track:7yrTny7FLWLbfIzsxoicWj","Emilia","noviogangsta <3","Sony Music Latin",2,16,78,"219822"
17,"spotify:track:4eqXTlaHeK6xkM1fRx9wR5","Pinky SD, Un Poco de Ruido, Uriel Lozano","Conmigo Te Gustó","Pinky SD",3,17,139,"218878"
18,"spotify:track:42mrOMjkQb7jRKatu0bqg4","Q' Lokura, Luck Ra","Mil Preguntas","Q' Lokura",11,19,262,"209413"
19,"spotify:track:2xbH0CuDbid800YW5nMPzR","Emanero, Karina, j mena, Angela Torres","SINVERGÜENZA - con Angela Torres","Fifty One",12,18,390,"204245"
20,"spotify:track:2N0hVk2Ant8751xPZUjCV2","ECKO, Los Turros, DobleP, Cristian Di Marco","Loquita - Remix","WM Chile",9,22,222,"202439"
21,"spotify:track:1MErjQ93iYHCjayOT1hl9N","Luck Ra, Elvis Crespo","SUAVEMENTE","Sony Music Latin",21,28,10,"198824"
22,"spotify:track:0Sr7ssScx54yxdM2ols7nW","Omar Courtz, De La Rose","Q U E V A S H A C E R H O Y ?","Mr. 305 Records / Rimas Entertainment",1,21,96,"188138"
23,"spotify:track:1yg1tWFaYajN4b7vsKtYRE","La T y La M","El Doctorado","GraceMusic",23,32,112,"186536"
24,"spotify:track:1db75lVrSgDFZI1gZh8JlV","Paulo Londra, Luck Ra, Valentino Merlo","Princesa","Paulo Londra / DALE PLAY Records",9,25,108,"184658"
25,"spotify:track:1K11lq4qn0DdPfljQcHkNE","Yami Safdie, Luck Ra, Q' Lokura","En Otra Vida - Versión Cuarteto","WM Chile",25,31,17,"184000"
26,"spotify:track:2otAnGaeFFFeIDV8nbu5uA","TINI","el cielo","5020 Records",5,20,24,"182339"
27,"spotify:track:5aZ8rf2aPfZrnRWLA7bByo","Big One, Tiago PZK, La Joaqui","Pa´Que Te Acuerdes | CROSSOVER #8","Fifty One",10,24,88,"181621"
28,"spotify:track:6ViJgiKfyqfs52x2pGhuPF","Hernan y La Champion's Liga, Callejero Fino, BM","Despójate Vol.2","Impronta Music",15,29,87,"175969"
29,"spotify:track:5DSMm0BZXlSvqArsTX00Ge","Luck Ra, Nicki Nicole","DOCTOR","Sony Music Latin",2,30,122,"175752"
30,"spotify:track:7bywjHOc0wSjGGbj04XbVi","Feid, ATL Jacob","LUNA","UMLE - Latino",4,23,390,"173493"
31,"spotify:track:0l0vcZMU7AOeQmUIREoI2U","Rauw Alejandro, Bad Bunny","Qué Pasaría...","Sony Music Latin/Duars Entertainment",12,27,45,"171716"
32,"spotify:track:7JKptWv4YXmievid0HajID","Luck Ra, KHEA","HOLA PERDIDA","Sony Music Entertainment Chile S.A",1,34,360,"170738"
33,"spotify:track:3cWo162YkfLIFyB3DWbVoH","Q' Lokura, Valentino Merlo","Tu Foto - En Vivo","Q' Lokura",1,33,228,"170017"
34,"spotify:track:03IpZ9yqJlo3EIgDQUgBSF","Duki, Myke Towers","Nueva Era","DALE PLAY Records / SSJ Records",1,26,59,"167060"
35,"spotify:track:2AFC9ad4nGauS1cgm7FCqU","Luck Ra, Chayanne","UN SIGLO SIN TI","Sony Music Latin",3,35,157,"164614"
36,"spotify:track:6vRQqxOhUFd78p5tL8jXr7","Luck Ra, BM","La Morocha","Sony Music Entertainment Chile S.A",1,42,542,"162970"
37,"spotify:track:5wcghdKONQcc5TKx9jCcns","DJ Tao, Roze Oficial","ROZE | DJ TAO Turreo Sessions #22","WM Chile",4,38,350,"156809"
38,"spotify:track:6hLsMjw00j3HGrkUjKwmgo","King Savagge, Jairo Vera, Bayron Fire","A200","King savagge",24,36,36,"156623"
39,"spotify:track:2Xetks48zQL2K7xUbJBHRn","Q' Lokura, Los Herrera","Cuidado Que Te Supero","Q' Lokura",38,45,210,"146201"
40,"spotify:track:2RmtEc2ZNDCzAU3vH0AbKx","Nicki Nicole","Ojos Verdes","Sony Music Latin/DALE PLAY Records",3,37,249,"145694"
41,"spotify:track:1YYfyJ2yCvGFCxwjsIqEK9","Rauw Alejandro, Romeo Santos","Khé?","Sony Music Latin/Duars Entertainment",18,39,41,"144646"
42,"spotify:track:6VbNzSrjWjTMfrDLJ6Jt5D","Pinky SD, Un Poco de Ruido, Uriel Lozano","La Piel Bien Caliente","Pinky SD",23,48,132,"139704"
43,"spotify:track:4jn3R3KF5hx2fCiXlj89yE","YSY A, Bhavi, Milo j","FLECHAZO EN EL CENTRO","Ysy A",7,40,480,"139116"
44,"spotify:track:3E8xyYdIPpiH2wNEozE68I","Standly","Pégate","Standly",14,41,350,"139048"
45,"spotify:track:0CgpCtEPvyDizcg2p47VrU","No Te Va Gustar","A las Nueve","Elefante Blanco",23,43,2115,"134781"
46,"spotify:track:5g2Jqe1D2qnZc6LcvWL3e1","Pinky SD, Un Poco de Ruido, El Mago Y La Nueva","Te Vas a Arrepentir","Pinky SD",21,53,124,"133441"
47,"spotify:track:6ryIAZUcqNrMi5D9kVaU7x","Luck Ra, Ke Personajes","VUELA","Sony Music Latin",28,46,45,"132515"
48,"spotify:track:3KeYEr9ogMBemsOfQIJmZp","Big One, Maria Becerra, Trueno","Cuando Te Vi | CROSSOVER #5","Fifty One",1,44,185,"127855"
49,"spotify:track:3n6EihEumKlLky7mfeOj71","Pinky SD, Un Poco de Ruido, Q' Lokura","Yo Era","Pinky SD",31,55,40,"125403"
50,"spotify:track:39Pc4a04VgCtcc7m0XKi9M","Myke Towers","TAMBIÉN","WEA Latina",15,49,113,"122371"
51,"spotify:track:1Zh6HllrXT0Khrwk2j3TrZ","La T y La M","No Se Va","GraceMusic",51,56,69,"120677"
52,"spotify:track:5vHWh24GAsXJ7tnIu8v7UN","Airbag","Por Mil Noches","DALE PLAY Records / Airbag",23,47,1825,"120435"
53,"spotify:track:7khla88C1xwKeI6qzwcOuH","Pinky SD, Un Poco de Ruido, Uriel Lozano","No Va a Venir","Pinky SD",26,62,131,"119653"
54,"spotify:track:0u6JsFiEEXb6kaF0oqyeFi","Luck Ra, La K'onga, Ke Personajes","Ya No Vuelvas (Versión Cuarteto)","Sony Music Entertainment Chile S.A",1,57,759,"118850"
55,"spotify:track:5HYUrHf4TAHzMs30T84NZd","Pinky SD, Un Poco de Ruido, Uriel Lozano","Mojada Por Dentro","Pinky SD",30,58,132,"118794"
56,"spotify:track:6MuJUSYCqA4FpMogUHzb2R","No Te Va Gustar","Ese Maldito Momento","Elefante Blanco",26,50,1098,"116107"
57,"spotify:track:5eqZZLLZ4CkuUznPCOimsi","Lucky Brown, Mateo on the Beatz","Cosa Linda","Lucky Brown",48,52,35,"114202"
58,"spotify:track:76lXtXJP6VqX6r9Ks3AUy0","Peipper, DobleP, Locura Mix","Si Las Gatas Se Amotinan","SUPERNOVAS MUSIC",34,59,40,"112842"
59,"spotify:track:20gpiaTYpTe32d40mkT9az","Pinky SD, Un Poco de Ruido, Q' Lokura","Frágil","Pinky SD",36,68,40,"112571"
60,"spotify:track:0u605hoZG0qHfjqxoE8Cro","Pinky SD, Un Poco de Ruido, Uriel Lozano","Pechos Calientes","Pinky SD",28,65,124,"112531"
61,"spotify:track:0EVxchTHYIgx618OrpcrdQ","Maria Becerra","AGORA","WEA Latina",1,54,108,"110102"
62,"spotify:track:61qPUnazSdkvua4wgA4L8C","Babasonicos","Como Eran Las Cosas","Universal Music Argentina S.A.",36,51,648,"109915"
63,"spotify:track:3oNnzH6hmqIGIhJ1NcHlrh","Maria Becerra","CORAZÓN VACÍO","WEA Latina",1,60,556,"108228"
64,"spotify:track:3tiJUOfAEqIrLFRQgGgdoY","Big One, FMK, Ke Personajes","Un Finde | CROSSOVER #2","Fifty One",1,64,635,"106335"
65,"spotify:track:44m9PAUZYeOEGeaTYh6NAl","No Te Va Gustar, Juan Casanova","Tan Lejos","Elefante Blanco",51,70,931,"103579"
66,"spotify:track:6Es8Sk3xe1HiJ2MXCfHHwR","Emilia, TINI","La_Original.mp3","Sony Music Latin",1,67,423,"102553"
67,"spotify:track:2N9LvPp7o61eerdZEyKQ19","Valentino Merlo, Salastkbron","Me Voy","Parulo Records",41,73,52,"102152"
68,"spotify:track:3OJDtCdYs8QJnui708tEU3","Shakira","Soltera","Sony Music Latin",15,63,94,"101018"
69,"spotify:track:2plbrEY59IikOBgBGLjaoe","Lady Gaga, Bruno Mars","Die With A Smile","Interscope",23,61,132,"100125"
70,"spotify:track:2Ue6HKn8jqcOaOT467gQHw","El Reja, Lauty Gram, DJ Tao, El negro tecla, Roze Oficial","Soltero Hasta la Tumba - Remix","Montevideo Music Group",70,98,10,"99774"
71,"spotify:track:4ZXZub1pPCWib6xlSHiTj6","Luck Ra, La T y La M, Rusherking","Quiero Creer","Sony Music Entertainment Chile S.A",9,74,691,"99405"
72,"spotify:track:42wdz3j7gstgUuhoFLCXqd","FloyyMenor","PELIGROSA","FloyyMenor under exclusive license to UnitedMasters LLC",9,71,166,"99138"
73,"spotify:track:5QjmUqgpPQgXgg4606DqZF","Kapo","UWAIE","Sony Music Latin/La Industria",11,66,132,"98710"
74,"spotify:track:1MCArCVJUgBUrBnzUoZqmq","Salastkbron, Omar Varela","Dimelo Mami","WEA Latina",18,69,123,"96863"
75,"spotify:track:11PV8CaPqlto9Uejx92C35","Grupo Frontera, Ke Personajes","OJITOS ROJOS","Grupo Frontera",3,76,528,"96156"
76,"spotify:track:4HuCvSUsveC5jCbYE5qllc","La T y La M, Sael","Aquellos Tiempos","GraceMusic",67,92,70,"95676"
77,"spotify:track:3TQozt8h0YlDD6tFItl5x3","Olivia Wald, Q' Lokura","en la cara - En Vivo","Cascabel",70,82,90,"94231"
78,"spotify:track:0mJRX0WnqWlu8Boe7gpQ1P","Salastkbron, Omar Varela","Tal Para Cual","WEA Latina",4,72,353,"92513"
79,"spotify:track:2GxRGqlBj32XudP1zki7zl","Pinky SD, Un Poco de Ruido, Mario Pereyra","A Ti","Pinky SD",74,97,16,"91852"
80,"spotify:track:5f4mOETLngamMDTJnbF9s7","Emilia","Exclusive.mp3","Sony Music Latin",3,78,423,"91543"
81,"spotify:track:7MVIfkyzuUmQ716j8U7yGR","Milo j, Taiu","Rara Vez","Universal Music Argentina S.A.",2,80,687,"90395"
82,"spotify:track:0EhmTBq33eARyOz3SIi4P2","Yami Safdie, Lasso","En Otra Vida","WM Chile",26,79,76,"87551"
83,"spotify:track:2xApi9QyGunvy7DCaHKVGd","Pinky SD, Un Poco de Ruido, Q' Lokura","Bailando Bachata","Pinky SD",54,85,40,"87322"
84,"spotify:track:0Cs2ANiGsCOQLKnCrNJ6hA","Emilia","La_Playlist.mpeg","Sony Music Latin",8,81,193,"87095"
85,"spotify:track:7eNwwoxDR8KVzNAuGvliAO","Omar Courtz, De La Rose, Haze","Kyoto","House of Haze",29,77,159,"87074"
86,"spotify:track:6Z28dALKtAgZ7AZRfjMQjY","Big One, Ulises Bueno, Rusherking","Mentiras | CROSSOVER #3","Fifty One",4,84,523,"86941"
87,"spotify:track:1AX4aybSRyXHWrjg27wTFE","Ke Personajes, Onda Sabanera","Pobre Corazón - En Vivo","Ke Personajes",2,88,597,"86236"
88,"spotify:track:6Soxxi73U6SO4rOGJwYYxI","Los Piojos","Tan Solo","El Farolito Discos",53,86,778,"85803"
89,"spotify:track:3pCkC3Ahgl7MShJbafchZz","Los Ángeles Azules, Maria Becerra","El Amor de Mi Vida","OCESA Seitrack",11,83,500,"85768"
90,"spotify:track:6uiCq7VixbvjdDNigtDBvE","Pinky SD, Un Poco de Ruido, El Mago Y La Nueva","Hojita Seca","Pinky SD",47,107,80,"85432"
91,"spotify:track:1LiN0Z98FkR1t0m8KmLcAH","Anuel AA, Haze","Amanece","House of Haze",10,75,887,"85276"
92,"spotify:track:0T25HZGE0WwyELWBlXQVbY","DJ Tao, Ponte Perro","PONTE PERRO | DJ TAO Turreo Sessions #24","WM Chile",40,127,206,"85017"
93,"spotify:track:2gCdlkqAvzMsmoWd2UfpID","Pinky SD, Un Poco de Ruido, El Mago Y La Nueva","Tu Presa Fácil","Pinky SD",57,90,90,"83359"
94,"spotify:track:7eVZK8roFvCbjKULZSsR29","La Joaqui, DobleP, Gusty dj","TERAPIA DE CHOQUE","LA JOAQUI / DALE PLAY Records",6,99,161,"81555"
95,"spotify:track:3ezO8gfskSWM3rk0GTfhFl","Emanero, Ulises Bueno, Migrantes, Los Palmeras","ATORRANTE - con Los Palmeras","Fifty One",12,89,543,"80844"
96,"spotify:track:11sIo7j1LPwveR6huGjFrJ","DesaKTa2","Monaco","Almenara Network",96,167,7,"80715"
97,"spotify:track:1y9pPW5hmmlLRLOc2h8HWD","Pinky SD, Un Poco de Ruido, Uriel Lozano","Voy a Morir Dentro Tuyo","Pinky SD",66,103,31,"80278"
98,"spotify:track:3eaI7pm5Epr3Wurhe36sfG","Q' Lokura, Valentina Olguin","Aventura - En Vivo","Q' Lokura",80,93,81,"80053"
99,"spotify:track:0JpTTz9Pgvk7e9hcWFjFaW","La T y La M","Ahora Estoy Solo","GraceMusic",99,111,12,"79772"
100,"spotify:track:2l0hr2jYYXdkbF393AThLm","La T y La M","Pa' la Selección","GraceMusic",1,158,493,"78918"
101,"spotify:track:3KZCP2StVGdWkOKyRZNWA4","Plan B","Es un Secreto","Pina Records",24,96,767,"78509"
102,"spotify:track:29s2n02oe1K1hTxBDHpYJh","Pinky SD, Un Poco de Ruido, Angela Leiva","Llamadas Extrañas","Pinky SD",90,112,9,"78458"
103,"spotify:track:23FJGRug9hlYUIBnrmkIBX","Airbag","Cicatrices","DALE PLAY Records / Airbag",54,87,258,"77468"
104,"spotify:track:286g5cgqOwKMJwybQPcy3G","Pinky SD, Un Poco de Ruido, Q' Lokura","Que Onda Perdida","Pinky SD",78,110,28,"77329"
105,"spotify:track:1kqH58eGh2ZTOHwqBIB2tM","Mesita, Nicki Nicole, Tiago PZK, Emilia","Una Foto Remix (feat. Emilia)","Mesita",1,95,360,"76855"
106,"spotify:track:5ISajXj2M1yvkrC0KsgbR5","Los del Fuego","Jurabas Tu","Los del Fuego",39,128,372,"75277"
107,"spotify:track:1Hs1uUl8o2VtDp1DABFq0O","LIT killah, Tiago PZK, Maria Becerra, Duki, Emilia, Rusherking, Big One, FMK","Los del Espacio","WEA Latina",1,91,577,"74637"
108,"spotify:track:6PaIQ2qR59qiqXgjeTFwJA","DesaKTa2","La Diabla","Almenara Network",108,-1,6,"73632"
109,"spotify:track:3qoCOROhkDhf242FvEOmAC","Pinky SD, Un Poco de Ruido, Uriel Lozano","Y Se Arrepentirá","Pinky SD",71,120,30,"72949"
110,"spotify:track:2qBirMakpTdz9ymxrZEyzg","Luis Alberto Spinetta","Seguir Viviendo Sin Tu Amor","EMI Argentina",55,100,2559,"72785"
111,"spotify:track:1bHGfwHY68cBK4RxRYdntn","Pinky SD, Un Poco de Ruido, Q' Lokura","Manos De Tijera","Pinky SD",87,136,24,"72582"
112,"spotify:track:2Ii4Yw4phq3dYpcrH15BSQ","Q' Lokura","Cuarteto Sessions #3","Q' Lokura",23,114,329,"72425"
113,"spotify:track:0h9G6K4etatAk01TInkOee","DesaKTa2","Luna","Almenara Network",113,187,4,"72164"
114,"spotify:track:4OWh4q7qfZpVFFXmmbnLbd","Valentino Merlo","Loco","Parulo Records",55,129,117,"71923"
115,"spotify:track:0fKK51bU6lcCCwdNnv64t3","Blessd, Anuel AA, Ovy On The Drums","DEPORTIVO","WEA Latina",66,109,38,"71888"
116,"spotify:track:2pmHBQiIjVfTyn3p1rRbSB","Intoxicados","Esta Saliendo El Sol","Universal Music Argentina S.A.",61,118,303,"70979"
117,"spotify:track:6TnZSXypAbIozg8BlodtWe","Q' Lokura, La K'onga","La Última Granada - En Vivo","Q'Lokura",85,137,102,"70532"
118,"spotify:track:1fTjqf10accJCDYstPwwZ6","Kapo","Ohnana","Sony Music Latin/La Industria",30,101,158,"70531"
119,"spotify:track:7w7BrPbOjF5OxChs2dxFve","Big One, Emilia, Callejero Fino","En La Intimidad | CROSSOVER #1","Fifty One",1,126,697,"70426"
120,"spotify:track:5gx39tUko6htjixWpIMqzM","Emanero, La K'onga, Antonio Rios","ADICTO","Fifty One",60,106,412,"70371"
121,"spotify:track:4JLedgJ80MsjcJBiFdqnFb","Pinky SD, Un Poco de Ruido, Q' Lokura","Me Duele Tu Nombre","Pinky SD",86,134,19,"69998"
122,"spotify:track:0H9WU0OIXPpbOVgzzOanXb","BM","Ni Una Ni Dos","DALE PLAY Records / Wesaisons Records",1,113,549,"69736"
123,"spotify:track:3UVM7rdOSbm2vKDXB9SsWo","Cosculluela","Manicomio","Rottweilas, Inc.",17,125,325,"69613"
124,"spotify:track:1pymWRCuZfCd0zdiBJo0Hj","Trueno","REAL GANGSTA LOVE","Sony Music Latin",1,94,220,"69365"
125,"spotify:track:4wJ5Qq0jBN4ajy7ouZIV1c","ROSÉ, Bruno Mars","APT.","Atlantic Records",58,105,71,"69213"
126,"spotify:track:1TvjOTe5HcnzxnlvQ8JRy8","Nestor En Bloque","Una Calle Nos Separa","Nestor En Bloque",64,175,76,"68992"
127,"spotify:track:2kjtg7XGjcCTBVXqwPFuZN","La Joaqui, Alan Gomez, Gusty dj","BANDIDAS RETIRADAS","LA JOAQUI / DALE PLAY Records",114,140,10,"68967"
128,"spotify:track:6kUopck7LHVadAjAFcXiTj","Patricio Rey y sus Redonditos de Ricota","Un Ángel para Tu Soledad","Patricio Rey Discos",77,104,815,"68937"
129,"spotify:track:2WFrChyI5KlmxunG45Sqws","La K'onga, Matías Valdez","Latidos","Leader Music",83,171,363,"68456"
130,"spotify:track:1p7m9H4H8s0Y7SgRm7j3ED","Andrés Calamaro","Flaca","DRO/EastWest Spain",57,130,2323,"68347"
131,"spotify:track:2wEhjcnre2PU36KQNBLXCC","DobleP, Tuti DJ, Pereiraremix","SE DICE DE MI","DALE PLAY Records / Wesaisons Records",26,132,109,"68142"
132,"spotify:track:04bg4edMdpKhsgkSzYqj55","Callejeros","9 de Julio","Pelo Music S.A.",56,145,244,"68135"
133,"spotify:track:6LBpjWMfy1NUfyxAJbcMRs","La K'onga, Nahuel Pennisi","Universo Paralelo","Leader Music",2,165,914,"67367"
134,"spotify:track:3zJyIy2A092fKIbkZJPzrz","The La Planta, Sebastian Mendoza","No Aguanto Más","The La Planta",134,174,5,"67125"
135,"spotify:track:0ZAJ660VP57lLK4U7NlGOy","Intoxicados","Nunca quise","Pop Art",59,138,2882,"67011"
136,"spotify:track:5Uptvz6j1sjDKxidAcnH2L","Cris Mj","SI NO ES CONTIGO","Sonar LLC.",11,117,219,"66505"
137,"spotify:track:6a9Z1jUms915w4O7N1PxjY","Rvssian, Rauw Alejandro, Ayra Starr","Santa","Sony Music Latin",1,123,256,"66484"
138,"spotify:track:3kGMgEDHQoWykByLL6Jut3","Brytiago, Anuel AA","Kilerito","Business Music",99,102,24,"66034"
139,"spotify:track:0pj1P1kA7Tgeg9PVEeYIFA","Angela Leiva","Amiga Traidora","World Music",88,196,54,"65602"
140,"spotify:track:4HnFARgZZdzuXSWLhfoRp1","Bauti Mascia, The La Planta, Q' Lokura, Meri Deal, Marama","Hasta La Luna (feat. Meri Deal, Marama) - Remix","WM Chile",139,183,5,"65378"
141,"spotify:track:35ttE4t8lQZA2vuCYDg4G7","Milo j","M.A.I","DALE PLAY Records",10,119,394,"65275"
142,"spotify:track:6WVDma2LMzIwf0F4Drf5yu","La T y La M, Rafaga","La Luna y Tú / Una Ráfaga de Amor","Sony Music Uruguay",142,166,2,"64874"
143,"spotify:track:50Uqhtm5VvhcEIQ17wGA9y","Pinky SD, Un Poco de Ruido, Uriel Lozano","Se Cansó De Esperar","Pinky SD",101,180,22,"64727"
144,"spotify:track:48H3BsuIXKMYRTuFtxkRhh","YSY A","El Amanecer","Ysy A",56,115,267,"64515"
145,"spotify:track:4pHdHimCLvD4nx8lh6uQyx","Los Abuelos De La Nada","Mil Horas - 1994 Remastered Version","Universal Music Argentina S.A.",81,121,1757,"64286"
146,"spotify:track:4ApLAqNEdqMwgF3Y8MRSXj","Cris Mj","7 Trompetas","Sonar LLC.",72,108,8,"64173"
147,"spotify:track:3zOgFY5kpQ6p2cwPIquZks","Bad Bunny","EL CLúB","Rimas Entertainment LLC",38,122,21,"64033"
148,"spotify:track:67Q93kXygxCskeQiIP0V0j","Ciro y los Persas","Me Gusta","300 Producciones",53,142,2749,"63995"
149,"spotify:track:6sIvFhsKL8by5feYLeqawQ","The La Planta, Marcela Morelo, La T y La M","Lo Mismo Que A Mí","TLP Records",79,-1,27,"63906"
150,"spotify:track:6CIMoDfTsvFVGhFi3v9Izn","Alan Gomez, Luck Ra","Luck Ra | Mission 15","WM Chile",14,149,429,"63867"
151,"spotify:track:2UIFEzinNxkSv9fY93SYhx","Emanero, Abel Pintos, The La Planta","BORRACHO Y LOCO","Fifty One",78,159,54,"63682"
152,"spotify:track:3EcCc1U405tm8yKm1x6Y8W","La K'onga","Te Mentiría","Leader Music",8,-1,992,"63638"
153,"spotify:track:3RPsA16IQlvfgC9lXErE8y","La T y La M","Siguiendo La Luna","GraceMusic",97,182,52,"63635"
154,"spotify:track:7upAH0ezzsThyvr33YKn4u","Turf","Pasos Al Costado","Pop Art",68,133,2266,"63506"
155,"spotify:track:6PhRhocBXP4y7NpciGmzra","Cris Mj, FloyyMenor, LOUKI","Después De La 1","Sonar LLC.",10,157,107,"63499"
156,"spotify:track:68YtOHlQPFGK2HoOfbVZ9p","Bruno Chavez Dj, Tomi Rmx","Dos Peine Rkt - Rkt","Bruno chavez dj 2024",156,194,7,"63235"
157,"spotify:track:5mvTYuQdbn6igxS5hfX6fB","Lira, BM, Salastkbron, KINGTO","El Pronóstico (feat. KINGTO) - Remix","ONE PLAY LATAM",117,139,14,"63164"
158,"spotify:track:38CEKqVlTXIaoJlmoUNl5J","Pinky SD, Un Poco de Ruido, Angela Leiva","Amor De Tres","Pinky SD",123,190,6,"63078"
159,"spotify:track:3tt9i3Hhzq84dPS8H7iSiJ","Manuel Turizo","La Bachata","Sony Music Latin/La Industria",1,141,933,"63041"
160,"spotify:track:1OEZzIyMUzSU8ZZc9C6OdD","Ulises Bueno, DesaKTa2","No Puedo Fingirlo","Almenara Network",127,163,32,"63011"
161,"spotify:track:5kfg05FFAsnW4ikMqSfI3g","Callejeros","Prohibido","Pelo Music S.A.",63,146,255,"62900"
162,"spotify:track:0N361WhEqVunVl5ZBkfd70","Árbol","El Fantasma","Surco",81,144,213,"62648"
163,"spotify:track:0oCiPqIEL5218yu2D996eP","Los Piojos","Bicho de Ciudad","300 Producciones",71,124,79,"62406"
164,"spotify:track:2gmd7lY3QSzLh0xIY4cRvi","Maisak, Feid","SE ME OLVIDA","Universal Music Latino",25,135,126,"61869"
165,"spotify:track:14rcLGX83RpsORAIzC4U4g","Patricio Rey y sus Redonditos de Ricota","Un Poco de Amor Francés","Patricio Rey Discos",61,131,1334,"61809"
166,"spotify:track:0ccUrj1mliFnR8R8VxCmKO","Ke Personajes, La Contra","Otro Día Más","Ke Personajes",28,169,517,"61710"
167,"spotify:track:7HrgGbnNKZKhBL70aFKpXk","Marka Akme, DJ Tao, Lauty Gram, Migrantes, Peipper","Linda - Remix","NES Play",3,181,378,"61590"
168,"spotify:track:2esZG2XFtuoWWA9AfDvSxy","FloyyMenor, Cris Mj","Gata Only","FloyyMenor under exclusive license to UnitedMasters LLC",1,162,329,"61356"
169,"spotify:track:0poQY3RMThmIiutOGv3yH3","Maria Becerra","AUTOMÁTICO","300 Entertainment",3,148,587,"61328"
170,"spotify:track:2CeKVsFFXG4QzA415QygGb","Feid","Feliz Cumpleaños Ferxxo","UMLE - Latino",18,160,811,"61184"
171,"spotify:track:5QpdTr2fHXLF0Oj8TcGHmV","Los Piojos","El Farolito","El Farolito Discos",70,170,36,"61157"
172,"spotify:track:3E8QV3GRIF8ejoSDPT9JWy","Pinky SD, Un Poco de Ruido, Angela Leiva","Solita Me Voy","Pinky SD",128,-1,7,"61050"
173,"spotify:track:2iIBpwP4FyQ95xgVail3yr","Emilia, LUDMILLA, ZECCA","No_se_ve.mp3","2023 WK Records",5,156,605,"60543"
174,"spotify:track:0kVpyCPMT52a05026zHGiq","Fer Vazquez, Flor Alvarez","Sin Querer","Fermazel LLC",11,195,283,"60417"
175,"spotify:track:6DUdDIRgLqCGq1DwkNWQTN","Maluma","Borro Cassette","Sony Music Latin",13,161,635,"60387"
176,"spotify:track:7qIw4D1PcDHigDohKkLB0W","Andrés Calamaro","Te quiero igual","DRO/EastWest Spain",98,151,76,"60073"
177,"spotify:track:54zcJnb3tp9c5OVKREZ1Is","KAROL G","MI EX TENÍA RAZÓN","Bichota/Interscope Records",29,116,500,"59999"
178,"spotify:track:6tbbtlYxqxj4EqErN3NQHh","Luck Ra, Eugenia Quevedo","OJALÁ","Sony Music Entertainment Chile S.A",152,-1,20,"59951"
179,"spotify:track:6hv8hai0yo19JF2c6pppj6","Emilia","GTA.mp3","Sony Music Latin",2,143,457,"59195"
180,"spotify:track:2n0NCtkvHx1oPqgiAvexiB","Tan Bionica","Loca","Pirca Records",47,168,447,"59176"
181,"spotify:track:6q6aChVJ5LLXFUSfakwpxW","Maria Becerra, Chencho Corleone, Ovy On The Drums","Piscina","WEA Latina",19,153,319,"59041"
182,"spotify:track:7l2nk7fFbaibO3sjvo4wvq","Los Charros","Amores como el nuestro","Leader Music",47,-1,122,"58908"
183,"spotify:track:7onMf0QvWgRba2MRxG27yj","La K'onga","El Mismo Aire","Leader Music",5,-1,1178,"58526"
184,"spotify:track:2PkTjm1QAJCZbJ9MqC4RqA","Fito Paez","11 Y 6","EMI Argentina",57,173,862,"58161"
185,"spotify:track:6dOtVTDdiauQNBQEDOtlAB","Billie Eilish","BIRDS OF A FEATHER","Darkroom/Interscope Records",53,152,225,"58148"
186,"spotify:track:5Bi9Cq5oVFy1OtUgecbegZ","Callejeros","Creo","Pelo Music S.A.",65,191,1968,"57865"
187,"spotify:track:7tI8dRuH2Yc6RuoTjxo4dU","Jimin","Who","BIGHIT MUSIC",30,188,158,"57863"
188,"spotify:track:0T2pB7P1VdXPhLdQZ488uH","Feid","Normal","UMLE - Latino",26,150,867,"57732"
189,"spotify:track:4JagWLF38FFHxt6ogYoBe5","Pinky SD, Un Poco de Ruido, El Mago Y La Nueva","Y Ahora Te Vas","Pinky SD",91,164,18,"57715"
190,"spotify:track:0vnrhysrKKRdNYFKLAGzRc","KHEA, Duki, Cazzu, Omar Varela, MYKKA","Loca","MUEVA",6,172,522,"57563"
191,"spotify:track:1Mqfdem6pgGVoULjSkkcc9","Airbag","Cae el Sol","DALE PLAY Records / Airbag",71,177,330,"57446"
192,"spotify:track:1JSTJqkT5qHq8MDJnJbRE1","The Police","Every Breath You Take","Polydor Records",109,186,709,"57195"
193,"spotify:track:6IRRoV7AbjHT8JWP4uFrD5","El Turko, Mandale Flow","30 Grados","FLOW BR",1,-1,296,"56884"
194,"spotify:track:5IgmWwbNUeZzvYrODLletR","Max Carra","UWAIE - versión cumbia","Max Carra",182,-1,3,"56789"
195,"spotify:track:2pbPa1O5a3rvBT9faODAyu","Pinky SD, Un Poco de Ruido, Angela Leiva","Mentías","Pinky SD",146,-1,3,"56720"
196,"spotify:track:4GLmfc26LRlW5otKs6TewR","Luck Ra, Ulises Bueno","QUE SED","Sony Music Entertainment Chile S.A",11,176,212,"56700"
197,"spotify:track:4k3K6Ke6KfAWb7zyQWrTEA","Los Pericos","Pupilas Lejanas","EMI Odeon S.A.I.C.",125,-1,135,"56541"
198,"spotify:track:0W3TCDzYM7xFrZSaXnQvs4","YSY A, SPONSOR DIOS, Evlay","CÓMO CHILLA ELLA","SPONSOR DIOS",1,178,427,"56429"
199,"spotify:track:6abr2lKyMZTy21gSPWm7aG","Ke Personajes","Entre Beso y Beso","Ke Personajes",28,-1,440,"56030"
200,"spotify:track:5KbBVSj6AJZ5662fO8EYFh","Marshmello, Manuel Turizo","El Merengue","Sony Music Latin",26,184,542,"55893"
