rank,uri,artist_names,track_name,source,peak_rank,previous_rank,days_on_chart,streams
1,"spotify:track:7k4t7uLgtOxPwTpFmtJNTY","KAROL G, Nicki Minaj","Tusa","TUSA - Karol G & Nicki Minaj",1,1,87,"434361"
2,"spotify:track:7sQKy5vlPQllr0k9IjYJv3","Arcángel, Sech, Dímelo Flow","Sigues Con El","Rimas Entertainment LLC.",2,2,52,"290874"
3,"spotify:track:5stPVcRqb4qixbafP9e8lt","Dalex, Lenny Tavárez, Chencho Corleone, Juhn, Dímelo Flow","Hola - Remix","Rich Music",2,3,94,"253068"
4,"spotify:track:1rgnBhdG2JDFTbYkYRZAku","Tones And I","Dance Monkey","Elektra (NEK)",4,4,118,"220223"
5,"spotify:track:5DxXgozhkPLgrbKFY91w0c","Bad Bunny","Vete","Rimas Entertainment LLC",1,5,74,"206531"
6,"spotify:track:2pWOMNQJW3g2zmGjP0Vkb0","Nicky Jam, Anuel AA","Whine Up","Sony Music Latin",4,6,97,"188223"
7,"spotify:track:6mAN61JH0dzyZpWslS11jy","Rauw Alejandro, Farruko","Fantasias","(SME US Latin) Duars Entertainment, Corp. (2)",1,7,157,"184506"
8,"spotify:track:4VgYtXCVJ7IbWAZ5ryfvEQ","Nicky Jam, Daddy Yankee","Muévelo","Sony Music Latin",8,8,26,"174011"
9,"spotify:track:37zdqI4r1gswIzczSBkRon","Lunay, Anuel AA, Ozuna","Aventura","round2media - LaFamilia",1,9,101,"167379"
10,"spotify:track:43NqTeL8pgBxKHPMiJKUP5","Myke Towers","Girl","2020 One World Music & Casablanca Records | Powered by GLAD Empire, LL",9,10,10,"165601"
11,"spotify:track:1Xnn1TPyr5h0hpRAT4B4EA","Dalex, Lenny Tavárez, Anitta, NATTI NATASHA, Farruko, Justin Quiles","Bellaquita - Remix","Rich Music",11,11,73,"157077"
12,"spotify:track:5Xhqh4lwJPtMUTsdBztN1a","Shakira, Anuel AA","Me Gusta","Sony Music Latin",9,12,21,"149473"
13,"spotify:track:6cy3ki60hLwimwIje7tALf","Black Eyed Peas, J Balvin","RITMO (Bad Boys For Life)","Epic/We The Best",4,14,114,"148897"
14,"spotify:track:3jbT1Y5MoPwEIpZndDDwVq","Tainy, Anuel AA, Ozuna","Adicto (with Anuel AA & Ozuna)","NEON16/Interscope Records",1,13,165,"148544"
15,"spotify:track:2ksOAxtIxY8yElEWw8RhgK","Anuel AA, Daddy Yankee, KAROL G, J Balvin, Ozuna","China","2019 Real Hasta La Muerte, LLC.",1,15,199,"141083"
16,"spotify:track:3mQ6SLdxxaL52Yte7KF2Ks","J Balvin","Morado","UMLE - Latino",16,16,24,"130414"
17,"spotify:track:4R8BJggjosTswLxtkw8V7P","JHAYCO, J Balvin, Bad Bunny","No Me Conoce - Remix","N&E Entertainment LLC",2,17,262,"128124"
18,"spotify:track:6RyaV7owmVU6fzEPE17sF1","Daddy Yankee","Que Tire Pa Lante","El Cartel Records (EC3)",5,18,108,"126797"
19,"spotify:track:5Id5B3dxJZhPcV9GzgYZZe","Rich Music LTD, Sech, Dalex, Justin Quiles, Lenny Tavárez, Feid, Wisin, Zion","Quizas","Rich Music",3,19,136,"119412"
20,"spotify:track:4z6wo6PJG4Fve45OXK6D9m","Arcángel, Bad Bunny","Infeliz","Rimas Entertainment LLC.",17,20,45,"110874"
21,"spotify:track:0fea68AdmYNygeTGI4RC18","J Balvin, Bad Bunny","LA CANCIÓN","Universal Music Latino / Rimas",4,21,220,"108258"
22,"spotify:track:2TH65lNHgvLxCKXM3apjxI","Bad Bunny, Tainy","Callaita","Rimas Entertainment LLC",1,22,248,"107755"
23,"spotify:track:5YrjfKuFd0pMmYTGeRDV6X","Noriel","Piropo","Sony Music Latin/Ganda Entertainment",23,23,100,"98282"
24,"spotify:track:6Y4PDQv4XjYjHLeLmvyOt0","Sech, Ozuna","Si Te Vas","Rich Music",5,24,130,"97110"
25,"spotify:track:1aUGxXCz9QimNkKeiJtzZ7","KEVVO, Farruko, Chencho Corleone, Arcángel, Darell, Ñengo Flow, Brytiago, Myke Towers","105 F Remix","Una Vision Quintana",7,25,144,"96534"
26,"spotify:track:5m3jpKkgkfoMcym1qjToFg","Alex Rose, Rafa Pabön","Jangueo","Los Oidos Fresh/ Los Proximos",26,29,71,"94207"
27,"spotify:track:5IjOqh4XLyjHINuOGolmAt","Eladio Carrion, Zion & Lennox, Wisin & Yandel, Lunay","Mi Error - Remix","Rimas Entertainment LLC",27,30,77,"92637"
28,"spotify:track:1A9PKAFEHMWgXNLpgf7k4J","Myke Towers","Piensan","2020 One World Music & Casablanca Records | Powered by GLAD Empire, LL",14,26,143,"91613"
29,"spotify:track:113PlnpZbHd3WIqeYjhZWv","Daddy Yankee, Sech","Definitivamente","El Cartel Records (EC3)",29,34,3,"90917"
30,"spotify:track:1ndyl3wJCFs872XZ3ztPk6","Justin Quiles, NATTI NATASHA, Farruko, Lenny Tavárez, Dalex, Zion","DJ No Pare (feat. Zion, Dalex, Lenny Tavárez) - Remix","WEA Latina",19,27,150,"90512"
31,"spotify:track:684EjRHwNsZQ9hCQxL4NYL","Dímelo Flow, Nicky Jam, Sech, Farruko, Zion, Lunay","El Favor (with Nicky Jam & Sech, feat. Farruko, Zion & Lunay)","Rich Music/Interscope Records",6,28,157,"90480"
32,"spotify:track:4t9a07PAghtQMRAIP9FQ7Z","Lunay, Daddy Yankee, Bad Bunny","Soltera (Remix)","round2media - LaFamilia",2,32,269,"89024"
33,"spotify:track:6K5BsR04ijf3FHNzjbaagD","Myke Towers, Farruko, Arcángel, Sech, Zion","Si Se Da - Remix","2019 Casablanca Records & One World Music | Distributed by GLAD Empire",5,31,185,"88992"
34,"spotify:track:0RDgqtvOHLwcI6yz9bjsZV","Rich Music LTD, Sech, Dalex, Justin Quiles, Lenny Tavárez, Feid","Perreo en La Luna","Rich Music",22,33,115,"88240"
35,"spotify:track:4o1DxRjMCHDwBiOKv88rOl","Rvssian, Darell, Zion & Lennox, Myke Towers","B11 (feat. Myke Towers)","Sony Music Latin",14,35,137,"81438"
36,"spotify:track:1nocRtwyNPVtGcIJqfgdzZ","Camilo, Pedro Capó","Tutu","Sony Music Latin",6,36,178,"80948"
37,"spotify:track:6WrI0LAC5M1Rw2MnX2ZvEg","Dua Lipa","Don't Start Now","Warner Records",34,38,94,"80736"
38,"spotify:track:4bTZeO72FwMa6wKOiqoynL","Sech, Ozuna, Anuel AA, Darell, Nicky Jam","Otro Trago - Remix","Rich Music",1,37,192,"80708"
39,"spotify:track:7FbKipScVxkjQxQXwTd0gL","El Alfa, Lil Pump","Coronao Now","EL JEFE RECORDS LLC",21,41,88,"79534"
40,"spotify:track:40rXWke6SnXiGkSmaT8ZUr","Ozuna","Fantasía","Aura Music Corp.",26,39,66,"78711"
41,"spotify:track:2B94bbI1a4LyBpK1439oP7","Noriel, Myke Towers, Rauw Alejandro, Almighty","Cuerpo en Venta","Rimas Entertainment LLC",11,40,178,"77628"
42,"spotify:track:64IRsSyqwD0CBbFAfrR0rT","Paloma Mami","Mami","Sony Music Latin",17,42,55,"74142"
43,"spotify:track:41L3O37CECZt3N7ziG2z7l","Justin Bieber","Yummy","RBMG/Def Jam",35,43,31,"73555"
44,"spotify:track:25ZAibhr3bdlMCLmubZDVt","J Balvin, Bad Bunny","QUE PRETENDES","Universal Music Latino / Rimas",5,44,220,"70818"
45,"spotify:track:7BlBVFwvbWvcwNcUarQmjk","ROSALÍA, Ozuna","Yo x Ti, Tu x Mi","Columbia",9,45,172,"69198"
46,"spotify:track:3dJWIbkKEnI0Jb9CK6kdcg","JHAYCO, Wisin & Yandel","Imaginaste - Remix","N&E Entertainment LLC",26,46,94,"68362"
47,"spotify:track:7fODjB7BrQTGqh0hogW6XD","Sech, Justin Quiles, Maluma, Nicky Jam, Farruko, Dalex, Lenny Tavárez","Que Mas Pues - Remix","Rich Music/Ingrooves Records",7,48,298,"67302"
48,"spotify:track:7MRU4vOkywuhZ9kbFiPuiu","Daddy Yankee, Wisin & Yandel","Si Supieras","El Cartel Records (EC3)",6,47,220,"66644"
49,"spotify:track:70zg99pT51vB4wlMS7e4q7","Myke Towers, Maluma, Farruko","La Playa - Remix","2019 Casablanca Records & One World Music | Distributed by GLAD Empire",33,50,31,"65612"
50,"spotify:track:4fj7e6Tc48Bmomwyz2Z2XC","Manuel Turizo, Anuel AA","Te Quemaste","Sony Music Latin/La Industria",18,49,164,"65359"
51,"spotify:track:6EWWkqE4aFlZRyoFwwOT8u","Javiielo","Pa Los Gustos Los Colores","Oye Saavedra / EMPIRE",42,53,112,"60651"
52,"spotify:track:7anSoGdgtmJTAPZBzcPhO6","Dalex, Nicky Jam, Justin Quiles, Sech, Lenny Tavárez, Feid, Rafa Pabön","Cuaderno","Rich Music/Ingrooves Records",5,51,269,"59909"
53,"spotify:track:6v3KW9xbzN5yKLt9YKDYA2","Shawn Mendes, Camila Cabello","Señorita","Island Records",11,52,227,"59471"
54,"spotify:track:53uKGbcMjEc2gIWbfmvpdS","Nio Garcia, Rauw Alejandro, Lenny Tavárez, Myke Towers, Casper Magico, Darell","Mírame - Remix","2019 Flow La Movie, Inc. | Distributed by GLAD Empire, LLC.",17,54,199,"57322"
55,"spotify:track:27uAea0qcUz3a7jKnAT7KG","Santaferia","Algún Día Volverás","Santaferia",20,57,563,"57152"
56,"spotify:track:1KdwnsWOvhM53vezy5ROuf","C. Tangana, Paloma Mami","No Te Debí Besar","Sony Music Entertainment",4,55,144,"55093"
57,"spotify:track:5BAKerbfUwW5KboNuIPMmn","joel music, Puch Flow","Mueve Lo Que Dios Te Dio","Lody Produccion",57,60,35,"54935"
58,"spotify:track:5NOHsDSfLIH45y3i9PfRyh","Casper Magico, Bryant Myers, Alex Rose, Juhn","Fantasmita - Remix","2019 Flow La Movie, Inc & Los Magicos",55,59,59,"54786"
59,"spotify:track:2oZBb87Jgwrg3qYhwsy3BN","Myke Towers","Parcerita","2020 One World Music & Casablanca Records | Powered by GLAD Empire, LL",56,56,10,"53616"
60,"spotify:track:74j34STf8L6uADnTN69ohv","Rauw Alejandro, Chencho Corleone, KEVVO, Bryant Myers, Lyanno, Dalex","El Efecto - Remix","(SME US Latin) Duars Entertainment, Corp. (2)",52,58,52,"53170"
61,"spotify:track:7g8YaUQABMal0zWe7a2ijz","Dalex, Rafa Pabön, KHEA, Sech, Feid, Cazzu, Lenny Tavárez","Pa Mí (Remix)","Rich Music/Ingrooves Records",2,61,360,"51416"
62,"spotify:track:2rc7BkzO8qepMFAxHtOrXc","J Balvin","Blanco","UMLE - Latino",54,63,80,"50959"
63,"spotify:track:59s0s39NFWScuHDbHytI14","Reik, J Balvin, Lalo Ebratt","Indeciso","Indeciso",29,62,164,"50922"
64,"spotify:track:3cUE3p7E39CzGjQoEsg7sM","Santaferia","EL Gil De Tu Ex","Santaferia",21,68,913,"50807"
65,"spotify:track:2qG5sZ7Si6sdK74qLxedYM","ROSALÍA, J Balvin, El Guincho","Con Altura","Columbia",12,64,312,"49768"
66,"spotify:track:374Yj1kOLjGLYLOydbCO3i","Lasso, Cami","Odio Que No Te Odio","Universal Music Mexico",19,66,17,"49263"
67,"spotify:track:1G2CAJeP7rCwOZjlSJ0Zw3","Major Lazer, J Balvin, El Alfa, Diplo","Que Calor","Mad Decent",42,67,143,"48948"
68,"spotify:track:5widvMUA2hiilH1RpOl5aM","Duki, RONNY J, Pablo Chill-E, Capo Plaza, C.R.O, Asan","Goteo - Remix","SSJ Records / DALE PLAY Records",53,65,10,"48701"
69,"spotify:track:4RaWbMItxVbuUExNkFsITP","Nio Garcia, Brray, Juanka","La Jeepeta","2019 Flow La Movie, Inc. | Distributed by GLAD Empire, LLC.",66,71,24,"48448"
70,"spotify:track:4lzxJ4jCuFDXXGkE1LmpKR","DJ Luian, Mambo Kingz, Anuel AA, Nicky Jam, Darell, Brytiago","Verte Ir","Hear This Music",1,69,312,"46442"
71,"spotify:track:0wMs7DPFOnToNAoecvAFQc","Rich Music LTD, Sech, Dalex, Justin Quiles, Lenny Tavárez, Feid, De La Ghetto, Zion & Lennox","Uniforme","Rich Music",23,70,115,"46430"
72,"spotify:track:0OoqRZXnSrgIUAha3iLKG1","Lunay, Myke Towers","La Cama","round2media - LaFamilia",19,72,111,"45959"
73,"spotify:track:6U3AilMn51njMyILgOlBQl","Adan La Amenaza, Yordano El Menor, Yohancito, Anonimus King, Carlitos Junior, Forest, BlackRoy","Dele Cotele - Remix","Adan La Amenaza | Eyey Networks",54,76,122,"45097"
74,"spotify:track:2Fxmhks0bxGSBdJ92vM42m","Billie Eilish","bad guy","Darkroom/Interscope Records",31,74,310,"43564"
75,"spotify:track:5iwz1NiezX7WWjnCgY5TH4","Pedro Capó, Farruko","Calma - Remix","Sony Music Latin",1,75,483,"42960"
76,"spotify:track:6768f4xbHQBpJo5lvFVNvs","Myke Towers","La Playa","2020 One World Music & Casablanca Records | Powered by GLAD Empire, LL",32,77,299,"42913"
77,"spotify:track:5w9c2J52mkdntKOmRLeM2m","Daddy Yankee, Snow","Con Calma","El Cartel Records (EC3)",1,73,375,"42504"
78,"spotify:track:0mcBgVRVsvESTkEyVHt7Ue","Darell","No Vuelvas Más","Sony Music Latin",73,79,58,"41919"
79,"spotify:track:099tjv6oy2opbpCOA3nBwX","Ir Sais, Rauw Alejandro","Dream Girl - Remix","Sony Music Latin",69,82,28,"41687"
80,"spotify:track:1LiN0Z98FkR1t0m8KmLcAH","Anuel AA, Haze","Amanece","House of Haze",2,80,416,"40657"
81,"spotify:track:7q3NthaBqFI6s0WnAlnIvq","Darell, Brytiago","Velitas","Sony Music Latin",36,78,206,"40319"
82,"spotify:track:1tpbAGsGpZee5jDHMcLrUJ","Dalex, Lenny Tavárez","Bellaquita","Rich Music",17,86,150,"40305"
83,"spotify:track:3QfD4bxxkopZL7XZ8RaezH","Tommy Boysen","Hookah & Sheridan's","Equity Distribution",12,84,502,"40277"
84,"spotify:track:7KbF6AdprOXEEHlsq11Z6d","Maluma","11 PM","Sony Music Latin",20,83,262,"39748"
85,"spotify:track:3YntiCUU0Xqq0B68FM3YAt","Myke Towers","Rutina","2019 Casablanca Records & One World Music | Distributed by GLAD Empire",70,85,50,"39512"
86,"spotify:track:1NmQc6rwLv7g0UHL1AFOa9","JHAYCO, Ozuna","Easy - Remix","N&E Entertainment LLC",57,91,75,"38329"
87,"spotify:track:5px6upUHM3fhOP621Edp4V","Dua Lipa","Physical","Warner Records",72,81,3,"38326"
88,"spotify:track:56f5qnyAlZdlz8wrUDA50h","Mau y Ricky, Manuel Turizo, Camilo","Desconocidos","Sony Music Latin",9,89,476,"38280"
89,"spotify:track:0sf12qNH5qcw8qpgymFOqD","The Weeknd","Blinding Lights","Republic Records",89,96,37,"38246"
90,"spotify:track:1Ej96GIBCTvgH7tNX1r3qr","Sech, Darell","Otro Trago","Rich Music/Ingrooves Records",1,87,290,"38169"
91,"spotify:track:5RClLxkUvnMWFUQ3VAQEHj","Myke Towers","Relación Rota","2020 One World Music & Casablanca Records | Powered by GLAD Empire, LL",69,88,10,"37770"
92,"spotify:track:4xvTPuwHaXoDM3p0QcY7bH","DJ Luian, Mambo Kingz, Farruko, Wisin, Myke Towers, Darell, Arcángel","Música","Hear This Music",56,93,60,"37307"
93,"spotify:track:4PJ3umtW1aWdfh5EITHc6T","Nicky Jam, Ozuna","Te Robaré","Sony Music Latin",4,92,318,"37191"
94,"spotify:track:26Qhn2T88XqVinXQpmSarj","Nicky Jam, Sech","Atrévete","Sony Music Latin",19,94,185,"37004"
95,"spotify:track:5QXQy0f2q8wJNpPwJtjifx","DJ Snake, J Balvin, Ozuna, Nicky Jam, NATTI NATASHA, Darell, Sech","Loco Contigo (with J. Balvin & Ozuna feat. Nicky Jam, Natti Natasha, Darell & Sech) - REMIX","DJ Snake Music Productions Limited/Geffen Records",59,90,38,"36956"
96,"spotify:track:132ALUzVLmqYB4UsBj5qD6","Paulo Londra","Adan y Eva","WEA Latina",1,97,455,"36341"
97,"spotify:track:6ehhkBXzCrzBJ6YCL9tIdd","Pablo Chill-E, 0-600","Jugo y Plata","ShishiGang Récords",95,95,3,"36231"
98,"spotify:track:6t94PGXYAuo9GbJEnMpPcW","Super Yei, Sammy Baby, Myke Towers, Lenny Tavárez, Rafa Pabön","La Forma en Que Me Miras","2018 Superiority",58,99,539,"36145"
99,"spotify:track:6Xfz4YNwwIcFRyfW3QQZVp","Ceaese, Utopiko, Polimá Westcoast, Young Cister","Te Quiero Ver (feat. Polimá Westcoast y Young Cister)","WM Chile",31,98,407,"35792"
100,"spotify:track:4Clmg1g8n2yBYG13Z1oSdG","Dayvi, Victor Cardenas, Kelly Ruíz","Baila Conmigo (feat. Kelly Ruiz)","Sony Music México",17,102,234,"35687"
101,"spotify:track:0nbXyq5TXYPCO7pr3N8S4I","Roddy Ricch","The Box","Atlantic Records",98,100,20,"35676"
102,"spotify:track:3ZCTVFBt2Brf31RLEnCkWJ","Billie Eilish","everything i wanted","Darkroom/Interscope Records",63,103,80,"34447"
103,"spotify:track:0GmiGIxXDNrePrHBpijYDp","Yannc, Darkiel, Eladio Carrion, Brray, Myke Towers","Sigue Bailandome","Full Harmony",4,101,468,"34209"
104,"spotify:track:09tYvFOFp1pKxZ8GJVlOXm","JHAYCO","Como Se Siente","N&E Entertainment LLC",104,118,4,"33397"
105,"spotify:track:34ZngZgo8xicbt1EE8Ob8Z","Rich Music LTD, Sech, Dalex, Justin Quiles, Lenny Tavárez, Feid","Porno","Rich Music",53,107,115,"33240"
106,"spotify:track:5jW3rF4URMdK7tO2xjS5EI","Paulo Londra","Tal Vez","WEA Latina",5,106,305,"33213"
107,"spotify:track:059bcIhyc2SBwm6sw2AZzd","Piso 21, Micro TDH","Te Vi","WM Mexico",17,105,410,"32373"
108,"spotify:track:7o0oY5wRcoV7oPuDhD2J1z","Paloma Mami","Fingías","Sony Music Latin",1,104,318,"32310"
109,"spotify:track:35wvL50xvKpCHEJPxLOLPI","Bad Bunny","Si Estuviésemos Juntos","Rimas Entertainment LLC",7,148,405,"32122"
110,"spotify:track:63Z1ToWxe9UJA82d9qF5lo","Simon la Letra, Pablo Chill-E","Es Poco","GGF",94,111,64,"32011"
111,"spotify:track:696DnlkuDOXcMAnKlTgXXK","Arizona Zervas","ROXANNE","Arizona Zervas",92,117,69,"31928"
112,"spotify:track:6OPl2rRpNsW1BZmtrSxP6X","Ceaese, Utopiko, DrefQuila, THAT","Damelo (feat. DrefQuila y THAT)","WM Chile",31,112,387,"31865"
113,"spotify:track:0EJu1RBtxzldMG2peczuPv","Paloma Mami","No Te Enamores","Sony Music Latin",1,109,409,"31858"
114,"spotify:track:2vrpcQNg6itmgVZWsNjWe0","Sebastian Yatra, Reik","Un Año","UMLE - Latino",9,113,381,"31643"
115,"spotify:track:3f5lA8nnc4YYF1qf78WpHw","Anuel AA, Romeo Santos","Ella Quiere Beber - Remix","Real Hasta La Muerte, LLC",8,108,458,"31515"
116,"spotify:track:6osaMSJh9NguagEDQcZaKx","DJ Snake, J Balvin, Tyga","Loco Contigo (feat. J. Balvin & Tyga)","DJ Snake Music Productions Limited",33,110,234,"31406"
117,"spotify:track:6fIVDVyzymH4OAlNhJ93k3","Jerry Di, Zion & Lennox, Lyanno, Noriel, Luis Alberto Ambrosio Cuque, Pablo C Fuentes, Wilmo Belisario","Verano En París - Remix","Nacho",109,114,93,"31334"
118,"spotify:track:7BuHdm4lQqcyG3qTwdkxus","Wisin & Yandel, Romeo Santos","Aullando","Sony Music Latin",25,116,416,"31033"
119,"spotify:track:3JHpk0DOTOzyh0777JFAky","Myke Towers","Diosa","2020 One World Music & Casablanca Records | Powered by GLAD Empire, LL",100,120,10,"30537"
120,"spotify:track:152U4ecGSiYeKm2gnFc4wA","Villa Cariño","Serenata cruel","Clandestino Records",44,128,1043,"30181"
121,"spotify:track:4jMwPJMtMF977ciTvD5fwg","Myke Towers, Farruko","Si Se Da","2020 One World Music & Casablanca Records | Powered by GLAD Empire, LL",6,115,340,"30166"
122,"spotify:track:4TnjEaWOeW0eKTKIEvJyCa","Trevor Daniel","Falling","Alamo",113,126,48,"29676"
123,"spotify:track:4SJHHpKhcuXwDsCsPqshXj","Rauw Alejandro, Chencho Corleone","El Efecto","Duars Entertainment, Corp.",64,119,322,"29655"
124,"spotify:track:5W83ErFkO3aKAIS1WMi6u0","Anuel AA, KAROL G","Secreto","Anuel AA & Karol G - Secreto",1,121,384,"29485"
125,"spotify:track:2b8fOow8UzyDFAE27YhOZM","Maroon 5","Memories","Interscope Records*",101,127,74,"29275"
126,"spotify:track:1khmgu0pveJbkbpbkyvcQv","Bad Bunny, El Alfa","La Romana","Rimas Entertainment LLC",14,124,406,"29197"
127,"spotify:track:64kNRze29YqCFzFEpQCaHQ","Gigolo Y La Exce, Myke Towers, Arcángel, El Alfa, Farruko","Rasta Barbie (Remix)","Rimas Entertainment LLC",69,122,109,"29154"
128,"spotify:track:0dlFCeKHsPhnLKPbqoOwwH","Santaferia","Haciendo nada","Santaferia",48,137,648,"28894"
129,"spotify:track:7mWFF4gPADjTQjC97CgFVt","Ozuna, Daddy Yankee, J Balvin, Farruko, Anuel AA","Baila Baila Baila - Remix","VP Records Corp/Dimelo Vi",11,130,284,"28717"
130,"spotify:track:29ShXDWDedEwZkYc8Du08N","Rich Music LTD, Sech, Dalex, Justin Quiles, Lenny Tavárez, Feid, Cazzu","Imaginate","Rich Music",54,131,114,"28387"
131,"spotify:track:7xX3wvvcZvxGCa06KlgTCp","Myke Towers","Tú","2020 One World Music & Casablanca Records | Powered by GLAD Empire, LL",90,125,10,"28308"
132,"spotify:track:2dy3TKVDEbIeWxeIb8JWqZ","NATTI NATASHA, Romeo Santos","La Mejor Versión de Mi - Remix","Pina Records",86,123,121,"27937"
133,"spotify:track:5xbZJo8AFv830Wx1RvmMXX","Drago200, Pablo Chill-E, Polimá Westcoast, Lleflight","Atraco Con 2 - Remix","Nabru Records LLC",119,135,6,"27578"
134,"spotify:track:2hMemEDS1l5hrjLWwU1MNt","Polimá Westcoast, Pablo Chill-E","MY BLOOD","Sony Music Entertainment Chile S.A",21,134,342,"27544"
135,"spotify:track:65DBZofI0b79kfHTcWWDuU","Soda Stereo","Trátame Suavemente - Remasterizado 2007","Columbia",134,139,248,"27423"
136,"spotify:track:57kdZIOAaolxAjB67d2yU3","Duki","Goteo","SSJ Records / DALE PLAY Records",22,140,179,"27303"
137,"spotify:track:4MxYiw28F30NGOaTZ1ySqd","Mau y Ricky, Nicky Jam, Dalex, Dímelo Flow, Justin Quiles, Lenny Tavárez","Bota Fuego (feat. Dímelo Flow, Justin Quiles & Lenny Tavárez) - Remix","Sony Music Latin",100,132,37,"27219"
138,"spotify:track:6pNjmMB8FTMEcqGSgs7Mji","Farruko, Ozuna, Lunay, Sech, Sharo Towers","Nadie (feat. Sech & Sharo Towers) - Remix","Sony Music Latin",25,129,115,"27200"
139,"spotify:track:6ifUES3keWjwXgae8pXI3o","Danny Ocean","Me Rehúso","Atlantic Records",1,133,1099,"27081"
140,"spotify:track:2EEmzqzM70CybVspgM7YRT","Mau y Ricky, Camilo, Lunay","La Boca - Remix","Sony Music Latin",28,136,201,"26910"
141,"spotify:track:116H0KvKr2Zl4RPuVBruDO","Bad Bunny, Drake","MIA","Rimas Entertainment LLC",1,141,479,"26362"
142,"spotify:track:42ArfZUgGo3k5btIHp08it","Paloma Mami","Not Steady","Sony Music Latin",3,138,534,"26297"
143,"spotify:track:0LHejotBx99f8kN7UQP2o4","Harry Nach, Young Kieff","Norty","Only Perk",143,153,48,"26024"
144,"spotify:track:7pxL0DzPpCjjcdfQccvnus","Piso 21, Myke Towers","Una Vida Para Recordar","WM Mexico",43,143,212,"26014"
145,"spotify:track:41axLDYnS1sPpENZ654sCN","Los Vasquez, Santaferia","Mariajuana","Sello del Sur Producciones Ltda",79,160,116,"25870"
146,"spotify:track:2J9B63FawlTaPdg4eH5X03","Beéle","Loco","Hear This Music",98,144,109,"25609"
147,"spotify:track:4EKZsrsCKyqr64FBHLc0DU","KAROL G, Maluma","Créeme","UMLE - Latino",32,159,454,"25548"
148,"spotify:track:6b2RcmUt1g9N9mQ3CbjX2Y","Sam Smith","How Do You Sleep?","PLG - Capitol",60,145,196,"25480"
149,"spotify:track:0VKkyBKCXyR99navhVRqcP","Zion & Lennox","La player (Bandolera)","WEA Latina",1,142,707,"25325"
150,"spotify:track:4aN4QlhHVjgvXYkF3hlW2b","Jay Wheeler, DJ Nelson, Farruko","Otra Noche Más - Remix","Linked Music / Dynamic Records / EMPIRE",150,162,11,"25321"
151,"spotify:track:1F205Nl2feOSYSztLNOJAL","Eladio Carrion, Brytiago","3 Am","Rimas Entertainment LLC",151,190,2,"25133"
152,"spotify:track:4jhHaLksdP8DJZzxYAjOSz","Eladio Carrion, Bad Bunny","Kemba Walker","Rimas Entertainment LLC",37,146,123,"25104"
153,"spotify:track:6exje52SuWDGQ2Ol8K4P5I","Pablo Chill-E, Chuchu Retro","Pensando En Ti","ShiShigang Records",70,154,311,"24967"
154,"spotify:track:6wBrZZ1LyiBxytLnpgnlhf","Cami","Querida Rosa","Universal Music Chile",26,158,602,"24851"
155,"spotify:track:0qZ7oronoocHdFDKGBdgLQ","Zion & Lennox","Sistema","WEA Latina",134,149,46,"24780"
156,"spotify:track:0aCTSZQTlmnjQucALTF00s","Harry Nach","Tak Tiki Tak","Sony Music Entertainment Chile S.A",156,164,12,"24621"
157,"spotify:track:5lFl0Aksww4t4CGiYYtpZz","Rauw Alejandro","Detective","Duars Entertainment, Corp.",109,152,167,"24579"
158,"spotify:track:2b6i9zx3ULzKrNWmyP0ePD","John C, Neo Pistea, Bhavi, Trueno","C90 (Remix)","Piloto Productions",73,165,46,"24544"
159,"spotify:track:7lk2SWsLObPlO98pOvz6V0","Santaferia, Illapu","Si Te Marchas, No Hay Manera","Santaferia",80,179,284,"24487"
160,"spotify:track:5099x34vBakWpGkHourFxP","Maluma, J Balvin","Qué Pena","Sony Music Latin",43,150,128,"24364"
161,"spotify:track:43zdsphuZLzwA9k4DJhU0I","Billie Eilish","when the party's over","Darkroom/Interscope Records",110,163,147,"24352"
162,"spotify:track:4BCPItsB94KDLuERZT3aNM","TINI, Lalo Ebratt","Fresa","5020 Records",58,157,148,"24214"
163,"spotify:track:74wEiOpnvCe1tCTWKGSYta","Becky G, Paulo Londra","Cuando Te Besé","Kemosabe Records/RCA Records/Sony Music Latin",5,147,547,"24197"
164,"spotify:track:1GBLO0NFODuL31A5fgw0uR","Maluma, Ricky Martin","No Se Me Quita (feat. Ricky Martin)","Sony Music Latin",74,151,154,"24159"
165,"spotify:track:0x1k6gSTSxaLxe0F2IThaX","Mike Bahía, Danny Ocean","Detente","WM Mexico",139,155,20,"23995"
166,"spotify:track:2xuYcmQW7sFoVHygnyP2k1","Músicxs De Chile, Francisca Valenzuela, Cami, Gepe, Moral Distraida, Fernando Milagros, Mon Laferte, Denisse Malebrán, Benjamín Walker, Pedropiedra, C-Funk, Noche de Brujas, Santaferia, Chancho En Piedra, Consuelo Schuster, Schuster, Gianluca, Princesa Alba, Joe Vasconcellos, Illapu, Nano Stern, Javiera Parra, Elizabeth Morris, Rubio, Mariel Mariel, Paz Court, Manuel García, Angel Parra, Juan Angel","El Derecho de Vivir en Paz","Sucesión Víctor Jara",109,184,18,"23923"
167,"spotify:track:3VyjsVV24RmBIbWJAeUJNu","Don Toliver","No Idea","We Run It Ent./Cactus Jack/Atlantic",114,166,38,"23865"
168,"spotify:track:0tJCo71s7HT9Mu5Z4juuLw","Sech, Farruko, Zion & Lennox","Solita","Rich Music/Ingrooves Records",46,172,335,"23861"
169,"spotify:track:4u7EnebtmKWzUH433cf5Qv","Queen","Bohemian Rhapsody - Remastered 2011","EMI",26,161,595,"23822"
170,"spotify:track:3CACzG9I3AoKUKA3ODE5zW","Damas Gratis, Viru Kumbieron","Me Vas a Extrañar - En Vivo","Pelo Music S.A.",51,173,271,"23561"
171,"spotify:track:5UyH584f99c7qErZifyaHy","Princesa Alba","Convéncete","Altafonte bajo licencia exclusiva de Princesa Alba",38,171,263,"23560"
172,"spotify:track:7ef4DlsgrMEH11cDZd32M6","Calvin Harris, Dua Lipa","One Kiss (with Dua Lipa)","Sony Music UK",32,167,454,"23516"
173,"spotify:track:6qqd7DGn2VXzxsR4k3Ycun","Rauw Alejandro, Farruko","Fantasias - Unplugged","(SME US Latin) Duars Entertainment, Corp. (2)",90,177,83,"23474"
174,"spotify:track:3CV6tcIs0tqW3aJtu6THaM","Pablo Chill-E","Vibras","ShiShi Gang Records",91,170,323,"23448"
175,"spotify:track:4whKi0lMYWNiV2IZBkTbYB","Casper Magico, Rauw Alejandro","La Mas Linda","2019 Flow La Movie, Inc & Los Magicos",123,174,49,"23430"
176,"spotify:track:21jGcNKet2qwijlDFuPiPb","Post Malone","Circles","Republic Records",123,175,90,"23087"
177,"spotify:track:6ydubKY1r75XKuQheIQB8f","Cami","Aquí Estoy","Universal Music Chile",11,183,223,"23059"
178,"spotify:track:7BuSE9uTIw931wtZYzvZcQ","Sebastian Yatra, Daddy Yankee, NATTI NATASHA, Jonas Brothers","Runaway","UMLE - Latino",14,169,226,"22958"
179,"spotify:track:6MJUCumnQsQEKbCy28tbCP","Daddy Yankee, Anuel AA","Adictiva","El Cartel Records (EC3)",5,168,450,"22934"
180,"spotify:track:3iQOfefMGDVDwo8dZoco8T","Feid, Justin Quiles","PORFA","JP Entertainment (Jorge Pino)",176,-1,24,"22668"
181,"spotify:track:7DOh0tBGnyMt6C5OO7o8Yq","Cazzu, Lyanno, Rauw Alejandro, Dalex","Nada","Rimas Entertainment LLC",124,176,79,"22529"
182,"spotify:track:0PaNKfwdqHjmW7hVEQ0lbu","Camilo","La Difícil","Sony Music Latin",117,180,23,"22423"
183,"spotify:track:3YqTzC9YYQmiT5nDZgl01q","Pablo Chill-E, El Futuro Fuera De Orbita","Flyte","ShiShi Gang Records",44,193,349,"22357"
184,"spotify:track:1LIqNVhaIgxXUt2eVoIQJ3","Maluma","HP","Sony Music Latin",18,181,338,"22336"
185,"spotify:track:3dWpRjCmaHbroNahuSeX11","Guaynaa, Nicky Jam, Farruko, Becky G, Sech","Rebota - Remix","Rebota Remix",21,178,204,"22177"
186,"spotify:track:6G4U9avyBNEfP0fAIduev3","Aventura, Don Omar","Ella Y Yo - Featuring Don Omar","Premium Latin Music",131,195,297,"22097"
187,"spotify:track:1JSTJqkT5qHq8MDJnJbRE1","The Police","Every Breath You Take","Polydor Records",161,196,126,"21996"
188,"spotify:track:0XtFQVI5WtK02YKo1sXcRi","Chencho Corleone, NATTI NATASHA, Justin Quiles, Wisin, Miky Woodz","Impaciente - Remix","Pina Records",188,189,3,"21960"
189,"spotify:track:0hVXuCcriWRGvwMV1r5Yn9","Ed Sheeran & Justin Bieber, Justin Bieber","I Don't Care (with Justin Bieber)","Atlantic Records UK",28,198,211,"21925"
190,"spotify:track:5qN1G8fSHq4Sv5FRoOkNGu","Paulo Londra","Por Eso Vine","WEA Latina",17,191,253,"21824"
191,"spotify:track:5MarqoT4wE5uNITGuEZams","Villa Cariño","Para dormir contigo otra vez","Clandestino Records",89,-1,453,"21807"
