rank,uri,artist_names,track_name,source,peak_rank,previous_rank,days_on_chart,streams
1,"spotify:track:4HYDUMY0xSpeBr0AMY9cUz","Jay Wheeler, DJ Nelson, Myke Towers","La Curiosidad","Linked Music / Dynamic Records / EMPIRE",1,1,30,"234384"
2,"spotify:track:1mohfLaTJtB2RplHLQVM70","Nio Garcia, Anuel AA, Myke Towers, Brray, Juanka","La Jeepeta - Remix","2020 Flow La Movie, Inc. | Powered by GLAD Empire, LLC",1,2,79,"214983"
3,"spotify:track:3ZG8N7aWw2meb6UrI5ZmnZ","Sech","Relación","Rich Music",3,3,101,"190709"
4,"spotify:track:2tFwfmceQa1Y6nRPhYbEtC","JHAYCO, Bad Bunny","CÓMO SE SIENTE - Remix","N&E Entertainment LLC",1,5,63,"163257"
5,"spotify:track:06s3QtMJVXw1AJX3UfvZG1","Anuel AA, Bad Bunny","Hasta Que Dios Diga","2020 Real Hasta La Muerte, LLC",1,4,44,"162188"
6,"spotify:track:50ZC4PM7hywH27RcCfViau","Rauw Alejandro, Dalex, Lenny Tavárez, Dímelo Flow","Elegí (feat. Dímelo Flow)","Sony Music Latin",3,6,107,"155282"
7,"spotify:track:7gwwt1IaAWwmB7af0AcuBM","Harry Nach","Tak Tiki Tak","Sony Music Entertainment Chile S.A",7,7,172,"142257"
8,"spotify:track:3gD4J3RUHy4OUuZ3qAiaiG","Ozuna","Caramelo","Aura Music Corp.",8,8,30,"131205"
9,"spotify:track:6yVkakCN460KOVol9ZazjH","Anuel AA","Reggaetonera","2020 Real Hasta La Muerte, LLC",2,10,44,"123801"
10,"spotify:track:4TOmcZvw0gHa7GiXRbcYAW","Feid, Justin Quiles","PORFA","JP Entertainment (Jorge Pino)",4,9,178,"122989"
11,"spotify:track:2DEZmgHKAvm41k4J3R2E9Y","Bad Bunny, Jowell & Randy, Ñengo Flow","Safaera","Rimas Entertainment LLC",1,11,133,"122101"
12,"spotify:track:4ZRrLHqzhGRXYj2qcB4s5S","Rauw Alejandro, Camilo","Tattoo - Remix with Camilo","Sony Music Latin/Duars Entertainment",12,12,2,"112056"
13,"spotify:track:0SqqAgdovOE24BzxIClpjw","Bad Bunny","Yo Perreo Sola","Rimas Entertainment LLC",2,13,134,"110125"
14,"spotify:track:74j34STf8L6uADnTN69ohv","Rauw Alejandro, Chencho Corleone, KEVVO, Bryant Myers, Lyanno, Dalex","El Efecto - Remix","(SME US Latin) Duars Entertainment, Corp. (2)",10,14,212,"107311"
15,"spotify:track:7lUdbnz7wsv3C9zzf4WHl9","Feid, J Balvin, Maluma, Nicky Jam, Sech, Justin Quiles","PORFA Remix ( Feat. Maluma, Nicky Jam, Sech) - Remix","JP Entertainment (Jorge Pino)",15,15,16,"99576"
16,"spotify:track:380HmhwTE2NJgawn1NwkXi","J Balvin","Rojo","UMLE - Latino",8,16,135,"99285"
17,"spotify:track:0jT8Nl0shPS8115is0wD2Q","Camilo","Favorito","Sony Music Latin",3,17,107,"98685"
18,"spotify:track:0VjIjW4GlUZAMYd2vXMi3b","The Weeknd","Blinding Lights","Republic Records",13,18,197,"95479"
19,"spotify:track:6NfrH0ANGmgBXyxgV2PeXt","Bad Bunny","La Difícil","Rimas Entertainment LLC",1,19,134,"93027"
20,"spotify:track:3JHpk0DOTOzyh0777JFAky","Myke Towers","Diosa","2020 One World Music & Casablanca Records | Powered by GLAD Empire, LL",7,21,170,"91896"
21,"spotify:track:7na7Bk98usp84FaOJFPv3d","Rauw Alejandro","Tattoo","(SME US Latin) Duars Entertainment, Corp. (2)",7,20,149,"89879"
22,"spotify:track:6AzKhCHOms83jvNVLsz0Bt","Aya Nakamura, Maluma","Djadja (feat. Maluma) - Remix","Rec. 118",22,24,26,"87373"
23,"spotify:track:5m3jpKkgkfoMcym1qjToFg","Alex Rose, Rafa Pabön","Jangueo","Los Oidos Fresh/ Los Proximos",13,22,231,"86676"
24,"spotify:track:38RIEav39FGi86jppxO0du","Bad Bunny, Sech","Ignorantes","Rimas Entertainment LLC",1,23,149,"82217"
25,"spotify:track:4QfZYDhGZc0T2RDvGiI69E","El Alfa, Chael Produciendo","Singapur","EL JEFE RECORDS LLC",25,27,23,"81211"
26,"spotify:track:5stPVcRqb4qixbafP9e8lt","Dalex, Lenny Tavárez, Chencho Corleone, Juhn, Dímelo Flow","Hola - Remix","Rich Music",2,25,254,"79555"
27,"spotify:track:2lCkncy6bIB0LTMT7kvrD1","J Balvin","Azul","UMLE - Latino",26,28,114,"79319"
28,"spotify:track:69vlMrzHwATKzupwNcUPyK","Bad Bunny, Daddy Yankee","La Santa","Rimas Entertainment LLC",3,26,134,"76227"
29,"spotify:track:7k4t7uLgtOxPwTpFmtJNTY","KAROL G, Nicki Minaj","Tusa","TUSA - Karol G & Nicki Minaj",1,34,247,"71959"
30,"spotify:track:2tGENA8xef0wABdHvyXwv9","Lunay, Ozuna, Myke Towers, Chencho Corleone, Rauw Alejandro","La Cama (Remix)","round2media - LaFamilia",20,29,107,"71421"
31,"spotify:track:0FktnzDqjClqU6iqOZVEs2","Bad Bunny","BYE ME FUI","Rimas Entertainment LLC",1,30,63,"70814"
32,"spotify:track:7sQKy5vlPQllr0k9IjYJv3","Arcángel, Sech, Dímelo Flow","Sigues Con El","Rimas Entertainment LLC.",2,31,212,"69398"
33,"spotify:track:5bmSver2b3ZXyuyLKtgnFI","Bad Bunny, Nicky Jam","BAD CON NICKY","Rimas Entertainment LLC",3,32,63,"68526"
34,"spotify:track:4EJHKSnHENfjOxXWryyNtL","Bad Bunny, Zion & Lennox","MÁS DE UNA CITA","Rimas Entertainment LLC",1,33,63,"67465"
35,"spotify:track:099tjv6oy2opbpCOA3nBwX","Ir Sais, Rauw Alejandro","Dream Girl - Remix","Sony Music Latin",34,35,188,"65556"
36,"spotify:track:35KmOEIUqAGn02t7n4qaIr","J Balvin","Morado","UMLE - Latino",12,37,184,"62636"
37,"spotify:track:3pm4XtcsRIFFtH2UErk62R","Yandel, Bad Bunny","CANCIÓN CON YANDEL","Rimas Entertainment LLC",4,36,63,"62569"
38,"spotify:track:57Ba26w9eoXx8BBUNgRNLV","Super Yei, Sammy Baby, Jone Quest, Myke Towers, Lenny Tavárez, Rafa Pabön","La Forma en Que Me Miras","2020 Superiority | Powered by GLAD EMPIRE, LLC",38,38,699,"62417"
39,"spotify:track:43NqTeL8pgBxKHPMiJKUP5","Myke Towers","Girl","2020 One World Music & Casablanca Records | Powered by GLAD Empire, LL",4,39,170,"59498"
40,"spotify:track:4r9jkMEnArtWGH2rL2FZl0","Bad Bunny","A Tu Merced","Rimas Entertainment LLC",9,40,134,"58409"
41,"spotify:track:5kbps8unnGH4raN5WduZuq","Sech, Daddy Yankee","Confía","Rich Music",28,41,52,"57914"
42,"spotify:track:4w47S36wQGBhGg073q3nt7","ROSALÍA, Travis Scott","TKN (feat. Travis Scott)","Columbia",32,43,45,"57575"
43,"spotify:track:2n7ohqg1s68ToAHh4u9mcW","Bad Bunny","Vete","Rimas Entertainment LLC",1,42,234,"57049"
44,"spotify:track:7x4ASXYEKfQBCewcZhK776","KAROL G","Ay, DiOs Mío!","UMLE - Latino",44,61,2,"55756"
45,"spotify:track:5379uuUPHodsdVhy8pIAAr","Cali Y El Dandee, Sebastian Yatra","Locura","Cali y El Dandee PS",31,45,65,"55533"
46,"spotify:track:7KKh0ujp8agIiCrkiJhf81","Anuel AA, Tego Calderón","Jangueo","2020 Real Hasta La Muerte, LLC",3,46,44,"55331"
47,"spotify:track:5EbtodsuLbxrFDH6j5avVS","Camilo, Pablo Alborán","El Mismo Aire - con Pablo Alborán","Sony Music Latin",29,44,32,"54922"
48,"spotify:track:1sHs87yRloQy0vE9mzpiZB","Juanka","Tus Besos","N&E Entertainment LLC",38,48,81,"54168"
49,"spotify:track:0OTtnwUO8natNWSwdZvXVF","Ovy On The Drums, Beéle","Inolvidable","WEA Latina",34,47,85,"53990"
50,"spotify:track:56Ta1O7Jxxpjnc6cWdDKUo","Reik, Farruko, Camilo","Si Me Dices Que Sí","Sony Music México",46,50,143,"53467"
51,"spotify:track:1rgnBhdG2JDFTbYkYRZAku","Tones And I","Dance Monkey","Elektra (NEK)",4,49,278,"52844"
52,"spotify:track:4Pu0a2TuHOYtI4CCE3HEXI","Arcángel, Sech, Romeo Santos","Sigues Con El - Remix","Rimas Entertainment LLC.",20,53,93,"50699"
53,"spotify:track:4R8BJggjosTswLxtkw8V7P","JHAYCO, J Balvin, Bad Bunny","No Me Conoce - Remix","N&E Entertainment LLC",2,56,422,"49922"
54,"spotify:track:41wtwzCZkXwpnakmwJ239F","Bad Bunny","Si Veo a Tu Mamá","Rimas Entertainment LLC",4,51,134,"49589"
55,"spotify:track:6mAN61JH0dzyZpWslS11jy","Rauw Alejandro, Farruko","Fantasias","(SME US Latin) Duars Entertainment, Corp. (2)",1,55,317,"49535"
56,"spotify:track:0eeKDrQxjqNl5bX5VCHDcn","Justin Quiles, Daddy Yankee, El Alfa","PAM","WEA Latina",50,54,72,"48900"
57,"spotify:track:3jbT1Y5MoPwEIpZndDDwVq","Tainy, Anuel AA, Ozuna","Adicto (with Anuel AA & Ozuna)","NEON16/Interscope Records",1,57,325,"46971"
58,"spotify:track:0KkIkfsLEJbrcIhYsCL7L5","Anuel AA, Daddy Yankee, KAROL G, Ozuna, J Balvin","China","2020 Real Hasta La Muerte, LLC",1,59,359,"46970"
59,"spotify:track:3vAn0qZzdyuHamcrpkfiX3","BLACKPINK","How You Like That","YG Entertainment/Interscope Records",29,52,16,"46104"
60,"spotify:track:4xI3U4sDj1TPmO9Iz5TkYp","El Alfa, Darell, Noriel","4K","EL JEFE RECORDS LLC",41,67,121,"45369"
61,"spotify:track:0pgj4EzB1XRqgZemoMNG5D","Camilo, Evaluna Montaner","Por Primera Vez","Sony Music Latin",24,62,124,"44517"
62,"spotify:track:0fea68AdmYNygeTGI4RC18","J Balvin, Bad Bunny","LA CANCIÓN","Universal Music Latino / Rimas",4,65,380,"44489"
63,"spotify:track:6UelLqGlWMcVH1E5c4H7lY","Harry Styles","Watermelon Sugar","Columbia",53,58,63,"44357"
64,"spotify:track:24Yi9hE78yPEbZ4kxyoXAI","SAINt JHN, Imanbek","Roses - Imanbek Remix","Columbia/B1 Recordings",51,60,112,"44128"
65,"spotify:track:0A37XY67wSdGqkGjtfW6aV","Rauw Alejandro, Anuel AA, NATTI NATASHA, Farruko, Lunay","Fantasias - Remix","(SME US Latin) Duars Entertainment, Corp. (2)",24,66,128,"44093"
66,"spotify:track:46V4kseB66GjFGklCgynGX","Casper Magico, Anuel AA","Sola & Vacía","2020 Flow La Movie, Inc. & Los Magicos, LLC | Powered by GLAD Empire,",29,69,86,"43474"
67,"spotify:track:5IjOqh4XLyjHINuOGolmAt","Eladio Carrion, Zion & Lennox, Wisin & Yandel, Lunay","Mi Error - Remix","Rimas Entertainment LLC",27,63,237,"42926"
68,"spotify:track:5XqCz18k96K8tx6DAYM97i","Bad Bunny, Don Omar","PA' ROMPERLA","Rimas Entertainment LLC",4,72,63,"42721"
69,"spotify:track:7kOf0qHO4Rcwk6QJifZDRJ","Anuel AA","El Manual","2020 Real Hasta La Muerte, LLC",27,71,44,"42411"
70,"spotify:track:7eJMfftS33KTjuF7lTsMCx","Powfu, beabadoobee","death bed (coffee for your head)","Columbia",36,64,119,"42052"
71,"spotify:track:3PfIrDoz19wz7qK7tYeu62","Dua Lipa","Don't Start Now","Warner Records",20,70,254,"41876"
72,"spotify:track:4GGwM2Krtlx9G9ii1RaEOx","Dalex, Lenny Tavárez, Anitta, NATTI NATASHA, Farruko, Justin Quiles","Bellaquita (Remix)","Rich Music",11,74,233,"41497"
73,"spotify:track:5eEQCfq7MXQr6aHLNRUZLs","Anuel AA","Keii","2020 Real Hasta La Muerte, LLC",4,68,156,"41111"
74,"spotify:track:6C1jKbkCUgFws7M0M4oGCB","Dalex, Sech","Mejor","Rich Music",26,73,156,"41011"
75,"spotify:track:4SJHHpKhcuXwDsCsPqshXj","Rauw Alejandro, Chencho Corleone","El Efecto","Duars Entertainment, Corp.",63,76,441,"39415"
76,"spotify:track:34LI7rwi9H8w2S5KTHnv1M","Manuel Turizo","Quiéreme Mientras Se Pueda","Sony Music Latin/La Industria",71,78,72,"39047"
77,"spotify:track:2TH65lNHgvLxCKXM3apjxI","Bad Bunny, Tainy","Callaita","Rimas Entertainment LLC",1,80,408,"38746"
78,"spotify:track:5Xe78U9cUwnWOuWbgYvAKZ","Eix, Rauw Alejandro, Noriel, KEVVO, Brytiago, Jay Wheeler","Infiel - Remix","Duars Entertainment, LLC",59,75,10,"37562"
79,"spotify:track:4MWb6mltydQn84NrTm7Gpl","Micro TDH, Rels B, Lenny Tavárez, Justin Quiles","Dime Cuantas Veces (Remix) [feat. Justin Quiles]","WEA Latina",76,81,17,"37428"
80,"spotify:track:1Ol5LmdNDNpFu1oNwfgkux","Camilo, Pedro Capó","Tutu","Sony Music Latin",6,87,338,"37323"
81,"spotify:track:6zEgnpM0qYmHLDnh8WPejL","J Balvin","Amarillo","UMLE - Latino",17,82,114,"37184"
82,"spotify:track:7mcdgAXmb35dakBnfDIv3q","Anuel AA","Narcos","2020 Real Hasta La Muerte, LLC",12,79,44,"36846"
83,"spotify:track:27uAea0qcUz3a7jKnAT7KG","Santaferia","Algún Día Volverás","Santaferia",20,101,723,"36731"
84,"spotify:track:4JznxNAtycdgvzd4kv343C","Javiielo, Jay Wheeler, Nekxum","Cenicero","Oye Saavedra / EMPIRE",84,86,2,"36080"
85,"spotify:track:5cBrOhKDyiJF9bPGUHKkG0","Dalex","+Linda","Rich Music",85,88,48,"35149"
86,"spotify:track:5Id5B3dxJZhPcV9GzgYZZe","Rich Music LTD, Sech, Dalex, Justin Quiles, Lenny Tavárez, Feid, Wisin, Zion","Quizas","Rich Music",3,90,296,"35048"
87,"spotify:track:113PlnpZbHd3WIqeYjhZWv","Daddy Yankee, Sech","Definitivamente","El Cartel Records (EC3)",13,85,163,"34779"
88,"spotify:track:1V8XneTrX6kKeoxYbk4x6h","Bad Bunny, Duki, Pablo Chill-E","Hablamos Mañana","Rimas Entertainment LLC",4,89,134,"34343"
89,"spotify:track:10u2iOS0r6plfb9GknD7g4","Rauw Alejandro, Myke Towers, Sky Rompiendo","Ponte Pa' Mi","(SME US Latin) Duars Entertainment, Corp. (2)",78,93,86,"33702"
90,"spotify:track:634fDJYRCr5yzqfFWa9rfS","Paloma Mami","Goteo","Sony Music Latin",9,97,73,"33685"
91,"spotify:track:6aKV6o1hZR6J1ajKqhlxnT","Kiddtetoon, Diego Smith","Illuminati","Duetti (Migration)",91,94,14,"33634"
92,"spotify:track:466cKvZn1j45IpxDdYZqdA","Drake","Toosie Slide","OVO",54,92,100,"33466"
93,"spotify:track:0HMTIZ3iQ6QNjBaD9IE7ZZ","JHAYCO","Dime A Ve","N&E Entertainment LLC",83,83,9,"33445"
94,"spotify:track:3FhiU60cxfN2j4jRy5Y40w","Cauty, Lenny Tavarez, Jay Wheeler, Noriel, Alex Rose","Lloras - Remix","eOne Music",75,91,139,"33190"
95,"spotify:track:6nGM44ZP7vSo0istUW2MOq","Farruko, Beéle, NATTI NATASHA, Manuel Turizo","Loco - Remix","Hear This Music",64,96,79,"33183"
96,"spotify:track:35wvL50xvKpCHEJPxLOLPI","Bad Bunny","Si Estuviésemos Juntos","Rimas Entertainment LLC",7,100,565,"33026"
97,"spotify:track:52zq2a71SGs3f1vJuv59ui","Juanfran","Como Llora","DN7 Music",82,95,72,"32929"
98,"spotify:track:1pqnQ41XbfKjaFu6M0eGJp","Tainy, J Balvin","Agua (with J Balvin)","NEON16/Interscope Records",77,77,2,"32894"
99,"spotify:track:37zdqI4r1gswIzczSBkRon","Lunay, Anuel AA, Ozuna","Aventura","round2media - LaFamilia",1,98,261,"32792"
100,"spotify:track:6CBag74VuMMNaI2SUnbhvN","Moral Distraida, Denise Rosenthal, Los Vasquez","Rico Rico","Moral Distraida",84,84,2,"32542"
101,"spotify:track:4RaWbMItxVbuUExNkFsITP","Nio Garcia, Brray, Juanka","La Jeepeta","2019 Flow La Movie, Inc. | Distributed by GLAD Empire, LLC.",34,104,184,"32235"
102,"spotify:track:6K5BsR04ijf3FHNzjbaagD","Myke Towers, Farruko, Arcángel, Sech, Zion","Si Se Da - Remix","2019 Casablanca Records & One World Music | Distributed by GLAD Empire",5,105,345,"32098"
103,"spotify:track:3jjujdWJ72nww5eGnfs2E7","Harry Styles","Adore You","Columbia",85,99,143,"31323"
104,"spotify:track:2w1rq80FIrbxeJy9WYURxw","KAROL G, Anuel AA","Follow","UMLE - Latino",18,103,101,"31316"
105,"spotify:track:24IgCW19L8lXKyFZwzFtD3","Black Eyed Peas, Ozuna, J. Rey Soul","MAMACITA","Epic",93,102,86,"30847"
106,"spotify:track:4t9a07PAghtQMRAIP9FQ7Z","Lunay, Daddy Yankee, Bad Bunny","Soltera (Remix)","round2media - LaFamilia",2,110,429,"30757"
107,"spotify:track:1ndyl3wJCFs872XZ3ztPk6","Justin Quiles, NATTI NATASHA, Farruko, Lenny Tavárez, Dalex, Zion","DJ No Pare (feat. Zion, Dalex, Lenny Tavárez) - Remix","WEA Latina",19,108,310,"30730"
108,"spotify:track:4j4w4CXm6BSr0s25wAWrrX","Bad Bunny, Yaviah","Bichiyal","Rimas Entertainment LLC",9,107,134,"30632"
109,"spotify:track:4z6wo6PJG4Fve45OXK6D9m","Arcángel, Bad Bunny","Infeliz","Rimas Entertainment LLC.",17,109,205,"30454"
110,"spotify:track:017PF4Q3l4DBUiWoXk4OWT","Dua Lipa","Break My Heart","Warner Records",49,106,108,"30272"
111,"spotify:track:4bTZeO72FwMa6wKOiqoynL","Sech, Ozuna, Anuel AA, Darell, Nicky Jam","Otro Trago - Remix","Rich Music",1,113,352,"30201"
112,"spotify:track:3cUE3p7E39CzGjQoEsg7sM","Santaferia","EL Gil De Tu Ex","Santaferia",21,131,1073,"29909"
113,"spotify:track:1aUGxXCz9QimNkKeiJtzZ7","KEVVO, Farruko, Chencho Corleone, Arcángel, Darell, Ñengo Flow, Brytiago, Myke Towers","105 F Remix","Una Vision Quintana",7,115,304,"28881"
114,"spotify:track:3l6Dc2DvpzEXJxnRTX5JUd","Nio Garcia, Bryant Myers, Lenny Tavárez, Miky Woodz, Jay Wheeler","Nocturna - Remix","2020 Flow La Movie Inc. | Distributed by GLAD Empire, LLC",76,111,134,"28827"
115,"spotify:track:3Dv1eDb0MEgF93GpLXlucZ","Doja Cat","Say So","Kemosabe Records/RCA Records",59,114,157,"28505"
116,"spotify:track:5Xhqh4lwJPtMUTsdBztN1a","Shakira, Anuel AA","Me Gusta","Sony Music Latin",9,116,181,"28250"
117,"spotify:track:4NCsrTzgVfsDo8nWyP8PPc","Black Eyed Peas, J Balvin","RITMO (Bad Boys For Life)","Epic",4,119,274,"28245"
118,"spotify:track:4VgYtXCVJ7IbWAZ5ryfvEQ","Nicky Jam, Daddy Yankee","Muévelo","Sony Music Latin",8,112,186,"27751"
119,"spotify:track:2pWOMNQJW3g2zmGjP0Vkb0","Nicky Jam, Anuel AA","Whine Up","Sony Music Latin",4,121,257,"27709"
120,"spotify:track:7sKDftgGirHWTVFMtJoDoh","Aya Nakamura","Djadja","Rec. 118",93,120,98,"27090"
121,"spotify:track:5J7teKIJGtqVypgYI6sqXj","Bad Bunny, Mora","Una Vez","Rimas Entertainment LLC",15,117,134,"27065"
122,"spotify:track:53uKGbcMjEc2gIWbfmvpdS","Nio Garcia, Rauw Alejandro, Lenny Tavárez, Myke Towers, Casper Magico, Darell","Mírame - Remix","2019 Flow La Movie, Inc. | Distributed by GLAD Empire, LLC.",17,124,359,"27046"
123,"spotify:track:70zg99pT51vB4wlMS7e4q7","Myke Towers, Maluma, Farruko","La Playa - Remix","2019 Casablanca Records & One World Music | Distributed by GLAD Empire",33,123,191,"26717"
124,"spotify:track:7ju97lgwC2rKQ6wwsf9no9","Lady Gaga, Ariana Grande","Rain On Me (with Ariana Grande)","Interscope",25,118,51,"26339"
125,"spotify:track:16DNJ8y6k97DxuMyV49W7V","KHEA","Dónde Estás","Young Flex - Khea",61,128,150,"26133"
126,"spotify:track:4s45VgkknMFkdiGoUcjxQU","Sebastian Yatra, Rauw Alejandro, Manuel Turizo","TBT","UMLE - Latino",57,122,142,"26120"
127,"spotify:track:2aGN6PplBq0xigh2lmqLbw","Sech, Ozuna","Si Te Vas","Rich Music",5,129,290,"26113"
128,"spotify:track:6Bd9rs5gv25asdPDRog3ce","Javiielo","Pa Los Gustos Los Colores","Oye Saavedra / EMPIRE",40,125,272,"26075"
129,"spotify:track:3qM0vBxIe4VUbK0Z0smuVP","JHAYCO, Anuel AA, J Balvin","Medusa","N&E Entertainment LLC",24,127,158,"26072"
130,"spotify:track:7g8YaUQABMal0zWe7a2ijz","Dalex, Rafa Pabön, KHEA, Sech, Feid, Cazzu, Lenny Tavárez","Pa Mí (Remix)","Rich Music/Ingrooves Records",2,130,520,"25995"
131,"spotify:track:47ZS1OjnJpJVfGN9yHXfMn","Alex Rose, Rauw Alejandro, Lenny Tavárez, Cazzu, Lyanno","Toda (Remix)","Los Oídos Fresh",8,126,278,"25872"
132,"spotify:track:7ytR5pFWmSjzHJIeQkgog4","DaBaby, Roddy Ricch","ROCKSTAR (feat. Roddy Ricch)","South Coast Music Group/Interscope Records",125,133,25,"25391"
133,"spotify:track:6RyaV7owmVU6fzEPE17sF1","Daddy Yankee","Que Tire Pa Lante","El Cartel Records (EC3)",5,137,268,"25272"
134,"spotify:track:5YrjfKuFd0pMmYTGeRDV6X","Noriel","Piropo","Sony Music Latin/Ganda Entertainment",23,134,260,"25167"
135,"spotify:track:56f5qnyAlZdlz8wrUDA50h","Mau y Ricky, Manuel Turizo, Camilo","Desconocidos","Sony Music Latin",9,138,636,"24603"
136,"spotify:track:2w8SKQCnT2YQK1qCqKl2uW","Lenny Tavárez, Justin Quiles","La Pared 360","WEA Latina",86,132,156,"24541"
137,"spotify:track:34ZngZgo8xicbt1EE8Ob8Z","Rich Music LTD, Sech, Dalex, Justin Quiles, Lenny Tavárez, Feid","Porno","Rich Music",53,136,275,"23959"
138,"spotify:track:7fODjB7BrQTGqh0hogW6XD","Sech, Justin Quiles, Maluma, Nicky Jam, Farruko, Dalex, Lenny Tavárez","Que Mas Pues - Remix","Rich Music/Ingrooves Records",7,135,458,"23895"
139,"spotify:track:2CoMYp2uIKsT09nreEZnZn","Bad Bunny","BENDICIONES","Rimas Entertainment LLC",7,139,63,"23485"
140,"spotify:track:25ZAibhr3bdlMCLmubZDVt","J Balvin, Bad Bunny","QUE PRETENDES","Universal Music Latino / Rimas",5,145,380,"23374"
141,"spotify:track:3dJWIbkKEnI0Jb9CK6kdcg","JHAYCO, Wisin & Yandel","Imaginaste - Remix","N&E Entertainment LLC",26,142,254,"23372"
142,"spotify:track:2B94bbI1a4LyBpK1439oP7","Noriel, Myke Towers, Rauw Alejandro, Almighty","Cuerpo en Venta","Rimas Entertainment LLC",11,141,338,"23327"
143,"spotify:track:5kQre7o8ky5DXeEPcyaCR1","Prince Royce, Myke Towers","Carita de Inocente (feat. Myke Towers) - Remix","Sony Music Latin",132,140,22,"23307"
144,"spotify:track:6Xfz4YNwwIcFRyfW3QQZVp","Ceaese, Utopiko, Polimá Westcoast, Young Cister","Te Quiero Ver (feat. Polimá Westcoast y Young Cister)","WM Chile",31,152,567,"23246"
145,"spotify:track:5iwz1NiezX7WWjnCgY5TH4","Pedro Capó, Farruko","Calma - Remix","Sony Music Latin",1,166,643,"23086"
146,"spotify:track:059bcIhyc2SBwm6sw2AZzd","Piso 21, Micro TDH","Te Vi","WM Mexico",17,153,570,"23022"
147,"spotify:track:1A9PKAFEHMWgXNLpgf7k4J","Myke Towers","Piensan","2020 One World Music & Casablanca Records | Powered by GLAD Empire, LL",14,143,303,"22779"
148,"spotify:track:2qG5sZ7Si6sdK74qLxedYM","ROSALÍA, J Balvin, El Guincho","Con Altura","Columbia",12,159,471,"22711"
149,"spotify:track:2hDe0Ls5mVqs1XJqv7sbcM","Anuel AA, Enrique Iglesias","Fútbol & Rumba (feat. Enrique Iglesias)","2020 Real Hasta La Muerte, LLC",15,146,44,"22709"
150,"spotify:track:6G4U9avyBNEfP0fAIduev3","Aventura, Don Omar","Ella Y Yo - Featuring Don Omar","Premium Latin Music",131,165,354,"22540"
151,"spotify:track:1JSTJqkT5qHq8MDJnJbRE1","The Police","Every Breath You Take","Polydor Records",138,162,244,"22509"
152,"spotify:track:7f5SeKPwJm4eM4GcngH2SX","Juanka","Cárcel","N&E Entertainment LLC",119,155,37,"22409"
153,"spotify:track:6NfC2FKfsfzuLIF4lThw0A","Anuel AA, Bad Bunny","Así Soy Yo","2020 Real Hasta La Muerte, LLC",5,147,44,"22256"
154,"spotify:track:4lzxJ4jCuFDXXGkE1LmpKR","DJ Luian, Mambo Kingz, Anuel AA, Nicky Jam, Darell, Brytiago","Verte Ir","Hear This Music",1,157,472,"22252"
155,"spotify:track:2dy3TKVDEbIeWxeIb8JWqZ","NATTI NATASHA, Romeo Santos","La Mejor Versión de Mi - Remix","Pina Records",86,149,281,"22196"
156,"spotify:track:5jW3rF4URMdK7tO2xjS5EI","Paulo Londra","Tal Vez","WEA Latina",5,160,464,"22068"
157,"spotify:track:1OW47kPsWJfvhcQ7V7XwhC","Myke Towers, Yandel","Mayor","2020 White World Music | Powered by GLAD Empire, LLC",110,154,30,"21929"
158,"spotify:track:3DyiAk1BzIF8rq9rimypG4","Anuel AA, Cardi B, Black Jonas Point, Secreto ""El Famoso Biberon"", Liro Shaq","La Bebe - Remix","2020 GLAD Empire, LLC & Flow La Movie, Inc.",115,151,40,"21905"
159,"spotify:track:4u7EnebtmKWzUH433cf5Qv","Queen","Bohemian Rhapsody - Remastered 2011","EMI",26,169,716,"21831"
160,"spotify:track:50ITehqoAuygfVlmG6FxO8","Harry Nach","Fixona","Only Perk",92,144,9,"21763"
161,"spotify:track:7KbF6AdprOXEEHlsq11Z6d","Maluma","11 PM","Sony Music Latin",20,168,402,"21748"
162,"spotify:track:6ifUES3keWjwXgae8pXI3o","Danny Ocean","Me Rehúso","Atlantic Records",1,170,1207,"21677"
163,"spotify:track:3SDvcxPcU7BlV1dAne4dWM","Play-N-Skillz, Daddy Yankee, Zion & Lennox","Bésame","Sony Music Latin/Latium Records",95,150,23,"21647"
164,"spotify:track:5NOHsDSfLIH45y3i9PfRyh","Casper Magico, Bryant Myers, Alex Rose, Juhn","Fantasmita - Remix","2019 Flow La Movie, Inc & Los Magicos",55,148,219,"21638"
165,"spotify:track:4VohsQwrtb7lj1yO0dFKJa","Tommy Boysen","Hookah & Sheridan's","Equity Distribution",12,174,662,"21559"
166,"spotify:track:0RDgqtvOHLwcI6yz9bjsZV","Rich Music LTD, Sech, Dalex, Justin Quiles, Lenny Tavárez, Feid","Perreo en La Luna","Rich Music",22,167,275,"21487"
167,"spotify:track:75pQqzwgCjUOSSy5CpmAjy","Bad Bunny","Pero Ya No","Rimas Entertainment LLC",6,156,134,"21449"
168,"spotify:track:6v3KW9xbzN5yKLt9YKDYA2","Shawn Mendes, Camila Cabello","Señorita","Island Records",11,158,387,"21448"
169,"spotify:track:3eJMSq78dDaFb7VvhNFnq6","Maluma","ADMV","Sony Music Latin",127,172,54,"21444"
170,"spotify:track:2vrpcQNg6itmgVZWsNjWe0","Sebastian Yatra, Reik","Un Año","UMLE - Latino",9,164,541,"21199"
171,"spotify:track:7q3NthaBqFI6s0WnAlnIvq","Darell, Brytiago","Velitas","Sony Music Latin",36,186,366,"21106"
172,"spotify:track:4cno0k9jDEFpLAQyHNjqVx","Anitta, Arcángel, De La Ghetto","Tócame (feat. Arcangel & De La Ghetto)","Warner Records",172,181,2,"21082"
173,"spotify:track:7MmrcXVA7A5zZ2CbDuGHNa","Rels B","A Mí","DALE PLAY Records / Flakk Team",173,177,6,"21021"
174,"spotify:track:7BlBVFwvbWvcwNcUarQmjk","ROSALÍA, Ozuna","Yo x Ti, Tu x Mi","Columbia",9,185,298,"20994"
175,"spotify:track:2btKz4s1XrMn5VHe7xZJpi","NATTI NATASHA","Que Mal Te Fue","Pina Records",135,176,37,"20881"
176,"spotify:track:1cVlW9WQiGlFdWUXFdFZGh","Piso 21, Christian Nodal","Pa' Olvidarme De Ella","WM Mexico",153,179,36,"20652"
177,"spotify:track:7BEPdOI0neT6p7PnLViqmH","Morat, Sebastian Yatra","Bajo La Mesa","Universal Music Spain S.L.",39,163,51,"20608"
178,"spotify:track:5p3JJehpKHjr9pJT5eD2Lz","Anuel AA, Farruko, Zion","Que Se Joda","2020 Real Hasta La Muerte, LLC",10,175,44,"20585"
179,"spotify:track:1Ej96GIBCTvgH7tNX1r3qr","Sech, Darell","Otro Trago","Rich Music/Ingrooves Records",1,190,441,"20484"
180,"spotify:track:5w9c2J52mkdntKOmRLeM2m","Daddy Yankee, Snow","Con Calma","El Cartel Records (EC3)",1,195,501,"20402"
181,"spotify:track:5vdp5UmvTsnMEMESIF2Ym7","Queen","Another One Bites The Dust - Remastered 2011","EMI",42,196,386,"20244"
182,"spotify:track:1xQ6trAsedVPCdbtDAmk0c","Jawsh 685, Jason Derulo","Savage Love (Laxed - Siren Beat)","Columbia",161,171,13,"20177"
183,"spotify:track:152U4ecGSiYeKm2gnFc4wA","Villa Cariño","Serenata cruel","Clandestino Records",44,-1,1078,"20146"
184,"spotify:track:62aP9fBQKYKxi7PDXwcUAS","Surf Mesa, Emilee","ily (i love you baby) (feat. Emilee)","Astralwerks",147,183,53,"20037"
185,"spotify:track:132ALUzVLmqYB4UsBj5qD6","Paulo Londra","Adan y Eva","WEA Latina",1,194,611,"20008"
186,"spotify:track:0VKkyBKCXyR99navhVRqcP","Zion & Lennox","La player (Bandolera)","WEA Latina",1,-1,755,"19948"
187,"spotify:track:1LiN0Z98FkR1t0m8KmLcAH","Anuel AA, Haze","Amanece","House of Haze",2,197,573,"19946"
188,"spotify:track:4DpNNXFMMxQEKl7r0ykkWA","Melanie Martinez","Play Date","Atlantic Records",119,173,62,"19915"
189,"spotify:track:69Ej1xrGjOcHvIMtMKxK0G","Don Omar","Dile","UMLE - Machete",189,-1,3,"19915"
190,"spotify:track:53v2u51nq3CxiKUNphRzP1","Bad Bunny, Ñengo Flow","Que Malo","Rimas Entertainment LLC",11,182,134,"19826"
191,"spotify:track:59s0s39NFWScuHDbHytI14","Reik, J Balvin, Lalo Ebratt","Indeciso","Indeciso",29,192,310,"19777"
192,"spotify:track:7szuecWAPwGoV1e5vGu8tl","The Weeknd","In Your Eyes","Republic Records",111,187,107,"19751"
193,"spotify:track:7anSoGdgtmJTAPZBzcPhO6","Dalex, Nicky Jam, Justin Quiles, Sech, Lenny Tavárez, Feid, Rafa Pabön","Cuaderno","Rich Music/Ingrooves Records",5,189,427,"19619"
194,"spotify:track:7qEHsqek33rTcFNT9PFqLf","Lewis Capaldi","Someone You Loved","Vertigo Berlin",141,180,54,"19601"
195,"spotify:track:7MRU4vOkywuhZ9kbFiPuiu","Daddy Yankee, Wisin & Yandel","Si Supieras","El Cartel Records (EC3)",6,193,372,"19536"
196,"spotify:track:7MCFjPDImfjQv7GynHgVrR","Nicki Nicole","Colocao","Sony Music Latin/DALE PLAY Records",136,184,47,"19505"
197,"spotify:track:65DBZofI0b79kfHTcWWDuU","Soda Stereo","Trátame Suavemente - Remasterizado 2007","Columbia",134,-1,272,"19502"
198,"spotify:track:4o1DxRjMCHDwBiOKv88rOl","Rvssian, Darell, Zion & Lennox, Myke Towers","B11 (feat. Myke Towers)","Sony Music Latin",14,199,297,"19470"
