rank,uri,artist_names,track_name,source,peak_rank,previous_rank,days_on_chart,streams
1,"spotify:track:3wYRLYuO1M88d8woWUIxct","Bad Bunny, Sech","Ignorantes","Rimas Entertainment LLC",1,2,10,"301107"
2,"spotify:track:7k4t7uLgtOxPwTpFmtJNTY","KAROL G, Nicki Minaj","Tusa","TUSA - Karol G & Nicki Minaj",1,1,108,"298434"
3,"spotify:track:7sQKy5vlPQllr0k9IjYJv3","Arcángel, Sech, Dímelo Flow","Sigues Con El","Rimas Entertainment LLC.",2,3,73,"249690"
4,"spotify:track:43NqTeL8pgBxKHPMiJKUP5","Myke Towers","Girl","2020 One World Music & Casablanca Records | Powered by GLAD Empire, LL",4,5,31,"223865"
5,"spotify:track:5stPVcRqb4qixbafP9e8lt","Dalex, Lenny Tavárez, Chencho Corleone, Juhn, Dímelo Flow","Hola - Remix","Rich Music",2,4,115,"220249"
6,"spotify:track:5eEQCfq7MXQr6aHLNRUZLs","Anuel AA","Keii","2020 Real Hasta La Muerte, LLC",4,6,17,"210686"
7,"spotify:track:5DxXgozhkPLgrbKFY91w0c","Bad Bunny","Vete","Rimas Entertainment LLC",1,8,95,"174344"
8,"spotify:track:1rgnBhdG2JDFTbYkYRZAku","Tones And I","Dance Monkey","Elektra (NEK)",4,7,139,"173727"
9,"spotify:track:3JHpk0DOTOzyh0777JFAky","Myke Towers","Diosa","2020 One World Music & Casablanca Records | Powered by GLAD Empire, LL",9,10,31,"162674"
10,"spotify:track:4VgYtXCVJ7IbWAZ5ryfvEQ","Nicky Jam, Daddy Yankee","Muévelo","Sony Music Latin",8,9,47,"155566"
11,"spotify:track:6mAN61JH0dzyZpWslS11jy","Rauw Alejandro, Farruko","Fantasias","(SME US Latin) Duars Entertainment, Corp. (2)",1,11,178,"149979"
12,"spotify:track:2pWOMNQJW3g2zmGjP0Vkb0","Nicky Jam, Anuel AA","Whine Up","Sony Music Latin",4,12,118,"140427"
13,"spotify:track:37zdqI4r1gswIzczSBkRon","Lunay, Anuel AA, Ozuna","Aventura","round2media - LaFamilia",1,13,122,"133000"
14,"spotify:track:1Xnn1TPyr5h0hpRAT4B4EA","Dalex, Lenny Tavárez, Anitta, NATTI NATASHA, Farruko, Justin Quiles","Bellaquita - Remix","Rich Music",11,14,94,"129192"
15,"spotify:track:5Xhqh4lwJPtMUTsdBztN1a","Shakira, Anuel AA","Me Gusta","Sony Music Latin",9,15,42,"124738"
16,"spotify:track:113PlnpZbHd3WIqeYjhZWv","Daddy Yankee, Sech","Definitivamente","El Cartel Records (EC3)",15,16,24,"124391"
17,"spotify:track:3mQ6SLdxxaL52Yte7KF2Ks","J Balvin","Morado","UMLE - Latino",16,17,45,"122413"
18,"spotify:track:3jbT1Y5MoPwEIpZndDDwVq","Tainy, Anuel AA, Ozuna","Adicto (with Anuel AA & Ozuna)","NEON16/Interscope Records",1,18,186,"119495"
19,"spotify:track:2ksOAxtIxY8yElEWw8RhgK","Anuel AA, Daddy Yankee, KAROL G, J Balvin, Ozuna","China","2019 Real Hasta La Muerte, LLC.",1,19,220,"114567"
20,"spotify:track:5m3jpKkgkfoMcym1qjToFg","Alex Rose, Rafa Pabön","Jangueo","Los Oidos Fresh/ Los Proximos",20,21,92,"113053"
21,"spotify:track:6cy3ki60hLwimwIje7tALf","Black Eyed Peas, J Balvin","RITMO (Bad Boys For Life)","Epic/We The Best",4,20,135,"110909"
22,"spotify:track:5Id5B3dxJZhPcV9GzgYZZe","Rich Music LTD, Sech, Dalex, Justin Quiles, Lenny Tavárez, Feid, Wisin, Zion","Quizas","Rich Music",3,22,157,"99682"
23,"spotify:track:4R8BJggjosTswLxtkw8V7P","JHAYCO, J Balvin, Bad Bunny","No Me Conoce - Remix","N&E Entertainment LLC",2,23,283,"97983"
24,"spotify:track:0fea68AdmYNygeTGI4RC18","J Balvin, Bad Bunny","LA CANCIÓN","Universal Music Latino / Rimas",4,24,241,"95542"
25,"spotify:track:2TH65lNHgvLxCKXM3apjxI","Bad Bunny, Tainy","Callaita","Rimas Entertainment LLC",1,26,269,"94379"
26,"spotify:track:6RyaV7owmVU6fzEPE17sF1","Daddy Yankee","Que Tire Pa Lante","El Cartel Records (EC3)",5,25,129,"93745"
27,"spotify:track:4z6wo6PJG4Fve45OXK6D9m","Arcángel, Bad Bunny","Infeliz","Rimas Entertainment LLC.",17,27,66,"91551"
28,"spotify:track:5YrjfKuFd0pMmYTGeRDV6X","Noriel","Piropo","Sony Music Latin/Ganda Entertainment",23,29,121,"90400"
29,"spotify:track:3qM0vBxIe4VUbK0Z0smuVP","JHAYCO, Anuel AA, J Balvin","Medusa","N&E Entertainment LLC",24,28,19,"90396"
30,"spotify:track:7na7Bk98usp84FaOJFPv3d","Rauw Alejandro","Tattoo","(SME US Latin) Duars Entertainment, Corp. (2)",30,33,10,"86380"
31,"spotify:track:1A9PKAFEHMWgXNLpgf7k4J","Myke Towers","Piensan","2020 One World Music & Casablanca Records | Powered by GLAD Empire, LL",14,30,164,"85665"
32,"spotify:track:1aUGxXCz9QimNkKeiJtzZ7","KEVVO, Farruko, Chencho Corleone, Arcángel, Darell, Ñengo Flow, Brytiago, Myke Towers","105 F Remix","Una Vision Quintana",7,32,165,"85463"
33,"spotify:track:6WrI0LAC5M1Rw2MnX2ZvEg","Dua Lipa","Don't Start Now","Warner Records",27,31,115,"85052"
34,"spotify:track:1mF6sMUsRU9MisrdB9qWvg","Dalex, Sech","Mejor","Rich Music",32,34,17,"82144"
35,"spotify:track:6K5BsR04ijf3FHNzjbaagD","Myke Towers, Farruko, Arcángel, Sech, Zion","Si Se Da - Remix","2019 Casablanca Records & One World Music | Distributed by GLAD Empire",5,35,206,"81914"
36,"spotify:track:6Y4PDQv4XjYjHLeLmvyOt0","Sech, Ozuna","Si Te Vas","Rich Music",5,37,151,"80233"
37,"spotify:track:1ndyl3wJCFs872XZ3ztPk6","Justin Quiles, NATTI NATASHA, Farruko, Lenny Tavárez, Dalex, Zion","DJ No Pare (feat. Zion, Dalex, Lenny Tavárez) - Remix","WEA Latina",19,36,171,"80005"
38,"spotify:track:0RDgqtvOHLwcI6yz9bjsZV","Rich Music LTD, Sech, Dalex, Justin Quiles, Lenny Tavárez, Feid","Perreo en La Luna","Rich Music",22,38,136,"79397"
39,"spotify:track:5IjOqh4XLyjHINuOGolmAt","Eladio Carrion, Zion & Lennox, Wisin & Yandel, Lunay","Mi Error - Remix","Rimas Entertainment LLC",27,39,98,"75799"
40,"spotify:track:6EWWkqE4aFlZRyoFwwOT8u","Javiielo","Pa Los Gustos Los Colores","Oye Saavedra / EMPIRE",40,42,133,"75107"
41,"spotify:track:4RaWbMItxVbuUExNkFsITP","Nio Garcia, Brray, Juanka","La Jeepeta","2019 Flow La Movie, Inc. | Distributed by GLAD Empire, LLC.",41,41,45,"74001"
42,"spotify:track:2B94bbI1a4LyBpK1439oP7","Noriel, Myke Towers, Rauw Alejandro, Almighty","Cuerpo en Venta","Rimas Entertainment LLC",11,43,199,"72129"
43,"spotify:track:4o1DxRjMCHDwBiOKv88rOl","Rvssian, Darell, Zion & Lennox, Myke Towers","B11 (feat. Myke Towers)","Sony Music Latin",14,44,158,"71735"
44,"spotify:track:684EjRHwNsZQ9hCQxL4NYL","Dímelo Flow, Nicky Jam, Sech, Farruko, Zion, Lunay","El Favor (with Nicky Jam & Sech, feat. Farruko, Zion & Lunay)","Rich Music/Interscope Records",6,40,178,"71384"
45,"spotify:track:1nocRtwyNPVtGcIJqfgdzZ","Camilo, Pedro Capó","Tutu","Sony Music Latin",6,47,199,"71000"
46,"spotify:track:70zg99pT51vB4wlMS7e4q7","Myke Towers, Maluma, Farruko","La Playa - Remix","2019 Casablanca Records & One World Music | Distributed by GLAD Empire",33,45,52,"69164"
47,"spotify:track:4bTZeO72FwMa6wKOiqoynL","Sech, Ozuna, Anuel AA, Darell, Nicky Jam","Otro Trago - Remix","Rich Music",1,46,213,"68789"
48,"spotify:track:7FbKipScVxkjQxQXwTd0gL","El Alfa, Lil Pump","Coronao Now","EL JEFE RECORDS LLC",21,48,109,"66672"
49,"spotify:track:047WmwIeerHyIUstFAEz5A","El Alfa, Lil Pump, Sech, Myke Towers, Vin Diesel","Coronao Now - Remix","EL JEFE RECORDS LLC",47,50,11,"62373"
50,"spotify:track:40rXWke6SnXiGkSmaT8ZUr","Ozuna","Fantasía","Aura Music Corp.",26,49,87,"60236"
51,"spotify:track:0sf12qNH5qcw8qpgymFOqD","The Weeknd","Blinding Lights","Republic Records",51,52,58,"59578"
52,"spotify:track:5BAKerbfUwW5KboNuIPMmn","joel music, Puch Flow","Mueve Lo Que Dios Te Dio","Lody Produccion",52,53,56,"59387"
53,"spotify:track:16wAOAZ2OkqoIDN7TpChjR","Justin Bieber","Yummy","RBMG/Def Jam",35,51,52,"55901"
54,"spotify:track:53uKGbcMjEc2gIWbfmvpdS","Nio Garcia, Rauw Alejandro, Lenny Tavárez, Myke Towers, Casper Magico, Darell","Mírame - Remix","2019 Flow La Movie, Inc. | Distributed by GLAD Empire, LLC.",17,55,220,"54833"
55,"spotify:track:4t9a07PAghtQMRAIP9FQ7Z","Lunay, Daddy Yankee, Bad Bunny","Soltera (Remix)","round2media - LaFamilia",2,54,290,"54156"
56,"spotify:track:3dJWIbkKEnI0Jb9CK6kdcg","JHAYCO, Wisin & Yandel","Imaginaste - Remix","N&E Entertainment LLC",26,56,115,"52798"
57,"spotify:track:27uAea0qcUz3a7jKnAT7KG","Santaferia","Algún Día Volverás","Santaferia",20,59,584,"51995"
58,"spotify:track:2oZBb87Jgwrg3qYhwsy3BN","Myke Towers","Parcerita","2020 One World Music & Casablanca Records | Powered by GLAD Empire, LL",54,58,31,"51261"
59,"spotify:track:74j34STf8L6uADnTN69ohv","Rauw Alejandro, Chencho Corleone, KEVVO, Bryant Myers, Lyanno, Dalex","El Efecto - Remix","(SME US Latin) Duars Entertainment, Corp. (2)",52,57,73,"50179"
60,"spotify:track:3cUE3p7E39CzGjQoEsg7sM","Santaferia","EL Gil De Tu Ex","Santaferia",21,63,934,"49158"
61,"spotify:track:5NOHsDSfLIH45y3i9PfRyh","Casper Magico, Bryant Myers, Alex Rose, Juhn","Fantasmita - Remix","2019 Flow La Movie, Inc & Los Magicos",55,60,80,"49116"
62,"spotify:track:4fj7e6Tc48Bmomwyz2Z2XC","Manuel Turizo, Anuel AA","Te Quemaste","Sony Music Latin/La Industria",18,62,185,"48013"
63,"spotify:track:64IRsSyqwD0CBbFAfrR0rT","Paloma Mami","Mami","Sony Music Latin",17,64,76,"47355"
64,"spotify:track:7MRU4vOkywuhZ9kbFiPuiu","Daddy Yankee, Wisin & Yandel","Si Supieras","El Cartel Records (EC3)",6,61,241,"46939"
65,"spotify:track:25ZAibhr3bdlMCLmubZDVt","J Balvin, Bad Bunny","QUE PRETENDES","Universal Music Latino / Rimas",5,65,241,"45790"
66,"spotify:track:099tjv6oy2opbpCOA3nBwX","Ir Sais, Rauw Alejandro","Dream Girl - Remix","Sony Music Latin",66,70,49,"45380"
67,"spotify:track:6t94PGXYAuo9GbJEnMpPcW","Super Yei, Sammy Baby, Myke Towers, Lenny Tavárez, Rafa Pabön","La Forma en Que Me Miras","2018 Superiority",58,68,560,"45142"
68,"spotify:track:7fODjB7BrQTGqh0hogW6XD","Sech, Justin Quiles, Maluma, Nicky Jam, Farruko, Dalex, Lenny Tavárez","Que Mas Pues - Remix","Rich Music/Ingrooves Records",7,69,319,"43917"
69,"spotify:track:1KdwnsWOvhM53vezy5ROuf","C. Tangana, Paloma Mami","No Te Debí Besar","Sony Music Entertainment",4,71,165,"43802"
70,"spotify:track:4s45VgkknMFkdiGoUcjxQU","Sebastian Yatra, Rauw Alejandro, Manuel Turizo","TBT","UMLE - Latino",65,66,3,"43750"
71,"spotify:track:6v3KW9xbzN5yKLt9YKDYA2","Shawn Mendes, Camila Cabello","Señorita","Island Records",11,73,248,"42969"
72,"spotify:track:1G2CAJeP7rCwOZjlSJ0Zw3","Major Lazer, J Balvin, El Alfa, Diplo","Que Calor","Mad Decent",42,72,164,"42717"
73,"spotify:track:7g8YaUQABMal0zWe7a2ijz","Dalex, Rafa Pabön, KHEA, Sech, Feid, Cazzu, Lenny Tavárez","Pa Mí (Remix)","Rich Music/Ingrooves Records",2,74,381,"42260"
74,"spotify:track:34ZngZgo8xicbt1EE8Ob8Z","Rich Music LTD, Sech, Dalex, Justin Quiles, Lenny Tavárez, Feid","Porno","Rich Music",53,82,136,"42076"
75,"spotify:track:2qG5sZ7Si6sdK74qLxedYM","ROSALÍA, J Balvin, El Guincho","Con Altura","Columbia",12,75,333,"41698"
76,"spotify:track:1ueLYdeuGMAwUiaezLDObD","Cami, WOS","Funeral","Universal Music Chile",50,67,5,"41422"
77,"spotify:track:6U3AilMn51njMyILgOlBQl","Adan La Amenaza, Yordano El Menor, Yohancito, Anonimus King, Carlitos Junior, Forest, BlackRoy","Dele Cotele - Remix","Adan La Amenaza | Eyey Networks",54,84,143,"41213"
78,"spotify:track:5iwz1NiezX7WWjnCgY5TH4","Pedro Capó, Farruko","Calma - Remix","Sony Music Latin",1,86,504,"41203"
79,"spotify:track:7anSoGdgtmJTAPZBzcPhO6","Dalex, Nicky Jam, Justin Quiles, Sech, Lenny Tavárez, Feid, Rafa Pabön","Cuaderno","Rich Music/Ingrooves Records",5,77,290,"40876"
80,"spotify:track:09tYvFOFp1pKxZ8GJVlOXm","JHAYCO","Como Se Siente","N&E Entertainment LLC",69,76,25,"40847"
81,"spotify:track:2rc7BkzO8qepMFAxHtOrXc","J Balvin","Blanco","UMLE - Latino",54,78,101,"40191"
82,"spotify:track:59s0s39NFWScuHDbHytI14","Reik, J Balvin, Lalo Ebratt","Indeciso","Indeciso",29,81,185,"39546"
83,"spotify:track:0wMs7DPFOnToNAoecvAFQc","Rich Music LTD, Sech, Dalex, Justin Quiles, Lenny Tavárez, Feid, De La Ghetto, Zion & Lennox","Uniforme","Rich Music",23,85,136,"39481"
84,"spotify:track:4lzxJ4jCuFDXXGkE1LmpKR","DJ Luian, Mambo Kingz, Anuel AA, Nicky Jam, Darell, Brytiago","Verte Ir","Hear This Music",1,80,333,"39476"
85,"spotify:track:0mcBgVRVsvESTkEyVHt7Ue","Darell","No Vuelvas Más","Sony Music Latin",73,83,79,"38903"
86,"spotify:track:7q3NthaBqFI6s0WnAlnIvq","Darell, Brytiago","Velitas","Sony Music Latin",36,91,227,"38631"
87,"spotify:track:0OoqRZXnSrgIUAha3iLKG1","Lunay, Myke Towers","La Cama","round2media - LaFamilia",19,87,132,"38600"
88,"spotify:track:0nbXyq5TXYPCO7pr3N8S4I","Roddy Ricch","The Box","Atlantic Records",70,90,41,"38533"
89,"spotify:track:7BlBVFwvbWvcwNcUarQmjk","ROSALÍA, Ozuna","Yo x Ti, Tu x Mi","Columbia",9,88,193,"38391"
90,"spotify:track:6768f4xbHQBpJo5lvFVNvs","Myke Towers","La Playa","2020 One World Music & Casablanca Records | Powered by GLAD Empire, LL",32,94,320,"37869"
91,"spotify:track:3D4s7bVcwLr9xA8U0DriRr","Denise Rosenthal","Tiene Sabor","Universal Music Chile",57,79,4,"37536"
92,"spotify:track:1LiN0Z98FkR1t0m8KmLcAH","Anuel AA, Haze","Amanece","House of Haze",2,93,437,"36441"
93,"spotify:track:2w8SKQCnT2YQK1qCqKl2uW","Lenny Tavárez, Justin Quiles","La Pared 360","WEA Latina",86,95,17,"36276"
94,"spotify:track:2Fxmhks0bxGSBdJ92vM42m","Billie Eilish","bad guy","Darkroom/Interscope Records",31,99,331,"36276"
95,"spotify:track:3QfD4bxxkopZL7XZ8RaezH","Tommy Boysen","Hookah & Sheridan's","Equity Distribution",12,92,523,"36223"
96,"spotify:track:7xX3wvvcZvxGCa06KlgTCp","Myke Towers","Tú","2020 One World Music & Casablanca Records | Powered by GLAD Empire, LL",90,104,31,"36103"
97,"spotify:track:2QyuXBcV1LJ2rq01KhreMF","BTS","ON","BIGHIT MUSIC",75,89,3,"35994"
98,"spotify:track:374Yj1kOLjGLYLOydbCO3i","Lasso, Cami","Odio Que No Te Odio","Universal Music Mexico",19,100,38,"35921"
99,"spotify:track:5w9c2J52mkdntKOmRLeM2m","Daddy Yankee, Snow","Con Calma","El Cartel Records (EC3)",1,96,396,"35284"
100,"spotify:track:5RClLxkUvnMWFUQ3VAQEHj","Myke Towers","Relación Rota","2020 One World Music & Casablanca Records | Powered by GLAD Empire, LL",69,103,31,"35134"
101,"spotify:track:56f5qnyAlZdlz8wrUDA50h","Mau y Ricky, Manuel Turizo, Camilo","Desconocidos","Sony Music Latin",9,97,497,"34897"
102,"spotify:track:1tpbAGsGpZee5jDHMcLrUJ","Dalex, Lenny Tavárez","Bellaquita","Rich Music",17,105,171,"34438"
103,"spotify:track:6Xfz4YNwwIcFRyfW3QQZVp","Ceaese, Utopiko, Polimá Westcoast, Young Cister","Te Quiero Ver (feat. Polimá Westcoast y Young Cister)","WM Chile",31,108,428,"33681"
104,"spotify:track:5widvMUA2hiilH1RpOl5aM","Duki, RONNY J, Pablo Chill-E, Capo Plaza, C.R.O, Asan","Goteo - Remix","SSJ Records / DALE PLAY Records",53,106,31,"33603"
105,"spotify:track:7KbF6AdprOXEEHlsq11Z6d","Maluma","11 PM","Sony Music Latin",20,101,283,"33020"
106,"spotify:track:1Ej96GIBCTvgH7tNX1r3qr","Sech, Darell","Otro Trago","Rich Music/Ingrooves Records",1,107,311,"32788"
107,"spotify:track:56Ta1O7Jxxpjnc6cWdDKUo","Reik, Farruko, Camilo","Si Me Dices Que Sí","Sony Music México",91,102,4,"31922"
108,"spotify:track:16DNJ8y6k97DxuMyV49W7V","KHEA","Dónde Estás","Young Flex - Khea",108,121,11,"31526"
109,"spotify:track:132ALUzVLmqYB4UsBj5qD6","Paulo Londra","Adan y Eva","WEA Latina",1,110,476,"31401"
110,"spotify:track:203uubEQA07to1kbro35qQ","NATTI NATASHA, Nicky Jam, Manuel Turizo, Myke Towers, DJ Luian, Mambo Kingz","Despacio","Pina Records",83,98,6,"31270"
111,"spotify:track:4TnjEaWOeW0eKTKIEvJyCa","Trevor Daniel","Falling","Alamo",94,119,69,"31115"
112,"spotify:track:2b8fOow8UzyDFAE27YhOZM","Maroon 5","Memories","Interscope Records*",101,117,95,"30879"
113,"spotify:track:26Qhn2T88XqVinXQpmSarj","Nicky Jam, Sech","Atrévete","Sony Music Latin",19,109,206,"30775"
114,"spotify:track:0LHejotBx99f8kN7UQP2o4","Harry Nach, Young Kieff","Norty","Only Perk",114,123,69,"30725"
115,"spotify:track:1NmQc6rwLv7g0UHL1AFOa9","JHAYCO, Ozuna","Easy - Remix","N&E Entertainment LLC",57,113,96,"30675"
116,"spotify:track:29ShXDWDedEwZkYc8Du08N","Rich Music LTD, Sech, Dalex, Justin Quiles, Lenny Tavárez, Feid, Cazzu","Imaginate","Rich Music",54,124,135,"30637"
117,"spotify:track:4Clmg1g8n2yBYG13Z1oSdG","Dayvi, Victor Cardenas, Kelly Ruíz","Baila Conmigo (feat. Kelly Ruiz)","Sony Music México",17,114,255,"30618"
118,"spotify:track:3YntiCUU0Xqq0B68FM3YAt","Myke Towers","Rutina","2019 Casablanca Records & One World Music | Distributed by GLAD Empire",70,111,71,"30473"
119,"spotify:track:0aCTSZQTlmnjQucALTF00s","Harry Nach","Tak Tiki Tak","Sony Music Entertainment Chile S.A",118,127,33,"30306"
120,"spotify:track:3ZCTVFBt2Brf31RLEnCkWJ","Billie Eilish","everything i wanted","Darkroom/Interscope Records",63,122,101,"30112"
121,"spotify:track:63Z1ToWxe9UJA82d9qF5lo","Simon la Letra, Pablo Chill-E","Es Poco","GGF",94,116,85,"29839"
122,"spotify:track:4PJ3umtW1aWdfh5EITHc6T","Nicky Jam, Ozuna","Te Robaré","Sony Music Latin",4,112,339,"29700"
123,"spotify:track:2Y1EBfErprYwOlgluV9neb","Feid, Manuel Turizo","BORRAXXA","JP Entertainment (Jorge Pino)",115,115,9,"29406"
124,"spotify:track:0GmiGIxXDNrePrHBpijYDp","Yannc, Darkiel, Eladio Carrion, Brray, Myke Towers","Sigue Bailandome","Full Harmony",4,118,489,"29277"
125,"spotify:track:1GBLO0NFODuL31A5fgw0uR","Maluma, Ricky Martin","No Se Me Quita (feat. Ricky Martin)","Sony Music Latin",74,154,175,"28900"
126,"spotify:track:2vrpcQNg6itmgVZWsNjWe0","Sebastian Yatra, Reik","Un Año","UMLE - Latino",9,120,402,"28864"
127,"spotify:track:6ehhkBXzCrzBJ6YCL9tIdd","Pablo Chill-E, 0-600","Jugo y Plata","ShishiGang Récords",95,128,24,"28473"
128,"spotify:track:152U4ecGSiYeKm2gnFc4wA","Villa Cariño","Serenata cruel","Clandestino Records",44,129,1064,"28462"
129,"spotify:track:6OPl2rRpNsW1BZmtrSxP6X","Ceaese, Utopiko, DrefQuila, THAT","Damelo (feat. DrefQuila y THAT)","WM Chile",31,133,408,"28461"
130,"spotify:track:35wvL50xvKpCHEJPxLOLPI","Bad Bunny","Si Estuviésemos Juntos","Rimas Entertainment LLC",7,138,426,"28427"
131,"spotify:track:6fIVDVyzymH4OAlNhJ93k3","Jerry Di, Zion & Lennox, Lyanno, Noriel, Luis Alberto Ambrosio Cuque, Pablo C Fuentes, Wilmo Belisario","Verano En París - Remix","Nacho",109,135,114,"28168"
132,"spotify:track:696DnlkuDOXcMAnKlTgXXK","Arizona Zervas","ROXANNE","Arizona Zervas",92,142,90,"27896"
133,"spotify:track:6g0R4XJbkoNpQ9iMLI2t1T","El Futuro Fuera De Orbita, Jey Brown, La Kikada","Sesi","Avatal Records LLC",133,166,4,"27753"
134,"spotify:track:059bcIhyc2SBwm6sw2AZzd","Piso 21, Micro TDH","Te Vi","WM Mexico",17,126,431,"27730"
135,"spotify:track:5jW3rF4URMdK7tO2xjS5EI","Paulo Londra","Tal Vez","WEA Latina",5,136,326,"27616"
136,"spotify:track:3fOcw4ZP2bekIYuw6ymjYo","DJ Snake, J Balvin, Ozuna, Nicky Jam, NATTI NATASHA, Darell, Sech","Loco Contigo (with J. Balvin & Ozuna feat. Nicky Jam, Natti Natasha, Darell & Sech) - REMIX","DJ Snake Music Productions Limited",59,125,59,"27490"
137,"spotify:track:4xvTPuwHaXoDM3p0QcY7bH","DJ Luian, Mambo Kingz, Farruko, Wisin, Myke Towers, Darell, Arcángel","Música","Hear This Music",56,132,81,"27215"
138,"spotify:track:7o0oY5wRcoV7oPuDhD2J1z","Paloma Mami","Fingías","Sony Music Latin",1,139,339,"27137"
139,"spotify:track:5px6upUHM3fhOP621Edp4V","Dua Lipa","Physical","Warner Records",72,137,24,"26742"
140,"spotify:track:3bkkMZEAhx7rTVz1C0itRQ","BTS","Black Swan","BIGHIT MUSIC",66,130,8,"26688"
141,"spotify:track:0dlFCeKHsPhnLKPbqoOwwH","Santaferia","Haciendo nada","Santaferia",48,140,669,"26560"
142,"spotify:track:1khmgu0pveJbkbpbkyvcQv","Bad Bunny, El Alfa","La Romana","Rimas Entertainment LLC",14,149,427,"26387"
143,"spotify:track:0EJu1RBtxzldMG2peczuPv","Paloma Mami","No Te Enamores","Sony Music Latin",1,150,430,"26184"
144,"spotify:track:64kNRze29YqCFzFEpQCaHQ","Gigolo Y La Exce, Myke Towers, Arcángel, El Alfa, Farruko","Rasta Barbie (Remix)","Rimas Entertainment LLC",69,153,130,"26003"
145,"spotify:track:3iQOfefMGDVDwo8dZoco8T","Feid, Justin Quiles","PORFA","JP Entertainment (Jorge Pino)",131,143,39,"25993"
146,"spotify:track:3f5lA8nnc4YYF1qf78WpHw","Anuel AA, Romeo Santos","Ella Quiere Beber - Remix","Real Hasta La Muerte, LLC",8,141,479,"25901"
147,"spotify:track:73SpzrcaHk0RQPFP73vqVR","Billie Eilish","No Time To Die","Darkroom/Interscope Records",75,146,10,"25562"
148,"spotify:track:4ejyZ4uJEXUURcgKp1kP8v","The Weeknd","After Hours","Republic Records",88,131,4,"25515"
149,"spotify:track:0ono6UCNVZ1XqOm6j78Blu","BTS","Filter","BIGHIT MUSIC",81,134,3,"25506"
150,"spotify:track:6osaMSJh9NguagEDQcZaKx","DJ Snake, J Balvin, Tyga","Loco Contigo (feat. J. Balvin & Tyga)","DJ Snake Music Productions Limited",33,145,255,"25327"
151,"spotify:track:5W83ErFkO3aKAIS1WMi6u0","Anuel AA, KAROL G","Secreto","Anuel AA & Karol G - Secreto",1,151,405,"25273"
152,"spotify:track:2xuYcmQW7sFoVHygnyP2k1","Músicxs De Chile, Francisca Valenzuela, Cami, Gepe, Moral Distraida, Fernando Milagros, Mon Laferte, Denisse Malebrán, Benjamín Walker, Pedropiedra, C-Funk, Noche de Brujas, Santaferia, Chancho En Piedra, Consuelo Schuster, Schuster, Gianluca, Princesa Alba, Joe Vasconcellos, Illapu, Nano Stern, Javiera Parra, Elizabeth Morris, Rubio, Mariel Mariel, Paz Court, Manuel García, Angel Parra, Juan Angel","El Derecho de Vivir en Paz","Sucesión Víctor Jara",109,162,33,"25002"
153,"spotify:track:2dy3TKVDEbIeWxeIb8JWqZ","NATTI NATASHA, Romeo Santos","La Mejor Versión de Mi - Remix","Pina Records",86,144,142,"24870"
154,"spotify:track:1zIshc2P9l5AZsOpJWmdTM","Ricky Martin","Tiburones","Sony Music Latin",154,-1,1,"24757"
155,"spotify:track:4jMwPJMtMF977ciTvD5fwg","Myke Towers, Farruko","Si Se Da","2020 One World Music & Casablanca Records | Powered by GLAD Empire, LL",6,152,361,"24739"
156,"spotify:track:6exje52SuWDGQ2Ol8K4P5I","Pablo Chill-E, Chuchu Retro","Pensando En Ti","ShiShigang Records",70,156,332,"24723"
157,"spotify:track:7BuHdm4lQqcyG3qTwdkxus","Wisin & Yandel, Romeo Santos","Aullando","Sony Music Latin",25,147,437,"24652"
158,"spotify:track:6ifUES3keWjwXgae8pXI3o","Danny Ocean","Me Rehúso","Atlantic Records",1,158,1120,"24629"
159,"spotify:track:6wBrZZ1LyiBxytLnpgnlhf","Cami","Querida Rosa","Universal Music Chile",26,164,623,"24556"
160,"spotify:track:0PaNKfwdqHjmW7hVEQ0lbu","Camilo","La Difícil","Sony Music Latin",117,167,44,"24483"
161,"spotify:track:3Dv1eDb0MEgF93GpLXlucZ","Doja Cat","Say So","Kemosabe Records/RCA Records",154,185,18,"24404"
162,"spotify:track:2hMemEDS1l5hrjLWwU1MNt","Polimá Westcoast, Pablo Chill-E","MY BLOOD","Sony Music Entertainment Chile S.A",21,172,363,"24368"
163,"spotify:track:4SJHHpKhcuXwDsCsPqshXj","Rauw Alejandro, Chencho Corleone","El Efecto","Duars Entertainment, Corp.",64,168,343,"24352"
164,"spotify:track:65DBZofI0b79kfHTcWWDuU","Soda Stereo","Trátame Suavemente - Remasterizado 2007","Columbia",134,170,269,"24339"
165,"spotify:track:7pxL0DzPpCjjcdfQccvnus","Piso 21, Myke Towers","Una Vida Para Recordar","WM Mexico",43,161,233,"24322"
166,"spotify:track:2EEmzqzM70CybVspgM7YRT","Mau y Ricky, Camilo, Lunay","La Boca - Remix","Sony Music Latin",28,159,222,"24297"
167,"spotify:track:6pNjmMB8FTMEcqGSgs7Mji","Farruko, Ozuna, Lunay, Sech, Sharo Towers","Nadie (feat. Sech & Sharo Towers) - Remix","Sony Music Latin",25,155,136,"24226"
168,"spotify:track:3CACzG9I3AoKUKA3ODE5zW","Damas Gratis, Viru Kumbieron","Me Vas a Extrañar - En Vivo","Pelo Music S.A.",51,169,277,"24177"
169,"spotify:track:7DOh0tBGnyMt6C5OO7o8Yq","Cazzu, Lyanno, Rauw Alejandro, Dalex","Nada","Rimas Entertainment LLC",124,177,100,"24153"
170,"spotify:track:7mWFF4gPADjTQjC97CgFVt","Ozuna, Daddy Yankee, J Balvin, Farruko, Anuel AA","Baila Baila Baila - Remix","VP Records Corp/Dimelo Vi",11,160,305,"24116"
171,"spotify:track:4umIPjkehX1r7uhmGvXiSV","Justin Bieber, Quavo","Intentions (feat. Quavo)","RBMG/Def Jam",94,163,16,"23929"
172,"spotify:track:3IB5qOeMayvpOdHxYCL5tZ","BTS, Sia","ON (Feat. Sia)","BIGHIT MUSIC",104,148,3,"23837"
173,"spotify:track:6b2RcmUt1g9N9mQ3CbjX2Y","Sam Smith","How Do You Sleep?","PLG - Capitol",60,173,217,"23606"
174,"spotify:track:4u7EnebtmKWzUH433cf5Qv","Queen","Bohemian Rhapsody - Remastered 2011","EMI",26,184,616,"23427"
175,"spotify:track:2J9B63FawlTaPdg4eH5X03","Beéle","Loco","Hear This Music",98,182,130,"23318"
176,"spotify:track:6ydubKY1r75XKuQheIQB8f","Cami","Aquí Estoy","Universal Music Chile",11,175,244,"23288"
177,"spotify:track:0VKkyBKCXyR99navhVRqcP","Zion & Lennox","La player (Bandolera)","WEA Latina",1,165,728,"23243"
178,"spotify:track:5lFl0Aksww4t4CGiYYtpZz","Rauw Alejandro","Detective","Duars Entertainment, Corp.",109,178,188,"23133"
179,"spotify:track:41axLDYnS1sPpENZ654sCN","Los Vasquez, Santaferia","Mariajuana","Sello del Sur Producciones Ltda",79,180,122,"23082"
180,"spotify:track:4aN4QlhHVjgvXYkF3hlW2b","Jay Wheeler, DJ Nelson, Farruko","Otra Noche Más - Remix","Linked Music / Dynamic Records / EMPIRE",145,174,32,"23066"
181,"spotify:track:7fa9MBXhVfQ8P8Df9OEbD8","Maroon 5, Cardi B","Girls Like You (feat. Cardi B) - Cardi B Version","Interscope Records*",46,183,366,"22947"
182,"spotify:track:116H0KvKr2Zl4RPuVBruDO","Bad Bunny, Drake","MIA","Rimas Entertainment LLC",1,179,500,"22911"
183,"spotify:track:3CV6tcIs0tqW3aJtu6THaM","Pablo Chill-E","Vibras","ShiShi Gang Records",91,190,343,"22513"
184,"spotify:track:1aKuG1GG76xPLUkjBbQo3W","BTS","UGH!","BIGHIT MUSIC",101,157,3,"22502"
185,"spotify:track:4vCAzANUWDE24URV6wQ4ra","Bad Bunny","Otra Noche en Miami","Rimas Entertainment LLC",34,-1,344,"22320"
186,"spotify:track:1JSTJqkT5qHq8MDJnJbRE1","The Police","Every Breath You Take","Polydor Records",157,186,147,"22305"
187,"spotify:track:6qqd7DGn2VXzxsR4k3Ycun","Rauw Alejandro, Farruko","Fantasias - Unplugged","(SME US Latin) Duars Entertainment, Corp. (2)",90,194,104,"22208"
188,"spotify:track:7lk2SWsLObPlO98pOvz6V0","Santaferia, Illapu","Si Te Marchas, No Hay Manera","Santaferia",80,181,290,"21906"
189,"spotify:track:5xbZJo8AFv830Wx1RvmMXX","Drago200, Pablo Chill-E, Polimá Westcoast, Lleflight","Atraco Con 2 - Remix","Nabru Records LLC",119,191,27,"21864"
190,"spotify:track:42ArfZUgGo3k5btIHp08it","Paloma Mami","Not Steady","Sony Music Latin",3,187,554,"21823"
191,"spotify:track:57kdZIOAaolxAjB67d2yU3","Duki","Goteo","SSJ Records / DALE PLAY Records",22,-1,198,"21601"
192,"spotify:track:5MarqoT4wE5uNITGuEZams","Villa Cariño","Para dormir contigo otra vez","Clandestino Records",89,192,458,"21600"
193,"spotify:track:6G4U9avyBNEfP0fAIduev3","Aventura, Don Omar","Ella Y Yo - Featuring Don Omar","Premium Latin Music",131,196,306,"21513"
194,"spotify:track:2GTCK8zYHwkcu0i0jtKjFz","Carlos Rivera, Becky G, Pedro Capó","Perdiendo la Cabeza","Sony Music México",193,193,2,"21485"
