rank,uri,artist_names,track_name,source,peak_rank,previous_rank,days_on_chart,streams
1,"spotify:track:7k4t7uLgtOxPwTpFmtJNTY","KAROL G, Nicki Minaj","Tusa","TUSA - Karol G & Nicki Minaj",1,1,76,"527870"
2,"spotify:track:7sQKy5vlPQllr0k9IjYJv3","Arcángel, Sech, Dímelo Flow","Sigues Con El","Rimas Entertainment LLC.",2,2,41,"330756"
3,"spotify:track:5stPVcRqb4qixbafP9e8lt","Dalex, Lenny Tavárez, Chencho Corleone, Juhn, Dímelo Flow","Hola - Remix","Rich Music",2,3,83,"277962"
4,"spotify:track:1rgnBhdG2JDFTbYkYRZAku","Tones And I","Dance Monkey","Elektra (NEK)",4,4,107,"248781"
5,"spotify:track:5DxXgozhkPLgrbKFY91w0c","Bad Bunny","Vete","Rimas Entertainment LLC",1,5,63,"238329"
6,"spotify:track:2pWOMNQJW3g2zmGjP0Vkb0","Nicky Jam, Anuel AA","Whine Up","Sony Music Latin",4,6,86,"211898"
7,"spotify:track:6mAN61JH0dzyZpWslS11jy","Rauw Alejandro, Farruko","Fantasias","(SME US Latin) Duars Entertainment, Corp. (2)",1,7,146,"202149"
8,"spotify:track:37zdqI4r1gswIzczSBkRon","Lunay, Anuel AA, Ozuna","Aventura","round2media - LaFamilia",1,8,90,"187409"
9,"spotify:track:6cy3ki60hLwimwIje7tALf","Black Eyed Peas, J Balvin","RITMO (Bad Boys For Life)","Epic/We The Best",4,9,103,"168814"
10,"spotify:track:3jbT1Y5MoPwEIpZndDDwVq","Tainy, Anuel AA, Ozuna","Adicto (with Anuel AA & Ozuna)","NEON16/Interscope Records",1,10,154,"166448"
11,"spotify:track:5Xhqh4lwJPtMUTsdBztN1a","Shakira, Anuel AA","Me Gusta","Sony Music Latin",11,11,10,"164052"
12,"spotify:track:1Xnn1TPyr5h0hpRAT4B4EA","Dalex, Lenny Tavárez, Anitta, NATTI NATASHA, Farruko, Justin Quiles","Bellaquita - Remix","Rich Music",11,12,62,"156204"
13,"spotify:track:2ksOAxtIxY8yElEWw8RhgK","Anuel AA, Daddy Yankee, KAROL G, J Balvin, Ozuna","China","2019 Real Hasta La Muerte, LLC.",1,13,188,"155645"
14,"spotify:track:4VgYtXCVJ7IbWAZ5ryfvEQ","Nicky Jam, Daddy Yankee","Muévelo","Sony Music Latin",11,14,15,"153863"
15,"spotify:track:4R8BJggjosTswLxtkw8V7P","JHAYCO, J Balvin, Bad Bunny","No Me Conoce - Remix","N&E Entertainment LLC",2,15,251,"141372"
16,"spotify:track:5Id5B3dxJZhPcV9GzgYZZe","Rich Music LTD, Sech, Dalex, Justin Quiles, Lenny Tavárez, Feid, Wisin, Zion","Quizas","Rich Music",3,16,125,"136401"
17,"spotify:track:6RyaV7owmVU6fzEPE17sF1","Daddy Yankee","Que Tire Pa Lante","El Cartel Records (EC3)",5,17,97,"135097"
18,"spotify:track:4z6wo6PJG4Fve45OXK6D9m","Arcángel, Bad Bunny","Infeliz","Rimas Entertainment LLC.",17,18,34,"130658"
19,"spotify:track:0fea68AdmYNygeTGI4RC18","J Balvin, Bad Bunny","LA CANCIÓN","Universal Music Latino / Rimas",4,19,209,"119623"
20,"spotify:track:2TH65lNHgvLxCKXM3apjxI","Bad Bunny, Tainy","Callaita","Rimas Entertainment LLC",1,20,237,"115872"
21,"spotify:track:3mQ6SLdxxaL52Yte7KF2Ks","J Balvin","Morado","UMLE - Latino",21,22,13,"114277"
22,"spotify:track:6Y4PDQv4XjYjHLeLmvyOt0","Sech, Ozuna","Si Te Vas","Rich Music",5,21,119,"112782"
23,"spotify:track:1aUGxXCz9QimNkKeiJtzZ7","KEVVO, Farruko, Chencho Corleone, Arcángel, Darell, Ñengo Flow, Brytiago, Myke Towers","105 F Remix","Una Vision Quintana",7,23,133,"104246"
24,"spotify:track:684EjRHwNsZQ9hCQxL4NYL","Dímelo Flow, Nicky Jam, Sech, Farruko, Zion, Lunay","El Favor (with Nicky Jam & Sech, feat. Farruko, Zion & Lunay)","Rich Music/Interscope Records",6,24,146,"102782"
25,"spotify:track:5YrjfKuFd0pMmYTGeRDV6X","Noriel","Piropo","Sony Music Latin/Ganda Entertainment",23,25,89,"100781"
26,"spotify:track:6K5BsR04ijf3FHNzjbaagD","Myke Towers, Farruko, Arcángel, Sech, Zion","Si Se Da - Remix","2019 Casablanca Records & One World Music | Distributed by GLAD Empire",5,27,174,"99533"
27,"spotify:track:1ndyl3wJCFs872XZ3ztPk6","Justin Quiles, NATTI NATASHA, Farruko, Lenny Tavárez, Dalex, Zion","DJ No Pare (feat. Zion, Dalex, Lenny Tavárez) - Remix","WEA Latina",19,28,139,"99402"
28,"spotify:track:0RDgqtvOHLwcI6yz9bjsZV","Rich Music LTD, Sech, Dalex, Justin Quiles, Lenny Tavárez, Feid","Perreo en La Luna","Rich Music",22,26,104,"99151"
29,"spotify:track:4t9a07PAghtQMRAIP9FQ7Z","Lunay, Daddy Yankee, Bad Bunny","Soltera (Remix)","round2media - LaFamilia",2,29,258,"96586"
30,"spotify:track:1nocRtwyNPVtGcIJqfgdzZ","Camilo, Pedro Capó","Tutu","Sony Music Latin",6,31,167,"91801"
31,"spotify:track:374Yj1kOLjGLYLOydbCO3i","Lasso, Cami","Odio Que No Te Odio","Universal Music Mexico",19,30,6,"90783"
32,"spotify:track:4bTZeO72FwMa6wKOiqoynL","Sech, Ozuna, Anuel AA, Darell, Nicky Jam","Otro Trago - Remix","Rich Music",1,32,181,"89143"
33,"spotify:track:40rXWke6SnXiGkSmaT8ZUr","Ozuna","Fantasía","Aura Music Corp.",26,33,55,"87569"
34,"spotify:track:2B94bbI1a4LyBpK1439oP7","Noriel, Myke Towers, Rauw Alejandro, Almighty","Cuerpo en Venta","Rimas Entertainment LLC",11,34,167,"87395"
35,"spotify:track:41L3O37CECZt3N7ziG2z7l","Justin Bieber","Yummy","RBMG/Def Jam",35,35,20,"85634"
36,"spotify:track:4o1DxRjMCHDwBiOKv88rOl","Rvssian, Darell, Zion & Lennox, Myke Towers","B11 (feat. Myke Towers)","Sony Music Latin",14,36,126,"84852"
37,"spotify:track:0i9oiUkWOgvtnjkr0fa3XN","Haze, Myke Towers","Piensan","2019 Casablanca Records & One World Music | Distributed by GLAD Empire",14,37,132,"82525"
38,"spotify:track:0lbhKycRyqkOMKZ6thzfU4","Eladio Carrion, Zion & Lennox, Wisin & Yandel, Lunay","Mi Error - Remix","Rimas Entertainment LLC",38,39,66,"81530"
39,"spotify:track:25ZAibhr3bdlMCLmubZDVt","J Balvin, Bad Bunny","QUE PRETENDES","Universal Music Latino / Rimas",5,38,209,"81190"
40,"spotify:track:64IRsSyqwD0CBbFAfrR0rT","Paloma Mami","Mami","Sony Music Latin",17,41,44,"80787"
41,"spotify:track:70zg99pT51vB4wlMS7e4q7","Myke Towers, Maluma, Farruko","La Playa - Remix","2019 Casablanca Records & One World Music | Distributed by GLAD Empire",33,40,20,"79185"
42,"spotify:track:7FbKipScVxkjQxQXwTd0gL","El Alfa, Lil Pump","Coronao Now","EL JEFE RECORDS LLC",21,42,77,"79105"
43,"spotify:track:6WrI0LAC5M1Rw2MnX2ZvEg","Dua Lipa","Don't Start Now","Warner Records",43,45,83,"79080"
44,"spotify:track:7BlBVFwvbWvcwNcUarQmjk","ROSALÍA, Ozuna","Yo x Ti, Tu x Mi","Columbia",9,44,161,"76776"
45,"spotify:track:56BAJvpaWgvr6C4wmc37iU","JHAYCO, Wisin & Yandel","Imaginaste - Remix","N&E Entertainment LLC",26,43,83,"75958"
46,"spotify:track:5m3jpKkgkfoMcym1qjToFg","Alex Rose, Rafa Pabön","Jangueo","Los Oidos Fresh/ Los Proximos",46,50,60,"75792"
47,"spotify:track:7MRU4vOkywuhZ9kbFiPuiu","Daddy Yankee, Wisin & Yandel","Si Supieras","El Cartel Records (EC3)",6,46,209,"75067"
48,"spotify:track:7fODjB7BrQTGqh0hogW6XD","Sech, Justin Quiles, Maluma, Nicky Jam, Farruko, Dalex, Lenny Tavárez","Que Mas Pues - Remix","Rich Music/Ingrooves Records",7,47,287,"74358"
49,"spotify:track:4fj7e6Tc48Bmomwyz2Z2XC","Manuel Turizo, Anuel AA","Te Quemaste","Sony Music Latin/La Industria",18,48,153,"73399"
50,"spotify:track:7anSoGdgtmJTAPZBzcPhO6","Dalex, Nicky Jam, Justin Quiles, Sech, Lenny Tavárez, Feid, Rafa Pabön","Cuaderno","Rich Music/Ingrooves Records",5,49,258,"71278"
51,"spotify:track:6v3KW9xbzN5yKLt9YKDYA2","Shawn Mendes, Camila Cabello","Señorita","Island Records",11,51,216,"69461"
52,"spotify:track:6EWWkqE4aFlZRyoFwwOT8u","Javiielo","Pa Los Gustos Los Colores","Oye Saavedra / EMPIRE",42,53,101,"67594"
53,"spotify:track:4lzxJ4jCuFDXXGkE1LmpKR","DJ Luian, Mambo Kingz, Anuel AA, Nicky Jam, Darell, Brytiago","Verte Ir","Hear This Music",1,52,301,"67518"
54,"spotify:track:53uKGbcMjEc2gIWbfmvpdS","Nio Garcia, Rauw Alejandro, Lenny Tavárez, Myke Towers, Casper Magico, Darell","Mírame - Remix","2019 Flow La Movie, Inc. | Distributed by GLAD Empire, LLC.",17,54,188,"64873"
55,"spotify:track:1KdwnsWOvhM53vezy5ROuf","C. Tangana, Paloma Mami","No Te Debí Besar","Sony Music Entertainment",4,56,133,"61311"
56,"spotify:track:5NOHsDSfLIH45y3i9PfRyh","Casper Magico, Bryant Myers, Alex Rose, Juhn","Fantasmita - Remix","2019 Flow La Movie, Inc & Los Magicos",55,55,48,"60543"
57,"spotify:track:7g8YaUQABMal0zWe7a2ijz","Dalex, Rafa Pabön, KHEA, Sech, Feid, Cazzu, Lenny Tavárez","Pa Mí (Remix)","Rich Music/Ingrooves Records",2,58,349,"59588"
58,"spotify:track:59s0s39NFWScuHDbHytI14","Reik, J Balvin, Lalo Ebratt","Indeciso","Indeciso",29,57,153,"58593"
59,"spotify:track:74j34STf8L6uADnTN69ohv","Rauw Alejandro, Chencho Corleone, KEVVO, Bryant Myers, Lyanno, Dalex","El Efecto - Remix","(SME US Latin) Duars Entertainment, Corp. (2)",52,59,41,"57976"
60,"spotify:track:2rc7BkzO8qepMFAxHtOrXc","J Balvin","Blanco","UMLE - Latino",54,60,69,"56820"
61,"spotify:track:0wMs7DPFOnToNAoecvAFQc","Rich Music LTD, Sech, Dalex, Justin Quiles, Lenny Tavárez, Feid, De La Ghetto, Zion & Lennox","Uniforme","Rich Music",23,61,104,"53554"
62,"spotify:track:4PJ3umtW1aWdfh5EITHc6T","Nicky Jam, Ozuna","Te Robaré","Sony Music Latin",4,64,307,"53256"
63,"spotify:track:2qG5sZ7Si6sdK74qLxedYM","ROSALÍA, J Balvin, El Guincho","Con Altura","Columbia",12,65,301,"53049"
64,"spotify:track:1G2CAJeP7rCwOZjlSJ0Zw3","Major Lazer, J Balvin, El Alfa, Diplo","Que Calor","Mad Decent",42,63,132,"52965"
65,"spotify:track:0OoqRZXnSrgIUAha3iLKG1","Lunay, Myke Towers","La Cama","round2media - LaFamilia",19,62,100,"52465"
66,"spotify:track:5QXQy0f2q8wJNpPwJtjifx","DJ Snake, J Balvin, Ozuna, Nicky Jam, NATTI NATASHA, Darell, Sech","Loco Contigo (with J. Balvin & Ozuna feat. Nicky Jam, Natti Natasha, Darell & Sech) - REMIX","DJ Snake Music Productions Limited/Geffen Records",59,66,27,"49207"
67,"spotify:track:27uAea0qcUz3a7jKnAT7KG","Santaferia","Algún Día Volverás","Santaferia",20,69,552,"48017"
68,"spotify:track:7q3NthaBqFI6s0WnAlnIvq","Darell, Brytiago","Velitas","Sony Music Latin",36,67,195,"46767"
69,"spotify:track:099tjv6oy2opbpCOA3nBwX","Ir Sais, Rauw Alejandro","Dream Girl - Remix","Sony Music Latin",69,72,17,"46253"
70,"spotify:track:4xvTPuwHaXoDM3p0QcY7bH","DJ Luian, Mambo Kingz, Farruko, Wisin, Myke Towers, Darell, Arcángel","Música","Hear This Music",56,70,49,"46208"
71,"spotify:track:7KbF6AdprOXEEHlsq11Z6d","Maluma","11 PM","Sony Music Latin",20,71,251,"45895"
72,"spotify:track:1tpbAGsGpZee5jDHMcLrUJ","Dalex, Lenny Tavárez","Bellaquita","Rich Music",17,68,139,"45763"
73,"spotify:track:3YntiCUU0Xqq0B68FM3YAt","Myke Towers","Rutina","2019 Casablanca Records & One World Music | Distributed by GLAD Empire",73,74,39,"45738"
74,"spotify:track:0mcBgVRVsvESTkEyVHt7Ue","Darell","No Vuelvas Más","Sony Music Latin",73,73,47,"45278"
75,"spotify:track:1LiN0Z98FkR1t0m8KmLcAH","Anuel AA, Haze","Amanece","House of Haze",2,77,405,"45274"
76,"spotify:track:1Ej96GIBCTvgH7tNX1r3qr","Sech, Darell","Otro Trago","Rich Music/Ingrooves Records",1,76,279,"45150"
77,"spotify:track:56f5qnyAlZdlz8wrUDA50h","Mau y Ricky, Manuel Turizo, Camilo","Desconocidos","Sony Music Latin",9,78,465,"44955"
78,"spotify:track:5w9c2J52mkdntKOmRLeM2m","Daddy Yankee, Snow","Con Calma","El Cartel Records (EC3)",1,75,364,"44946"
79,"spotify:track:26Qhn2T88XqVinXQpmSarj","Nicky Jam, Sech","Atrévete","Sony Music Latin",19,79,174,"44270"
80,"spotify:track:5iwz1NiezX7WWjnCgY5TH4","Pedro Capó, Farruko","Calma - Remix","Sony Music Latin",1,80,472,"43116"
81,"spotify:track:3QfD4bxxkopZL7XZ8RaezH","Tommy Boysen","Hookah & Sheridan's","Equity Distribution",12,81,491,"42659"
82,"spotify:track:3cUE3p7E39CzGjQoEsg7sM","Santaferia","EL Gil De Tu Ex","Santaferia",21,83,902,"42219"
83,"spotify:track:6Xfz4YNwwIcFRyfW3QQZVp","Ceaese, Utopiko, Polimá Westcoast, Young Cister","Te Quiero Ver (feat. Polimá Westcoast y Young Cister)","WM Chile",31,86,396,"41196"
84,"spotify:track:132ALUzVLmqYB4UsBj5qD6","Paulo Londra","Adan y Eva","WEA Latina",1,87,444,"40467"
85,"spotify:track:0Cn8NxJZz7zUlsaA3rXoIU","JHAYCO, Ozuna","Easy - Remix","N&E Entertainment LLC",57,84,64,"40375"
86,"spotify:track:6t94PGXYAuo9GbJEnMpPcW","Super Yei, Sammy Baby, Myke Towers, Lenny Tavárez, Rafa Pabön","La Forma en Que Me Miras","2018 Superiority",58,85,528,"39916"
87,"spotify:track:4Clmg1g8n2yBYG13Z1oSdG","Dayvi, Victor Cardenas, Kelly Ruíz","Baila Conmigo (feat. Kelly Ruiz)","Sony Music México",17,82,223,"39819"
88,"spotify:track:059bcIhyc2SBwm6sw2AZzd","Piso 21, Micro TDH","Te Vi","WM Mexico",17,91,399,"38952"
89,"spotify:track:0GmiGIxXDNrePrHBpijYDp","Yannc, Darkiel, Eladio Carrion, Brray, Myke Towers","Sigue Bailandome","Full Harmony",4,92,457,"38879"
90,"spotify:track:5jW3rF4URMdK7tO2xjS5EI","Paulo Londra","Tal Vez","WEA Latina",5,88,294,"38690"
91,"spotify:track:2vrpcQNg6itmgVZWsNjWe0","Sebastian Yatra, Reik","Un Año","UMLE - Latino",9,90,370,"38660"
92,"spotify:track:5BAKerbfUwW5KboNuIPMmn","joel music, Puch Flow","Mueve Lo Que Dios Te Dio","Lody Produccion",82,95,24,"38634"
93,"spotify:track:3f5lA8nnc4YYF1qf78WpHw","Anuel AA, Romeo Santos","Ella Quiere Beber - Remix","Real Hasta La Muerte, LLC",8,96,447,"38064"
94,"spotify:track:6U3AilMn51njMyILgOlBQl","Adan La Amenaza, Yordano El Menor, Yohancito, Anonimus King, Carlitos Junior, Forest, BlackRoy","Dele Cotele - Remix","Adan La Amenaza | Eyey Networks",54,89,111,"37731"
95,"spotify:track:6osaMSJh9NguagEDQcZaKx","DJ Snake, J Balvin, Tyga","Loco Contigo (feat. J. Balvin & Tyga)","DJ Snake Music Productions Limited",33,97,223,"37034"
96,"spotify:track:4SJHHpKhcuXwDsCsPqshXj","Rauw Alejandro, Chencho Corleone","El Efecto","Duars Entertainment, Corp.",64,103,311,"36816"
97,"spotify:track:7BuHdm4lQqcyG3qTwdkxus","Wisin & Yandel, Romeo Santos","Aullando","Sony Music Latin",25,98,405,"36807"
98,"spotify:track:63Z1ToWxe9UJA82d9qF5lo","Simon la Letra, Pablo Chill-E","Es Poco","GGF",94,94,53,"36465"
99,"spotify:track:4RaWbMItxVbuUExNkFsITP","Nio Garcia, Brray, Juanka","La Jeepeta","2019 Flow La Movie, Inc. | Distributed by GLAD Empire, LLC.",99,104,13,"36339"
100,"spotify:track:0sf12qNH5qcw8qpgymFOqD","The Weeknd","Blinding Lights","Republic Records",100,121,26,"36101"
101,"spotify:track:6OPl2rRpNsW1BZmtrSxP6X","Ceaese, Utopiko, DrefQuila, THAT","Damelo (feat. DrefQuila y THAT)","WM Chile",31,100,376,"36015"
102,"spotify:track:2EEmzqzM70CybVspgM7YRT","Mau y Ricky, Camilo, Lunay","La Boca - Remix","Sony Music Latin",28,99,190,"36012"
103,"spotify:track:2dy3TKVDEbIeWxeIb8JWqZ","NATTI NATASHA, Romeo Santos","La Mejor Versión de Mi - Remix","Pina Records",86,102,110,"35791"
104,"spotify:track:7hynhxDoDpgMIV12JuVtNa","J Balvin, Bad Bunny, Marciano Cantero","UN PESO","Universal Music Latino / Rimas",9,93,209,"35747"
105,"spotify:track:2Fxmhks0bxGSBdJ92vM42m","Billie Eilish","bad guy","Darkroom/Interscope Records",31,107,299,"35518"
106,"spotify:track:5W83ErFkO3aKAIS1WMi6u0","Anuel AA, KAROL G","Secreto","Anuel AA & Karol G - Secreto",1,109,373,"35449"
107,"spotify:track:34ZngZgo8xicbt1EE8Ob8Z","Rich Music LTD, Sech, Dalex, Justin Quiles, Lenny Tavárez, Feid","Porno","Rich Music",53,101,104,"35302"
108,"spotify:track:0jeS8PyyIRAG0A3t5DtL71","Myke Towers","La Playa","2019 Casablanca Records & One World Music | Distributed by GLAD Empire",32,106,288,"35108"
109,"spotify:track:696DnlkuDOXcMAnKlTgXXK","Arizona Zervas","ROXANNE","Arizona Zervas",92,108,58,"35067"
110,"spotify:track:7o0oY5wRcoV7oPuDhD2J1z","Paloma Mami","Fingías","Sony Music Latin",1,113,307,"33903"
111,"spotify:track:2b8fOow8UzyDFAE27YhOZM","Maroon 5","Memories","Interscope Records*",101,112,63,"33866"
112,"spotify:track:4MxYiw28F30NGOaTZ1ySqd","Mau y Ricky, Nicky Jam, Dalex, Dímelo Flow, Justin Quiles, Lenny Tavárez","Bota Fuego (feat. Dímelo Flow, Justin Quiles & Lenny Tavárez) - Remix","Sony Music Latin",100,110,26,"33748"
113,"spotify:track:64kNRze29YqCFzFEpQCaHQ","Gigolo Y La Exce, Myke Towers, Arcángel, El Alfa, Farruko","Rasta Barbie (Remix)","Rimas Entertainment LLC",69,114,98,"32933"
114,"spotify:track:4MR1AZhe1p0zTuH2HGhX9L","Zion & Lennox, Anuel AA, Haze","Guayo","WEA Latina",11,105,251,"32918"
115,"spotify:track:6b2RcmUt1g9N9mQ3CbjX2Y","Sam Smith","How Do You Sleep?","PLG - Capitol",60,122,185,"32841"
116,"spotify:track:6pNjmMB8FTMEcqGSgs7Mji","Farruko, Ozuna, Lunay, Sech, Sharo Towers","Nadie (feat. Sech & Sharo Towers) - Remix","Sony Music Latin",25,117,104,"32742"
117,"spotify:track:29ShXDWDedEwZkYc8Du08N","Rich Music LTD, Sech, Dalex, Justin Quiles, Lenny Tavárez, Feid, Cazzu","Imaginate","Rich Music",54,111,103,"32662"
118,"spotify:track:3VyjsVV24RmBIbWJAeUJNu","Don Toliver","No Idea","We Run It Ent./Cactus Jack/Atlantic",114,132,27,"32530"
119,"spotify:track:57kdZIOAaolxAjB67d2yU3","Duki","Goteo","SSJ Records / DALE PLAY Records",22,119,168,"32351"
120,"spotify:track:0PaNKfwdqHjmW7hVEQ0lbu","Camilo","La Difícil","Sony Music Latin",117,120,12,"32287"
121,"spotify:track:4BCPItsB94KDLuERZT3aNM","TINI, Lalo Ebratt","Fresa","5020 Records",58,118,137,"32198"
122,"spotify:track:35wvL50xvKpCHEJPxLOLPI","Bad Bunny","Si Estuviésemos Juntos","Rimas Entertainment LLC",7,115,394,"32170"
123,"spotify:track:4EKZsrsCKyqr64FBHLc0DU","KAROL G, Maluma","Créeme","UMLE - Latino",32,116,443,"31874"
124,"spotify:track:74wEiOpnvCe1tCTWKGSYta","Becky G, Paulo Londra","Cuando Te Besé","Kemosabe Records/RCA Records/Sony Music Latin",5,128,536,"31440"
125,"spotify:track:4TnjEaWOeW0eKTKIEvJyCa","Trevor Daniel","Falling","Alamo",113,131,37,"31340"
126,"spotify:track:0EJu1RBtxzldMG2peczuPv","Paloma Mami","No Te Enamores","Sony Music Latin",1,125,398,"31275"
127,"spotify:track:6ifUES3keWjwXgae8pXI3o","Danny Ocean","Me Rehúso","Atlantic Records",1,123,1088,"31227"
128,"spotify:track:7mWFF4gPADjTQjC97CgFVt","Ozuna, Daddy Yankee, J Balvin, Farruko, Anuel AA","Baila Baila Baila - Remix","VP Records Corp/Dimelo Vi",11,127,273,"31067"
129,"spotify:track:1khmgu0pveJbkbpbkyvcQv","Bad Bunny, El Alfa","La Romana","Rimas Entertainment LLC",14,124,395,"31044"
130,"spotify:track:6fIVDVyzymH4OAlNhJ93k3","Jerry Di, Zion & Lennox, Lyanno, Noriel, Luis Alberto Ambrosio Cuque, Pablo C Fuentes, Wilmo Belisario","Verano En París - Remix","Nacho",123,126,82,"30778"
131,"spotify:track:7pxL0DzPpCjjcdfQccvnus","Piso 21, Myke Towers","Una Vida Para Recordar","WM Mexico",43,129,201,"30351"
132,"spotify:track:1SmkyV46t9ggDHc994V6Wt","Movimiento Original","Only You","Movimiento Original",132,135,5,"30188"
133,"spotify:track:2ohqtT8jp5VeSBAtBEpSqA","Brytiago, Myke Towers","Toxico","Business Music",58,130,68,"29950"
134,"spotify:track:116H0KvKr2Zl4RPuVBruDO","Bad Bunny, Drake","MIA","Rimas Entertainment LLC",1,133,468,"29739"
135,"spotify:track:3ZCTVFBt2Brf31RLEnCkWJ","Billie Eilish","everything i wanted","Darkroom/Interscope Records",63,134,69,"29516"
136,"spotify:track:6wBrZZ1LyiBxytLnpgnlhf","Cami","Querida Rosa","Universal Music Chile",26,137,591,"29456"
137,"spotify:track:5099x34vBakWpGkHourFxP","Maluma, J Balvin","Qué Pena","Sony Music Latin",43,138,117,"29072"
138,"spotify:track:2J9B63FawlTaPdg4eH5X03","Beéle","Loco","Hear This Music",98,136,98,"28772"
139,"spotify:track:5lFl0Aksww4t4CGiYYtpZz","Rauw Alejandro","Detective","Duars Entertainment, Corp.",109,139,156,"28603"
140,"spotify:track:0VKkyBKCXyR99navhVRqcP","Zion & Lennox","La player (Bandolera)","WEA Latina",1,141,696,"28535"
141,"spotify:track:2b6i9zx3ULzKrNWmyP0ePD","John C, Neo Pistea, Bhavi, Trueno","C90 (Remix)","Piloto Productions",73,140,35,"28491"
142,"spotify:track:0nbXyq5TXYPCO7pr3N8S4I","Roddy Ricch","The Box","Atlantic Records",142,146,9,"28447"
143,"spotify:track:0x1k6gSTSxaLxe0F2IThaX","Mike Bahía, Danny Ocean","Detente","WM Mexico",143,143,9,"28380"
144,"spotify:track:4l0Mvzj72xxOpRrp6h8nHi","Selena Gomez","Lose You To Love Me","Interscope Records",25,151,87,"28254"
145,"spotify:track:4whKi0lMYWNiV2IZBkTbYB","Casper Magico, Rauw Alejandro","La Mas Linda","2019 Flow La Movie, Inc & Los Magicos",123,142,38,"27975"
146,"spotify:track:619zlIsV7csW2h2narAoPC","Lasso, Cami","Un Millón Como Tú","Universal Music Mexico",52,144,299,"27616"
147,"spotify:track:1mlGScrDQqHqmhdIqE8MmA","Morat, Juanes","Besos En Guerra","Universal Music Spain S.L.",74,147,524,"27544"
148,"spotify:track:6ydubKY1r75XKuQheIQB8f","Cami","Aquí Estoy","Universal Music Chile",11,149,212,"27381"
149,"spotify:track:21jGcNKet2qwijlDFuPiPb","Post Malone","Circles","Republic Records",123,152,79,"27212"
150,"spotify:track:6MJUCumnQsQEKbCy28tbCP","Daddy Yankee, Anuel AA","Adictiva","El Cartel Records (EC3)",5,150,439,"26884"
151,"spotify:track:7BuSE9uTIw931wtZYzvZcQ","Sebastian Yatra, Daddy Yankee, NATTI NATASHA, Jonas Brothers","Runaway","UMLE - Latino",14,157,215,"26773"
152,"spotify:track:2hMemEDS1l5hrjLWwU1MNt","Polimá Westcoast, Pablo Chill-E","MY BLOOD","Sony Music Entertainment Chile S.A",21,145,331,"26647"
153,"spotify:track:152U4ecGSiYeKm2gnFc4wA","Villa Cariño","Serenata cruel","Clandestino Records",44,166,1032,"26630"
154,"spotify:track:42ArfZUgGo3k5btIHp08it","Paloma Mami","Not Steady","Sony Music Latin",3,156,523,"26614"
155,"spotify:track:65DBZofI0b79kfHTcWWDuU","Soda Stereo","Trátame Suavemente - Remasterizado 2007","Columbia",134,165,237,"26604"
156,"spotify:track:7DOh0tBGnyMt6C5OO7o8Yq","Cazzu, Lyanno, Rauw Alejandro, Dalex","Nada","Rimas Entertainment LLC",124,163,68,"26520"
157,"spotify:track:71iAechwVKGu26pahzFL0k","Morat","Cuando Nadie Ve","Universal Music Spain S.L.",42,148,428,"26507"
158,"spotify:track:0PabDDMMzwmn9cfJsfes7W","Wisin & Yandel","Chica Bombastic","Sony Music Latin",88,159,95,"26393"
159,"spotify:track:09nSCeCs6eYfAIJVfye1CE","TINI, Sebastian Yatra","Oye","5020 Records",35,160,102,"26157"
160,"spotify:track:6qqd7DGn2VXzxsR4k3Ycun","Rauw Alejandro, Farruko","Fantasias - Unplugged","(SME US Latin) Duars Entertainment, Corp. (2)",90,153,72,"26141"
161,"spotify:track:5qN1G8fSHq4Sv5FRoOkNGu","Paulo Londra","Por Eso Vine","WEA Latina",17,161,242,"26102"
162,"spotify:track:1GBLO0NFODuL31A5fgw0uR","Maluma, Ricky Martin","No Se Me Quita (feat. Ricky Martin)","Sony Music Latin",74,162,143,"26047"
163,"spotify:track:0tJCo71s7HT9Mu5Z4juuLw","Sech, Farruko, Zion & Lennox","Solita","Rich Music/Ingrooves Records",46,154,324,"25999"
164,"spotify:track:0LHejotBx99f8kN7UQP2o4","Harry Nach, Young Kieff","Norty","Only Perk",147,155,37,"25889"
165,"spotify:track:7ef4DlsgrMEH11cDZd32M6","Calvin Harris, Dua Lipa","One Kiss (with Dua Lipa)","Sony Music UK",32,164,443,"25866"
166,"spotify:track:0qZ7oronoocHdFDKGBdgLQ","Zion & Lennox","Sistema","WEA Latina",134,158,35,"25832"
167,"spotify:track:1g2Z2lOrwayOzDqOc8EfbR","Farruko, Bad Bunny","La Cartera","Sony Music Latin",28,167,269,"25533"
168,"spotify:track:0hVXuCcriWRGvwMV1r5Yn9","Ed Sheeran & Justin Bieber, Justin Bieber","I Don't Care (with Justin Bieber)","Atlantic Records UK",28,173,201,"25523"
169,"spotify:track:7LLXLd0pisbEAdIVK502VM","Wisin & Yandel","Reggaetón en lo Oscuro","Sony Music Latin",13,168,451,"25423"
170,"spotify:track:4cuGZb0iFyHtwaSKdKrJkF","Luis Fonsi, Ozuna","Imposible","UMLE - Latino",7,175,457,"25386"
171,"spotify:track:5UyH584f99c7qErZifyaHy","Princesa Alba","Convéncete","Altafonte bajo licencia exclusiva de Princesa Alba",38,169,252,"25337"
172,"spotify:track:0dDboLfmRNsTBscy4j3Rnl","Ozuna","Hasta Que Salga el Sol","Aura Music Corp.",42,177,76,"25024"
173,"spotify:track:1LIqNVhaIgxXUt2eVoIQJ3","Maluma","HP","Sony Music Latin",18,170,327,"24964"
174,"spotify:track:4uP3pUP18ennmz0tb3GphR","Bad Bunny","Solo de Mi","Rimas Entertainment LLC",10,179,354,"24933"
175,"spotify:track:0UfVfRSmy4xMyi67LKH5zZ","Dímelo Flow, Sech, Dalex, Justin Quiles, La Exce, Feid, Zion","La Isla (with Sech & Dalex feat. Justin Quiles, La Exce, Feid, Zion)","Rich Music/Interscope Records",127,172,53,"24797"
176,"spotify:track:7HMmFQsKsljwTw8bS7lu19","Selena Gomez","Rare","Interscope Records",71,194,12,"24784"
177,"spotify:track:1JSTJqkT5qHq8MDJnJbRE1","The Police","Every Breath You Take","Polydor Records",161,186,117,"24732"
178,"spotify:track:3dWpRjCmaHbroNahuSeX11","Guaynaa, Nicky Jam, Farruko, Becky G, Sech","Rebota - Remix","Rebota Remix",21,176,194,"24668"
179,"spotify:track:703iVQrfbQsXt7Uzgy1h8k","Sebastian Yatra","Cristina","UMLE - Latino",28,187,299,"24663"
180,"spotify:track:3bCuNSiaBHqxdevMYEnGpe","Jesse & Joy, Luis Fonsi","Tanto","WEA Latina",78,184,88,"24572"
181,"spotify:track:041Kcvnw8nOdq8xiRibPTG","Greeicy, Nacho","Destino","UMLE - Latino",97,178,277,"24509"
182,"spotify:track:4u7EnebtmKWzUH433cf5Qv","Queen","Bohemian Rhapsody - Remastered 2011","EMI",26,180,584,"24494"
183,"spotify:track:48zFZh27QU5qsrBjn4C2FA","Ozuna, Manuel Turizo","Vaina Loca","VP Records Corp/Dimelo Vi",1,188,570,"24480"
184,"spotify:track:5suqjbw9bF0T1X3HU1oG1v","Bryant Myers, Alex Rose","Bandolera","eOne Music",78,174,205,"24477"
185,"spotify:track:27qRmG3zOWPvMYUkpPdQ1g","Bryant Myers, Anuel AA","Gan-Ga - Remix","eOne Music",25,181,68,"24323"
186,"spotify:track:5N5k9nd479b1xpDZ4usjrg","Calvin Harris, Sam Smith, Jessie Reyez","Promises (with Sam Smith)","Columbia",92,189,243,"24265"
187,"spotify:track:04XBsg0wY1iNV2bpxXgvku","Brytiago","Te Falle","Duars Music/Business Music",172,183,4,"24180"
188,"spotify:track:5KbBGUpIZd6gVFUU8tqYiQ","Myke Towers, Farruko","Si Se Da","2019 Casablanca Records & One World Music | Distributed by GLAD Empire",6,185,329,"24101"
189,"spotify:track:2uhMYJq2TODWBuZhHRrdWy","Becky G, Myke Towers","DOLLAR","Kemosabe Records/RCA Records/Sony Music Latin",82,195,189,"24010"
190,"spotify:track:4vCAzANUWDE24URV6wQ4ra","Bad Bunny","Otra Noche en Miami","Rimas Entertainment LLC",34,198,328,"23960"
191,"spotify:track:3V8UKqhEK5zBkBb6d6ub8i","Nio Garcia, Casper Magico, Bad Bunny, Darell, Ozuna, Nicky Jam","Te Boté - Remix","Flow La Movie, Inc.",1,190,617,"23857"
192,"spotify:track:6exje52SuWDGQ2Ol8K4P5I","Pablo Chill-E, Chuchu Retro","Pensando En Ti","ShiShigang Records",70,182,300,"23823"
193,"spotify:track:3iQOfefMGDVDwo8dZoco8T","Feid, Justin Quiles","PORFA","JP Entertainment (Jorge Pino)",176,191,15,"23686"
194,"spotify:track:0aCTSZQTlmnjQucALTF00s","Harry Nach","Tak Tiki Tak","Sony Music Entertainment Chile S.A",192,192,3,"23641"
195,"spotify:track:0WpwK09agFbwEUaNrGnXoe","Manuel Turizo, Ozuna","Esclavo de Tus Besos","Sony Music Latin/La Industria",16,200,331,"23614"
196,"spotify:track:3CV6tcIs0tqW3aJtu6THaM","Pablo Chill-E","Vibras","ShiShi Gang Records",91,197,314,"23613"
197,"spotify:track:0UQwlF2pRkr1lMN6kNNUj3","Mau y Ricky, Camilo","La Boca","Sony Music Latin",63,-1,239,"23283"
