rank,uri,artist_names,track_name,source,peak_rank,previous_rank,days_on_chart,streams
1,"spotify:track:4HYDUMY0xSpeBr0AMY9cUz","Jay Wheeler, DJ Nelson, Myke Towers","La Curiosidad","Linked Music / Dynamic Records / EMPIRE",1,1,20,"198164"
2,"spotify:track:1mohfLaTJtB2RplHLQVM70","Nio Garcia, Anuel AA, Myke Towers, Brray, Juanka","La Jeepeta - Remix","2020 Flow La Movie, Inc. | Powered by GLAD Empire, LLC",1,2,69,"179295"
3,"spotify:track:06s3QtMJVXw1AJX3UfvZG1","Anuel AA, Bad Bunny","Hasta Que Dios Diga","2020 Real Hasta La Muerte, LLC",1,3,34,"160957"
4,"spotify:track:2tFwfmceQa1Y6nRPhYbEtC","JHAYCO, Bad Bunny","CÓMO SE SIENTE - Remix","N&E Entertainment LLC",1,4,53,"156138"
5,"spotify:track:3ZG8N7aWw2meb6UrI5ZmnZ","Sech","Relación","Rich Music",4,5,91,"155481"
6,"spotify:track:50ZC4PM7hywH27RcCfViau","Rauw Alejandro, Dalex, Lenny Tavárez, Dímelo Flow","Elegí (feat. Dímelo Flow)","Sony Music Latin",3,6,97,"144427"
7,"spotify:track:4TOmcZvw0gHa7GiXRbcYAW","Feid, Justin Quiles","PORFA","JP Entertainment (Jorge Pino)",4,7,168,"124928"
8,"spotify:track:6Hw21Z5CmEV78jrncFpMwz","Harry Nach","Tak Tiki Tak","Sony Music Entertainment Chile S.A",8,8,162,"122010"
9,"spotify:track:2DEZmgHKAvm41k4J3R2E9Y","Bad Bunny, Jowell & Randy, Ñengo Flow","Safaera","Rimas Entertainment LLC",1,9,123,"116106"
10,"spotify:track:3gD4J3RUHy4OUuZ3qAiaiG","Ozuna","Caramelo","Aura Music Corp.",10,10,20,"111081"
11,"spotify:track:0SqqAgdovOE24BzxIClpjw","Bad Bunny","Yo Perreo Sola","Rimas Entertainment LLC",2,11,124,"106453"
12,"spotify:track:74j34STf8L6uADnTN69ohv","Rauw Alejandro, Chencho Corleone, KEVVO, Bryant Myers, Lyanno, Dalex","El Efecto - Remix","(SME US Latin) Duars Entertainment, Corp. (2)",10,12,202,"101738"
13,"spotify:track:6yVkakCN460KOVol9ZazjH","Anuel AA","Reggaetonera","2020 Real Hasta La Muerte, LLC",2,13,34,"98079"
14,"spotify:track:0VjIjW4GlUZAMYd2vXMi3b","The Weeknd","Blinding Lights","Republic Records",13,14,187,"94393"
15,"spotify:track:380HmhwTE2NJgawn1NwkXi","J Balvin","Rojo","UMLE - Latino",8,15,125,"93728"
16,"spotify:track:6NfrH0ANGmgBXyxgV2PeXt","Bad Bunny","La Difícil","Rimas Entertainment LLC",1,16,124,"89654"
17,"spotify:track:0jT8Nl0shPS8115is0wD2Q","Camilo","Favorito","Sony Music Latin",3,17,97,"86741"
18,"spotify:track:3JHpk0DOTOzyh0777JFAky","Myke Towers","Diosa","2020 One World Music & Casablanca Records | Powered by GLAD Empire, LL",7,18,160,"82923"
19,"spotify:track:7na7Bk98usp84FaOJFPv3d","Rauw Alejandro","Tattoo","(SME US Latin) Duars Entertainment, Corp. (2)",7,19,139,"81122"
20,"spotify:track:5stPVcRqb4qixbafP9e8lt","Dalex, Lenny Tavárez, Chencho Corleone, Juhn, Dímelo Flow","Hola - Remix","Rich Music",2,21,244,"78762"
21,"spotify:track:38RIEav39FGi86jppxO0du","Bad Bunny, Sech","Ignorantes","Rimas Entertainment LLC",1,22,139,"77842"
22,"spotify:track:5m3jpKkgkfoMcym1qjToFg","Alex Rose, Rafa Pabön","Jangueo","Los Oidos Fresh/ Los Proximos",13,23,221,"76096"
23,"spotify:track:7sQKy5vlPQllr0k9IjYJv3","Arcángel, Sech, Dímelo Flow","Sigues Con El","Rimas Entertainment LLC.",2,24,202,"75023"
24,"spotify:track:7lUdbnz7wsv3C9zzf4WHl9","Feid, J Balvin, Maluma, Nicky Jam, Sech, Justin Quiles","PORFA Remix ( Feat. Maluma, Nicky Jam, Sech) - Remix","JP Entertainment (Jorge Pino)",18,20,6,"74980"
25,"spotify:track:69vlMrzHwATKzupwNcUPyK","Bad Bunny, Daddy Yankee","La Santa","Rimas Entertainment LLC",3,25,124,"73619"
26,"spotify:track:0FktnzDqjClqU6iqOZVEs2","Bad Bunny","BYE ME FUI","Rimas Entertainment LLC",1,26,53,"68762"
27,"spotify:track:5bmSver2b3ZXyuyLKtgnFI","Bad Bunny, Nicky Jam","BAD CON NICKY","Rimas Entertainment LLC",3,27,53,"68396"
28,"spotify:track:4EJHKSnHENfjOxXWryyNtL","Bad Bunny, Zion & Lennox","MÁS DE UNA CITA","Rimas Entertainment LLC",1,28,53,"66441"
29,"spotify:track:2tGENA8xef0wABdHvyXwv9","Lunay, Ozuna, Myke Towers, Chencho Corleone, Rauw Alejandro","La Cama (Remix)","round2media - LaFamilia",20,29,97,"64885"
30,"spotify:track:3pm4XtcsRIFFtH2UErk62R","Yandel, Bad Bunny","CANCIÓN CON YANDEL","Rimas Entertainment LLC",4,30,53,"61362"
31,"spotify:track:7k4t7uLgtOxPwTpFmtJNTY","KAROL G, Nicki Minaj","Tusa","TUSA - Karol G & Nicki Minaj",1,31,237,"60031"
32,"spotify:track:2lCkncy6bIB0LTMT7kvrD1","J Balvin","Azul","UMLE - Latino",29,32,104,"59085"
33,"spotify:track:1rgnBhdG2JDFTbYkYRZAku","Tones And I","Dance Monkey","Elektra (NEK)",4,33,268,"58865"
34,"spotify:track:5kbps8unnGH4raN5WduZuq","Sech, Daddy Yankee","Confía","Rich Music",28,36,42,"56660"
35,"spotify:track:099tjv6oy2opbpCOA3nBwX","Ir Sais, Rauw Alejandro","Dream Girl - Remix","Sony Music Latin",35,35,178,"56442"
36,"spotify:track:35KmOEIUqAGn02t7n4qaIr","J Balvin","Morado","UMLE - Latino",12,39,174,"56190"
37,"spotify:track:43NqTeL8pgBxKHPMiJKUP5","Myke Towers","Girl","2020 One World Music & Casablanca Records | Powered by GLAD Empire, LL",4,38,160,"55843"
38,"spotify:track:4r9jkMEnArtWGH2rL2FZl0","Bad Bunny","A Tu Merced","Rimas Entertainment LLC",9,37,124,"55230"
39,"spotify:track:5eEQCfq7MXQr6aHLNRUZLs","Anuel AA","Keii","2020 Real Hasta La Muerte, LLC",4,40,146,"54921"
40,"spotify:track:2n7ohqg1s68ToAHh4u9mcW","Bad Bunny","Vete","Rimas Entertainment LLC",1,44,224,"54638"
41,"spotify:track:5379uuUPHodsdVhy8pIAAr","Cali Y El Dandee, Sebastian Yatra","Locura","Cali y El Dandee PS",31,43,55,"53762"
42,"spotify:track:1sHs87yRloQy0vE9mzpiZB","Juanka","Tus Besos","N&E Entertainment LLC",38,41,71,"53470"
43,"spotify:track:7KKh0ujp8agIiCrkiJhf81","Anuel AA, Tego Calderón","Jangueo","2020 Real Hasta La Muerte, LLC",3,45,34,"53357"
44,"spotify:track:3vAn0qZzdyuHamcrpkfiX3","BLACKPINK","How You Like That","YG Entertainment/Interscope Records",29,34,6,"53319"
45,"spotify:track:5EbtodsuLbxrFDH6j5avVS","Camilo, Pablo Alborán","El Mismo Aire - con Pablo Alborán","Sony Music Latin",29,42,22,"52712"
46,"spotify:track:56Ta1O7Jxxpjnc6cWdDKUo","Reik, Farruko, Camilo","Si Me Dices Que Sí","Sony Music México",46,48,133,"50157"
47,"spotify:track:0OTtnwUO8natNWSwdZvXVF","Ovy On The Drums, Beéle","Inolvidable","WEA Latina",34,47,75,"49889"
48,"spotify:track:41wtwzCZkXwpnakmwJ239F","Bad Bunny","Si Veo a Tu Mamá","Rimas Entertainment LLC",4,46,124,"49851"
49,"spotify:track:7eJMfftS33KTjuF7lTsMCx","Powfu, beabadoobee","death bed (coffee for your head)","Columbia",36,50,109,"49368"
50,"spotify:track:6mAN61JH0dzyZpWslS11jy","Rauw Alejandro, Farruko","Fantasias","(SME US Latin) Duars Entertainment, Corp. (2)",1,49,307,"48867"
51,"spotify:track:6AzKhCHOms83jvNVLsz0Bt","Aya Nakamura, Maluma","Djadja (feat. Maluma) - Remix","Rec. 118",51,51,16,"47399"
52,"spotify:track:0eeKDrQxjqNl5bX5VCHDcn","Justin Quiles, Daddy Yankee, El Alfa","PAM","WEA Latina",50,52,62,"45535"
53,"spotify:track:5IjOqh4XLyjHINuOGolmAt","Eladio Carrion, Zion & Lennox, Wisin & Yandel, Lunay","Mi Error - Remix","Rimas Entertainment LLC",27,53,227,"45080"
54,"spotify:track:4w47S36wQGBhGg073q3nt7","ROSALÍA, Travis Scott","TKN (feat. Travis Scott)","Columbia",32,55,35,"45049"
55,"spotify:track:4QfZYDhGZc0T2RDvGiI69E","El Alfa, Chael Produciendo","Singapur","EL JEFE RECORDS LLC",55,62,13,"44339"
56,"spotify:track:4Pu0a2TuHOYtI4CCE3HEXI","Arcángel, Sech, Romeo Santos","Sigues Con El - Remix","Rimas Entertainment LLC.",20,54,83,"43806"
57,"spotify:track:4R8BJggjosTswLxtkw8V7P","JHAYCO, J Balvin, Bad Bunny","No Me Conoce - Remix","N&E Entertainment LLC",2,57,412,"43690"
58,"spotify:track:3jbT1Y5MoPwEIpZndDDwVq","Tainy, Anuel AA, Ozuna","Adicto (with Anuel AA & Ozuna)","NEON16/Interscope Records",1,56,315,"43429"
59,"spotify:track:6zEgnpM0qYmHLDnh8WPejL","J Balvin","Amarillo","UMLE - Latino",17,59,104,"42783"
60,"spotify:track:0pgj4EzB1XRqgZemoMNG5D","Camilo, Evaluna Montaner","Por Primera Vez","Sony Music Latin",24,58,114,"42681"
61,"spotify:track:6UelLqGlWMcVH1E5c4H7lY","Harry Styles","Watermelon Sugar","Columbia",59,61,53,"42571"
62,"spotify:track:24Yi9hE78yPEbZ4kxyoXAI","SAINt JHN, Imanbek","Roses - Imanbek Remix","Columbia/B1 Recordings",51,63,102,"42386"
63,"spotify:track:0KkIkfsLEJbrcIhYsCL7L5","Anuel AA, Daddy Yankee, KAROL G, Ozuna, J Balvin","China","2020 Real Hasta La Muerte, LLC",1,65,349,"42117"
64,"spotify:track:0A37XY67wSdGqkGjtfW6aV","Rauw Alejandro, Anuel AA, NATTI NATASHA, Farruko, Lunay","Fantasias - Remix","(SME US Latin) Duars Entertainment, Corp. (2)",24,60,118,"41754"
65,"spotify:track:3PfIrDoz19wz7qK7tYeu62","Dua Lipa","Don't Start Now","Warner Records",20,67,244,"41183"
66,"spotify:track:57Ba26w9eoXx8BBUNgRNLV","Super Yei, Sammy Baby, Jone Quest, Myke Towers, Lenny Tavárez, Rafa Pabön","La Forma en Que Me Miras","2020 Superiority | Powered by GLAD EMPIRE, LLC",57,66,689,"41091"
67,"spotify:track:5XqCz18k96K8tx6DAYM97i","Bad Bunny, Don Omar","PA' ROMPERLA","Rimas Entertainment LLC",4,64,53,"40970"
68,"spotify:track:113PlnpZbHd3WIqeYjhZWv","Daddy Yankee, Sech","Definitivamente","El Cartel Records (EC3)",13,68,153,"40491"
69,"spotify:track:4xI3U4sDj1TPmO9Iz5TkYp","El Alfa, Darell, Noriel","4K","EL JEFE RECORDS LLC",41,69,111,"39656"
70,"spotify:track:0fea68AdmYNygeTGI4RC18","J Balvin, Bad Bunny","LA CANCIÓN","Universal Music Latino / Rimas",4,70,370,"39526"
71,"spotify:track:6C1jKbkCUgFws7M0M4oGCB","Dalex, Sech","Mejor","Rich Music",26,72,146,"39504"
72,"spotify:track:46V4kseB66GjFGklCgynGX","Casper Magico, Anuel AA","Sola & Vacía","2020 Flow La Movie, Inc. & Los Magicos, LLC | Powered by GLAD Empire,",29,71,76,"39209"
73,"spotify:track:7kOf0qHO4Rcwk6QJifZDRJ","Anuel AA","El Manual","2020 Real Hasta La Muerte, LLC",27,76,34,"38055"
74,"spotify:track:4SJHHpKhcuXwDsCsPqshXj","Rauw Alejandro, Chencho Corleone","El Efecto","Duars Entertainment, Corp.",63,75,431,"37892"
75,"spotify:track:4GGwM2Krtlx9G9ii1RaEOx","Dalex, Lenny Tavárez, Anitta, NATTI NATASHA, Farruko, Justin Quiles","Bellaquita (Remix)","Rich Music",11,73,223,"37658"
76,"spotify:track:34LI7rwi9H8w2S5KTHnv1M","Manuel Turizo","Quiéreme Mientras Se Pueda","Sony Music Latin/La Industria",71,74,62,"36858"
77,"spotify:track:7mcdgAXmb35dakBnfDIv3q","Anuel AA","Narcos","2020 Real Hasta La Muerte, LLC",12,78,34,"35675"
78,"spotify:track:7ju97lgwC2rKQ6wwsf9no9","Lady Gaga, Ariana Grande","Rain On Me (with Ariana Grande)","Interscope",25,77,41,"35238"
79,"spotify:track:466cKvZn1j45IpxDdYZqdA","Drake","Toosie Slide","OVO",54,79,90,"34568"
80,"spotify:track:2TH65lNHgvLxCKXM3apjxI","Bad Bunny, Tainy","Callaita","Rimas Entertainment LLC",1,80,398,"34037"
81,"spotify:track:4MWb6mltydQn84NrTm7Gpl","Micro TDH, Rels B, Lenny Tavárez, Justin Quiles","Dime Cuantas Veces (Remix) [feat. Justin Quiles]","WEA Latina",76,84,7,"33970"
82,"spotify:track:1V8XneTrX6kKeoxYbk4x6h","Bad Bunny, Duki, Pablo Chill-E","Hablamos Mañana","Rimas Entertainment LLC",4,82,124,"33778"
83,"spotify:track:5Id5B3dxJZhPcV9GzgYZZe","Rich Music LTD, Sech, Dalex, Justin Quiles, Lenny Tavárez, Feid, Wisin, Zion","Quizas","Rich Music",3,81,286,"33478"
84,"spotify:track:3FhiU60cxfN2j4jRy5Y40w","Cauty, Lenny Tavarez, Jay Wheeler, Noriel, Alex Rose","Lloras - Remix","eOne Music",75,85,129,"32962"
85,"spotify:track:10u2iOS0r6plfb9GknD7g4","Rauw Alejandro, Myke Towers, Sky Rompiendo","Ponte Pa' Mi","(SME US Latin) Duars Entertainment, Corp. (2)",78,86,76,"32531"
86,"spotify:track:634fDJYRCr5yzqfFWa9rfS","Paloma Mami","Goteo","Sony Music Latin",9,83,63,"32313"
87,"spotify:track:1Ol5LmdNDNpFu1oNwfgkux","Camilo, Pedro Capó","Tutu","Sony Music Latin",6,87,328,"32185"
88,"spotify:track:3jjujdWJ72nww5eGnfs2E7","Harry Styles","Adore You","Columbia",86,90,133,"32041"
89,"spotify:track:52zq2a71SGs3f1vJuv59ui","Juanfran","Como Llora","DN7 Music",82,91,62,"31943"
90,"spotify:track:6nGM44ZP7vSo0istUW2MOq","Farruko, Beéle, NATTI NATASHA, Manuel Turizo","Loco - Remix","Hear This Music",64,88,69,"31609"
91,"spotify:track:017PF4Q3l4DBUiWoXk4OWT","Dua Lipa","Break My Heart","Warner Records",49,89,98,"31554"
92,"spotify:track:37zdqI4r1gswIzczSBkRon","Lunay, Anuel AA, Ozuna","Aventura","round2media - LaFamilia",1,93,251,"31216"
93,"spotify:track:4VgYtXCVJ7IbWAZ5ryfvEQ","Nicky Jam, Daddy Yankee","Muévelo","Sony Music Latin",8,95,176,"31145"
94,"spotify:track:4j4w4CXm6BSr0s25wAWrrX","Bad Bunny, Yaviah","Bichiyal","Rimas Entertainment LLC",9,92,124,"30879"
95,"spotify:track:2w1rq80FIrbxeJy9WYURxw","KAROL G, Anuel AA","Follow","UMLE - Latino",18,94,91,"30659"
96,"spotify:track:24IgCW19L8lXKyFZwzFtD3","Black Eyed Peas, Ozuna, J. Rey Soul","MAMACITA","Epic",96,96,76,"30233"
97,"spotify:track:35wvL50xvKpCHEJPxLOLPI","Bad Bunny","Si Estuviésemos Juntos","Rimas Entertainment LLC",7,104,555,"29376"
98,"spotify:track:3Dv1eDb0MEgF93GpLXlucZ","Doja Cat","Say So","Kemosabe Records/RCA Records",59,98,147,"29275"
99,"spotify:track:3l6Dc2DvpzEXJxnRTX5JUd","Nio Garcia, Bryant Myers, Lenny Tavárez, Miky Woodz, Jay Wheeler","Nocturna - Remix","2020 Flow La Movie Inc. | Distributed by GLAD Empire, LLC",76,101,124,"29201"
100,"spotify:track:4RaWbMItxVbuUExNkFsITP","Nio Garcia, Brray, Juanka","La Jeepeta","2019 Flow La Movie, Inc. | Distributed by GLAD Empire, LLC.",34,102,174,"28793"
101,"spotify:track:4t9a07PAghtQMRAIP9FQ7Z","Lunay, Daddy Yankee, Bad Bunny","Soltera (Remix)","round2media - LaFamilia",2,100,419,"28784"
102,"spotify:track:6K5BsR04ijf3FHNzjbaagD","Myke Towers, Farruko, Arcángel, Sech, Zion","Si Se Da - Remix","2019 Casablanca Records & One World Music | Distributed by GLAD Empire",5,99,335,"28173"
103,"spotify:track:4z6wo6PJG4Fve45OXK6D9m","Arcángel, Bad Bunny","Infeliz","Rimas Entertainment LLC.",17,106,195,"28062"
104,"spotify:track:1ndyl3wJCFs872XZ3ztPk6","Justin Quiles, NATTI NATASHA, Farruko, Lenny Tavárez, Dalex, Zion","DJ No Pare (feat. Zion, Dalex, Lenny Tavárez) - Remix","WEA Latina",19,97,300,"27852"
105,"spotify:track:1aUGxXCz9QimNkKeiJtzZ7","KEVVO, Farruko, Chencho Corleone, Arcángel, Darell, Ñengo Flow, Brytiago, Myke Towers","105 F Remix","Una Vision Quintana",7,103,294,"27679"
106,"spotify:track:5J7teKIJGtqVypgYI6sqXj","Bad Bunny, Mora","Una Vez","Rimas Entertainment LLC",15,105,124,"27135"
107,"spotify:track:7sKDftgGirHWTVFMtJoDoh","Aya Nakamura","Djadja","Rec. 118",93,107,88,"26627"
108,"spotify:track:3qM0vBxIe4VUbK0Z0smuVP","JHAYCO, Anuel AA, J Balvin","Medusa","N&E Entertainment LLC",24,111,148,"26465"
109,"spotify:track:5Xhqh4lwJPtMUTsdBztN1a","Shakira, Anuel AA","Me Gusta","Sony Music Latin",9,108,171,"26390"
110,"spotify:track:4bTZeO72FwMa6wKOiqoynL","Sech, Ozuna, Anuel AA, Darell, Nicky Jam","Otro Trago - Remix","Rich Music",1,110,342,"26246"
111,"spotify:track:70zg99pT51vB4wlMS7e4q7","Myke Towers, Maluma, Farruko","La Playa - Remix","2019 Casablanca Records & One World Music | Distributed by GLAD Empire",33,112,181,"26232"
112,"spotify:track:2pWOMNQJW3g2zmGjP0Vkb0","Nicky Jam, Anuel AA","Whine Up","Sony Music Latin",4,118,247,"25815"
113,"spotify:track:4NCsrTzgVfsDo8nWyP8PPc","Black Eyed Peas, J Balvin","RITMO (Bad Boys For Life)","Epic",4,117,264,"25810"
114,"spotify:track:5cBrOhKDyiJF9bPGUHKkG0","Dalex","+Linda","Rich Music",114,115,38,"25748"
115,"spotify:track:53uKGbcMjEc2gIWbfmvpdS","Nio Garcia, Rauw Alejandro, Lenny Tavárez, Myke Towers, Casper Magico, Darell","Mírame - Remix","2019 Flow La Movie, Inc. | Distributed by GLAD Empire, LLC.",17,109,349,"25635"
116,"spotify:track:2w8SKQCnT2YQK1qCqKl2uW","Lenny Tavárez, Justin Quiles","La Pared 360","WEA Latina",86,121,146,"25193"
117,"spotify:track:2aGN6PplBq0xigh2lmqLbw","Sech, Ozuna","Si Te Vas","Rich Music",5,114,280,"25151"
118,"spotify:track:4s45VgkknMFkdiGoUcjxQU","Sebastian Yatra, Rauw Alejandro, Manuel Turizo","TBT","UMLE - Latino",57,113,132,"25061"
119,"spotify:track:27uAea0qcUz3a7jKnAT7KG","Santaferia","Algún Día Volverás","Santaferia",20,125,713,"24997"
120,"spotify:track:7g8YaUQABMal0zWe7a2ijz","Dalex, Rafa Pabön, KHEA, Sech, Feid, Cazzu, Lenny Tavárez","Pa Mí (Remix)","Rich Music/Ingrooves Records",2,119,510,"24836"
121,"spotify:track:47ZS1OjnJpJVfGN9yHXfMn","Alex Rose, Rauw Alejandro, Lenny Tavárez, Cazzu, Lyanno","Toda (Remix)","Los Oídos Fresh",8,120,268,"24761"
122,"spotify:track:6Bd9rs5gv25asdPDRog3ce","Javiielo","Pa Los Gustos Los Colores","Oye Saavedra / EMPIRE",40,116,262,"24733"
123,"spotify:track:2CoMYp2uIKsT09nreEZnZn","Bad Bunny","BENDICIONES","Rimas Entertainment LLC",7,122,53,"24320"
124,"spotify:track:5YrjfKuFd0pMmYTGeRDV6X","Noriel","Piropo","Sony Music Latin/Ganda Entertainment",23,128,250,"24110"
125,"spotify:track:34ZngZgo8xicbt1EE8Ob8Z","Rich Music LTD, Sech, Dalex, Justin Quiles, Lenny Tavárez, Feid","Porno","Rich Music",53,124,265,"24025"
126,"spotify:track:2hDe0Ls5mVqs1XJqv7sbcM","Anuel AA, Enrique Iglesias","Fútbol & Rumba (feat. Enrique Iglesias)","2020 Real Hasta La Muerte, LLC",15,123,34,"23922"
127,"spotify:track:7f5SeKPwJm4eM4GcngH2SX","Juanka","Cárcel","N&E Entertainment LLC",119,127,27,"23813"
128,"spotify:track:6NfC2FKfsfzuLIF4lThw0A","Anuel AA, Bad Bunny","Así Soy Yo","2020 Real Hasta La Muerte, LLC",5,126,34,"23436"
129,"spotify:track:56f5qnyAlZdlz8wrUDA50h","Mau y Ricky, Manuel Turizo, Camilo","Desconocidos","Sony Music Latin",9,134,626,"23108"
130,"spotify:track:7fODjB7BrQTGqh0hogW6XD","Sech, Justin Quiles, Maluma, Nicky Jam, Farruko, Dalex, Lenny Tavárez","Que Mas Pues - Remix","Rich Music/Ingrooves Records",7,129,448,"22863"
131,"spotify:track:7ytR5pFWmSjzHJIeQkgog4","DaBaby, Roddy Ricch","ROCKSTAR (feat. Roddy Ricch)","South Coast Music Group/Interscope Records",131,139,15,"22659"
132,"spotify:track:5NOHsDSfLIH45y3i9PfRyh","Casper Magico, Bryant Myers, Alex Rose, Juhn","Fantasmita - Remix","2019 Flow La Movie, Inc & Los Magicos",55,135,209,"22642"
133,"spotify:track:1A9PKAFEHMWgXNLpgf7k4J","Myke Towers","Piensan","2020 One World Music & Casablanca Records | Powered by GLAD Empire, LL",14,133,293,"22588"
134,"spotify:track:2B94bbI1a4LyBpK1439oP7","Noriel, Myke Towers, Rauw Alejandro, Almighty","Cuerpo en Venta","Rimas Entertainment LLC",11,132,328,"22581"
135,"spotify:track:4DpNNXFMMxQEKl7r0ykkWA","Melanie Martinez","Play Date","Atlantic Records",119,131,52,"22490"
136,"spotify:track:5p3JJehpKHjr9pJT5eD2Lz","Anuel AA, Farruko, Zion","Que Se Joda","2020 Real Hasta La Muerte, LLC",10,140,34,"22407"
137,"spotify:track:6Xfz4YNwwIcFRyfW3QQZVp","Ceaese, Utopiko, Polimá Westcoast, Young Cister","Te Quiero Ver (feat. Polimá Westcoast y Young Cister)","WM Chile",31,136,557,"22252"
138,"spotify:track:16DNJ8y6k97DxuMyV49W7V","KHEA","Dónde Estás","Young Flex - Khea",61,141,140,"22180"
139,"spotify:track:1OW47kPsWJfvhcQ7V7XwhC","Myke Towers, Yandel","Mayor","2020 White World Music | Powered by GLAD Empire, LLC",110,130,20,"22135"
140,"spotify:track:3dJWIbkKEnI0Jb9CK6kdcg","JHAYCO, Wisin & Yandel","Imaginaste - Remix","N&E Entertainment LLC",26,142,244,"22119"
141,"spotify:track:3DyiAk1BzIF8rq9rimypG4","Anuel AA, Cardi B, Black Jonas Point, Secreto ""El Famoso Biberon"", Liro Shaq","La Bebe - Remix","2020 GLAD Empire, LLC & Flow La Movie, Inc.",115,143,30,"21643"
142,"spotify:track:0zlnHTHiBQ68ZCAmTw5ozm","Rauw Alejandro","Algo Mágico","Sony Music Latin/Duars Entertainment",131,149,6,"21583"
143,"spotify:track:75pQqzwgCjUOSSy5CpmAjy","Bad Bunny","Pero Ya No","Rimas Entertainment LLC",6,144,124,"21569"
144,"spotify:track:7BEPdOI0neT6p7PnLViqmH","Morat, Sebastian Yatra","Bajo La Mesa","Universal Music Spain S.L.",39,138,41,"21564"
145,"spotify:track:3SDvcxPcU7BlV1dAne4dWM","Play-N-Skillz, Daddy Yankee, Zion & Lennox","Bésame","Sony Music Latin/Latium Records",95,137,13,"21530"
146,"spotify:track:6RyaV7owmVU6fzEPE17sF1","Daddy Yankee","Que Tire Pa Lante","El Cartel Records (EC3)",5,153,258,"21522"
147,"spotify:track:7MCFjPDImfjQv7GynHgVrR","Nicki Nicole","Colocao","Sony Music Latin/DALE PLAY Records",136,145,37,"21380"
148,"spotify:track:25ZAibhr3bdlMCLmubZDVt","J Balvin, Bad Bunny","QUE PRETENDES","Universal Music Latino / Rimas",5,156,370,"21357"
149,"spotify:track:6v3KW9xbzN5yKLt9YKDYA2","Shawn Mendes, Camila Cabello","Señorita","Island Records",11,147,377,"21138"
150,"spotify:track:0RDgqtvOHLwcI6yz9bjsZV","Rich Music LTD, Sech, Dalex, Justin Quiles, Lenny Tavárez, Feid","Perreo en La Luna","Rich Music",22,152,265,"21060"
151,"spotify:track:5kQre7o8ky5DXeEPcyaCR1","Prince Royce, Myke Towers","Carita de Inocente (feat. Myke Towers) - Remix","Sony Music Latin",146,146,12,"20974"
152,"spotify:track:7qEHsqek33rTcFNT9PFqLf","Lewis Capaldi","Someone You Loved","Vertigo Berlin",141,155,44,"20908"
153,"spotify:track:7q3NthaBqFI6s0WnAlnIvq","Darell, Brytiago","Velitas","Sony Music Latin",36,154,356,"20742"
154,"spotify:track:7szuecWAPwGoV1e5vGu8tl","The Weeknd","In Your Eyes","Republic Records",111,150,97,"20615"
155,"spotify:track:2dy3TKVDEbIeWxeIb8JWqZ","NATTI NATASHA, Romeo Santos","La Mejor Versión de Mi - Remix","Pina Records",86,157,271,"20591"
156,"spotify:track:059bcIhyc2SBwm6sw2AZzd","Piso 21, Micro TDH","Te Vi","WM Mexico",17,165,560,"20533"
157,"spotify:track:53v2u51nq3CxiKUNphRzP1","Bad Bunny, Ñengo Flow","Que Malo","Rimas Entertainment LLC",11,161,124,"20321"
158,"spotify:track:4VohsQwrtb7lj1yO0dFKJa","Tommy Boysen","Hookah & Sheridan's","Equity Distribution",12,163,652,"20314"
159,"spotify:track:3cUE3p7E39CzGjQoEsg7sM","Santaferia","EL Gil De Tu Ex","Santaferia",21,169,1063,"20233"
160,"spotify:track:1JSTJqkT5qHq8MDJnJbRE1","The Police","Every Breath You Take","Polydor Records",138,166,234,"20163"
161,"spotify:track:2btKz4s1XrMn5VHe7xZJpi","NATTI NATASHA","Que Mal Te Fue","Pina Records",135,151,27,"20078"
162,"spotify:track:5jW3rF4URMdK7tO2xjS5EI","Paulo Londra","Tal Vez","WEA Latina",5,164,454,"20063"
163,"spotify:track:62aP9fBQKYKxi7PDXwcUAS","Surf Mesa, Emilee","ily (i love you baby) (feat. Emilee)","Astralwerks",147,158,43,"19919"
164,"spotify:track:1IWNylpZ477gIVUDpJL66u","Lady Gaga, BLACKPINK","Sour Candy (with BLACKPINK)","Interscope",39,148,35,"19876"
165,"spotify:track:4lzxJ4jCuFDXXGkE1LmpKR","DJ Luian, Mambo Kingz, Anuel AA, Nicky Jam, Darell, Brytiago","Verte Ir","Hear This Music",1,171,462,"19818"
166,"spotify:track:2gMXnyrvIjhVBUZwvLZDMP","Lewis Capaldi","Before You Go","Vertigo Berlin",166,175,2,"19817"
167,"spotify:track:2rRJrJEo19S2J82BDsQ3F7","Trevor Daniel","Falling","Alamo",94,162,195,"19734"
168,"spotify:track:4u7EnebtmKWzUH433cf5Qv","Queen","Bohemian Rhapsody - Remastered 2011","EMI",26,174,706,"19661"
169,"spotify:track:0G0p7mc4wEaQTsUpzEmkEs","Reik, Morat","La Bella y la Bestia","Sony Music México",123,170,18,"19609"
170,"spotify:track:2vrpcQNg6itmgVZWsNjWe0","Sebastian Yatra, Reik","Un Año","UMLE - Latino",9,167,531,"19557"
171,"spotify:track:5iwz1NiezX7WWjnCgY5TH4","Pedro Capó, Farruko","Calma - Remix","Sony Music Latin",1,173,633,"19537"
172,"spotify:track:6fNJm8sYmCBbmkKpKgTReA","Camilo","La Difícil","Sony Music Latin",55,160,172,"19498"
173,"spotify:track:4o1DxRjMCHDwBiOKv88rOl","Rvssian, Darell, Zion & Lennox, Myke Towers","B11 (feat. Myke Towers)","Sony Music Latin",14,172,287,"19298"
174,"spotify:track:1LiN0Z98FkR1t0m8KmLcAH","Anuel AA, Haze","Amanece","House of Haze",2,179,566,"19288"
175,"spotify:track:6ifUES3keWjwXgae8pXI3o","Danny Ocean","Me Rehúso","Atlantic Records",1,159,1197,"19257"
176,"spotify:track:3OVMfEILPtNyvtvxBm1jqE","Kiddtetoon, Diego Smith","Illuminati","Duetti (Migration)",176,187,4,"19176"
177,"spotify:track:3eJMSq78dDaFb7VvhNFnq6","Maluma","ADMV","Sony Music Latin",127,168,44,"19144"
178,"spotify:track:0tgVpDi06FyKpA1z0VMD4v","Ed Sheeran","Perfect","Atlantic Records UK",55,176,957,"19132"
179,"spotify:track:2qG5sZ7Si6sdK74qLxedYM","ROSALÍA, J Balvin, El Guincho","Con Altura","Columbia",12,181,461,"18920"
180,"spotify:track:1xQ6trAsedVPCdbtDAmk0c","Jawsh 685, Jason Derulo","Savage Love (Laxed - Siren Beat)","Columbia",180,194,3,"18896"
181,"spotify:track:19VunfeIrl0bx984mJ810c","Dalex, Sech, Justin Quiles","Perfume","Rich Music",55,191,118,"18744"
182,"spotify:track:4nK5YrxbMGZstTLbvj6Gxw","BENEE, Gus Dapperton","Supalonely","Republic Records",116,177,101,"18696"
183,"spotify:track:6gBFPUFcJLzWGx4lenP6h2","Travis Scott","goosebumps","Cactus Jack / Epic",58,188,69,"18629"
184,"spotify:track:7anSoGdgtmJTAPZBzcPhO6","Dalex, Nicky Jam, Justin Quiles, Sech, Lenny Tavárez, Feid, Rafa Pabön","Cuaderno","Rich Music/Ingrooves Records",5,186,417,"18568"
185,"spotify:track:4HBZA5flZLE435QTztThqH","Ariana Grande, Justin Bieber","Stuck with U (with Justin Bieber)","Ariana Grande & Justin Bieber ""Stuck With U""- Charity",43,180,44,"18515"
186,"spotify:track:5poUJOhLyalGkUedn3ggeX","Anuel AA, Mariah Angeliq","Bandido","2020 Real Hasta La Muerte, LLC",29,184,34,"18509"
187,"spotify:track:132ALUzVLmqYB4UsBj5qD6","Paulo Londra","Adan y Eva","WEA Latina",1,189,601,"18467"
188,"spotify:track:3AzjcOeAmA57TIOr9zF1ZW","Dua Lipa","Physical","Warner Records",50,183,132,"18434"
189,"spotify:track:2xLMifQCjDGFmkHkpNLD9h","Travis Scott","SICKO MODE","Cactus Jack / Epic",35,190,71,"18391"
190,"spotify:track:7sOfmPd18RWp3FoCzpa7Kw","Bad Bunny","Soliá","Rimas Entertainment LLC",10,185,124,"18298"
191,"spotify:track:7MRU4vOkywuhZ9kbFiPuiu","Daddy Yankee, Wisin & Yandel","Si Supieras","El Cartel Records (EC3)",6,195,362,"18170"
192,"spotify:track:0nbXyq5TXYPCO7pr3N8S4I","Roddy Ricch","The Box","Atlantic Records",58,192,169,"18088"
193,"spotify:track:6G4U9avyBNEfP0fAIduev3","Aventura, Don Omar","Ella Y Yo - Featuring Don Omar","Premium Latin Music",131,-1,344,"18083"
194,"spotify:track:5vdp5UmvTsnMEMESIF2Ym7","Queen","Another One Bites The Dust - Remastered 2011","EMI",42,-1,377,"18041"
195,"spotify:track:4ZLzoOkj0MPWrTLvooIuaa","Kina, Snøw","Get You The Moon (feat. Snøw)","Columbia",161,199,29,"17932"
196,"spotify:track:2uy5wXDZQcdd89PvDBSfyy","Ñengo Flow, Anuel AA","Sur y Norte","Nengo Flow (Edwin Rosa Vazquez) (Real G 4 Life, Inc.)",40,198,47,"17918"
197,"spotify:track:3a29UVSEIj6x3YcfKs2rdi","Camilo","El Mismo Aire","Sony Music Latin",54,182,68,"17907"
198,"spotify:track:59s0s39NFWScuHDbHytI14","Reik, J Balvin, Lalo Ebratt","Indeciso","Indeciso",29,197,304,"17890"
199,"spotify:track:1Ej96GIBCTvgH7tNX1r3qr","Sech, Darell","Otro Trago","Rich Music/Ingrooves Records",1,200,432,"17867"
