rank,uri,artist_names,track_name,source,peak_rank,previous_rank,days_on_chart,streams
192,"spotify:track:2ohqtT8jp5VeSBAtBEpSqA","Brytiago, Myke Towers","Toxico","Business Music",58,186,79,"21762"
193,"spotify:track:3trowLiYwwOoiwapLISNyk","Damas Gratis, Viru Kumbieron","No Te Creas Tan Importante - En Vivo","Pelo Music S.A.",83,-1,136,"21711"
194,"spotify:track:1g2Z2lOrwayOzDqOc8EfbR","Farruko, Bad Bunny","La Cartera","Sony Music Latin",28,182,280,"21703"
195,"spotify:track:4MR1AZhe1p0zTuH2HGhX9L","Zion & Lennox, Anuel AA, Haze","Guayo","WEA Latina",11,188,262,"21534"
196,"spotify:track:3V8UKqhEK5zBkBb6d6ub8i","Nio Garcia, Casper Magico, Bad Bunny, Darell, Ozuna, Nicky Jam","Te Boté - Remix","Flow La Movie, Inc.",1,194,622,"21531"
197,"spotify:track:1mlGScrDQqHqmhdIqE8MmA","Morat, Juanes","Besos En Guerra","Universal Music Spain S.L.",74,192,535,"21516"
198,"spotify:track:7LLXLd0pisbEAdIVK502VM","Wisin & Yandel","Reggaetón en lo Oscuro","Sony Music Latin",13,187,461,"21498"
199,"spotify:track:4vCAzANUWDE24URV6wQ4ra","Bad Bunny","Otra Noche en Miami","Rimas Entertainment LLC",34,-1,330,"21301"
200,"spotify:track:619zlIsV7csW2h2narAoPC","Lasso, Cami","Un Millón Como Tú","Universal Music Mexico",52,-1,309,"21182"
