rank,uri,artist_names,track_name,source,peak_rank,previous_rank,days_on_chart,streams
195,"spotify:track:619zlIsV7csW2h2narAoPC","Lasso, Cami","Un Millón Como Tú","Universal Music Mexico",52,-1,327,"21426"
196,"spotify:track:4vTgx6h4seHvkuFh84JXYP","BTS","My Time","BIGHIT MUSIC",100,171,3,"21393"
197,"spotify:track:0x1k6gSTSxaLxe0F2IThaX","Mike Bahía, Danny Ocean","Detente","WM Mexico",139,188,41,"21177"
198,"spotify:track:7ef4DlsgrMEH11cDZd32M6","Calvin Harris, Dua Lipa","One Kiss (with Dua Lipa)","Sony Music UK",32,189,475,"21127"
199,"spotify:track:2ohqtT8jp5VeSBAtBEpSqA","Brytiago, Myke Towers","Toxico","Business Music",58,-1,98,"21077"
200,"spotify:track:74wEiOpnvCe1tCTWKGSYta","Becky G, Paulo Londra","Cuando Te Besé","Kemosabe Records/RCA Records/Sony Music Latin",5,-1,566,"21076"
