rank,uri,artist_names,track_name,source,peak_rank,previous_rank,days_on_chart,streams
1,"spotify:track:4HYDUMY0xSpeBr0AMY9cUz","Jay Wheeler, DJ Nelson, Myke Towers","La Curiosidad","Linked Music / Dynamic Records / EMPIRE",1,1,22,"225071"
2,"spotify:track:1mohfLaTJtB2RplHLQVM70","Nio Garcia, Anuel AA, Myke Towers, Brray, Juanka","La Jeepeta - Remix","2020 Flow La Movie, Inc. | Powered by GLAD Empire, LLC",1,2,71,"199769"
3,"spotify:track:06s3QtMJVXw1AJX3UfvZG1","Anuel AA, Bad Bunny","Hasta Que Dios Diga","2020 Real Hasta La Muerte, LLC",1,3,36,"175761"
4,"spotify:track:3ZG8N7aWw2meb6UrI5ZmnZ","Sech","Relación","Rich Music",4,5,93,"170595"
5,"spotify:track:2tFwfmceQa1Y6nRPhYbEtC","JHAYCO, Bad Bunny","CÓMO SE SIENTE - Remix","N&E Entertainment LLC",1,4,55,"168668"
6,"spotify:track:50ZC4PM7hywH27RcCfViau","Rauw Alejandro, Dalex, Lenny Tavárez, Dímelo Flow","Elegí (feat. Dímelo Flow)","Sony Music Latin",3,6,99,"155377"
7,"spotify:track:6Hw21Z5CmEV78jrncFpMwz","Harry Nach","Tak Tiki Tak","Sony Music Entertainment Chile S.A",7,8,164,"132217"
8,"spotify:track:4TOmcZvw0gHa7GiXRbcYAW","Feid, Justin Quiles","PORFA","JP Entertainment (Jorge Pino)",4,7,170,"128857"
9,"spotify:track:2DEZmgHKAvm41k4J3R2E9Y","Bad Bunny, Jowell & Randy, Ñengo Flow","Safaera","Rimas Entertainment LLC",1,9,125,"124426"
10,"spotify:track:3gD4J3RUHy4OUuZ3qAiaiG","Ozuna","Caramelo","Aura Music Corp.",10,10,22,"119657"
11,"spotify:track:0SqqAgdovOE24BzxIClpjw","Bad Bunny","Yo Perreo Sola","Rimas Entertainment LLC",2,11,126,"113558"
12,"spotify:track:74j34STf8L6uADnTN69ohv","Rauw Alejandro, Chencho Corleone, KEVVO, Bryant Myers, Lyanno, Dalex","El Efecto - Remix","(SME US Latin) Duars Entertainment, Corp. (2)",10,12,204,"111977"
13,"spotify:track:6yVkakCN460KOVol9ZazjH","Anuel AA","Reggaetonera","2020 Real Hasta La Muerte, LLC",2,13,36,"107169"
14,"spotify:track:380HmhwTE2NJgawn1NwkXi","J Balvin","Rojo","UMLE - Latino",8,15,127,"103437"
15,"spotify:track:0VjIjW4GlUZAMYd2vXMi3b","The Weeknd","Blinding Lights","Republic Records",13,14,189,"101531"
16,"spotify:track:6NfrH0ANGmgBXyxgV2PeXt","Bad Bunny","La Difícil","Rimas Entertainment LLC",1,16,126,"99296"
17,"spotify:track:7lUdbnz7wsv3C9zzf4WHl9","Feid, J Balvin, Maluma, Nicky Jam, Sech, Justin Quiles","PORFA Remix ( Feat. Maluma, Nicky Jam, Sech) - Remix","JP Entertainment (Jorge Pino)",17,25,8,"97377"
18,"spotify:track:0jT8Nl0shPS8115is0wD2Q","Camilo","Favorito","Sony Music Latin",3,17,99,"93901"
19,"spotify:track:3JHpk0DOTOzyh0777JFAky","Myke Towers","Diosa","2020 One World Music & Casablanca Records | Powered by GLAD Empire, LL",7,18,162,"91838"
20,"spotify:track:7na7Bk98usp84FaOJFPv3d","Rauw Alejandro","Tattoo","(SME US Latin) Duars Entertainment, Corp. (2)",7,19,141,"89794"
21,"spotify:track:38RIEav39FGi86jppxO0du","Bad Bunny, Sech","Ignorantes","Rimas Entertainment LLC",1,20,141,"86798"
22,"spotify:track:5stPVcRqb4qixbafP9e8lt","Dalex, Lenny Tavárez, Chencho Corleone, Juhn, Dímelo Flow","Hola - Remix","Rich Music",2,21,246,"86208"
23,"spotify:track:5m3jpKkgkfoMcym1qjToFg","Alex Rose, Rafa Pabön","Jangueo","Los Oidos Fresh/ Los Proximos",13,22,223,"85867"
24,"spotify:track:7sQKy5vlPQllr0k9IjYJv3","Arcángel, Sech, Dímelo Flow","Sigues Con El","Rimas Entertainment LLC.",2,23,204,"83856"
25,"spotify:track:69vlMrzHwATKzupwNcUPyK","Bad Bunny, Daddy Yankee","La Santa","Rimas Entertainment LLC",3,24,126,"81312"
26,"spotify:track:0FktnzDqjClqU6iqOZVEs2","Bad Bunny","BYE ME FUI","Rimas Entertainment LLC",1,26,55,"74442"
27,"spotify:track:4EJHKSnHENfjOxXWryyNtL","Bad Bunny, Zion & Lennox","MÁS DE UNA CITA","Rimas Entertainment LLC",1,27,55,"73309"
28,"spotify:track:2tGENA8xef0wABdHvyXwv9","Lunay, Ozuna, Myke Towers, Chencho Corleone, Rauw Alejandro","La Cama (Remix)","round2media - LaFamilia",20,29,99,"72617"
29,"spotify:track:5bmSver2b3ZXyuyLKtgnFI","Bad Bunny, Nicky Jam","BAD CON NICKY","Rimas Entertainment LLC",3,28,55,"72427"
30,"spotify:track:7k4t7uLgtOxPwTpFmtJNTY","KAROL G, Nicki Minaj","Tusa","TUSA - Karol G & Nicki Minaj",1,31,239,"68178"
31,"spotify:track:3pm4XtcsRIFFtH2UErk62R","Yandel, Bad Bunny","CANCIÓN CON YANDEL","Rimas Entertainment LLC",4,30,55,"66161"
32,"spotify:track:1rgnBhdG2JDFTbYkYRZAku","Tones And I","Dance Monkey","Elektra (NEK)",4,32,270,"64610"
33,"spotify:track:2lCkncy6bIB0LTMT7kvrD1","J Balvin","Azul","UMLE - Latino",29,33,106,"63644"
34,"spotify:track:43NqTeL8pgBxKHPMiJKUP5","Myke Towers","Girl","2020 One World Music & Casablanca Records | Powered by GLAD Empire, LL",4,36,162,"62396"
35,"spotify:track:099tjv6oy2opbpCOA3nBwX","Ir Sais, Rauw Alejandro","Dream Girl - Remix","Sony Music Latin",34,34,180,"62270"
36,"spotify:track:35KmOEIUqAGn02t7n4qaIr","J Balvin","Morado","UMLE - Latino",12,37,176,"61972"
37,"spotify:track:4r9jkMEnArtWGH2rL2FZl0","Bad Bunny","A Tu Merced","Rimas Entertainment LLC",9,38,126,"60170"
38,"spotify:track:5kbps8unnGH4raN5WduZuq","Sech, Daddy Yankee","Confía","Rich Music",28,35,44,"59982"
39,"spotify:track:5eEQCfq7MXQr6aHLNRUZLs","Anuel AA","Keii","2020 Real Hasta La Muerte, LLC",4,39,148,"59552"
40,"spotify:track:2n7ohqg1s68ToAHh4u9mcW","Bad Bunny","Vete","Rimas Entertainment LLC",1,41,226,"59312"
41,"spotify:track:6AzKhCHOms83jvNVLsz0Bt","Aya Nakamura, Maluma","Djadja (feat. Maluma) - Remix","Rec. 118",41,50,18,"59096"
42,"spotify:track:7KKh0ujp8agIiCrkiJhf81","Anuel AA, Tego Calderón","Jangueo","2020 Real Hasta La Muerte, LLC",3,43,36,"56790"
43,"spotify:track:5379uuUPHodsdVhy8pIAAr","Cali Y El Dandee, Sebastian Yatra","Locura","Cali y El Dandee PS",31,44,57,"56681"
44,"spotify:track:3vAn0qZzdyuHamcrpkfiX3","BLACKPINK","How You Like That","YG Entertainment/Interscope Records",29,40,8,"56607"
45,"spotify:track:1sHs87yRloQy0vE9mzpiZB","Juanka","Tus Besos","N&E Entertainment LLC",38,42,73,"56507"
46,"spotify:track:41wtwzCZkXwpnakmwJ239F","Bad Bunny","Si Veo a Tu Mamá","Rimas Entertainment LLC",4,46,126,"54391"
47,"spotify:track:5EbtodsuLbxrFDH6j5avVS","Camilo, Pablo Alborán","El Mismo Aire - con Pablo Alborán","Sony Music Latin",29,45,24,"54183"
48,"spotify:track:56Ta1O7Jxxpjnc6cWdDKUo","Reik, Farruko, Camilo","Si Me Dices Que Sí","Sony Music México",46,47,135,"53236"
49,"spotify:track:6mAN61JH0dzyZpWslS11jy","Rauw Alejandro, Farruko","Fantasias","(SME US Latin) Duars Entertainment, Corp. (2)",1,48,309,"52892"
50,"spotify:track:0OTtnwUO8natNWSwdZvXVF","Ovy On The Drums, Beéle","Inolvidable","WEA Latina",34,49,77,"50231"
51,"spotify:track:4w47S36wQGBhGg073q3nt7","ROSALÍA, Travis Scott","TKN (feat. Travis Scott)","Columbia",32,54,37,"49585"
52,"spotify:track:5IjOqh4XLyjHINuOGolmAt","Eladio Carrion, Zion & Lennox, Wisin & Yandel, Lunay","Mi Error - Remix","Rimas Entertainment LLC",27,53,229,"49239"
53,"spotify:track:0eeKDrQxjqNl5bX5VCHDcn","Justin Quiles, Daddy Yankee, El Alfa","PAM","WEA Latina",50,52,64,"49183"
54,"spotify:track:57Ba26w9eoXx8BBUNgRNLV","Super Yei, Sammy Baby, Jone Quest, Myke Towers, Lenny Tavárez, Rafa Pabön","La Forma en Que Me Miras","2020 Superiority | Powered by GLAD EMPIRE, LLC",54,67,691,"48748"
55,"spotify:track:4R8BJggjosTswLxtkw8V7P","JHAYCO, J Balvin, Bad Bunny","No Me Conoce - Remix","N&E Entertainment LLC",2,56,414,"48413"
56,"spotify:track:24Yi9hE78yPEbZ4kxyoXAI","SAINt JHN, Imanbek","Roses - Imanbek Remix","Columbia/B1 Recordings",51,55,104,"48378"
57,"spotify:track:4QfZYDhGZc0T2RDvGiI69E","El Alfa, Chael Produciendo","Singapur","EL JEFE RECORDS LLC",55,57,15,"48344"
58,"spotify:track:4Pu0a2TuHOYtI4CCE3HEXI","Arcángel, Sech, Romeo Santos","Sigues Con El - Remix","Rimas Entertainment LLC.",20,58,85,"47607"
59,"spotify:track:5Xe78U9cUwnWOuWbgYvAKZ","Eix, Rauw Alejandro, Noriel, KEVVO, Brytiago, Jay Wheeler","Infiel - Remix","Duars Entertainment, LLC",59,97,2,"47438"
60,"spotify:track:7eJMfftS33KTjuF7lTsMCx","Powfu, beabadoobee","death bed (coffee for your head)","Columbia",36,51,111,"47334"
61,"spotify:track:3jbT1Y5MoPwEIpZndDDwVq","Tainy, Anuel AA, Ozuna","Adicto (with Anuel AA & Ozuna)","NEON16/Interscope Records",1,59,317,"47264"
62,"spotify:track:6zEgnpM0qYmHLDnh8WPejL","J Balvin","Amarillo","UMLE - Latino",17,61,106,"46630"
63,"spotify:track:0KkIkfsLEJbrcIhYsCL7L5","Anuel AA, Daddy Yankee, KAROL G, Ozuna, J Balvin","China","2020 Real Hasta La Muerte, LLC",1,60,351,"46398"
64,"spotify:track:0A37XY67wSdGqkGjtfW6aV","Rauw Alejandro, Anuel AA, NATTI NATASHA, Farruko, Lunay","Fantasias - Remix","(SME US Latin) Duars Entertainment, Corp. (2)",24,63,120,"45278"
65,"spotify:track:5XqCz18k96K8tx6DAYM97i","Bad Bunny, Don Omar","PA' ROMPERLA","Rimas Entertainment LLC",4,66,55,"44898"
66,"spotify:track:6UelLqGlWMcVH1E5c4H7lY","Harry Styles","Watermelon Sugar","Columbia",59,62,55,"44891"
67,"spotify:track:113PlnpZbHd3WIqeYjhZWv","Daddy Yankee, Sech","Definitivamente","El Cartel Records (EC3)",13,69,155,"44844"
68,"spotify:track:0pgj4EzB1XRqgZemoMNG5D","Camilo, Evaluna Montaner","Por Primera Vez","Sony Music Latin",24,64,116,"44620"
69,"spotify:track:46V4kseB66GjFGklCgynGX","Casper Magico, Anuel AA","Sola & Vacía","2020 Flow La Movie, Inc. & Los Magicos, LLC | Powered by GLAD Empire,",29,65,78,"44003"
70,"spotify:track:0fea68AdmYNygeTGI4RC18","J Balvin, Bad Bunny","LA CANCIÓN","Universal Music Latino / Rimas",4,71,372,"43973"
71,"spotify:track:4xI3U4sDj1TPmO9Iz5TkYp","El Alfa, Darell, Noriel","4K","EL JEFE RECORDS LLC",41,70,113,"43812"
72,"spotify:track:3PfIrDoz19wz7qK7tYeu62","Dua Lipa","Don't Start Now","Warner Records",20,68,246,"43359"
73,"spotify:track:6C1jKbkCUgFws7M0M4oGCB","Dalex, Sech","Mejor","Rich Music",26,72,148,"42836"
74,"spotify:track:7kOf0qHO4Rcwk6QJifZDRJ","Anuel AA","El Manual","2020 Real Hasta La Muerte, LLC",27,74,36,"41341"
75,"spotify:track:4GGwM2Krtlx9G9ii1RaEOx","Dalex, Lenny Tavárez, Anitta, NATTI NATASHA, Farruko, Justin Quiles","Bellaquita (Remix)","Rich Music",11,73,225,"41186"
76,"spotify:track:4SJHHpKhcuXwDsCsPqshXj","Rauw Alejandro, Chencho Corleone","El Efecto","Duars Entertainment, Corp.",63,75,433,"39827"
77,"spotify:track:34LI7rwi9H8w2S5KTHnv1M","Manuel Turizo","Quiéreme Mientras Se Pueda","Sony Music Latin/La Industria",71,76,64,"38777"
78,"spotify:track:7mcdgAXmb35dakBnfDIv3q","Anuel AA","Narcos","2020 Real Hasta La Muerte, LLC",12,77,36,"38670"
79,"spotify:track:2TH65lNHgvLxCKXM3apjxI","Bad Bunny, Tainy","Callaita","Rimas Entertainment LLC",1,78,400,"37242"
80,"spotify:track:5Id5B3dxJZhPcV9GzgYZZe","Rich Music LTD, Sech, Dalex, Justin Quiles, Lenny Tavárez, Feid, Wisin, Zion","Quizas","Rich Music",3,79,288,"36551"
81,"spotify:track:466cKvZn1j45IpxDdYZqdA","Drake","Toosie Slide","OVO",54,80,92,"36184"
82,"spotify:track:634fDJYRCr5yzqfFWa9rfS","Paloma Mami","Goteo","Sony Music Latin",9,81,65,"36083"
83,"spotify:track:1V8XneTrX6kKeoxYbk4x6h","Bad Bunny, Duki, Pablo Chill-E","Hablamos Mañana","Rimas Entertainment LLC",4,82,126,"35735"
84,"spotify:track:3FhiU60cxfN2j4jRy5Y40w","Cauty, Lenny Tavarez, Jay Wheeler, Noriel, Alex Rose","Lloras - Remix","eOne Music",75,83,131,"35346"
85,"spotify:track:37zdqI4r1gswIzczSBkRon","Lunay, Anuel AA, Ozuna","Aventura","round2media - LaFamilia",1,85,253,"34705"
86,"spotify:track:1Ol5LmdNDNpFu1oNwfgkux","Camilo, Pedro Capó","Tutu","Sony Music Latin",6,87,330,"34337"
87,"spotify:track:4VgYtXCVJ7IbWAZ5ryfvEQ","Nicky Jam, Daddy Yankee","Muévelo","Sony Music Latin",8,89,178,"34280"
88,"spotify:track:4MWb6mltydQn84NrTm7Gpl","Micro TDH, Rels B, Lenny Tavárez, Justin Quiles","Dime Cuantas Veces (Remix) [feat. Justin Quiles]","WEA Latina",76,84,9,"34091"
89,"spotify:track:6nGM44ZP7vSo0istUW2MOq","Farruko, Beéle, NATTI NATASHA, Manuel Turizo","Loco - Remix","Hear This Music",64,86,71,"33767"
90,"spotify:track:10u2iOS0r6plfb9GknD7g4","Rauw Alejandro, Myke Towers, Sky Rompiendo","Ponte Pa' Mi","(SME US Latin) Duars Entertainment, Corp. (2)",78,88,78,"33621"
91,"spotify:track:4j4w4CXm6BSr0s25wAWrrX","Bad Bunny, Yaviah","Bichiyal","Rimas Entertainment LLC",9,91,126,"33309"
92,"spotify:track:50ITehqoAuygfVlmG6FxO8","Harry Nach","Fixona","Only Perk",92,-1,1,"33307"
93,"spotify:track:52zq2a71SGs3f1vJuv59ui","Juanfran","Como Llora","DN7 Music",82,90,64,"33243"
94,"spotify:track:2w1rq80FIrbxeJy9WYURxw","KAROL G, Anuel AA","Follow","UMLE - Latino",18,95,93,"33175"
95,"spotify:track:3jjujdWJ72nww5eGnfs2E7","Harry Styles","Adore You","Columbia",86,92,135,"33089"
96,"spotify:track:24IgCW19L8lXKyFZwzFtD3","Black Eyed Peas, Ozuna, J. Rey Soul","MAMACITA","Epic",94,94,78,"32882"
97,"spotify:track:017PF4Q3l4DBUiWoXk4OWT","Dua Lipa","Break My Heart","Warner Records",49,93,100,"32521"
98,"spotify:track:35wvL50xvKpCHEJPxLOLPI","Bad Bunny","Si Estuviésemos Juntos","Rimas Entertainment LLC",7,98,557,"32031"
99,"spotify:track:3l6Dc2DvpzEXJxnRTX5JUd","Nio Garcia, Bryant Myers, Lenny Tavárez, Miky Woodz, Jay Wheeler","Nocturna - Remix","2020 Flow La Movie Inc. | Distributed by GLAD Empire, LLC",76,100,126,"31724"
100,"spotify:track:6K5BsR04ijf3FHNzjbaagD","Myke Towers, Farruko, Arcángel, Sech, Zion","Si Se Da - Remix","2019 Casablanca Records & One World Music | Distributed by GLAD Empire",5,103,337,"31717"
101,"spotify:track:1aUGxXCz9QimNkKeiJtzZ7","KEVVO, Farruko, Chencho Corleone, Arcángel, Darell, Ñengo Flow, Brytiago, Myke Towers","105 F Remix","Una Vision Quintana",7,105,296,"31561"
102,"spotify:track:0HMTIZ3iQ6QNjBaD9IE7ZZ","JHAYCO","Dime A Ve","N&E Entertainment LLC",102,-1,1,"31534"
103,"spotify:track:7ju97lgwC2rKQ6wwsf9no9","Lady Gaga, Ariana Grande","Rain On Me (with Ariana Grande)","Interscope",25,96,43,"31498"
104,"spotify:track:4z6wo6PJG4Fve45OXK6D9m","Arcángel, Bad Bunny","Infeliz","Rimas Entertainment LLC.",17,106,197,"31466"
105,"spotify:track:1ndyl3wJCFs872XZ3ztPk6","Justin Quiles, NATTI NATASHA, Farruko, Lenny Tavárez, Dalex, Zion","DJ No Pare (feat. Zion, Dalex, Lenny Tavárez) - Remix","WEA Latina",19,101,302,"31291"
106,"spotify:track:4RaWbMItxVbuUExNkFsITP","Nio Garcia, Brray, Juanka","La Jeepeta","2019 Flow La Movie, Inc. | Distributed by GLAD Empire, LLC.",34,104,176,"31265"
107,"spotify:track:3Dv1eDb0MEgF93GpLXlucZ","Doja Cat","Say So","Kemosabe Records/RCA Records",59,99,149,"31073"
108,"spotify:track:4t9a07PAghtQMRAIP9FQ7Z","Lunay, Daddy Yankee, Bad Bunny","Soltera (Remix)","round2media - LaFamilia",2,102,421,"31025"
109,"spotify:track:7sKDftgGirHWTVFMtJoDoh","Aya Nakamura","Djadja","Rec. 118",93,107,90,"29872"
110,"spotify:track:70zg99pT51vB4wlMS7e4q7","Myke Towers, Maluma, Farruko","La Playa - Remix","2019 Casablanca Records & One World Music | Distributed by GLAD Empire",33,112,183,"29311"
111,"spotify:track:53uKGbcMjEc2gIWbfmvpdS","Nio Garcia, Rauw Alejandro, Lenny Tavárez, Myke Towers, Casper Magico, Darell","Mírame - Remix","2019 Flow La Movie, Inc. | Distributed by GLAD Empire, LLC.",17,109,351,"29271"
112,"spotify:track:5J7teKIJGtqVypgYI6sqXj","Bad Bunny, Mora","Una Vez","Rimas Entertainment LLC",15,108,126,"29192"
113,"spotify:track:5Xhqh4lwJPtMUTsdBztN1a","Shakira, Anuel AA","Me Gusta","Sony Music Latin",9,110,173,"29077"
114,"spotify:track:27uAea0qcUz3a7jKnAT7KG","Santaferia","Algún Día Volverás","Santaferia",20,118,715,"29006"
115,"spotify:track:4NCsrTzgVfsDo8nWyP8PPc","Black Eyed Peas, J Balvin","RITMO (Bad Boys For Life)","Epic",4,111,266,"28961"
116,"spotify:track:4bTZeO72FwMa6wKOiqoynL","Sech, Ozuna, Anuel AA, Darell, Nicky Jam","Otro Trago - Remix","Rich Music",1,113,344,"28723"
117,"spotify:track:2pWOMNQJW3g2zmGjP0Vkb0","Nicky Jam, Anuel AA","Whine Up","Sony Music Latin",4,115,249,"28435"
118,"spotify:track:3qM0vBxIe4VUbK0Z0smuVP","JHAYCO, Anuel AA, J Balvin","Medusa","N&E Entertainment LLC",24,117,150,"27877"
119,"spotify:track:5YrjfKuFd0pMmYTGeRDV6X","Noriel","Piropo","Sony Music Latin/Ganda Entertainment",23,119,252,"27437"
120,"spotify:track:5cBrOhKDyiJF9bPGUHKkG0","Dalex","+Linda","Rich Music",114,114,40,"27410"
121,"spotify:track:6Bd9rs5gv25asdPDRog3ce","Javiielo","Pa Los Gustos Los Colores","Oye Saavedra / EMPIRE",40,120,264,"27403"
122,"spotify:track:4s45VgkknMFkdiGoUcjxQU","Sebastian Yatra, Rauw Alejandro, Manuel Turizo","TBT","UMLE - Latino",57,126,134,"27396"
123,"spotify:track:2aGN6PplBq0xigh2lmqLbw","Sech, Ozuna","Si Te Vas","Rich Music",5,116,282,"27236"
124,"spotify:track:2w8SKQCnT2YQK1qCqKl2uW","Lenny Tavárez, Justin Quiles","La Pared 360","WEA Latina",86,124,148,"27111"
125,"spotify:track:7g8YaUQABMal0zWe7a2ijz","Dalex, Rafa Pabön, KHEA, Sech, Feid, Cazzu, Lenny Tavárez","Pa Mí (Remix)","Rich Music/Ingrooves Records",2,121,512,"26351"
126,"spotify:track:34ZngZgo8xicbt1EE8Ob8Z","Rich Music LTD, Sech, Dalex, Justin Quiles, Lenny Tavárez, Feid","Porno","Rich Music",53,122,267,"26208"
127,"spotify:track:47ZS1OjnJpJVfGN9yHXfMn","Alex Rose, Rauw Alejandro, Lenny Tavárez, Cazzu, Lyanno","Toda (Remix)","Los Oídos Fresh",8,123,270,"26157"
128,"spotify:track:2CoMYp2uIKsT09nreEZnZn","Bad Bunny","BENDICIONES","Rimas Entertainment LLC",7,125,55,"25672"
129,"spotify:track:2hDe0Ls5mVqs1XJqv7sbcM","Anuel AA, Enrique Iglesias","Fútbol & Rumba (feat. Enrique Iglesias)","2020 Real Hasta La Muerte, LLC",15,127,36,"25349"
130,"spotify:track:7fODjB7BrQTGqh0hogW6XD","Sech, Justin Quiles, Maluma, Nicky Jam, Farruko, Dalex, Lenny Tavárez","Que Mas Pues - Remix","Rich Music/Ingrooves Records",7,130,450,"25163"
131,"spotify:track:16DNJ8y6k97DxuMyV49W7V","KHEA","Dónde Estás","Young Flex - Khea",61,140,142,"25053"
132,"spotify:track:3SDvcxPcU7BlV1dAne4dWM","Play-N-Skillz, Daddy Yankee, Zion & Lennox","Bésame","Sony Music Latin/Latium Records",95,142,15,"24774"
133,"spotify:track:1A9PKAFEHMWgXNLpgf7k4J","Myke Towers","Piensan","2020 One World Music & Casablanca Records | Powered by GLAD Empire, LL",14,135,295,"24765"
134,"spotify:track:7f5SeKPwJm4eM4GcngH2SX","Juanka","Cárcel","N&E Entertainment LLC",119,128,29,"24614"
135,"spotify:track:6NfC2FKfsfzuLIF4lThw0A","Anuel AA, Bad Bunny","Así Soy Yo","2020 Real Hasta La Muerte, LLC",5,129,36,"24591"
136,"spotify:track:6RyaV7owmVU6fzEPE17sF1","Daddy Yankee","Que Tire Pa Lante","El Cartel Records (EC3)",5,134,260,"24248"
137,"spotify:track:56f5qnyAlZdlz8wrUDA50h","Mau y Ricky, Manuel Turizo, Camilo","Desconocidos","Sony Music Latin",9,132,628,"24221"
138,"spotify:track:3dJWIbkKEnI0Jb9CK6kdcg","JHAYCO, Wisin & Yandel","Imaginaste - Remix","N&E Entertainment LLC",26,137,246,"24126"
139,"spotify:track:7ytR5pFWmSjzHJIeQkgog4","DaBaby, Roddy Ricch","ROCKSTAR (feat. Roddy Ricch)","South Coast Music Group/Interscope Records",131,133,17,"24074"
140,"spotify:track:5NOHsDSfLIH45y3i9PfRyh","Casper Magico, Bryant Myers, Alex Rose, Juhn","Fantasmita - Remix","2019 Flow La Movie, Inc & Los Magicos",55,131,211,"24027"
141,"spotify:track:3cUE3p7E39CzGjQoEsg7sM","Santaferia","EL Gil De Tu Ex","Santaferia",21,153,1065,"23715"
142,"spotify:track:0zlnHTHiBQ68ZCAmTw5ozm","Rauw Alejandro","Algo Mágico","Sony Music Latin/Duars Entertainment",131,150,8,"23697"
143,"spotify:track:6Xfz4YNwwIcFRyfW3QQZVp","Ceaese, Utopiko, Polimá Westcoast, Young Cister","Te Quiero Ver (feat. Polimá Westcoast y Young Cister)","WM Chile",31,136,559,"23479"
144,"spotify:track:0RDgqtvOHLwcI6yz9bjsZV","Rich Music LTD, Sech, Dalex, Justin Quiles, Lenny Tavárez, Feid","Perreo en La Luna","Rich Music",22,148,267,"23433"
145,"spotify:track:2B94bbI1a4LyBpK1439oP7","Noriel, Myke Towers, Rauw Alejandro, Almighty","Cuerpo en Venta","Rimas Entertainment LLC",11,139,330,"23410"
146,"spotify:track:5p3JJehpKHjr9pJT5eD2Lz","Anuel AA, Farruko, Zion","Que Se Joda","2020 Real Hasta La Muerte, LLC",10,138,36,"23283"
147,"spotify:track:25ZAibhr3bdlMCLmubZDVt","J Balvin, Bad Bunny","QUE PRETENDES","Universal Music Latino / Rimas",5,141,372,"23064"
148,"spotify:track:75pQqzwgCjUOSSy5CpmAjy","Bad Bunny","Pero Ya No","Rimas Entertainment LLC",6,143,126,"23027"
149,"spotify:track:1OW47kPsWJfvhcQ7V7XwhC","Myke Towers, Yandel","Mayor","2020 White World Music | Powered by GLAD Empire, LLC",110,145,22,"22800"
150,"spotify:track:4DpNNXFMMxQEKl7r0ykkWA","Melanie Martinez","Play Date","Atlantic Records",119,144,54,"22723"
151,"spotify:track:7MCFjPDImfjQv7GynHgVrR","Nicki Nicole","Colocao","Sony Music Latin/DALE PLAY Records",136,154,39,"22643"
152,"spotify:track:2dy3TKVDEbIeWxeIb8JWqZ","NATTI NATASHA, Romeo Santos","La Mejor Versión de Mi - Remix","Pina Records",86,147,273,"22641"
153,"spotify:track:3DyiAk1BzIF8rq9rimypG4","Anuel AA, Cardi B, Black Jonas Point, Secreto ""El Famoso Biberon"", Liro Shaq","La Bebe - Remix","2020 GLAD Empire, LLC & Flow La Movie, Inc.",115,146,32,"22499"
154,"spotify:track:6v3KW9xbzN5yKLt9YKDYA2","Shawn Mendes, Camila Cabello","Señorita","Island Records",11,152,379,"22428"
155,"spotify:track:29KkQi7wKF6IdOjwU8infb","El Alfa, Nicky Jam, Ozuna, Arcángel, Secreto ""El Famoso Biberon""","A Correr Los Lakers - Remix","EL JEFE RECORDS LLC",155,-1,1,"22232"
156,"spotify:track:4VohsQwrtb7lj1yO0dFKJa","Tommy Boysen","Hookah & Sheridan's","Equity Distribution",12,159,654,"22210"
157,"spotify:track:7BEPdOI0neT6p7PnLViqmH","Morat, Sebastian Yatra","Bajo La Mesa","Universal Music Spain S.L.",39,151,43,"22191"
158,"spotify:track:5kQre7o8ky5DXeEPcyaCR1","Prince Royce, Myke Towers","Carita de Inocente (feat. Myke Towers) - Remix","Sony Music Latin",146,149,14,"21803"
159,"spotify:track:2btKz4s1XrMn5VHe7xZJpi","NATTI NATASHA","Que Mal Te Fue","Pina Records",135,156,29,"21725"
160,"spotify:track:059bcIhyc2SBwm6sw2AZzd","Piso 21, Micro TDH","Te Vi","WM Mexico",17,160,562,"21688"
161,"spotify:track:7szuecWAPwGoV1e5vGu8tl","The Weeknd","In Your Eyes","Republic Records",111,157,99,"21604"
162,"spotify:track:53v2u51nq3CxiKUNphRzP1","Bad Bunny, Ñengo Flow","Que Malo","Rimas Entertainment LLC",11,155,126,"21597"
163,"spotify:track:5iwz1NiezX7WWjnCgY5TH4","Pedro Capó, Farruko","Calma - Remix","Sony Music Latin",1,164,635,"21525"
164,"spotify:track:5jW3rF4URMdK7tO2xjS5EI","Paulo Londra","Tal Vez","WEA Latina",5,172,456,"21501"
165,"spotify:track:4lzxJ4jCuFDXXGkE1LmpKR","DJ Luian, Mambo Kingz, Anuel AA, Nicky Jam, Darell, Brytiago","Verte Ir","Hear This Music",1,165,464,"21491"
166,"spotify:track:7q3NthaBqFI6s0WnAlnIvq","Darell, Brytiago","Velitas","Sony Music Latin",36,167,358,"21315"
167,"spotify:track:6ifUES3keWjwXgae8pXI3o","Danny Ocean","Me Rehúso","Atlantic Records",1,163,1199,"21202"
168,"spotify:track:1JSTJqkT5qHq8MDJnJbRE1","The Police","Every Breath You Take","Polydor Records",138,166,236,"21187"
169,"spotify:track:2vrpcQNg6itmgVZWsNjWe0","Sebastian Yatra, Reik","Un Año","UMLE - Latino",9,171,533,"21165"
170,"spotify:track:4u7EnebtmKWzUH433cf5Qv","Queen","Bohemian Rhapsody - Remastered 2011","EMI",26,170,708,"21086"
171,"spotify:track:2qG5sZ7Si6sdK74qLxedYM","ROSALÍA, J Balvin, El Guincho","Con Altura","Columbia",12,169,463,"20858"
172,"spotify:track:1xQ6trAsedVPCdbtDAmk0c","Jawsh 685, Jason Derulo","Savage Love (Laxed - Siren Beat)","Columbia",172,180,5,"20803"
173,"spotify:track:6G4U9avyBNEfP0fAIduev3","Aventura, Don Omar","Ella Y Yo - Featuring Don Omar","Premium Latin Music",131,178,346,"20706"
174,"spotify:track:7qEHsqek33rTcFNT9PFqLf","Lewis Capaldi","Someone You Loved","Vertigo Berlin",141,161,46,"20617"
175,"spotify:track:0G0p7mc4wEaQTsUpzEmkEs","Reik, Morat","La Bella y la Bestia","Sony Music México",123,162,20,"20588"
176,"spotify:track:7MRU4vOkywuhZ9kbFiPuiu","Daddy Yankee, Wisin & Yandel","Si Supieras","El Cartel Records (EC3)",6,182,364,"20483"
177,"spotify:track:1LiN0Z98FkR1t0m8KmLcAH","Anuel AA, Haze","Amanece","House of Haze",2,173,568,"20480"
178,"spotify:track:6fNJm8sYmCBbmkKpKgTReA","Camilo","La Difícil","Sony Music Latin",55,174,174,"20450"
179,"spotify:track:62aP9fBQKYKxi7PDXwcUAS","Surf Mesa, Emilee","ily (i love you baby) (feat. Emilee)","Astralwerks",147,168,45,"20433"
180,"spotify:track:7z0cli6eF13Ew8ARrDgGHJ","KHEA, Piso 21","Dónde Estás (with Piso 21) - Remix","Young Flex - Khea",180,-1,1,"20405"
181,"spotify:track:4o1DxRjMCHDwBiOKv88rOl","Rvssian, Darell, Zion & Lennox, Myke Towers","B11 (feat. Myke Towers)","Sony Music Latin",14,177,289,"20335"
182,"spotify:track:7anSoGdgtmJTAPZBzcPhO6","Dalex, Nicky Jam, Justin Quiles, Sech, Lenny Tavárez, Feid, Rafa Pabön","Cuaderno","Rich Music/Ingrooves Records",5,183,419,"20287"
183,"spotify:track:2gMXnyrvIjhVBUZwvLZDMP","Lewis Capaldi","Before You Go","Vertigo Berlin",158,158,4,"20236"
184,"spotify:track:7BlBVFwvbWvcwNcUarQmjk","ROSALÍA, Ozuna","Yo x Ti, Tu x Mi","Columbia",9,192,290,"20155"
185,"spotify:track:71oz9Wgbrm873aMlVBrDKR","Nicky Jam, Carla Morrison","Desahogo (feat. Carla Morrison)","Sony Music Latin",185,-1,1,"20128"
186,"spotify:track:3OVMfEILPtNyvtvxBm1jqE","Kiddtetoon, Diego Smith","Illuminati","Duetti (Migration)",176,188,6,"20090"
187,"spotify:track:0VKkyBKCXyR99navhVRqcP","Zion & Lennox","La player (Bandolera)","WEA Latina",1,194,753,"20024"
188,"spotify:track:5w9c2J52mkdntKOmRLeM2m","Daddy Yankee, Snow","Con Calma","El Cartel Records (EC3)",1,193,494,"19980"
189,"spotify:track:3eJMSq78dDaFb7VvhNFnq6","Maluma","ADMV","Sony Music Latin",127,176,46,"19974"
190,"spotify:track:1Ej96GIBCTvgH7tNX1r3qr","Sech, Darell","Otro Trago","Rich Music/Ingrooves Records",1,187,434,"19944"
191,"spotify:track:19VunfeIrl0bx984mJ810c","Dalex, Sech, Justin Quiles","Perfume","Rich Music",55,189,120,"19764"
192,"spotify:track:7sOfmPd18RWp3FoCzpa7Kw","Bad Bunny","Soliá","Rimas Entertainment LLC",10,186,126,"19698"
193,"spotify:track:2rRJrJEo19S2J82BDsQ3F7","Trevor Daniel","Falling","Alamo",94,179,197,"19667"
194,"spotify:track:1IWNylpZ477gIVUDpJL66u","Lady Gaga, BLACKPINK","Sour Candy (with BLACKPINK)","Interscope",39,175,37,"19603"
195,"spotify:track:132ALUzVLmqYB4UsBj5qD6","Paulo Londra","Adan y Eva","WEA Latina",1,191,603,"19482"
196,"spotify:track:2xLMifQCjDGFmkHkpNLD9h","Travis Scott","SICKO MODE","Cactus Jack / Epic",35,198,73,"19480"
197,"spotify:track:59s0s39NFWScuHDbHytI14","Reik, J Balvin, Lalo Ebratt","Indeciso","Indeciso",29,-1,305,"19386"
198,"spotify:track:0tgVpDi06FyKpA1z0VMD4v","Ed Sheeran","Perfect","Atlantic Records UK",55,181,959,"19358"
199,"spotify:track:3f5lA8nnc4YYF1qf78WpHw","Anuel AA, Romeo Santos","Ella Quiere Beber - Remix","Real Hasta La Muerte, LLC",8,-1,535,"19264"
