rank,uri,artist_names,track_name,source,peak_rank,previous_rank,days_on_chart,streams
1,"spotify:track:4HYDUMY0xSpeBr0AMY9cUz","Jay Wheeler, DJ Nelson, Myke Towers","La Curiosidad","Linked Music / Dynamic Records / EMPIRE",1,1,23,"208953"
2,"spotify:track:1mohfLaTJtB2RplHLQVM70","Nio Garcia, Anuel AA, Myke Towers, Brray, Juanka","La Jeepeta - Remix","2020 Flow La Movie, Inc. | Powered by GLAD Empire, LLC",1,2,72,"187914"
3,"spotify:track:06s3QtMJVXw1AJX3UfvZG1","Anuel AA, Bad Bunny","Hasta Que Dios Diga","2020 Real Hasta La Muerte, LLC",1,3,37,"160774"
4,"spotify:track:3ZG8N7aWw2meb6UrI5ZmnZ","Sech","Relación","Rich Music",4,4,94,"157926"
5,"spotify:track:2tFwfmceQa1Y6nRPhYbEtC","JHAYCO, Bad Bunny","CÓMO SE SIENTE - Remix","N&E Entertainment LLC",1,5,56,"155150"
6,"spotify:track:50ZC4PM7hywH27RcCfViau","Rauw Alejandro, Dalex, Lenny Tavárez, Dímelo Flow","Elegí (feat. Dímelo Flow)","Sony Music Latin",3,6,100,"141323"
7,"spotify:track:6Hw21Z5CmEV78jrncFpMwz","Harry Nach","Tak Tiki Tak","Sony Music Entertainment Chile S.A",7,7,165,"123271"
8,"spotify:track:4TOmcZvw0gHa7GiXRbcYAW","Feid, Justin Quiles","PORFA","JP Entertainment (Jorge Pino)",4,8,171,"115729"
9,"spotify:track:2DEZmgHKAvm41k4J3R2E9Y","Bad Bunny, Jowell & Randy, Ñengo Flow","Safaera","Rimas Entertainment LLC",1,9,126,"114218"
10,"spotify:track:3gD4J3RUHy4OUuZ3qAiaiG","Ozuna","Caramelo","Aura Music Corp.",10,10,23,"111661"
11,"spotify:track:0SqqAgdovOE24BzxIClpjw","Bad Bunny","Yo Perreo Sola","Rimas Entertainment LLC",2,11,127,"106018"
12,"spotify:track:74j34STf8L6uADnTN69ohv","Rauw Alejandro, Chencho Corleone, KEVVO, Bryant Myers, Lyanno, Dalex","El Efecto - Remix","(SME US Latin) Duars Entertainment, Corp. (2)",10,12,205,"101931"
13,"spotify:track:6yVkakCN460KOVol9ZazjH","Anuel AA","Reggaetonera","2020 Real Hasta La Muerte, LLC",2,13,37,"99729"
14,"spotify:track:380HmhwTE2NJgawn1NwkXi","J Balvin","Rojo","UMLE - Latino",8,14,128,"94500"
15,"spotify:track:0VjIjW4GlUZAMYd2vXMi3b","The Weeknd","Blinding Lights","Republic Records",13,15,190,"92399"
16,"spotify:track:7lUdbnz7wsv3C9zzf4WHl9","Feid, J Balvin, Maluma, Nicky Jam, Sech, Justin Quiles","PORFA Remix ( Feat. Maluma, Nicky Jam, Sech) - Remix","JP Entertainment (Jorge Pino)",16,17,9,"90505"
17,"spotify:track:6NfrH0ANGmgBXyxgV2PeXt","Bad Bunny","La Difícil","Rimas Entertainment LLC",1,16,127,"90292"
18,"spotify:track:0jT8Nl0shPS8115is0wD2Q","Camilo","Favorito","Sony Music Latin",3,18,100,"85546"
19,"spotify:track:3JHpk0DOTOzyh0777JFAky","Myke Towers","Diosa","2020 One World Music & Casablanca Records | Powered by GLAD Empire, LL",7,19,163,"84147"
20,"spotify:track:7na7Bk98usp84FaOJFPv3d","Rauw Alejandro","Tattoo","(SME US Latin) Duars Entertainment, Corp. (2)",7,20,142,"82148"
21,"spotify:track:5m3jpKkgkfoMcym1qjToFg","Alex Rose, Rafa Pabön","Jangueo","Los Oidos Fresh/ Los Proximos",13,23,224,"78790"
22,"spotify:track:38RIEav39FGi86jppxO0du","Bad Bunny, Sech","Ignorantes","Rimas Entertainment LLC",1,21,142,"78055"
23,"spotify:track:5stPVcRqb4qixbafP9e8lt","Dalex, Lenny Tavárez, Chencho Corleone, Juhn, Dímelo Flow","Hola - Remix","Rich Music",2,22,247,"76474"
24,"spotify:track:7sQKy5vlPQllr0k9IjYJv3","Arcángel, Sech, Dímelo Flow","Sigues Con El","Rimas Entertainment LLC.",2,24,205,"74960"
25,"spotify:track:69vlMrzHwATKzupwNcUPyK","Bad Bunny, Daddy Yankee","La Santa","Rimas Entertainment LLC",3,25,127,"73844"
26,"spotify:track:2tGENA8xef0wABdHvyXwv9","Lunay, Ozuna, Myke Towers, Chencho Corleone, Rauw Alejandro","La Cama (Remix)","round2media - LaFamilia",20,28,100,"67395"
27,"spotify:track:0FktnzDqjClqU6iqOZVEs2","Bad Bunny","BYE ME FUI","Rimas Entertainment LLC",1,26,56,"67347"
28,"spotify:track:4EJHKSnHENfjOxXWryyNtL","Bad Bunny, Zion & Lennox","MÁS DE UNA CITA","Rimas Entertainment LLC",1,27,56,"66367"
29,"spotify:track:5bmSver2b3ZXyuyLKtgnFI","Bad Bunny, Nicky Jam","BAD CON NICKY","Rimas Entertainment LLC",3,29,56,"65899"
30,"spotify:track:7k4t7uLgtOxPwTpFmtJNTY","KAROL G, Nicki Minaj","Tusa","TUSA - Karol G & Nicki Minaj",1,30,240,"63981"
31,"spotify:track:3pm4XtcsRIFFtH2UErk62R","Yandel, Bad Bunny","CANCIÓN CON YANDEL","Rimas Entertainment LLC",4,31,56,"59878"
32,"spotify:track:1rgnBhdG2JDFTbYkYRZAku","Tones And I","Dance Monkey","Elektra (NEK)",4,32,271,"59036"
33,"spotify:track:2lCkncy6bIB0LTMT7kvrD1","J Balvin","Azul","UMLE - Latino",29,33,107,"57894"
34,"spotify:track:4r9jkMEnArtWGH2rL2FZl0","Bad Bunny","A Tu Merced","Rimas Entertainment LLC",9,37,127,"57885"
35,"spotify:track:6AzKhCHOms83jvNVLsz0Bt","Aya Nakamura, Maluma","Djadja (feat. Maluma) - Remix","Rec. 118",35,41,19,"57232"
36,"spotify:track:43NqTeL8pgBxKHPMiJKUP5","Myke Towers","Girl","2020 One World Music & Casablanca Records | Powered by GLAD Empire, LL",4,34,163,"56889"
37,"spotify:track:099tjv6oy2opbpCOA3nBwX","Ir Sais, Rauw Alejandro","Dream Girl - Remix","Sony Music Latin",34,35,181,"56720"
38,"spotify:track:35KmOEIUqAGn02t7n4qaIr","J Balvin","Morado","UMLE - Latino",12,36,177,"56043"
39,"spotify:track:5kbps8unnGH4raN5WduZuq","Sech, Daddy Yankee","Confía","Rich Music",28,38,45,"54501"
40,"spotify:track:2n7ohqg1s68ToAHh4u9mcW","Bad Bunny","Vete","Rimas Entertainment LLC",1,40,227,"53201"
41,"spotify:track:5eEQCfq7MXQr6aHLNRUZLs","Anuel AA","Keii","2020 Real Hasta La Muerte, LLC",4,39,149,"52809"
42,"spotify:track:7KKh0ujp8agIiCrkiJhf81","Anuel AA, Tego Calderón","Jangueo","2020 Real Hasta La Muerte, LLC",3,42,37,"52524"
43,"spotify:track:1sHs87yRloQy0vE9mzpiZB","Juanka","Tus Besos","N&E Entertainment LLC",38,45,74,"52251"
44,"spotify:track:5379uuUPHodsdVhy8pIAAr","Cali Y El Dandee, Sebastian Yatra","Locura","Cali y El Dandee PS",31,43,58,"50736"
45,"spotify:track:41wtwzCZkXwpnakmwJ239F","Bad Bunny","Si Veo a Tu Mamá","Rimas Entertainment LLC",4,46,127,"49915"
46,"spotify:track:3vAn0qZzdyuHamcrpkfiX3","BLACKPINK","How You Like That","YG Entertainment/Interscope Records",29,44,9,"48298"
47,"spotify:track:5EbtodsuLbxrFDH6j5avVS","Camilo, Pablo Alborán","El Mismo Aire - con Pablo Alborán","Sony Music Latin",29,47,25,"47679"
48,"spotify:track:56Ta1O7Jxxpjnc6cWdDKUo","Reik, Farruko, Camilo","Si Me Dices Que Sí","Sony Music México",46,48,136,"47456"
49,"spotify:track:6mAN61JH0dzyZpWslS11jy","Rauw Alejandro, Farruko","Fantasias","(SME US Latin) Duars Entertainment, Corp. (2)",1,49,310,"47414"
50,"spotify:track:4QfZYDhGZc0T2RDvGiI69E","El Alfa, Chael Produciendo","Singapur","EL JEFE RECORDS LLC",50,57,16,"46464"
51,"spotify:track:57Ba26w9eoXx8BBUNgRNLV","Super Yei, Sammy Baby, Jone Quest, Myke Towers, Lenny Tavárez, Rafa Pabön","La Forma en Que Me Miras","2020 Superiority | Powered by GLAD EMPIRE, LLC",51,54,692,"45761"
52,"spotify:track:0OTtnwUO8natNWSwdZvXVF","Ovy On The Drums, Beéle","Inolvidable","WEA Latina",34,50,78,"45667"
53,"spotify:track:4w47S36wQGBhGg073q3nt7","ROSALÍA, Travis Scott","TKN (feat. Travis Scott)","Columbia",32,51,38,"45354"
54,"spotify:track:4R8BJggjosTswLxtkw8V7P","JHAYCO, J Balvin, Bad Bunny","No Me Conoce - Remix","N&E Entertainment LLC",2,55,415,"44553"
55,"spotify:track:5IjOqh4XLyjHINuOGolmAt","Eladio Carrion, Zion & Lennox, Wisin & Yandel, Lunay","Mi Error - Remix","Rimas Entertainment LLC",27,52,230,"44480"
56,"spotify:track:0eeKDrQxjqNl5bX5VCHDcn","Justin Quiles, Daddy Yankee, El Alfa","PAM","WEA Latina",50,53,65,"44223"
57,"spotify:track:24Yi9hE78yPEbZ4kxyoXAI","SAINt JHN, Imanbek","Roses - Imanbek Remix","Columbia/B1 Recordings",51,56,105,"43971"
58,"spotify:track:4Pu0a2TuHOYtI4CCE3HEXI","Arcángel, Sech, Romeo Santos","Sigues Con El - Remix","Rimas Entertainment LLC.",20,58,86,"43730"
59,"spotify:track:0KkIkfsLEJbrcIhYsCL7L5","Anuel AA, Daddy Yankee, KAROL G, Ozuna, J Balvin","China","2020 Real Hasta La Muerte, LLC",1,63,352,"43110"
60,"spotify:track:3jbT1Y5MoPwEIpZndDDwVq","Tainy, Anuel AA, Ozuna","Adicto (with Anuel AA & Ozuna)","NEON16/Interscope Records",1,61,318,"42860"
61,"spotify:track:7eJMfftS33KTjuF7lTsMCx","Powfu, beabadoobee","death bed (coffee for your head)","Columbia",36,60,112,"42491"
62,"spotify:track:6zEgnpM0qYmHLDnh8WPejL","J Balvin","Amarillo","UMLE - Latino",17,62,107,"42083"
63,"spotify:track:6UelLqGlWMcVH1E5c4H7lY","Harry Styles","Watermelon Sugar","Columbia",59,66,56,"41041"
64,"spotify:track:46V4kseB66GjFGklCgynGX","Casper Magico, Anuel AA","Sola & Vacía","2020 Flow La Movie, Inc. & Los Magicos, LLC | Powered by GLAD Empire,",29,69,79,"40829"
65,"spotify:track:4xI3U4sDj1TPmO9Iz5TkYp","El Alfa, Darell, Noriel","4K","EL JEFE RECORDS LLC",41,71,114,"40666"
66,"spotify:track:0fea68AdmYNygeTGI4RC18","J Balvin, Bad Bunny","LA CANCIÓN","Universal Music Latino / Rimas",4,70,373,"40475"
67,"spotify:track:0A37XY67wSdGqkGjtfW6aV","Rauw Alejandro, Anuel AA, NATTI NATASHA, Farruko, Lunay","Fantasias - Remix","(SME US Latin) Duars Entertainment, Corp. (2)",24,64,121,"40449"
68,"spotify:track:5XqCz18k96K8tx6DAYM97i","Bad Bunny, Don Omar","PA' ROMPERLA","Rimas Entertainment LLC",4,65,56,"40028"
69,"spotify:track:113PlnpZbHd3WIqeYjhZWv","Daddy Yankee, Sech","Definitivamente","El Cartel Records (EC3)",13,67,156,"39837"
70,"spotify:track:5Xe78U9cUwnWOuWbgYvAKZ","Eix, Rauw Alejandro, Noriel, KEVVO, Brytiago, Jay Wheeler","Infiel - Remix","Duars Entertainment, LLC",59,59,3,"39283"
71,"spotify:track:0pgj4EzB1XRqgZemoMNG5D","Camilo, Evaluna Montaner","Por Primera Vez","Sony Music Latin",24,68,117,"39159"
72,"spotify:track:6C1jKbkCUgFws7M0M4oGCB","Dalex, Sech","Mejor","Rich Music",26,73,149,"38599"
73,"spotify:track:3PfIrDoz19wz7qK7tYeu62","Dua Lipa","Don't Start Now","Warner Records",20,72,247,"38315"
74,"spotify:track:7kOf0qHO4Rcwk6QJifZDRJ","Anuel AA","El Manual","2020 Real Hasta La Muerte, LLC",27,74,37,"37806"
75,"spotify:track:4SJHHpKhcuXwDsCsPqshXj","Rauw Alejandro, Chencho Corleone","El Efecto","Duars Entertainment, Corp.",63,76,434,"36703"
76,"spotify:track:4GGwM2Krtlx9G9ii1RaEOx","Dalex, Lenny Tavárez, Anitta, NATTI NATASHA, Farruko, Justin Quiles","Bellaquita (Remix)","Rich Music",11,75,226,"36619"
77,"spotify:track:7mcdgAXmb35dakBnfDIv3q","Anuel AA","Narcos","2020 Real Hasta La Muerte, LLC",12,78,37,"35946"
78,"spotify:track:2TH65lNHgvLxCKXM3apjxI","Bad Bunny, Tainy","Callaita","Rimas Entertainment LLC",1,79,401,"34743"
79,"spotify:track:34LI7rwi9H8w2S5KTHnv1M","Manuel Turizo","Quiéreme Mientras Se Pueda","Sony Music Latin/La Industria",71,77,65,"34478"
80,"spotify:track:1V8XneTrX6kKeoxYbk4x6h","Bad Bunny, Duki, Pablo Chill-E","Hablamos Mañana","Rimas Entertainment LLC",4,83,127,"33215"
81,"spotify:track:466cKvZn1j45IpxDdYZqdA","Drake","Toosie Slide","OVO",54,81,93,"32976"
82,"spotify:track:634fDJYRCr5yzqfFWa9rfS","Paloma Mami","Goteo","Sony Music Latin",9,82,66,"32552"
83,"spotify:track:5Id5B3dxJZhPcV9GzgYZZe","Rich Music LTD, Sech, Dalex, Justin Quiles, Lenny Tavárez, Feid, Wisin, Zion","Quizas","Rich Music",3,80,289,"32411"
84,"spotify:track:3FhiU60cxfN2j4jRy5Y40w","Cauty, Lenny Tavarez, Jay Wheeler, Noriel, Alex Rose","Lloras - Remix","eOne Music",75,84,132,"32321"
85,"spotify:track:52zq2a71SGs3f1vJuv59ui","Juanfran","Como Llora","DN7 Music",82,93,65,"31161"
86,"spotify:track:1Ol5LmdNDNpFu1oNwfgkux","Camilo, Pedro Capó","Tutu","Sony Music Latin",6,86,331,"30947"
87,"spotify:track:6nGM44ZP7vSo0istUW2MOq","Farruko, Beéle, NATTI NATASHA, Manuel Turizo","Loco - Remix","Hear This Music",64,89,72,"30778"
88,"spotify:track:4VgYtXCVJ7IbWAZ5ryfvEQ","Nicky Jam, Daddy Yankee","Muévelo","Sony Music Latin",8,87,179,"30753"
89,"spotify:track:37zdqI4r1gswIzczSBkRon","Lunay, Anuel AA, Ozuna","Aventura","round2media - LaFamilia",1,85,254,"30689"
90,"spotify:track:10u2iOS0r6plfb9GknD7g4","Rauw Alejandro, Myke Towers, Sky Rompiendo","Ponte Pa' Mi","(SME US Latin) Duars Entertainment, Corp. (2)",78,90,79,"30463"
91,"spotify:track:4j4w4CXm6BSr0s25wAWrrX","Bad Bunny, Yaviah","Bichiyal","Rimas Entertainment LLC",9,91,127,"30291"
92,"spotify:track:2w1rq80FIrbxeJy9WYURxw","KAROL G, Anuel AA","Follow","UMLE - Latino",18,94,94,"29798"
93,"spotify:track:24IgCW19L8lXKyFZwzFtD3","Black Eyed Peas, Ozuna, J. Rey Soul","MAMACITA","Epic",93,96,79,"29587"
94,"spotify:track:0HMTIZ3iQ6QNjBaD9IE7ZZ","JHAYCO","Dime A Ve","N&E Entertainment LLC",94,102,2,"29584"
95,"spotify:track:4MWb6mltydQn84NrTm7Gpl","Micro TDH, Rels B, Lenny Tavárez, Justin Quiles","Dime Cuantas Veces (Remix) [feat. Justin Quiles]","WEA Latina",76,88,10,"29247"
96,"spotify:track:3jjujdWJ72nww5eGnfs2E7","Harry Styles","Adore You","Columbia",86,95,136,"29232"
97,"spotify:track:35wvL50xvKpCHEJPxLOLPI","Bad Bunny","Si Estuviésemos Juntos","Rimas Entertainment LLC",7,98,558,"29044"
98,"spotify:track:6K5BsR04ijf3FHNzjbaagD","Myke Towers, Farruko, Arcángel, Sech, Zion","Si Se Da - Remix","2019 Casablanca Records & One World Music | Distributed by GLAD Empire",5,100,338,"28867"
99,"spotify:track:3l6Dc2DvpzEXJxnRTX5JUd","Nio Garcia, Bryant Myers, Lenny Tavárez, Miky Woodz, Jay Wheeler","Nocturna - Remix","2020 Flow La Movie Inc. | Distributed by GLAD Empire, LLC",76,99,127,"28800"
100,"spotify:track:27uAea0qcUz3a7jKnAT7KG","Santaferia","Algún Día Volverás","Santaferia",20,114,716,"28781"
101,"spotify:track:017PF4Q3l4DBUiWoXk4OWT","Dua Lipa","Break My Heart","Warner Records",49,97,101,"28769"
102,"spotify:track:4RaWbMItxVbuUExNkFsITP","Nio Garcia, Brray, Juanka","La Jeepeta","2019 Flow La Movie, Inc. | Distributed by GLAD Empire, LLC.",34,106,177,"28736"
103,"spotify:track:4t9a07PAghtQMRAIP9FQ7Z","Lunay, Daddy Yankee, Bad Bunny","Soltera (Remix)","round2media - LaFamilia",2,108,422,"28483"
104,"spotify:track:3Dv1eDb0MEgF93GpLXlucZ","Doja Cat","Say So","Kemosabe Records/RCA Records",59,107,150,"27898"
105,"spotify:track:1aUGxXCz9QimNkKeiJtzZ7","KEVVO, Farruko, Chencho Corleone, Arcángel, Darell, Ñengo Flow, Brytiago, Myke Towers","105 F Remix","Una Vision Quintana",7,101,297,"27750"
106,"spotify:track:1ndyl3wJCFs872XZ3ztPk6","Justin Quiles, NATTI NATASHA, Farruko, Lenny Tavárez, Dalex, Zion","DJ No Pare (feat. Zion, Dalex, Lenny Tavárez) - Remix","WEA Latina",19,105,303,"27602"
107,"spotify:track:7sKDftgGirHWTVFMtJoDoh","Aya Nakamura","Djadja","Rec. 118",93,109,91,"27346"
108,"spotify:track:50ITehqoAuygfVlmG6FxO8","Harry Nach","Fixona","Only Perk",92,92,2,"27179"
109,"spotify:track:7ju97lgwC2rKQ6wwsf9no9","Lady Gaga, Ariana Grande","Rain On Me (with Ariana Grande)","Interscope",25,103,44,"27123"
110,"spotify:track:5J7teKIJGtqVypgYI6sqXj","Bad Bunny, Mora","Una Vez","Rimas Entertainment LLC",15,112,127,"26886"
111,"spotify:track:4bTZeO72FwMa6wKOiqoynL","Sech, Ozuna, Anuel AA, Darell, Nicky Jam","Otro Trago - Remix","Rich Music",1,116,345,"26565"
112,"spotify:track:4z6wo6PJG4Fve45OXK6D9m","Arcángel, Bad Bunny","Infeliz","Rimas Entertainment LLC.",17,104,198,"26417"
113,"spotify:track:5Xhqh4lwJPtMUTsdBztN1a","Shakira, Anuel AA","Me Gusta","Sony Music Latin",9,113,174,"26115"
114,"spotify:track:4NCsrTzgVfsDo8nWyP8PPc","Black Eyed Peas, J Balvin","RITMO (Bad Boys For Life)","Epic",4,115,267,"26017"
115,"spotify:track:5cBrOhKDyiJF9bPGUHKkG0","Dalex","+Linda","Rich Music",114,120,41,"25555"
116,"spotify:track:2pWOMNQJW3g2zmGjP0Vkb0","Nicky Jam, Anuel AA","Whine Up","Sony Music Latin",4,117,250,"25471"
117,"spotify:track:70zg99pT51vB4wlMS7e4q7","Myke Towers, Maluma, Farruko","La Playa - Remix","2019 Casablanca Records & One World Music | Distributed by GLAD Empire",33,110,184,"25366"
118,"spotify:track:53uKGbcMjEc2gIWbfmvpdS","Nio Garcia, Rauw Alejandro, Lenny Tavárez, Myke Towers, Casper Magico, Darell","Mírame - Remix","2019 Flow La Movie, Inc. | Distributed by GLAD Empire, LLC.",17,111,352,"25295"
119,"spotify:track:6Bd9rs5gv25asdPDRog3ce","Javiielo","Pa Los Gustos Los Colores","Oye Saavedra / EMPIRE",40,121,265,"25259"
120,"spotify:track:3qM0vBxIe4VUbK0Z0smuVP","JHAYCO, Anuel AA, J Balvin","Medusa","N&E Entertainment LLC",24,118,151,"24832"
121,"spotify:track:5YrjfKuFd0pMmYTGeRDV6X","Noriel","Piropo","Sony Music Latin/Ganda Entertainment",23,119,253,"24282"
122,"spotify:track:4s45VgkknMFkdiGoUcjxQU","Sebastian Yatra, Rauw Alejandro, Manuel Turizo","TBT","UMLE - Latino",57,122,135,"24173"
123,"spotify:track:2w8SKQCnT2YQK1qCqKl2uW","Lenny Tavárez, Justin Quiles","La Pared 360","WEA Latina",86,124,149,"24163"
124,"spotify:track:34ZngZgo8xicbt1EE8Ob8Z","Rich Music LTD, Sech, Dalex, Justin Quiles, Lenny Tavárez, Feid","Porno","Rich Music",53,126,268,"24060"
125,"spotify:track:7g8YaUQABMal0zWe7a2ijz","Dalex, Rafa Pabön, KHEA, Sech, Feid, Cazzu, Lenny Tavárez","Pa Mí (Remix)","Rich Music/Ingrooves Records",2,125,513,"23568"
126,"spotify:track:2aGN6PplBq0xigh2lmqLbw","Sech, Ozuna","Si Te Vas","Rich Music",5,123,283,"23511"
127,"spotify:track:47ZS1OjnJpJVfGN9yHXfMn","Alex Rose, Rauw Alejandro, Lenny Tavárez, Cazzu, Lyanno","Toda (Remix)","Los Oídos Fresh",8,127,271,"23327"
128,"spotify:track:16DNJ8y6k97DxuMyV49W7V","KHEA","Dónde Estás","Young Flex - Khea",61,131,143,"23202"
129,"spotify:track:2CoMYp2uIKsT09nreEZnZn","Bad Bunny","BENDICIONES","Rimas Entertainment LLC",7,128,56,"23034"
130,"spotify:track:3cUE3p7E39CzGjQoEsg7sM","Santaferia","EL Gil De Tu Ex","Santaferia",21,141,1066,"22912"
131,"spotify:track:2hDe0Ls5mVqs1XJqv7sbcM","Anuel AA, Enrique Iglesias","Fútbol & Rumba (feat. Enrique Iglesias)","2020 Real Hasta La Muerte, LLC",15,129,37,"22647"
132,"spotify:track:7f5SeKPwJm4eM4GcngH2SX","Juanka","Cárcel","N&E Entertainment LLC",119,134,30,"22478"
133,"spotify:track:5NOHsDSfLIH45y3i9PfRyh","Casper Magico, Bryant Myers, Alex Rose, Juhn","Fantasmita - Remix","2019 Flow La Movie, Inc & Los Magicos",55,140,212,"22397"
134,"spotify:track:7ytR5pFWmSjzHJIeQkgog4","DaBaby, Roddy Ricch","ROCKSTAR (feat. Roddy Ricch)","South Coast Music Group/Interscope Records",131,139,18,"22350"
135,"spotify:track:6EfBMJQwe2xLgldra6DaYp","6ix9ine","YAYA","Create Music Group",135,-1,1,"22122"
136,"spotify:track:6NfC2FKfsfzuLIF4lThw0A","Anuel AA, Bad Bunny","Así Soy Yo","2020 Real Hasta La Muerte, LLC",5,135,37,"22120"
137,"spotify:track:7fODjB7BrQTGqh0hogW6XD","Sech, Justin Quiles, Maluma, Nicky Jam, Farruko, Dalex, Lenny Tavárez","Que Mas Pues - Remix","Rich Music/Ingrooves Records",7,130,451,"21997"
138,"spotify:track:6RyaV7owmVU6fzEPE17sF1","Daddy Yankee","Que Tire Pa Lante","El Cartel Records (EC3)",5,136,261,"21920"
139,"spotify:track:56f5qnyAlZdlz8wrUDA50h","Mau y Ricky, Manuel Turizo, Camilo","Desconocidos","Sony Music Latin",9,137,629,"21849"
140,"spotify:track:1A9PKAFEHMWgXNLpgf7k4J","Myke Towers","Piensan","2020 One World Music & Casablanca Records | Powered by GLAD Empire, LL",14,133,296,"21804"
141,"spotify:track:3SDvcxPcU7BlV1dAne4dWM","Play-N-Skillz, Daddy Yankee, Zion & Lennox","Bésame","Sony Music Latin/Latium Records",95,132,16,"21657"
142,"spotify:track:6Xfz4YNwwIcFRyfW3QQZVp","Ceaese, Utopiko, Polimá Westcoast, Young Cister","Te Quiero Ver (feat. Polimá Westcoast y Young Cister)","WM Chile",31,143,560,"21553"
143,"spotify:track:3dJWIbkKEnI0Jb9CK6kdcg","JHAYCO, Wisin & Yandel","Imaginaste - Remix","N&E Entertainment LLC",26,138,247,"21338"
144,"spotify:track:25ZAibhr3bdlMCLmubZDVt","J Balvin, Bad Bunny","QUE PRETENDES","Universal Music Latino / Rimas",5,147,373,"21233"
145,"spotify:track:3DyiAk1BzIF8rq9rimypG4","Anuel AA, Cardi B, Black Jonas Point, Secreto ""El Famoso Biberon"", Liro Shaq","La Bebe - Remix","2020 GLAD Empire, LLC & Flow La Movie, Inc.",115,153,33,"21000"
146,"spotify:track:2B94bbI1a4LyBpK1439oP7","Noriel, Myke Towers, Rauw Alejandro, Almighty","Cuerpo en Venta","Rimas Entertainment LLC",11,145,331,"20987"
147,"spotify:track:5p3JJehpKHjr9pJT5eD2Lz","Anuel AA, Farruko, Zion","Que Se Joda","2020 Real Hasta La Muerte, LLC",10,146,37,"20976"
148,"spotify:track:75pQqzwgCjUOSSy5CpmAjy","Bad Bunny","Pero Ya No","Rimas Entertainment LLC",6,148,127,"20829"
149,"spotify:track:0RDgqtvOHLwcI6yz9bjsZV","Rich Music LTD, Sech, Dalex, Justin Quiles, Lenny Tavárez, Feid","Perreo en La Luna","Rich Music",22,144,268,"20783"
150,"spotify:track:4VohsQwrtb7lj1yO0dFKJa","Tommy Boysen","Hookah & Sheridan's","Equity Distribution",12,156,655,"20500"
151,"spotify:track:1OW47kPsWJfvhcQ7V7XwhC","Myke Towers, Yandel","Mayor","2020 White World Music | Powered by GLAD Empire, LLC",110,149,23,"20495"
152,"spotify:track:7MCFjPDImfjQv7GynHgVrR","Nicki Nicole","Colocao","Sony Music Latin/DALE PLAY Records",136,151,40,"20445"
153,"spotify:track:5kQre7o8ky5DXeEPcyaCR1","Prince Royce, Myke Towers","Carita de Inocente (feat. Myke Towers) - Remix","Sony Music Latin",146,158,15,"20307"
154,"spotify:track:3OVMfEILPtNyvtvxBm1jqE","Kiddtetoon, Diego Smith","Illuminati","Duetti (Migration)",154,186,7,"20149"
155,"spotify:track:7qEHsqek33rTcFNT9PFqLf","Lewis Capaldi","Someone You Loved","Vertigo Berlin",141,174,47,"20122"
156,"spotify:track:6v3KW9xbzN5yKLt9YKDYA2","Shawn Mendes, Camila Cabello","Señorita","Island Records",11,154,380,"20002"
157,"spotify:track:4DpNNXFMMxQEKl7r0ykkWA","Melanie Martinez","Play Date","Atlantic Records",119,150,55,"19974"
158,"spotify:track:5jW3rF4URMdK7tO2xjS5EI","Paulo Londra","Tal Vez","WEA Latina",5,164,457,"19912"
159,"spotify:track:0zlnHTHiBQ68ZCAmTw5ozm","Rauw Alejandro","Algo Mágico","Sony Music Latin/Duars Entertainment",131,142,9,"19905"
160,"spotify:track:5iwz1NiezX7WWjnCgY5TH4","Pedro Capó, Farruko","Calma - Remix","Sony Music Latin",1,163,636,"19842"
161,"spotify:track:6G4U9avyBNEfP0fAIduev3","Aventura, Don Omar","Ella Y Yo - Featuring Don Omar","Premium Latin Music",131,173,347,"19823"
162,"spotify:track:7BEPdOI0neT6p7PnLViqmH","Morat, Sebastian Yatra","Bajo La Mesa","Universal Music Spain S.L.",39,157,44,"19798"
163,"spotify:track:2btKz4s1XrMn5VHe7xZJpi","NATTI NATASHA","Que Mal Te Fue","Pina Records",135,159,30,"19709"
164,"spotify:track:1JSTJqkT5qHq8MDJnJbRE1","The Police","Every Breath You Take","Polydor Records",138,168,237,"19669"
165,"spotify:track:2dy3TKVDEbIeWxeIb8JWqZ","NATTI NATASHA, Romeo Santos","La Mejor Versión de Mi - Remix","Pina Records",86,152,274,"19651"
166,"spotify:track:4u7EnebtmKWzUH433cf5Qv","Queen","Bohemian Rhapsody - Remastered 2011","EMI",26,170,709,"19544"
167,"spotify:track:6ifUES3keWjwXgae8pXI3o","Danny Ocean","Me Rehúso","Atlantic Records",1,167,1200,"19454"
168,"spotify:track:4lzxJ4jCuFDXXGkE1LmpKR","DJ Luian, Mambo Kingz, Anuel AA, Nicky Jam, Darell, Brytiago","Verte Ir","Hear This Music",1,165,465,"19422"
169,"spotify:track:7szuecWAPwGoV1e5vGu8tl","The Weeknd","In Your Eyes","Republic Records",111,161,100,"19291"
170,"spotify:track:7q3NthaBqFI6s0WnAlnIvq","Darell, Brytiago","Velitas","Sony Music Latin",36,166,359,"19284"
171,"spotify:track:2qG5sZ7Si6sdK74qLxedYM","ROSALÍA, J Balvin, El Guincho","Con Altura","Columbia",12,171,464,"19158"
172,"spotify:track:53v2u51nq3CxiKUNphRzP1","Bad Bunny, Ñengo Flow","Que Malo","Rimas Entertainment LLC",11,162,127,"19129"
173,"spotify:track:059bcIhyc2SBwm6sw2AZzd","Piso 21, Micro TDH","Te Vi","WM Mexico",17,160,563,"18856"
174,"spotify:track:1xQ6trAsedVPCdbtDAmk0c","Jawsh 685, Jason Derulo","Savage Love (Laxed - Siren Beat)","Columbia",172,172,6,"18820"
175,"spotify:track:4o1DxRjMCHDwBiOKv88rOl","Rvssian, Darell, Zion & Lennox, Myke Towers","B11 (feat. Myke Towers)","Sony Music Latin",14,181,290,"18749"
176,"spotify:track:1Ej96GIBCTvgH7tNX1r3qr","Sech, Darell","Otro Trago","Rich Music/Ingrooves Records",1,190,435,"18740"
177,"spotify:track:2vrpcQNg6itmgVZWsNjWe0","Sebastian Yatra, Reik","Un Año","UMLE - Latino",9,169,534,"18549"
178,"spotify:track:1LiN0Z98FkR1t0m8KmLcAH","Anuel AA, Haze","Amanece","House of Haze",2,177,569,"18428"
179,"spotify:track:0tgVpDi06FyKpA1z0VMD4v","Ed Sheeran","Perfect","Atlantic Records UK",55,198,960,"18345"
180,"spotify:track:132ALUzVLmqYB4UsBj5qD6","Paulo Londra","Adan y Eva","WEA Latina",1,195,604,"18333"
181,"spotify:track:5w9c2J52mkdntKOmRLeM2m","Daddy Yankee, Snow","Con Calma","El Cartel Records (EC3)",1,188,495,"18309"
182,"spotify:track:71oz9Wgbrm873aMlVBrDKR","Nicky Jam, Carla Morrison","Desahogo (feat. Carla Morrison)","Sony Music Latin",182,185,2,"18303"
183,"spotify:track:0G0p7mc4wEaQTsUpzEmkEs","Reik, Morat","La Bella y la Bestia","Sony Music México",123,175,21,"18268"
184,"spotify:track:62aP9fBQKYKxi7PDXwcUAS","Surf Mesa, Emilee","ily (i love you baby) (feat. Emilee)","Astralwerks",147,179,46,"18212"
185,"spotify:track:2gMXnyrvIjhVBUZwvLZDMP","Lewis Capaldi","Before You Go","Vertigo Berlin",158,183,5,"18181"
186,"spotify:track:7MRU4vOkywuhZ9kbFiPuiu","Daddy Yankee, Wisin & Yandel","Si Supieras","El Cartel Records (EC3)",6,176,365,"18175"
187,"spotify:track:0VKkyBKCXyR99navhVRqcP","Zion & Lennox","La player (Bandolera)","WEA Latina",1,187,754,"18102"
188,"spotify:track:6fNJm8sYmCBbmkKpKgTReA","Camilo","La Difícil","Sony Music Latin",55,178,175,"18021"
189,"spotify:track:7BlBVFwvbWvcwNcUarQmjk","ROSALÍA, Ozuna","Yo x Ti, Tu x Mi","Columbia",9,184,291,"17999"
190,"spotify:track:7sOfmPd18RWp3FoCzpa7Kw","Bad Bunny","Soliá","Rimas Entertainment LLC",10,192,127,"17982"
191,"spotify:track:7anSoGdgtmJTAPZBzcPhO6","Dalex, Nicky Jam, Justin Quiles, Sech, Lenny Tavárez, Feid, Rafa Pabön","Cuaderno","Rich Music/Ingrooves Records",5,182,420,"17895"
192,"spotify:track:2xLMifQCjDGFmkHkpNLD9h","Travis Scott","SICKO MODE","Cactus Jack / Epic",35,196,74,"17813"
193,"spotify:track:2rRJrJEo19S2J82BDsQ3F7","Trevor Daniel","Falling","Alamo",94,193,198,"17661"
194,"spotify:track:6gBFPUFcJLzWGx4lenP6h2","Travis Scott","goosebumps","Cactus Jack / Epic",58,-1,71,"17626"
195,"spotify:track:7z0cli6eF13Ew8ARrDgGHJ","KHEA, Piso 21","Dónde Estás (with Piso 21) - Remix","Young Flex - Khea",180,180,2,"17579"
196,"spotify:track:3eJMSq78dDaFb7VvhNFnq6","Maluma","ADMV","Sony Music Latin",127,189,47,"17504"
197,"spotify:track:5vdp5UmvTsnMEMESIF2Ym7","Queen","Another One Bites The Dust - Remastered 2011","EMI",42,-1,379,"17482"
198,"spotify:track:3f5lA8nnc4YYF1qf78WpHw","Anuel AA, Romeo Santos","Ella Quiere Beber - Remix","Real Hasta La Muerte, LLC",8,199,536,"17255"
199,"spotify:track:19VunfeIrl0bx984mJ810c","Dalex, Sech, Justin Quiles","Perfume","Rich Music",55,191,121,"17198"
