rank,uri,artist_names,track_name,source,peak_rank,previous_rank,days_on_chart,streams
1,"spotify:track:7k4t7uLgtOxPwTpFmtJNTY","KAROL G, Nicki Minaj","Tusa","TUSA - Karol G & Nicki Minaj",1,1,95,"371647"
2,"spotify:track:7sQKy5vlPQllr0k9IjYJv3","Arcángel, Sech, Dímelo Flow","Sigues Con El","Rimas Entertainment LLC.",2,2,60,"297841"
3,"spotify:track:5stPVcRqb4qixbafP9e8lt","Dalex, Lenny Tavárez, Chencho Corleone, Juhn, Dímelo Flow","Hola - Remix","Rich Music",2,3,102,"252584"
4,"spotify:track:43NqTeL8pgBxKHPMiJKUP5","Myke Towers","Girl","2020 One World Music & Casablanca Records | Powered by GLAD Empire, LL",4,4,18,"244429"
5,"spotify:track:5eEQCfq7MXQr6aHLNRUZLs","Anuel AA","Keii","2020 Real Hasta La Muerte, LLC",4,5,4,"236992"
6,"spotify:track:1rgnBhdG2JDFTbYkYRZAku","Tones And I","Dance Monkey","Elektra (NEK)",4,6,126,"228392"
7,"spotify:track:5DxXgozhkPLgrbKFY91w0c","Bad Bunny","Vete","Rimas Entertainment LLC",1,7,82,"207174"
8,"spotify:track:6mAN61JH0dzyZpWslS11jy","Rauw Alejandro, Farruko","Fantasias","(SME US Latin) Duars Entertainment, Corp. (2)",1,8,165,"186697"
9,"spotify:track:2pWOMNQJW3g2zmGjP0Vkb0","Nicky Jam, Anuel AA","Whine Up","Sony Music Latin",4,9,105,"180358"
10,"spotify:track:4VgYtXCVJ7IbWAZ5ryfvEQ","Nicky Jam, Daddy Yankee","Muévelo","Sony Music Latin",8,10,34,"176864"
11,"spotify:track:37zdqI4r1gswIzczSBkRon","Lunay, Anuel AA, Ozuna","Aventura","round2media - LaFamilia",1,11,109,"164571"
12,"spotify:track:1Xnn1TPyr5h0hpRAT4B4EA","Dalex, Lenny Tavárez, Anitta, NATTI NATASHA, Farruko, Justin Quiles","Bellaquita - Remix","Rich Music",11,12,81,"159158"
13,"spotify:track:5Xhqh4lwJPtMUTsdBztN1a","Shakira, Anuel AA","Me Gusta","Sony Music Latin",9,13,29,"157496"
14,"spotify:track:3jbT1Y5MoPwEIpZndDDwVq","Tainy, Anuel AA, Ozuna","Adicto (with Anuel AA & Ozuna)","NEON16/Interscope Records",1,15,173,"148695"
15,"spotify:track:6cy3ki60hLwimwIje7tALf","Black Eyed Peas, J Balvin","RITMO (Bad Boys For Life)","Epic/We The Best",4,14,122,"147069"
16,"spotify:track:2ksOAxtIxY8yElEWw8RhgK","Anuel AA, Daddy Yankee, KAROL G, J Balvin, Ozuna","China","2019 Real Hasta La Muerte, LLC.",1,16,207,"140815"
17,"spotify:track:3mQ6SLdxxaL52Yte7KF2Ks","J Balvin","Morado","UMLE - Latino",16,17,32,"132996"
18,"spotify:track:113PlnpZbHd3WIqeYjhZWv","Daddy Yankee, Sech","Definitivamente","El Cartel Records (EC3)",18,20,11,"124371"
19,"spotify:track:5Id5B3dxJZhPcV9GzgYZZe","Rich Music LTD, Sech, Dalex, Justin Quiles, Lenny Tavárez, Feid, Wisin, Zion","Quizas","Rich Music",3,19,144,"120270"
20,"spotify:track:6RyaV7owmVU6fzEPE17sF1","Daddy Yankee","Que Tire Pa Lante","El Cartel Records (EC3)",5,18,116,"117283"
21,"spotify:track:4z6wo6PJG4Fve45OXK6D9m","Arcángel, Bad Bunny","Infeliz","Rimas Entertainment LLC.",17,23,53,"114859"
22,"spotify:track:5m3jpKkgkfoMcym1qjToFg","Alex Rose, Rafa Pabön","Jangueo","Los Oidos Fresh/ Los Proximos",22,25,79,"112382"
23,"spotify:track:4R8BJggjosTswLxtkw8V7P","JHAYCO, J Balvin, Bad Bunny","No Me Conoce - Remix","N&E Entertainment LLC",2,21,270,"112106"
24,"spotify:track:3qM0vBxIe4VUbK0Z0smuVP","JHAYCO, Anuel AA, J Balvin","Medusa","N&E Entertainment LLC",24,26,6,"111533"
25,"spotify:track:0fea68AdmYNygeTGI4RC18","J Balvin, Bad Bunny","LA CANCIÓN","Universal Music Latino / Rimas",4,24,228,"110307"
26,"spotify:track:2TH65lNHgvLxCKXM3apjxI","Bad Bunny, Tainy","Callaita","Rimas Entertainment LLC",1,22,256,"109703"
27,"spotify:track:6WrI0LAC5M1Rw2MnX2ZvEg","Dua Lipa","Don't Start Now","Warner Records",27,28,102,"106972"
28,"spotify:track:1A9PKAFEHMWgXNLpgf7k4J","Myke Towers","Piensan","2020 One World Music & Casablanca Records | Powered by GLAD Empire, LL",14,29,151,"104941"
29,"spotify:track:5YrjfKuFd0pMmYTGeRDV6X","Noriel","Piropo","Sony Music Latin/Ganda Entertainment",23,27,108,"102457"
30,"spotify:track:6Y4PDQv4XjYjHLeLmvyOt0","Sech, Ozuna","Si Te Vas","Rich Music",5,31,138,"101091"
31,"spotify:track:1aUGxXCz9QimNkKeiJtzZ7","KEVVO, Farruko, Chencho Corleone, Arcángel, Darell, Ñengo Flow, Brytiago, Myke Towers","105 F Remix","Una Vision Quintana",7,30,152,"98868"
32,"spotify:track:1ndyl3wJCFs872XZ3ztPk6","Justin Quiles, NATTI NATASHA, Farruko, Lenny Tavárez, Dalex, Zion","DJ No Pare (feat. Zion, Dalex, Lenny Tavárez) - Remix","WEA Latina",19,32,158,"94792"
33,"spotify:track:5IjOqh4XLyjHINuOGolmAt","Eladio Carrion, Zion & Lennox, Wisin & Yandel, Lunay","Mi Error - Remix","Rimas Entertainment LLC",27,36,85,"93148"
34,"spotify:track:0RDgqtvOHLwcI6yz9bjsZV","Rich Music LTD, Sech, Dalex, Justin Quiles, Lenny Tavárez, Feid","Perreo en La Luna","Rich Music",22,34,123,"91862"
35,"spotify:track:6K5BsR04ijf3FHNzjbaagD","Myke Towers, Farruko, Arcángel, Sech, Zion","Si Se Da - Remix","2019 Casablanca Records & One World Music | Distributed by GLAD Empire",5,33,193,"91367"
36,"spotify:track:684EjRHwNsZQ9hCQxL4NYL","Dímelo Flow, Nicky Jam, Sech, Farruko, Zion, Lunay","El Favor (with Nicky Jam & Sech, feat. Farruko, Zion & Lunay)","Rich Music/Interscope Records",6,35,165,"90119"
37,"spotify:track:4o1DxRjMCHDwBiOKv88rOl","Rvssian, Darell, Zion & Lennox, Myke Towers","B11 (feat. Myke Towers)","Sony Music Latin",14,37,145,"88074"
38,"spotify:track:2B94bbI1a4LyBpK1439oP7","Noriel, Myke Towers, Rauw Alejandro, Almighty","Cuerpo en Venta","Rimas Entertainment LLC",11,38,186,"86040"
39,"spotify:track:3JHpk0DOTOzyh0777JFAky","Myke Towers","Diosa","2020 One World Music & Casablanca Records | Powered by GLAD Empire, LL",39,50,18,"84071"
40,"spotify:track:1nocRtwyNPVtGcIJqfgdzZ","Camilo, Pedro Capó","Tutu","Sony Music Latin",6,41,186,"82282"
41,"spotify:track:4bTZeO72FwMa6wKOiqoynL","Sech, Ozuna, Anuel AA, Darell, Nicky Jam","Otro Trago - Remix","Rich Music",1,40,200,"82038"
42,"spotify:track:41L3O37CECZt3N7ziG2z7l","Justin Bieber","Yummy","RBMG/Def Jam",35,43,39,"79513"
43,"spotify:track:70zg99pT51vB4wlMS7e4q7","Myke Towers, Maluma, Farruko","La Playa - Remix","2019 Casablanca Records & One World Music | Distributed by GLAD Empire",33,42,39,"79016"
44,"spotify:track:7FbKipScVxkjQxQXwTd0gL","El Alfa, Lil Pump","Coronao Now","EL JEFE RECORDS LLC",21,39,96,"78533"
45,"spotify:track:40rXWke6SnXiGkSmaT8ZUr","Ozuna","Fantasía","Aura Music Corp.",26,44,74,"76223"
46,"spotify:track:64IRsSyqwD0CBbFAfrR0rT","Paloma Mami","Mami","Sony Music Latin",17,46,63,"76071"
47,"spotify:track:25ZAibhr3bdlMCLmubZDVt","J Balvin, Bad Bunny","QUE PRETENDES","Universal Music Latino / Rimas",5,47,228,"74150"
48,"spotify:track:4t9a07PAghtQMRAIP9FQ7Z","Lunay, Daddy Yankee, Bad Bunny","Soltera (Remix)","round2media - LaFamilia",2,45,277,"73813"
49,"spotify:track:3dJWIbkKEnI0Jb9CK6kdcg","JHAYCO, Wisin & Yandel","Imaginaste - Remix","N&E Entertainment LLC",26,48,102,"73613"
50,"spotify:track:7MRU4vOkywuhZ9kbFiPuiu","Daddy Yankee, Wisin & Yandel","Si Supieras","El Cartel Records (EC3)",6,49,228,"73103"
51,"spotify:track:6EWWkqE4aFlZRyoFwwOT8u","Javiielo","Pa Los Gustos Los Colores","Oye Saavedra / EMPIRE",42,52,120,"69287"
52,"spotify:track:4RaWbMItxVbuUExNkFsITP","Nio Garcia, Brray, Juanka","La Jeepeta","2019 Flow La Movie, Inc. | Distributed by GLAD Empire, LLC.",52,53,32,"66216"
53,"spotify:track:4fj7e6Tc48Bmomwyz2Z2XC","Manuel Turizo, Anuel AA","Te Quemaste","Sony Music Latin/La Industria",18,51,172,"64618"
54,"spotify:track:0sf12qNH5qcw8qpgymFOqD","The Weeknd","Blinding Lights","Republic Records",54,57,45,"64105"
55,"spotify:track:53uKGbcMjEc2gIWbfmvpdS","Nio Garcia, Rauw Alejandro, Lenny Tavárez, Myke Towers, Casper Magico, Darell","Mírame - Remix","2019 Flow La Movie, Inc. | Distributed by GLAD Empire, LLC.",17,54,207,"64055"
56,"spotify:track:7anSoGdgtmJTAPZBzcPhO6","Dalex, Nicky Jam, Justin Quiles, Sech, Lenny Tavárez, Feid, Rafa Pabön","Cuaderno","Rich Music/Ingrooves Records",5,59,277,"62252"
57,"spotify:track:7BlBVFwvbWvcwNcUarQmjk","ROSALÍA, Ozuna","Yo x Ti, Tu x Mi","Columbia",9,55,180,"60551"
58,"spotify:track:2oZBb87Jgwrg3qYhwsy3BN","Myke Towers","Parcerita","2020 One World Music & Casablanca Records | Powered by GLAD Empire, LL",54,61,18,"60353"
59,"spotify:track:1mF6sMUsRU9MisrdB9qWvg","Dalex, Sech","Mejor","Rich Music",59,72,4,"59909"
60,"spotify:track:74j34STf8L6uADnTN69ohv","Rauw Alejandro, Chencho Corleone, KEVVO, Bryant Myers, Lyanno, Dalex","El Efecto - Remix","(SME US Latin) Duars Entertainment, Corp. (2)",52,60,60,"59041"
61,"spotify:track:6v3KW9xbzN5yKLt9YKDYA2","Shawn Mendes, Camila Cabello","Señorita","Island Records",11,65,235,"58343"
62,"spotify:track:5NOHsDSfLIH45y3i9PfRyh","Casper Magico, Bryant Myers, Alex Rose, Juhn","Fantasmita - Remix","2019 Flow La Movie, Inc & Los Magicos",55,64,67,"57132"
63,"spotify:track:1KdwnsWOvhM53vezy5ROuf","C. Tangana, Paloma Mami","No Te Debí Besar","Sony Music Entertainment",4,63,152,"56059"
64,"spotify:track:7fODjB7BrQTGqh0hogW6XD","Sech, Justin Quiles, Maluma, Nicky Jam, Farruko, Dalex, Lenny Tavárez","Que Mas Pues - Remix","Rich Music/Ingrooves Records",7,66,306,"54992"
65,"spotify:track:7g8YaUQABMal0zWe7a2ijz","Dalex, Rafa Pabön, KHEA, Sech, Feid, Cazzu, Lenny Tavárez","Pa Mí (Remix)","Rich Music/Ingrooves Records",2,68,368,"53564"
66,"spotify:track:59s0s39NFWScuHDbHytI14","Reik, J Balvin, Lalo Ebratt","Indeciso","Indeciso",29,69,172,"53286"
67,"spotify:track:374Yj1kOLjGLYLOydbCO3i","Lasso, Cami","Odio Que No Te Odio","Universal Music Mexico",19,78,25,"53068"
68,"spotify:track:5BAKerbfUwW5KboNuIPMmn","joel music, Puch Flow","Mueve Lo Que Dios Te Dio","Lody Produccion",56,56,43,"52822"
69,"spotify:track:1G2CAJeP7rCwOZjlSJ0Zw3","Major Lazer, J Balvin, El Alfa, Diplo","Que Calor","Mad Decent",42,62,151,"52438"
70,"spotify:track:099tjv6oy2opbpCOA3nBwX","Ir Sais, Rauw Alejandro","Dream Girl - Remix","Sony Music Latin",69,75,36,"51694"
71,"spotify:track:27uAea0qcUz3a7jKnAT7KG","Santaferia","Algún Día Volverás","Santaferia",20,58,571,"50975"
72,"spotify:track:4lzxJ4jCuFDXXGkE1LmpKR","DJ Luian, Mambo Kingz, Anuel AA, Nicky Jam, Darell, Brytiago","Verte Ir","Hear This Music",1,77,320,"50080"
73,"spotify:track:2Fxmhks0bxGSBdJ92vM42m","Billie Eilish","bad guy","Darkroom/Interscope Records",31,82,318,"49960"
74,"spotify:track:0nbXyq5TXYPCO7pr3N8S4I","Roddy Ricch","The Box","Atlantic Records",70,70,28,"49575"
75,"spotify:track:0OoqRZXnSrgIUAha3iLKG1","Lunay, Myke Towers","La Cama","round2media - LaFamilia",19,76,119,"49032"
76,"spotify:track:2rc7BkzO8qepMFAxHtOrXc","J Balvin","Blanco","UMLE - Latino",54,73,88,"48908"
77,"spotify:track:2qG5sZ7Si6sdK74qLxedYM","ROSALÍA, J Balvin, El Guincho","Con Altura","Columbia",12,71,320,"47822"
78,"spotify:track:0wMs7DPFOnToNAoecvAFQc","Rich Music LTD, Sech, Dalex, Justin Quiles, Lenny Tavárez, Feid, De La Ghetto, Zion & Lennox","Uniforme","Rich Music",23,79,123,"47640"
79,"spotify:track:09tYvFOFp1pKxZ8GJVlOXm","JHAYCO","Como Se Siente","N&E Entertainment LLC",69,86,12,"46701"
80,"spotify:track:6768f4xbHQBpJo5lvFVNvs","Myke Towers","La Playa","2020 One World Music & Casablanca Records | Powered by GLAD Empire, LL",32,80,307,"45655"
81,"spotify:track:3cUE3p7E39CzGjQoEsg7sM","Santaferia","EL Gil De Tu Ex","Santaferia",21,67,921,"45217"
82,"spotify:track:5RClLxkUvnMWFUQ3VAQEHj","Myke Towers","Relación Rota","2020 One World Music & Casablanca Records | Powered by GLAD Empire, LL",69,92,18,"44922"
83,"spotify:track:3ZCTVFBt2Brf31RLEnCkWJ","Billie Eilish","everything i wanted","Darkroom/Interscope Records",63,99,88,"44433"
84,"spotify:track:6t94PGXYAuo9GbJEnMpPcW","Super Yei, Sammy Baby, Myke Towers, Lenny Tavárez, Rafa Pabön","La Forma en Que Me Miras","2018 Superiority",58,88,547,"44344"
85,"spotify:track:7q3NthaBqFI6s0WnAlnIvq","Darell, Brytiago","Velitas","Sony Music Latin",36,84,214,"43687"
86,"spotify:track:7KbF6AdprOXEEHlsq11Z6d","Maluma","11 PM","Sony Music Latin",20,93,270,"43291"
87,"spotify:track:5widvMUA2hiilH1RpOl5aM","Duki, RONNY J, Pablo Chill-E, Capo Plaza, C.R.O, Asan","Goteo - Remix","SSJ Records / DALE PLAY Records",53,90,18,"43121"
88,"spotify:track:6U3AilMn51njMyILgOlBQl","Adan La Amenaza, Yordano El Menor, Yohancito, Anonimus King, Carlitos Junior, Forest, BlackRoy","Dele Cotele - Remix","Adan La Amenaza | Eyey Networks",54,74,130,"42851"
89,"spotify:track:1LiN0Z98FkR1t0m8KmLcAH","Anuel AA, Haze","Amanece","House of Haze",2,85,424,"42714"
90,"spotify:track:0mcBgVRVsvESTkEyVHt7Ue","Darell","No Vuelvas Más","Sony Music Latin",73,91,66,"42640"
91,"spotify:track:2w8SKQCnT2YQK1qCqKl2uW","Lenny Tavárez, Justin Quiles","La Pared 360","WEA Latina",91,107,4,"42594"
92,"spotify:track:1tpbAGsGpZee5jDHMcLrUJ","Dalex, Lenny Tavárez","Bellaquita","Rich Music",17,87,158,"42313"
93,"spotify:track:5iwz1NiezX7WWjnCgY5TH4","Pedro Capó, Farruko","Calma - Remix","Sony Music Latin",1,81,491,"42071"
94,"spotify:track:3QfD4bxxkopZL7XZ8RaezH","Tommy Boysen","Hookah & Sheridan's","Equity Distribution",12,89,510,"41819"
95,"spotify:track:56f5qnyAlZdlz8wrUDA50h","Mau y Ricky, Manuel Turizo, Camilo","Desconocidos","Sony Music Latin",9,98,484,"41789"
96,"spotify:track:5px6upUHM3fhOP621Edp4V","Dua Lipa","Physical","Warner Records",72,101,11,"41272"
97,"spotify:track:5w9c2J52mkdntKOmRLeM2m","Daddy Yankee, Snow","Con Calma","El Cartel Records (EC3)",1,83,383,"41113"
98,"spotify:track:34ZngZgo8xicbt1EE8Ob8Z","Rich Music LTD, Sech, Dalex, Justin Quiles, Lenny Tavárez, Feid","Porno","Rich Music",53,95,123,"40583"
99,"spotify:track:4TnjEaWOeW0eKTKIEvJyCa","Trevor Daniel","Falling","Alamo",94,94,56,"40448"
100,"spotify:track:1Ej96GIBCTvgH7tNX1r3qr","Sech, Darell","Otro Trago","Rich Music/Ingrooves Records",1,96,298,"40128"
101,"spotify:track:26Qhn2T88XqVinXQpmSarj","Nicky Jam, Sech","Atrévete","Sony Music Latin",19,97,193,"39782"
102,"spotify:track:4xvTPuwHaXoDM3p0QcY7bH","DJ Luian, Mambo Kingz, Farruko, Wisin, Myke Towers, Darell, Arcángel","Música","Hear This Music",56,103,68,"39051"
103,"spotify:track:3YntiCUU0Xqq0B68FM3YAt","Myke Towers","Rutina","2019 Casablanca Records & One World Music | Distributed by GLAD Empire",70,106,58,"38544"
104,"spotify:track:696DnlkuDOXcMAnKlTgXXK","Arizona Zervas","ROXANNE","Arizona Zervas",92,102,77,"38407"
105,"spotify:track:4PJ3umtW1aWdfh5EITHc6T","Nicky Jam, Ozuna","Te Robaré","Sony Music Latin",4,104,326,"37560"
106,"spotify:track:6Xfz4YNwwIcFRyfW3QQZVp","Ceaese, Utopiko, Polimá Westcoast, Young Cister","Te Quiero Ver (feat. Polimá Westcoast y Young Cister)","WM Chile",31,100,415,"37474"
107,"spotify:track:132ALUzVLmqYB4UsBj5qD6","Paulo Londra","Adan y Eva","WEA Latina",1,109,463,"37455"
108,"spotify:track:2vrpcQNg6itmgVZWsNjWe0","Sebastian Yatra, Reik","Un Año","UMLE - Latino",9,119,389,"36364"
109,"spotify:track:059bcIhyc2SBwm6sw2AZzd","Piso 21, Micro TDH","Te Vi","WM Mexico",17,114,418,"35986"
110,"spotify:track:0GmiGIxXDNrePrHBpijYDp","Yannc, Darkiel, Eladio Carrion, Brray, Myke Towers","Sigue Bailandome","Full Harmony",4,108,476,"35930"
111,"spotify:track:2b8fOow8UzyDFAE27YhOZM","Maroon 5","Memories","Interscope Records*",101,120,82,"35454"
112,"spotify:track:3f5lA8nnc4YYF1qf78WpHw","Anuel AA, Romeo Santos","Ella Quiere Beber - Remix","Real Hasta La Muerte, LLC",8,112,466,"35183"
113,"spotify:track:1NmQc6rwLv7g0UHL1AFOa9","JHAYCO, Ozuna","Easy - Remix","N&E Entertainment LLC",57,110,83,"35145"
114,"spotify:track:63Z1ToWxe9UJA82d9qF5lo","Simon la Letra, Pablo Chill-E","Es Poco","GGF",94,111,72,"34573"
115,"spotify:track:5jW3rF4URMdK7tO2xjS5EI","Paulo Londra","Tal Vez","WEA Latina",5,115,313,"33580"
116,"spotify:track:5QXQy0f2q8wJNpPwJtjifx","DJ Snake, J Balvin, Ozuna, Nicky Jam, NATTI NATASHA, Darell, Sech","Loco Contigo (with J. Balvin & Ozuna feat. Nicky Jam, Natti Natasha, Darell & Sech) - REMIX","DJ Snake Music Productions Limited/Geffen Records",59,113,46,"33431"
117,"spotify:track:6OPl2rRpNsW1BZmtrSxP6X","Ceaese, Utopiko, DrefQuila, THAT","Damelo (feat. DrefQuila y THAT)","WM Chile",31,117,395,"33192"
118,"spotify:track:7o0oY5wRcoV7oPuDhD2J1z","Paloma Mami","Fingías","Sony Music Latin",1,116,326,"32693"
119,"spotify:track:4jMwPJMtMF977ciTvD5fwg","Myke Towers, Farruko","Si Se Da","2020 One World Music & Casablanca Records | Powered by GLAD Empire, LL",6,128,348,"32538"
120,"spotify:track:7BuHdm4lQqcyG3qTwdkxus","Wisin & Yandel, Romeo Santos","Aullando","Sony Music Latin",25,131,424,"32520"
121,"spotify:track:6osaMSJh9NguagEDQcZaKx","DJ Snake, J Balvin, Tyga","Loco Contigo (feat. J. Balvin & Tyga)","DJ Snake Music Productions Limited",33,121,242,"32505"
122,"spotify:track:2dy3TKVDEbIeWxeIb8JWqZ","NATTI NATASHA, Romeo Santos","La Mejor Versión de Mi - Remix","Pina Records",86,139,129,"32463"
123,"spotify:track:4Clmg1g8n2yBYG13Z1oSdG","Dayvi, Victor Cardenas, Kelly Ruíz","Baila Conmigo (feat. Kelly Ruiz)","Sony Music México",17,105,242,"32407"
124,"spotify:track:6fIVDVyzymH4OAlNhJ93k3","Jerry Di, Zion & Lennox, Lyanno, Noriel, Luis Alberto Ambrosio Cuque, Pablo C Fuentes, Wilmo Belisario","Verano En París - Remix","Nacho",109,118,101,"32261"
125,"spotify:track:4SJHHpKhcuXwDsCsPqshXj","Rauw Alejandro, Chencho Corleone","El Efecto","Duars Entertainment, Corp.",64,129,330,"32228"
126,"spotify:track:35wvL50xvKpCHEJPxLOLPI","Bad Bunny","Si Estuviésemos Juntos","Rimas Entertainment LLC",7,126,413,"31706"
127,"spotify:track:64kNRze29YqCFzFEpQCaHQ","Gigolo Y La Exce, Myke Towers, Arcángel, El Alfa, Farruko","Rasta Barbie (Remix)","Rimas Entertainment LLC",69,125,117,"31488"
128,"spotify:track:6pNjmMB8FTMEcqGSgs7Mji","Farruko, Ozuna, Lunay, Sech, Sharo Towers","Nadie (feat. Sech & Sharo Towers) - Remix","Sony Music Latin",25,133,123,"31301"
129,"spotify:track:29ShXDWDedEwZkYc8Du08N","Rich Music LTD, Sech, Dalex, Justin Quiles, Lenny Tavárez, Feid, Cazzu","Imaginate","Rich Music",54,132,122,"31264"
130,"spotify:track:5W83ErFkO3aKAIS1WMi6u0","Anuel AA, KAROL G","Secreto","Anuel AA & Karol G - Secreto",1,122,392,"30957"
131,"spotify:track:6ehhkBXzCrzBJ6YCL9tIdd","Pablo Chill-E, 0-600","Jugo y Plata","ShishiGang Récords",95,136,11,"30839"
132,"spotify:track:7pxL0DzPpCjjcdfQccvnus","Piso 21, Myke Towers","Una Vida Para Recordar","WM Mexico",43,141,220,"30673"
133,"spotify:track:0EJu1RBtxzldMG2peczuPv","Paloma Mami","No Te Enamores","Sony Music Latin",1,123,417,"30596"
134,"spotify:track:6b2RcmUt1g9N9mQ3CbjX2Y","Sam Smith","How Do You Sleep?","PLG - Capitol",60,152,204,"30543"
135,"spotify:track:7xX3wvvcZvxGCa06KlgTCp","Myke Towers","Tú","2020 One World Music & Casablanca Records | Powered by GLAD Empire, LL",90,138,18,"30423"
136,"spotify:track:6ifUES3keWjwXgae8pXI3o","Danny Ocean","Me Rehúso","Atlantic Records",1,135,1107,"29981"
137,"spotify:track:21jGcNKet2qwijlDFuPiPb","Post Malone","Circles","Republic Records",123,146,98,"29507"
138,"spotify:track:0aCTSZQTlmnjQucALTF00s","Harry Nach","Tak Tiki Tak","Sony Music Entertainment Chile S.A",138,143,20,"29470"
139,"spotify:track:6wBrZZ1LyiBxytLnpgnlhf","Cami","Querida Rosa","Universal Music Chile",26,160,610,"29413"
140,"spotify:track:364dI1bYnvamSnBJ8JcNzN","Justin Bieber, Quavo","Intentions","RBMG/Def Jam",140,144,3,"29218"
141,"spotify:track:0PaNKfwdqHjmW7hVEQ0lbu","Camilo","La Difícil","Sony Music Latin",117,175,31,"28545"
142,"spotify:track:7mWFF4gPADjTQjC97CgFVt","Ozuna, Daddy Yankee, J Balvin, Farruko, Anuel AA","Baila Baila Baila - Remix","VP Records Corp/Dimelo Vi",11,134,292,"28425"
143,"spotify:track:2EEmzqzM70CybVspgM7YRT","Mau y Ricky, Camilo, Lunay","La Boca - Remix","Sony Music Latin",28,140,209,"28351"
144,"spotify:track:0x1k6gSTSxaLxe0F2IThaX","Mike Bahía, Danny Ocean","Detente","WM Mexico",139,165,28,"28288"
145,"spotify:track:1khmgu0pveJbkbpbkyvcQv","Bad Bunny, El Alfa","La Romana","Rimas Entertainment LLC",14,130,414,"28226"
146,"spotify:track:2J9B63FawlTaPdg4eH5X03","Beéle","Loco","Hear This Music",98,151,117,"28094"
147,"spotify:track:4aN4QlhHVjgvXYkF3hlW2b","Jay Wheeler, DJ Nelson, Farruko","Otra Noche Más - Remix","Linked Music / Dynamic Records / EMPIRE",145,158,19,"28042"
148,"spotify:track:4EKZsrsCKyqr64FBHLc0DU","KAROL G, Maluma","Créeme","UMLE - Latino",32,163,462,"27957"
149,"spotify:track:152U4ecGSiYeKm2gnFc4wA","Villa Cariño","Serenata cruel","Clandestino Records",44,124,1051,"27770"
150,"spotify:track:0VKkyBKCXyR99navhVRqcP","Zion & Lennox","La player (Bandolera)","WEA Latina",1,153,715,"27446"
151,"spotify:track:116H0KvKr2Zl4RPuVBruDO","Bad Bunny, Drake","MIA","Rimas Entertainment LLC",1,145,487,"27389"
152,"spotify:track:7ef4DlsgrMEH11cDZd32M6","Calvin Harris, Dua Lipa","One Kiss (with Dua Lipa)","Sony Music UK",32,169,462,"27370"
153,"spotify:track:2hMemEDS1l5hrjLWwU1MNt","Polimá Westcoast, Pablo Chill-E","MY BLOOD","Sony Music Entertainment Chile S.A",21,147,350,"27227"
154,"spotify:track:0hVXuCcriWRGvwMV1r5Yn9","Ed Sheeran & Justin Bieber, Justin Bieber","I Don't Care (with Justin Bieber)","Atlantic Records UK",28,174,219,"27172"
155,"spotify:track:0LHejotBx99f8kN7UQP2o4","Harry Nach, Young Kieff","Norty","Only Perk",143,149,56,"27127"
156,"spotify:track:5lFl0Aksww4t4CGiYYtpZz","Rauw Alejandro","Detective","Duars Entertainment, Corp.",109,148,175,"27007"
157,"spotify:track:3Dv1eDb0MEgF93GpLXlucZ","Doja Cat","Say So","Kemosabe Records/RCA Records",154,154,5,"26947"
158,"spotify:track:65DBZofI0b79kfHTcWWDuU","Soda Stereo","Trátame Suavemente - Remasterizado 2007","Columbia",134,137,256,"26689"
159,"spotify:track:74wEiOpnvCe1tCTWKGSYta","Becky G, Paulo Londra","Cuando Te Besé","Kemosabe Records/RCA Records/Sony Music Latin",5,162,555,"26614"
160,"spotify:track:1GBLO0NFODuL31A5fgw0uR","Maluma, Ricky Martin","No Se Me Quita (feat. Ricky Martin)","Sony Music Latin",74,159,162,"26601"
161,"spotify:track:6ydubKY1r75XKuQheIQB8f","Cami","Aquí Estoy","Universal Music Chile",11,190,231,"26595"
162,"spotify:track:4u7EnebtmKWzUH433cf5Qv","Queen","Bohemian Rhapsody - Remastered 2011","EMI",26,156,603,"26381"
163,"spotify:track:6qqd7DGn2VXzxsR4k3Ycun","Rauw Alejandro, Farruko","Fantasias - Unplugged","(SME US Latin) Duars Entertainment, Corp. (2)",90,176,91,"26335"
164,"spotify:track:4MxYiw28F30NGOaTZ1ySqd","Mau y Ricky, Nicky Jam, Dalex, Dímelo Flow, Justin Quiles, Lenny Tavárez","Bota Fuego (feat. Dímelo Flow, Justin Quiles & Lenny Tavárez) - Remix","Sony Music Latin",100,164,45,"26286"
165,"spotify:track:57kdZIOAaolxAjB67d2yU3","Duki","Goteo","SSJ Records / DALE PLAY Records",22,157,187,"26240"
166,"spotify:track:1F205Nl2feOSYSztLNOJAL","Eladio Carrion, Brytiago","3 Am","Rimas Entertainment LLC",133,171,10,"26198"
167,"spotify:track:42ArfZUgGo3k5btIHp08it","Paloma Mami","Not Steady","Sony Music Latin",3,150,542,"26188"
168,"spotify:track:2ohqtT8jp5VeSBAtBEpSqA","Brytiago, Myke Towers","Toxico","Business Music",58,186,87,"25992"
169,"spotify:track:4jhHaLksdP8DJZzxYAjOSz","Eladio Carrion, Bad Bunny","Kemba Walker","Rimas Entertainment LLC",37,172,131,"25807"
170,"spotify:track:3bCuNSiaBHqxdevMYEnGpe","Jesse & Joy, Luis Fonsi","Tanto","WEA Latina",78,-1,99,"25763"
171,"spotify:track:6exje52SuWDGQ2Ol8K4P5I","Pablo Chill-E, Chuchu Retro","Pensando En Ti","ShiShigang Records",70,166,319,"25707"
172,"spotify:track:1JSTJqkT5qHq8MDJnJbRE1","The Police","Every Breath You Take","Polydor Records",161,170,134,"25613"
173,"spotify:track:619zlIsV7csW2h2narAoPC","Lasso, Cami","Un Millón Como Tú","Universal Music Mexico",52,-1,315,"25580"
174,"spotify:track:5xbZJo8AFv830Wx1RvmMXX","Drago200, Pablo Chill-E, Polimá Westcoast, Lleflight","Atraco Con 2 - Remix","Nabru Records LLC",119,179,14,"25557"
175,"spotify:track:7DOh0tBGnyMt6C5OO7o8Yq","Cazzu, Lyanno, Rauw Alejandro, Dalex","Nada","Rimas Entertainment LLC",124,177,87,"25547"
176,"spotify:track:5099x34vBakWpGkHourFxP","Maluma, J Balvin","Qué Pena","Sony Music Latin",43,167,136,"25523"
177,"spotify:track:1mlGScrDQqHqmhdIqE8MmA","Morat, Juanes","Besos En Guerra","Universal Music Spain S.L.",74,-1,541,"25425"
178,"spotify:track:7BuSE9uTIw931wtZYzvZcQ","Sebastian Yatra, Daddy Yankee, NATTI NATASHA, Jonas Brothers","Runaway","UMLE - Latino",14,178,234,"25089"
179,"spotify:track:4BCPItsB94KDLuERZT3aNM","TINI, Lalo Ebratt","Fresa","5020 Records",58,173,156,"25030"
180,"spotify:track:3VyjsVV24RmBIbWJAeUJNu","Don Toliver","No Idea","We Run It Ent./Cactus Jack/Atlantic",114,168,46,"24932"
181,"spotify:track:4whKi0lMYWNiV2IZBkTbYB","Casper Magico, Rauw Alejandro","La Mas Linda","2019 Flow La Movie, Inc & Los Magicos",123,188,57,"24902"
182,"spotify:track:0dlFCeKHsPhnLKPbqoOwwH","Santaferia","Haciendo nada","Santaferia",48,127,656,"24870"
183,"spotify:track:3jjujdWJ72nww5eGnfs2E7","Harry Styles","Adore You","Columbia",87,195,21,"24734"
184,"spotify:track:43zdsphuZLzwA9k4DJhU0I","Billie Eilish","when the party's over","Darkroom/Interscope Records",110,-1,153,"24730"
185,"spotify:track:1SmkyV46t9ggDHc994V6Wt","Movimiento Original","Only You","Movimiento Original",118,-1,22,"24682"
186,"spotify:track:7qiZfU4dY1lWllzX7mPBI3","Ed Sheeran","Shape of You","Atlantic Records UK",2,200,1008,"24653"
187,"spotify:track:5UyH584f99c7qErZifyaHy","Princesa Alba","Convéncete","Altafonte bajo licencia exclusiva de Princesa Alba",38,184,271,"24612"
188,"spotify:track:71iAechwVKGu26pahzFL0k","Morat","Cuando Nadie Ve","Universal Music Spain S.L.",42,-1,441,"24588"
189,"spotify:track:7hynhxDoDpgMIV12JuVtNa","J Balvin, Bad Bunny, Marciano Cantero","UN PESO","Universal Music Latino / Rimas",9,189,226,"24386"
190,"spotify:track:5yY9lUy8nbvjM1Uyo1Uqoc","Future, Drake","Life Is Good (feat. Drake)","Epic/Freebandz",182,182,2,"24345"
191,"spotify:track:4l0Mvzj72xxOpRrp6h8nHi","Selena Gomez","Lose You To Love Me","Interscope Records",25,-1,98,"24300"
192,"spotify:track:7fa9MBXhVfQ8P8Df9OEbD8","Maroon 5, Cardi B","Girls Like You (feat. Cardi B) - Cardi B Version","Interscope Records*",46,-1,360,"24040"
193,"spotify:track:3CV6tcIs0tqW3aJtu6THaM","Pablo Chill-E","Vibras","ShiShi Gang Records",91,187,331,"23974"
194,"spotify:track:0tgVpDi06FyKpA1z0VMD4v","Ed Sheeran","Perfect","Atlantic Records UK",55,-1,903,"23836"
195,"spotify:track:5N5k9nd479b1xpDZ4usjrg","Calvin Harris, Sam Smith, Jessie Reyez","Promises (with Sam Smith)","Columbia",92,-1,248,"23790"
196,"spotify:track:3dWpRjCmaHbroNahuSeX11","Guaynaa, Nicky Jam, Farruko, Becky G, Sech","Rebota - Remix","Rebota Remix",21,183,212,"23720"
