rank,uri,artist_names,track_name,source,peak_rank,previous_rank,days_on_chart,streams
1,"spotify:track:4HYDUMY0xSpeBr0AMY9cUz","Jay Wheeler, DJ Nelson, Myke Towers","La Curiosidad","Linked Music / Dynamic Records / EMPIRE",1,1,27,"218944"
2,"spotify:track:1mohfLaTJtB2RplHLQVM70","Nio Garcia, Anuel AA, Myke Towers, Brray, Juanka","La Jeepeta - Remix","2020 Flow La Movie, Inc. | Powered by GLAD Empire, LLC",1,2,76,"191251"
3,"spotify:track:3ZG8N7aWw2meb6UrI5ZmnZ","Sech","Relación","Rich Music",3,3,98,"165602"
4,"spotify:track:06s3QtMJVXw1AJX3UfvZG1","Anuel AA, Bad Bunny","Hasta Que Dios Diga","2020 Real Hasta La Muerte, LLC",1,4,41,"156380"
5,"spotify:track:2tFwfmceQa1Y6nRPhYbEtC","JHAYCO, Bad Bunny","CÓMO SE SIENTE - Remix","N&E Entertainment LLC",1,5,60,"154344"
6,"spotify:track:50ZC4PM7hywH27RcCfViau","Rauw Alejandro, Dalex, Lenny Tavárez, Dímelo Flow","Elegí (feat. Dímelo Flow)","Sony Music Latin",3,6,104,"142309"
7,"spotify:track:6Hw21Z5CmEV78jrncFpMwz","Harry Nach","Tak Tiki Tak","Sony Music Entertainment Chile S.A",7,7,169,"124215"
8,"spotify:track:3gD4J3RUHy4OUuZ3qAiaiG","Ozuna","Caramelo","Aura Music Corp.",8,8,27,"117330"
9,"spotify:track:4TOmcZvw0gHa7GiXRbcYAW","Feid, Justin Quiles","PORFA","JP Entertainment (Jorge Pino)",4,9,175,"114014"
10,"spotify:track:2DEZmgHKAvm41k4J3R2E9Y","Bad Bunny, Jowell & Randy, Ñengo Flow","Safaera","Rimas Entertainment LLC",1,10,130,"109472"
11,"spotify:track:6yVkakCN460KOVol9ZazjH","Anuel AA","Reggaetonera","2020 Real Hasta La Muerte, LLC",2,12,41,"102916"
12,"spotify:track:74j34STf8L6uADnTN69ohv","Rauw Alejandro, Chencho Corleone, KEVVO, Bryant Myers, Lyanno, Dalex","El Efecto - Remix","(SME US Latin) Duars Entertainment, Corp. (2)",10,11,209,"100643"
13,"spotify:track:0SqqAgdovOE24BzxIClpjw","Bad Bunny","Yo Perreo Sola","Rimas Entertainment LLC",2,13,131,"100099"
14,"spotify:track:0VjIjW4GlUZAMYd2vXMi3b","The Weeknd","Blinding Lights","Republic Records",13,14,194,"92587"
15,"spotify:track:380HmhwTE2NJgawn1NwkXi","J Balvin","Rojo","UMLE - Latino",8,15,132,"92319"
16,"spotify:track:7lUdbnz7wsv3C9zzf4WHl9","Feid, J Balvin, Maluma, Nicky Jam, Sech, Justin Quiles","PORFA Remix ( Feat. Maluma, Nicky Jam, Sech) - Remix","JP Entertainment (Jorge Pino)",16,16,13,"91330"
17,"spotify:track:6NfrH0ANGmgBXyxgV2PeXt","Bad Bunny","La Difícil","Rimas Entertainment LLC",1,17,131,"87895"
18,"spotify:track:0jT8Nl0shPS8115is0wD2Q","Camilo","Favorito","Sony Music Latin",3,18,104,"85380"
19,"spotify:track:3JHpk0DOTOzyh0777JFAky","Myke Towers","Diosa","2020 One World Music & Casablanca Records | Powered by GLAD Empire, LL",7,19,167,"83069"
20,"spotify:track:7na7Bk98usp84FaOJFPv3d","Rauw Alejandro","Tattoo","(SME US Latin) Duars Entertainment, Corp. (2)",7,20,146,"81279"
21,"spotify:track:38RIEav39FGi86jppxO0du","Bad Bunny, Sech","Ignorantes","Rimas Entertainment LLC",1,22,146,"77480"
22,"spotify:track:5m3jpKkgkfoMcym1qjToFg","Alex Rose, Rafa Pabön","Jangueo","Los Oidos Fresh/ Los Proximos",13,23,228,"77097"
23,"spotify:track:5stPVcRqb4qixbafP9e8lt","Dalex, Lenny Tavárez, Chencho Corleone, Juhn, Dímelo Flow","Hola - Remix","Rich Music",2,21,251,"76965"
24,"spotify:track:7sQKy5vlPQllr0k9IjYJv3","Arcángel, Sech, Dímelo Flow","Sigues Con El","Rimas Entertainment LLC.",2,24,209,"74198"
25,"spotify:track:69vlMrzHwATKzupwNcUPyK","Bad Bunny, Daddy Yankee","La Santa","Rimas Entertainment LLC",3,25,131,"72338"
26,"spotify:track:0FktnzDqjClqU6iqOZVEs2","Bad Bunny","BYE ME FUI","Rimas Entertainment LLC",1,26,60,"67546"
27,"spotify:track:2tGENA8xef0wABdHvyXwv9","Lunay, Ozuna, Myke Towers, Chencho Corleone, Rauw Alejandro","La Cama (Remix)","round2media - LaFamilia",20,28,104,"66491"
28,"spotify:track:4EJHKSnHENfjOxXWryyNtL","Bad Bunny, Zion & Lennox","MÁS DE UNA CITA","Rimas Entertainment LLC",1,27,60,"66433"
29,"spotify:track:5bmSver2b3ZXyuyLKtgnFI","Bad Bunny, Nicky Jam","BAD CON NICKY","Rimas Entertainment LLC",3,29,60,"65691"
30,"spotify:track:6AzKhCHOms83jvNVLsz0Bt","Aya Nakamura, Maluma","Djadja (feat. Maluma) - Remix","Rec. 118",30,30,23,"64959"
31,"spotify:track:2lCkncy6bIB0LTMT7kvrD1","J Balvin","Azul","UMLE - Latino",29,33,111,"61726"
32,"spotify:track:3pm4XtcsRIFFtH2UErk62R","Yandel, Bad Bunny","CANCIÓN CON YANDEL","Rimas Entertainment LLC",4,32,60,"60972"
33,"spotify:track:7k4t7uLgtOxPwTpFmtJNTY","KAROL G, Nicki Minaj","Tusa","TUSA - Karol G & Nicki Minaj",1,31,244,"60343"
34,"spotify:track:4QfZYDhGZc0T2RDvGiI69E","El Alfa, Chael Produciendo","Singapur","EL JEFE RECORDS LLC",34,40,20,"58822"
35,"spotify:track:1rgnBhdG2JDFTbYkYRZAku","Tones And I","Dance Monkey","Elektra (NEK)",4,34,275,"58380"
36,"spotify:track:099tjv6oy2opbpCOA3nBwX","Ir Sais, Rauw Alejandro","Dream Girl - Remix","Sony Music Latin",34,36,185,"55951"
37,"spotify:track:43NqTeL8pgBxKHPMiJKUP5","Myke Towers","Girl","2020 One World Music & Casablanca Records | Powered by GLAD Empire, LL",4,37,167,"55752"
38,"spotify:track:4r9jkMEnArtWGH2rL2FZl0","Bad Bunny","A Tu Merced","Rimas Entertainment LLC",9,35,131,"55515"
39,"spotify:track:5kbps8unnGH4raN5WduZuq","Sech, Daddy Yankee","Confía","Rich Music",28,38,49,"54835"
40,"spotify:track:35KmOEIUqAGn02t7n4qaIr","J Balvin","Morado","UMLE - Latino",12,39,181,"54535"
41,"spotify:track:2n7ohqg1s68ToAHh4u9mcW","Bad Bunny","Vete","Rimas Entertainment LLC",1,41,231,"53120"
42,"spotify:track:4w47S36wQGBhGg073q3nt7","ROSALÍA, Travis Scott","TKN (feat. Travis Scott)","Columbia",32,47,42,"52509"
43,"spotify:track:5379uuUPHodsdVhy8pIAAr","Cali Y El Dandee, Sebastian Yatra","Locura","Cali y El Dandee PS",31,42,62,"52106"
44,"spotify:track:1sHs87yRloQy0vE9mzpiZB","Juanka","Tus Besos","N&E Entertainment LLC",38,45,78,"51107"
45,"spotify:track:7KKh0ujp8agIiCrkiJhf81","Anuel AA, Tego Calderón","Jangueo","2020 Real Hasta La Muerte, LLC",3,46,41,"51039"
46,"spotify:track:5EbtodsuLbxrFDH6j5avVS","Camilo, Pablo Alborán","El Mismo Aire - con Pablo Alborán","Sony Music Latin",29,48,29,"51007"
47,"spotify:track:5eEQCfq7MXQr6aHLNRUZLs","Anuel AA","Keii","2020 Real Hasta La Muerte, LLC",4,43,153,"50727"
48,"spotify:track:3vAn0qZzdyuHamcrpkfiX3","BLACKPINK","How You Like That","YG Entertainment/Interscope Records",29,44,13,"50013"
49,"spotify:track:56Ta1O7Jxxpjnc6cWdDKUo","Reik, Farruko, Camilo","Si Me Dices Que Sí","Sony Music México",46,50,140,"49535"
50,"spotify:track:41wtwzCZkXwpnakmwJ239F","Bad Bunny","Si Veo a Tu Mamá","Rimas Entertainment LLC",4,49,131,"49271"
51,"spotify:track:57Ba26w9eoXx8BBUNgRNLV","Super Yei, Sammy Baby, Jone Quest, Myke Towers, Lenny Tavárez, Rafa Pabön","La Forma en Que Me Miras","2020 Superiority | Powered by GLAD EMPIRE, LLC",51,51,696,"47055"
52,"spotify:track:0eeKDrQxjqNl5bX5VCHDcn","Justin Quiles, Daddy Yankee, El Alfa","PAM","WEA Latina",50,52,69,"45936"
53,"spotify:track:6UelLqGlWMcVH1E5c4H7lY","Harry Styles","Watermelon Sugar","Columbia",53,57,60,"44797"
54,"spotify:track:4R8BJggjosTswLxtkw8V7P","JHAYCO, J Balvin, Bad Bunny","No Me Conoce - Remix","N&E Entertainment LLC",2,55,419,"44642"
55,"spotify:track:24Yi9hE78yPEbZ4kxyoXAI","SAINt JHN, Imanbek","Roses - Imanbek Remix","Columbia/B1 Recordings",51,54,109,"44552"
56,"spotify:track:5IjOqh4XLyjHINuOGolmAt","Eladio Carrion, Zion & Lennox, Wisin & Yandel, Lunay","Mi Error - Remix","Rimas Entertainment LLC",27,56,234,"44409"
57,"spotify:track:6mAN61JH0dzyZpWslS11jy","Rauw Alejandro, Farruko","Fantasias","(SME US Latin) Duars Entertainment, Corp. (2)",1,53,314,"44317"
58,"spotify:track:3jbT1Y5MoPwEIpZndDDwVq","Tainy, Anuel AA, Ozuna","Adicto (with Anuel AA & Ozuna)","NEON16/Interscope Records",1,60,322,"44160"
59,"spotify:track:0OTtnwUO8natNWSwdZvXVF","Ovy On The Drums, Beéle","Inolvidable","WEA Latina",34,59,82,"44125"
60,"spotify:track:4Pu0a2TuHOYtI4CCE3HEXI","Arcángel, Sech, Romeo Santos","Sigues Con El - Remix","Rimas Entertainment LLC.",20,58,90,"42838"
61,"spotify:track:7eJMfftS33KTjuF7lTsMCx","Powfu, beabadoobee","death bed (coffee for your head)","Columbia",36,61,116,"42773"
62,"spotify:track:0KkIkfsLEJbrcIhYsCL7L5","Anuel AA, Daddy Yankee, KAROL G, Ozuna, J Balvin","China","2020 Real Hasta La Muerte, LLC",1,62,356,"42424"
63,"spotify:track:46V4kseB66GjFGklCgynGX","Casper Magico, Anuel AA","Sola & Vacía","2020 Flow La Movie, Inc. & Los Magicos, LLC | Powered by GLAD Empire,",29,65,83,"41406"
64,"spotify:track:6zEgnpM0qYmHLDnh8WPejL","J Balvin","Amarillo","UMLE - Latino",17,63,111,"41240"
65,"spotify:track:5XqCz18k96K8tx6DAYM97i","Bad Bunny, Don Omar","PA' ROMPERLA","Rimas Entertainment LLC",4,72,60,"40883"
66,"spotify:track:3PfIrDoz19wz7qK7tYeu62","Dua Lipa","Don't Start Now","Warner Records",20,64,251,"40778"
67,"spotify:track:0A37XY67wSdGqkGjtfW6aV","Rauw Alejandro, Anuel AA, NATTI NATASHA, Farruko, Lunay","Fantasias - Remix","(SME US Latin) Duars Entertainment, Corp. (2)",24,68,125,"40573"
68,"spotify:track:4xI3U4sDj1TPmO9Iz5TkYp","El Alfa, Darell, Noriel","4K","EL JEFE RECORDS LLC",41,67,118,"39974"
69,"spotify:track:0pgj4EzB1XRqgZemoMNG5D","Camilo, Evaluna Montaner","Por Primera Vez","Sony Music Latin",24,69,121,"39489"
70,"spotify:track:113PlnpZbHd3WIqeYjhZWv","Daddy Yankee, Sech","Definitivamente","El Cartel Records (EC3)",13,70,160,"39150"
71,"spotify:track:0fea68AdmYNygeTGI4RC18","J Balvin, Bad Bunny","LA CANCIÓN","Universal Music Latino / Rimas",4,71,377,"39109"
72,"spotify:track:5Xe78U9cUwnWOuWbgYvAKZ","Eix, Rauw Alejandro, Noriel, KEVVO, Brytiago, Jay Wheeler","Infiel - Remix","Duars Entertainment, LLC",59,66,7,"38944"
73,"spotify:track:7kOf0qHO4Rcwk6QJifZDRJ","Anuel AA","El Manual","2020 Real Hasta La Muerte, LLC",27,74,41,"38348"
74,"spotify:track:6C1jKbkCUgFws7M0M4oGCB","Dalex, Sech","Mejor","Rich Music",26,73,153,"38311"
75,"spotify:track:4GGwM2Krtlx9G9ii1RaEOx","Dalex, Lenny Tavárez, Anitta, NATTI NATASHA, Farruko, Justin Quiles","Bellaquita (Remix)","Rich Music",11,75,230,"37244"
76,"spotify:track:7mcdgAXmb35dakBnfDIv3q","Anuel AA","Narcos","2020 Real Hasta La Muerte, LLC",12,76,41,"37137"
77,"spotify:track:34LI7rwi9H8w2S5KTHnv1M","Manuel Turizo","Quiéreme Mientras Se Pueda","Sony Music Latin/La Industria",71,77,69,"36777"
78,"spotify:track:4SJHHpKhcuXwDsCsPqshXj","Rauw Alejandro, Chencho Corleone","El Efecto","Duars Entertainment, Corp.",63,78,438,"36094"
79,"spotify:track:2TH65lNHgvLxCKXM3apjxI","Bad Bunny, Tainy","Callaita","Rimas Entertainment LLC",1,79,405,"33728"
80,"spotify:track:466cKvZn1j45IpxDdYZqdA","Drake","Toosie Slide","OVO",54,81,97,"33647"
81,"spotify:track:1V8XneTrX6kKeoxYbk4x6h","Bad Bunny, Duki, Pablo Chill-E","Hablamos Mañana","Rimas Entertainment LLC",4,80,131,"33553"
82,"spotify:track:5Id5B3dxJZhPcV9GzgYZZe","Rich Music LTD, Sech, Dalex, Justin Quiles, Lenny Tavárez, Feid, Wisin, Zion","Quizas","Rich Music",3,82,293,"33169"
83,"spotify:track:3FhiU60cxfN2j4jRy5Y40w","Cauty, Lenny Tavarez, Jay Wheeler, Noriel, Alex Rose","Lloras - Remix","eOne Music",75,84,136,"32752"
84,"spotify:track:6nGM44ZP7vSo0istUW2MOq","Farruko, Beéle, NATTI NATASHA, Manuel Turizo","Loco - Remix","Hear This Music",64,83,76,"32711"
85,"spotify:track:4MWb6mltydQn84NrTm7Gpl","Micro TDH, Rels B, Lenny Tavárez, Justin Quiles","Dime Cuantas Veces (Remix) [feat. Justin Quiles]","WEA Latina",76,91,14,"32555"
86,"spotify:track:10u2iOS0r6plfb9GknD7g4","Rauw Alejandro, Myke Towers, Sky Rompiendo","Ponte Pa' Mi","(SME US Latin) Duars Entertainment, Corp. (2)",78,85,83,"32317"
87,"spotify:track:3jjujdWJ72nww5eGnfs2E7","Harry Styles","Adore You","Columbia",85,87,140,"32278"
88,"spotify:track:634fDJYRCr5yzqfFWa9rfS","Paloma Mami","Goteo","Sony Music Latin",9,88,70,"31344"
89,"spotify:track:35wvL50xvKpCHEJPxLOLPI","Bad Bunny","Si Estuviésemos Juntos","Rimas Entertainment LLC",7,97,562,"31017"
90,"spotify:track:1Ol5LmdNDNpFu1oNwfgkux","Camilo, Pedro Capó","Tutu","Sony Music Latin",6,89,335,"31000"
91,"spotify:track:52zq2a71SGs3f1vJuv59ui","Juanfran","Como Llora","DN7 Music",82,86,69,"30963"
92,"spotify:track:017PF4Q3l4DBUiWoXk4OWT","Dua Lipa","Break My Heart","Warner Records",49,90,105,"30948"
93,"spotify:track:37zdqI4r1gswIzczSBkRon","Lunay, Anuel AA, Ozuna","Aventura","round2media - LaFamilia",1,94,258,"30457"
94,"spotify:track:0HMTIZ3iQ6QNjBaD9IE7ZZ","JHAYCO","Dime A Ve","N&E Entertainment LLC",91,92,6,"30368"
95,"spotify:track:4VgYtXCVJ7IbWAZ5ryfvEQ","Nicky Jam, Daddy Yankee","Muévelo","Sony Music Latin",8,93,183,"30107"
96,"spotify:track:2w1rq80FIrbxeJy9WYURxw","KAROL G, Anuel AA","Follow","UMLE - Latino",18,95,98,"29962"
97,"spotify:track:24IgCW19L8lXKyFZwzFtD3","Black Eyed Peas, Ozuna, J. Rey Soul","MAMACITA","Epic",93,96,83,"29953"
98,"spotify:track:4j4w4CXm6BSr0s25wAWrrX","Bad Bunny, Yaviah","Bichiyal","Rimas Entertainment LLC",9,98,131,"29866"
99,"spotify:track:5cBrOhKDyiJF9bPGUHKkG0","Dalex","+Linda","Rich Music",99,100,45,"29761"
100,"spotify:track:6K5BsR04ijf3FHNzjbaagD","Myke Towers, Farruko, Arcángel, Sech, Zion","Si Se Da - Remix","2019 Casablanca Records & One World Music | Distributed by GLAD Empire",5,99,342,"28811"
101,"spotify:track:4RaWbMItxVbuUExNkFsITP","Nio Garcia, Brray, Juanka","La Jeepeta","2019 Flow La Movie, Inc. | Distributed by GLAD Empire, LLC.",34,103,181,"28745"
102,"spotify:track:3l6Dc2DvpzEXJxnRTX5JUd","Nio Garcia, Bryant Myers, Lenny Tavárez, Miky Woodz, Jay Wheeler","Nocturna - Remix","2020 Flow La Movie Inc. | Distributed by GLAD Empire, LLC",76,102,131,"28665"
103,"spotify:track:3Dv1eDb0MEgF93GpLXlucZ","Doja Cat","Say So","Kemosabe Records/RCA Records",59,104,154,"28331"
104,"spotify:track:7ju97lgwC2rKQ6wwsf9no9","Lady Gaga, Ariana Grande","Rain On Me (with Ariana Grande)","Interscope",25,101,48,"28151"
105,"spotify:track:1aUGxXCz9QimNkKeiJtzZ7","KEVVO, Farruko, Chencho Corleone, Arcángel, Darell, Ñengo Flow, Brytiago, Myke Towers","105 F Remix","Una Vision Quintana",7,106,301,"28060"
106,"spotify:track:1ndyl3wJCFs872XZ3ztPk6","Justin Quiles, NATTI NATASHA, Farruko, Lenny Tavárez, Dalex, Zion","DJ No Pare (feat. Zion, Dalex, Lenny Tavárez) - Remix","WEA Latina",19,105,307,"28020"
107,"spotify:track:4t9a07PAghtQMRAIP9FQ7Z","Lunay, Daddy Yankee, Bad Bunny","Soltera (Remix)","round2media - LaFamilia",2,107,426,"27579"
108,"spotify:track:5J7teKIJGtqVypgYI6sqXj","Bad Bunny, Mora","Una Vez","Rimas Entertainment LLC",15,110,131,"27154"
109,"spotify:track:4bTZeO72FwMa6wKOiqoynL","Sech, Ozuna, Anuel AA, Darell, Nicky Jam","Otro Trago - Remix","Rich Music",1,109,349,"27007"
110,"spotify:track:7sKDftgGirHWTVFMtJoDoh","Aya Nakamura","Djadja","Rec. 118",93,108,95,"26970"
111,"spotify:track:27uAea0qcUz3a7jKnAT7KG","Santaferia","Algún Día Volverás","Santaferia",20,114,720,"26555"
112,"spotify:track:53uKGbcMjEc2gIWbfmvpdS","Nio Garcia, Rauw Alejandro, Lenny Tavárez, Myke Towers, Casper Magico, Darell","Mírame - Remix","2019 Flow La Movie, Inc. | Distributed by GLAD Empire, LLC.",17,111,356,"26470"
113,"spotify:track:4z6wo6PJG4Fve45OXK6D9m","Arcángel, Bad Bunny","Infeliz","Rimas Entertainment LLC.",17,115,202,"26313"
114,"spotify:track:5Xhqh4lwJPtMUTsdBztN1a","Shakira, Anuel AA","Me Gusta","Sony Music Latin",9,113,178,"26296"
115,"spotify:track:6aKV6o1hZR6J1ajKqhlxnT","Kiddtetoon, Diego Smith","Illuminati","Duetti (Migration)",112,112,11,"25502"
116,"spotify:track:2pWOMNQJW3g2zmGjP0Vkb0","Nicky Jam, Anuel AA","Whine Up","Sony Music Latin",4,120,254,"25492"
117,"spotify:track:70zg99pT51vB4wlMS7e4q7","Myke Towers, Maluma, Farruko","La Playa - Remix","2019 Casablanca Records & One World Music | Distributed by GLAD Empire",33,119,188,"25404"
118,"spotify:track:47ZS1OjnJpJVfGN9yHXfMn","Alex Rose, Rauw Alejandro, Lenny Tavárez, Cazzu, Lyanno","Toda (Remix)","Los Oídos Fresh",8,121,275,"25397"
119,"spotify:track:4NCsrTzgVfsDo8nWyP8PPc","Black Eyed Peas, J Balvin","RITMO (Bad Boys For Life)","Epic",4,116,271,"25355"
120,"spotify:track:2aGN6PplBq0xigh2lmqLbw","Sech, Ozuna","Si Te Vas","Rich Music",5,118,287,"25298"
121,"spotify:track:4s45VgkknMFkdiGoUcjxQU","Sebastian Yatra, Rauw Alejandro, Manuel Turizo","TBT","UMLE - Latino",57,117,139,"24879"
122,"spotify:track:7g8YaUQABMal0zWe7a2ijz","Dalex, Rafa Pabön, KHEA, Sech, Feid, Cazzu, Lenny Tavárez","Pa Mí (Remix)","Rich Music/Ingrooves Records",2,122,517,"24798"
123,"spotify:track:3qM0vBxIe4VUbK0Z0smuVP","JHAYCO, Anuel AA, J Balvin","Medusa","N&E Entertainment LLC",24,124,155,"24785"
124,"spotify:track:5YrjfKuFd0pMmYTGeRDV6X","Noriel","Piropo","Sony Music Latin/Ganda Entertainment",23,127,257,"24774"
125,"spotify:track:6Bd9rs5gv25asdPDRog3ce","Javiielo","Pa Los Gustos Los Colores","Oye Saavedra / EMPIRE",40,123,269,"24672"
126,"spotify:track:50ITehqoAuygfVlmG6FxO8","Harry Nach","Fixona","Only Perk",92,126,6,"24472"
127,"spotify:track:7ytR5pFWmSjzHJIeQkgog4","DaBaby, Roddy Ricch","ROCKSTAR (feat. Roddy Ricch)","South Coast Music Group/Interscope Records",125,125,22,"24256"
128,"spotify:track:34ZngZgo8xicbt1EE8Ob8Z","Rich Music LTD, Sech, Dalex, Justin Quiles, Lenny Tavárez, Feid","Porno","Rich Music",53,128,272,"23708"
129,"spotify:track:2CoMYp2uIKsT09nreEZnZn","Bad Bunny","BENDICIONES","Rimas Entertainment LLC",7,132,60,"23309"
130,"spotify:track:16DNJ8y6k97DxuMyV49W7V","KHEA","Dónde Estás","Young Flex - Khea",61,130,147,"22952"
131,"spotify:track:2w8SKQCnT2YQK1qCqKl2uW","Lenny Tavárez, Justin Quiles","La Pared 360","WEA Latina",86,129,153,"22944"
132,"spotify:track:5kQre7o8ky5DXeEPcyaCR1","Prince Royce, Myke Towers","Carita de Inocente (feat. Myke Towers) - Remix","Sony Music Latin",132,140,19,"22708"
133,"spotify:track:7fODjB7BrQTGqh0hogW6XD","Sech, Justin Quiles, Maluma, Nicky Jam, Farruko, Dalex, Lenny Tavárez","Que Mas Pues - Remix","Rich Music/Ingrooves Records",7,131,455,"22676"
134,"spotify:track:56f5qnyAlZdlz8wrUDA50h","Mau y Ricky, Manuel Turizo, Camilo","Desconocidos","Sony Music Latin",9,133,633,"22650"
135,"spotify:track:3dJWIbkKEnI0Jb9CK6kdcg","JHAYCO, Wisin & Yandel","Imaginaste - Remix","N&E Entertainment LLC",26,138,251,"22445"
136,"spotify:track:2B94bbI1a4LyBpK1439oP7","Noriel, Myke Towers, Rauw Alejandro, Almighty","Cuerpo en Venta","Rimas Entertainment LLC",11,135,335,"22247"
137,"spotify:track:1A9PKAFEHMWgXNLpgf7k4J","Myke Towers","Piensan","2020 One World Music & Casablanca Records | Powered by GLAD Empire, LL",14,137,300,"21951"
138,"spotify:track:5NOHsDSfLIH45y3i9PfRyh","Casper Magico, Bryant Myers, Alex Rose, Juhn","Fantasmita - Remix","2019 Flow La Movie, Inc & Los Magicos",55,139,216,"21948"
139,"spotify:track:6NfC2FKfsfzuLIF4lThw0A","Anuel AA, Bad Bunny","Así Soy Yo","2020 Real Hasta La Muerte, LLC",5,136,41,"21923"
140,"spotify:track:3DyiAk1BzIF8rq9rimypG4","Anuel AA, Cardi B, Black Jonas Point, Secreto ""El Famoso Biberon"", Liro Shaq","La Bebe - Remix","2020 GLAD Empire, LLC & Flow La Movie, Inc.",115,142,37,"21895"
141,"spotify:track:2hDe0Ls5mVqs1XJqv7sbcM","Anuel AA, Enrique Iglesias","Fútbol & Rumba (feat. Enrique Iglesias)","2020 Real Hasta La Muerte, LLC",15,134,41,"21852"
142,"spotify:track:7f5SeKPwJm4eM4GcngH2SX","Juanka","Cárcel","N&E Entertainment LLC",119,143,34,"21661"
143,"spotify:track:3cUE3p7E39CzGjQoEsg7sM","Santaferia","EL Gil De Tu Ex","Santaferia",21,153,1070,"21625"
144,"spotify:track:3SDvcxPcU7BlV1dAne4dWM","Play-N-Skillz, Daddy Yankee, Zion & Lennox","Bésame","Sony Music Latin/Latium Records",95,144,20,"21564"
145,"spotify:track:6RyaV7owmVU6fzEPE17sF1","Daddy Yankee","Que Tire Pa Lante","El Cartel Records (EC3)",5,141,265,"21435"
146,"spotify:track:6Xfz4YNwwIcFRyfW3QQZVp","Ceaese, Utopiko, Polimá Westcoast, Young Cister","Te Quiero Ver (feat. Polimá Westcoast y Young Cister)","WM Chile",31,145,564,"21346"
147,"spotify:track:4DpNNXFMMxQEKl7r0ykkWA","Melanie Martinez","Play Date","Atlantic Records",119,151,59,"21244"
148,"spotify:track:2dy3TKVDEbIeWxeIb8JWqZ","NATTI NATASHA, Romeo Santos","La Mejor Versión de Mi - Remix","Pina Records",86,147,278,"21133"
149,"spotify:track:1OW47kPsWJfvhcQ7V7XwhC","Myke Towers, Yandel","Mayor","2020 White World Music | Powered by GLAD Empire, LLC",110,155,27,"20923"
150,"spotify:track:75pQqzwgCjUOSSy5CpmAjy","Bad Bunny","Pero Ya No","Rimas Entertainment LLC",6,149,131,"20900"
151,"spotify:track:6v3KW9xbzN5yKLt9YKDYA2","Shawn Mendes, Camila Cabello","Señorita","Island Records",11,148,384,"20886"
152,"spotify:track:2btKz4s1XrMn5VHe7xZJpi","NATTI NATASHA","Que Mal Te Fue","Pina Records",135,163,34,"20814"
153,"spotify:track:7q3NthaBqFI6s0WnAlnIvq","Darell, Brytiago","Velitas","Sony Music Latin",36,156,363,"20801"
154,"spotify:track:25ZAibhr3bdlMCLmubZDVt","J Balvin, Bad Bunny","QUE PRETENDES","Universal Music Latino / Rimas",5,154,377,"20776"
155,"spotify:track:7BEPdOI0neT6p7PnLViqmH","Morat, Sebastian Yatra","Bajo La Mesa","Universal Music Spain S.L.",39,150,48,"20735"
156,"spotify:track:7qEHsqek33rTcFNT9PFqLf","Lewis Capaldi","Someone You Loved","Vertigo Berlin",141,157,51,"20594"
157,"spotify:track:29KkQi7wKF6IdOjwU8infb","El Alfa, Nicky Jam, Ozuna, Arcángel, Secreto ""El Famoso Biberon""","A Correr Los Lakers - Remix","EL JEFE RECORDS LLC",146,146,4,"20542"
158,"spotify:track:0RDgqtvOHLwcI6yz9bjsZV","Rich Music LTD, Sech, Dalex, Justin Quiles, Lenny Tavárez, Feid","Perreo en La Luna","Rich Music",22,158,272,"20472"
159,"spotify:track:7szuecWAPwGoV1e5vGu8tl","The Weeknd","In Your Eyes","Republic Records",111,159,104,"20441"
160,"spotify:track:1JSTJqkT5qHq8MDJnJbRE1","The Police","Every Breath You Take","Polydor Records",138,152,241,"20388"
161,"spotify:track:5p3JJehpKHjr9pJT5eD2Lz","Anuel AA, Farruko, Zion","Que Se Joda","2020 Real Hasta La Muerte, LLC",10,162,41,"20351"
162,"spotify:track:1xQ6trAsedVPCdbtDAmk0c","Jawsh 685, Jason Derulo","Savage Love (Laxed - Siren Beat)","Columbia",161,165,10,"20232"
163,"spotify:track:3eJMSq78dDaFb7VvhNFnq6","Maluma","ADMV","Sony Music Latin",127,171,51,"20211"
164,"spotify:track:4u7EnebtmKWzUH433cf5Qv","Queen","Bohemian Rhapsody - Remastered 2011","EMI",26,160,713,"20148"
165,"spotify:track:2vrpcQNg6itmgVZWsNjWe0","Sebastian Yatra, Reik","Un Año","UMLE - Latino",9,166,538,"20093"
166,"spotify:track:62aP9fBQKYKxi7PDXwcUAS","Surf Mesa, Emilee","ily (i love you baby) (feat. Emilee)","Astralwerks",147,164,50,"20080"
167,"spotify:track:059bcIhyc2SBwm6sw2AZzd","Piso 21, Micro TDH","Te Vi","WM Mexico",17,170,567,"20079"
168,"spotify:track:7MCFjPDImfjQv7GynHgVrR","Nicki Nicole","Colocao","Sony Music Latin/DALE PLAY Records",136,161,44,"19985"
169,"spotify:track:4VohsQwrtb7lj1yO0dFKJa","Tommy Boysen","Hookah & Sheridan's","Equity Distribution",12,167,659,"19928"
170,"spotify:track:4lzxJ4jCuFDXXGkE1LmpKR","DJ Luian, Mambo Kingz, Anuel AA, Nicky Jam, Darell, Brytiago","Verte Ir","Hear This Music",1,168,469,"19804"
171,"spotify:track:6ifUES3keWjwXgae8pXI3o","Danny Ocean","Me Rehúso","Atlantic Records",1,172,1204,"19769"
172,"spotify:track:0zlnHTHiBQ68ZCAmTw5ozm","Rauw Alejandro","Algo Mágico","Sony Music Latin/Duars Entertainment",131,182,13,"19713"
173,"spotify:track:53v2u51nq3CxiKUNphRzP1","Bad Bunny, Ñengo Flow","Que Malo","Rimas Entertainment LLC",11,174,131,"19698"
174,"spotify:track:6G4U9avyBNEfP0fAIduev3","Aventura, Don Omar","Ella Y Yo - Featuring Don Omar","Premium Latin Music",131,181,351,"19686"
175,"spotify:track:5jW3rF4URMdK7tO2xjS5EI","Paulo Londra","Tal Vez","WEA Latina",5,169,461,"19630"
176,"spotify:track:2gMXnyrvIjhVBUZwvLZDMP","Lewis Capaldi","Before You Go","Vertigo Berlin",158,183,9,"19387"
177,"spotify:track:2uy5wXDZQcdd89PvDBSfyy","Ñengo Flow, Anuel AA","Sur y Norte","Nengo Flow (Edwin Rosa Vazquez) (Real G 4 Life, Inc.)",40,-1,49,"19240"
178,"spotify:track:7BlBVFwvbWvcwNcUarQmjk","ROSALÍA, Ozuna","Yo x Ti, Tu x Mi","Columbia",9,184,295,"19184"
179,"spotify:track:4o1DxRjMCHDwBiOKv88rOl","Rvssian, Darell, Zion & Lennox, Myke Towers","B11 (feat. Myke Towers)","Sony Music Latin",14,187,294,"19120"
180,"spotify:track:7anSoGdgtmJTAPZBzcPhO6","Dalex, Nicky Jam, Justin Quiles, Sech, Lenny Tavárez, Feid, Rafa Pabön","Cuaderno","Rich Music/Ingrooves Records",5,186,424,"19117"
181,"spotify:track:5iwz1NiezX7WWjnCgY5TH4","Pedro Capó, Farruko","Calma - Remix","Sony Music Latin",1,176,640,"19096"
182,"spotify:track:0tgVpDi06FyKpA1z0VMD4v","Ed Sheeran","Perfect","Atlantic Records UK",55,175,964,"19032"
183,"spotify:track:2qG5sZ7Si6sdK74qLxedYM","ROSALÍA, J Balvin, El Guincho","Con Altura","Columbia",12,179,468,"18998"
184,"spotify:track:7MRU4vOkywuhZ9kbFiPuiu","Daddy Yankee, Wisin & Yandel","Si Supieras","El Cartel Records (EC3)",6,180,369,"18914"
185,"spotify:track:0G0p7mc4wEaQTsUpzEmkEs","Reik, Morat","La Bella y la Bestia","Sony Music México",123,177,25,"18834"
186,"spotify:track:132ALUzVLmqYB4UsBj5qD6","Paulo Londra","Adan y Eva","WEA Latina",1,192,608,"18652"
187,"spotify:track:4HBZA5flZLE435QTztThqH","Ariana Grande, Justin Bieber","Stuck with U (with Justin Bieber)","Ariana Grande & Justin Bieber ""Stuck With U""- Charity",43,188,49,"18642"
188,"spotify:track:5vdp5UmvTsnMEMESIF2Ym7","Queen","Another One Bites The Dust - Remastered 2011","EMI",42,178,383,"18588"
189,"spotify:track:7MmrcXVA7A5zZ2CbDuGHNa","Rels B","A Mí","DALE PLAY Records / Flakk Team",189,197,3,"18531"
190,"spotify:track:6KeweE0BlXx3AtjMKhBLaz","Rich Music LTD, Sech, Dalex, Justin Quiles, Lenny Tavárez, Feid, Mariah Angeliq","Feel Me","Rich Music",159,200,17,"18460"
191,"spotify:track:3AzjcOeAmA57TIOr9zF1ZW","Dua Lipa","Physical","Warner Records",50,191,137,"18458"
192,"spotify:track:5w9c2J52mkdntKOmRLeM2m","Daddy Yankee, Snow","Con Calma","El Cartel Records (EC3)",1,189,498,"18171"
193,"spotify:track:3f5lA8nnc4YYF1qf78WpHw","Anuel AA, Romeo Santos","Ella Quiere Beber - Remix","Real Hasta La Muerte, LLC",8,-1,537,"18168"
194,"spotify:track:7sOfmPd18RWp3FoCzpa7Kw","Bad Bunny","Soliá","Rimas Entertainment LLC",10,195,130,"18105"
195,"spotify:track:1IWNylpZ477gIVUDpJL66u","Lady Gaga, BLACKPINK","Sour Candy (with BLACKPINK)","Interscope",39,185,41,"18092"
196,"spotify:track:6fNJm8sYmCBbmkKpKgTReA","Camilo","La Difícil","Sony Music Latin",55,193,179,"17957"
197,"spotify:track:6gBFPUFcJLzWGx4lenP6h2","Travis Scott","goosebumps","Cactus Jack / Epic",58,-1,73,"17940"
198,"spotify:track:4nK5YrxbMGZstTLbvj6Gxw","BENEE, Gus Dapperton","Supalonely","Republic Records",116,196,106,"17935"
