rank,uri,artist_names,track_name,source,peak_rank,previous_rank,days_on_chart,streams
1,"spotify:track:3wYRLYuO1M88d8woWUIxct","Bad Bunny, Sech","Ignorantes","Rimas Entertainment LLC",1,1,12,"324229"
2,"spotify:track:7k4t7uLgtOxPwTpFmtJNTY","KAROL G, Nicki Minaj","Tusa","TUSA - Karol G & Nicki Minaj",1,2,110,"272434"
3,"spotify:track:7sQKy5vlPQllr0k9IjYJv3","Arcángel, Sech, Dímelo Flow","Sigues Con El","Rimas Entertainment LLC.",2,3,75,"255842"
4,"spotify:track:43NqTeL8pgBxKHPMiJKUP5","Myke Towers","Girl","2020 One World Music & Casablanca Records | Powered by GLAD Empire, LL",4,4,33,"231857"
5,"spotify:track:5eEQCfq7MXQr6aHLNRUZLs","Anuel AA","Keii","2020 Real Hasta La Muerte, LLC",4,6,19,"218894"
6,"spotify:track:5stPVcRqb4qixbafP9e8lt","Dalex, Lenny Tavárez, Chencho Corleone, Juhn, Dímelo Flow","Hola - Remix","Rich Music",2,5,117,"218128"
7,"spotify:track:3JHpk0DOTOzyh0777JFAky","Myke Towers","Diosa","2020 One World Music & Casablanca Records | Powered by GLAD Empire, LL",7,7,33,"180293"
8,"spotify:track:5DxXgozhkPLgrbKFY91w0c","Bad Bunny","Vete","Rimas Entertainment LLC",1,8,97,"177956"
9,"spotify:track:1rgnBhdG2JDFTbYkYRZAku","Tones And I","Dance Monkey","Elektra (NEK)",4,9,141,"171427"
10,"spotify:track:4VgYtXCVJ7IbWAZ5ryfvEQ","Nicky Jam, Daddy Yankee","Muévelo","Sony Music Latin",8,10,49,"153479"
11,"spotify:track:6mAN61JH0dzyZpWslS11jy","Rauw Alejandro, Farruko","Fantasias","(SME US Latin) Duars Entertainment, Corp. (2)",1,11,180,"148673"
12,"spotify:track:2pWOMNQJW3g2zmGjP0Vkb0","Nicky Jam, Anuel AA","Whine Up","Sony Music Latin",4,12,120,"135958"
13,"spotify:track:37zdqI4r1gswIzczSBkRon","Lunay, Anuel AA, Ozuna","Aventura","round2media - LaFamilia",1,13,124,"132557"
14,"spotify:track:1Xnn1TPyr5h0hpRAT4B4EA","Dalex, Lenny Tavárez, Anitta, NATTI NATASHA, Farruko, Justin Quiles","Bellaquita - Remix","Rich Music",11,14,96,"130676"
15,"spotify:track:113PlnpZbHd3WIqeYjhZWv","Daddy Yankee, Sech","Definitivamente","El Cartel Records (EC3)",15,15,26,"127972"
16,"spotify:track:5Xhqh4lwJPtMUTsdBztN1a","Shakira, Anuel AA","Me Gusta","Sony Music Latin",9,16,44,"125319"
17,"spotify:track:3mQ6SLdxxaL52Yte7KF2Ks","J Balvin","Morado","UMLE - Latino",16,17,47,"124141"
18,"spotify:track:3jbT1Y5MoPwEIpZndDDwVq","Tainy, Anuel AA, Ozuna","Adicto (with Anuel AA & Ozuna)","NEON16/Interscope Records",1,18,188,"118079"
19,"spotify:track:5m3jpKkgkfoMcym1qjToFg","Alex Rose, Rafa Pabön","Jangueo","Los Oidos Fresh/ Los Proximos",19,19,94,"117978"
20,"spotify:track:2ksOAxtIxY8yElEWw8RhgK","Anuel AA, Daddy Yankee, KAROL G, J Balvin, Ozuna","China","2019 Real Hasta La Muerte, LLC.",1,20,222,"107877"
21,"spotify:track:7na7Bk98usp84FaOJFPv3d","Rauw Alejandro","Tattoo","(SME US Latin) Duars Entertainment, Corp. (2)",21,23,12,"103896"
22,"spotify:track:6cy3ki60hLwimwIje7tALf","Black Eyed Peas, J Balvin","RITMO (Bad Boys For Life)","Epic/We The Best",4,21,137,"102191"
23,"spotify:track:5Id5B3dxJZhPcV9GzgYZZe","Rich Music LTD, Sech, Dalex, Justin Quiles, Lenny Tavárez, Feid, Wisin, Zion","Quizas","Rich Music",3,22,159,"99753"
24,"spotify:track:4R8BJggjosTswLxtkw8V7P","JHAYCO, J Balvin, Bad Bunny","No Me Conoce - Remix","N&E Entertainment LLC",2,24,285,"95421"
25,"spotify:track:4z6wo6PJG4Fve45OXK6D9m","Arcángel, Bad Bunny","Infeliz","Rimas Entertainment LLC.",17,25,68,"94323"
26,"spotify:track:3qM0vBxIe4VUbK0Z0smuVP","JHAYCO, Anuel AA, J Balvin","Medusa","N&E Entertainment LLC",24,26,21,"94147"
27,"spotify:track:0fea68AdmYNygeTGI4RC18","J Balvin, Bad Bunny","LA CANCIÓN","Universal Music Latino / Rimas",4,27,243,"92532"
28,"spotify:track:6WrI0LAC5M1Rw2MnX2ZvEg","Dua Lipa","Don't Start Now","Warner Records",27,28,117,"92189"
29,"spotify:track:5YrjfKuFd0pMmYTGeRDV6X","Noriel","Piropo","Sony Music Latin/Ganda Entertainment",23,29,123,"90137"
30,"spotify:track:1mF6sMUsRU9MisrdB9qWvg","Dalex, Sech","Mejor","Rich Music",30,32,19,"88361"
31,"spotify:track:2TH65lNHgvLxCKXM3apjxI","Bad Bunny, Tainy","Callaita","Rimas Entertainment LLC",1,30,271,"88324"
32,"spotify:track:1A9PKAFEHMWgXNLpgf7k4J","Myke Towers","Piensan","2020 One World Music & Casablanca Records | Powered by GLAD Empire, LL",14,31,166,"87523"
33,"spotify:track:6RyaV7owmVU6fzEPE17sF1","Daddy Yankee","Que Tire Pa Lante","El Cartel Records (EC3)",5,33,131,"86251"
34,"spotify:track:1aUGxXCz9QimNkKeiJtzZ7","KEVVO, Farruko, Chencho Corleone, Arcángel, Darell, Ñengo Flow, Brytiago, Myke Towers","105 F Remix","Una Vision Quintana",7,35,167,"81384"
35,"spotify:track:6Y4PDQv4XjYjHLeLmvyOt0","Sech, Ozuna","Si Te Vas","Rich Music",5,34,153,"81218"
36,"spotify:track:0RDgqtvOHLwcI6yz9bjsZV","Rich Music LTD, Sech, Dalex, Justin Quiles, Lenny Tavárez, Feid","Perreo en La Luna","Rich Music",22,36,138,"80933"
37,"spotify:track:4RaWbMItxVbuUExNkFsITP","Nio Garcia, Brray, Juanka","La Jeepeta","2019 Flow La Movie, Inc. | Distributed by GLAD Empire, LLC.",37,42,47,"80825"
38,"spotify:track:5IjOqh4XLyjHINuOGolmAt","Eladio Carrion, Zion & Lennox, Wisin & Yandel, Lunay","Mi Error - Remix","Rimas Entertainment LLC",27,37,100,"80775"
39,"spotify:track:1ndyl3wJCFs872XZ3ztPk6","Justin Quiles, NATTI NATASHA, Farruko, Lenny Tavárez, Dalex, Zion","DJ No Pare (feat. Zion, Dalex, Lenny Tavárez) - Remix","WEA Latina",19,38,173,"79278"
40,"spotify:track:6K5BsR04ijf3FHNzjbaagD","Myke Towers, Farruko, Arcángel, Sech, Zion","Si Se Da - Remix","2019 Casablanca Records & One World Music | Distributed by GLAD Empire",5,39,208,"78817"
41,"spotify:track:6EWWkqE4aFlZRyoFwwOT8u","Javiielo","Pa Los Gustos Los Colores","Oye Saavedra / EMPIRE",40,41,135,"78162"
42,"spotify:track:2B94bbI1a4LyBpK1439oP7","Noriel, Myke Towers, Rauw Alejandro, Almighty","Cuerpo en Venta","Rimas Entertainment LLC",11,43,201,"72475"
43,"spotify:track:4o1DxRjMCHDwBiOKv88rOl","Rvssian, Darell, Zion & Lennox, Myke Towers","B11 (feat. Myke Towers)","Sony Music Latin",14,44,160,"71941"
44,"spotify:track:1nocRtwyNPVtGcIJqfgdzZ","Camilo, Pedro Capó","Tutu","Sony Music Latin",6,40,201,"71231"
45,"spotify:track:684EjRHwNsZQ9hCQxL4NYL","Dímelo Flow, Nicky Jam, Sech, Farruko, Zion, Lunay","El Favor (with Nicky Jam & Sech, feat. Farruko, Zion & Lunay)","Rich Music/Interscope Records",6,45,180,"70181"
46,"spotify:track:70zg99pT51vB4wlMS7e4q7","Myke Towers, Maluma, Farruko","La Playa - Remix","2019 Casablanca Records & One World Music | Distributed by GLAD Empire",33,46,54,"69015"
47,"spotify:track:0sf12qNH5qcw8qpgymFOqD","The Weeknd","Blinding Lights","Republic Records",47,47,60,"66505"
48,"spotify:track:4bTZeO72FwMa6wKOiqoynL","Sech, Ozuna, Anuel AA, Darell, Nicky Jam","Otro Trago - Remix","Rich Music",1,48,215,"65217"
49,"spotify:track:0937IXPkSlckRCq1WoHSEl","Mon Laferte, Guaynaa","Plata Ta Tá","Universal Music Mexico",49,112,59,"63283"
50,"spotify:track:40rXWke6SnXiGkSmaT8ZUr","Ozuna","Fantasía","Aura Music Corp.",26,51,89,"61495"
51,"spotify:track:047WmwIeerHyIUstFAEz5A","El Alfa, Lil Pump, Sech, Myke Towers, Vin Diesel","Coronao Now - Remix","EL JEFE RECORDS LLC",47,49,13,"61222"
52,"spotify:track:7FbKipScVxkjQxQXwTd0gL","El Alfa, Lil Pump","Coronao Now","EL JEFE RECORDS LLC",21,50,111,"60246"
53,"spotify:track:3dJWIbkKEnI0Jb9CK6kdcg","JHAYCO, Wisin & Yandel","Imaginaste - Remix","N&E Entertainment LLC",26,55,117,"56615"
54,"spotify:track:53uKGbcMjEc2gIWbfmvpdS","Nio Garcia, Rauw Alejandro, Lenny Tavárez, Myke Towers, Casper Magico, Darell","Mírame - Remix","2019 Flow La Movie, Inc. | Distributed by GLAD Empire, LLC.",17,53,222,"55728"
55,"spotify:track:2oZBb87Jgwrg3qYhwsy3BN","Myke Towers","Parcerita","2020 One World Music & Casablanca Records | Powered by GLAD Empire, LL",54,54,33,"55373"
56,"spotify:track:16wAOAZ2OkqoIDN7TpChjR","Justin Bieber","Yummy","RBMG/Def Jam",35,52,54,"54537"
57,"spotify:track:74j34STf8L6uADnTN69ohv","Rauw Alejandro, Chencho Corleone, KEVVO, Bryant Myers, Lyanno, Dalex","El Efecto - Remix","(SME US Latin) Duars Entertainment, Corp. (2)",52,58,75,"53263"
58,"spotify:track:4t9a07PAghtQMRAIP9FQ7Z","Lunay, Daddy Yankee, Bad Bunny","Soltera (Remix)","round2media - LaFamilia",2,56,292,"52240"
59,"spotify:track:5NOHsDSfLIH45y3i9PfRyh","Casper Magico, Bryant Myers, Alex Rose, Juhn","Fantasmita - Remix","2019 Flow La Movie, Inc & Los Magicos",55,60,82,"51833"
60,"spotify:track:4s45VgkknMFkdiGoUcjxQU","Sebastian Yatra, Rauw Alejandro, Manuel Turizo","TBT","UMLE - Latino",57,57,5,"51223"
61,"spotify:track:4fj7e6Tc48Bmomwyz2Z2XC","Manuel Turizo, Anuel AA","Te Quemaste","Sony Music Latin/La Industria",18,62,187,"49089"
62,"spotify:track:7MRU4vOkywuhZ9kbFiPuiu","Daddy Yankee, Wisin & Yandel","Si Supieras","El Cartel Records (EC3)",6,64,243,"48468"
63,"spotify:track:64IRsSyqwD0CBbFAfrR0rT","Paloma Mami","Mami","Sony Music Latin",17,61,78,"48064"
64,"spotify:track:6t94PGXYAuo9GbJEnMpPcW","Super Yei, Sammy Baby, Myke Towers, Lenny Tavárez, Rafa Pabön","La Forma en Que Me Miras","2018 Superiority",58,63,562,"47961"
65,"spotify:track:3EK4tGkSiO5xvvB5sM4tln","Mon Laferte, Juanes","Amárrame","Universal Music Mexico",5,188,638,"47764"
66,"spotify:track:099tjv6oy2opbpCOA3nBwX","Ir Sais, Rauw Alejandro","Dream Girl - Remix","Sony Music Latin",65,65,51,"47671"
67,"spotify:track:5BAKerbfUwW5KboNuIPMmn","joel music, Puch Flow","Mueve Lo Que Dios Te Dio","Lody Produccion",52,66,58,"47465"
68,"spotify:track:09tYvFOFp1pKxZ8GJVlOXm","JHAYCO","Como Se Siente","N&E Entertainment LLC",68,72,27,"46612"
69,"spotify:track:4Qk19LdSLuuEDjzR8j2gcV","Francisca Valenzuela","Ya No Se Trata De Ti","Sony Music Entertainment Chile S.A",69,199,2,"45912"
70,"spotify:track:4skuEIloXWuxxgekKupkEH","Mon Laferte","Tu Falta De Querer","Universal Music Mexico",3,-1,435,"45615"
71,"spotify:track:25ZAibhr3bdlMCLmubZDVt","J Balvin, Bad Bunny","QUE PRETENDES","Universal Music Latino / Rimas",5,69,243,"45596"
72,"spotify:track:7fODjB7BrQTGqh0hogW6XD","Sech, Justin Quiles, Maluma, Nicky Jam, Farruko, Dalex, Lenny Tavárez","Que Mas Pues - Remix","Rich Music/Ingrooves Records",7,68,321,"45302"
73,"spotify:track:6v3KW9xbzN5yKLt9YKDYA2","Shawn Mendes, Camila Cabello","Señorita","Island Records",11,67,250,"45290"
74,"spotify:track:34ZngZgo8xicbt1EE8Ob8Z","Rich Music LTD, Sech, Dalex, Justin Quiles, Lenny Tavárez, Feid","Porno","Rich Music",53,71,138,"44963"
75,"spotify:track:7g8YaUQABMal0zWe7a2ijz","Dalex, Rafa Pabön, KHEA, Sech, Feid, Cazzu, Lenny Tavárez","Pa Mí (Remix)","Rich Music/Ingrooves Records",2,75,383,"43996"
76,"spotify:track:1KdwnsWOvhM53vezy5ROuf","C. Tangana, Paloma Mami","No Te Debí Besar","Sony Music Entertainment",4,73,167,"42999"
77,"spotify:track:27uAea0qcUz3a7jKnAT7KG","Santaferia","Algún Día Volverás","Santaferia",20,78,586,"42925"
78,"spotify:track:00kIWJu9IHiQ6i0qJAU0Z9","Mon Laferte","Amor Completo","Universal Music Mexico",10,-1,364,"42069"
79,"spotify:track:4lzxJ4jCuFDXXGkE1LmpKR","DJ Luian, Mambo Kingz, Anuel AA, Nicky Jam, Darell, Brytiago","Verte Ir","Hear This Music",1,82,335,"41983"
80,"spotify:track:0wMs7DPFOnToNAoecvAFQc","Rich Music LTD, Sech, Dalex, Justin Quiles, Lenny Tavárez, Feid, De La Ghetto, Zion & Lennox","Uniforme","Rich Music",23,83,138,"41586"
81,"spotify:track:7anSoGdgtmJTAPZBzcPhO6","Dalex, Nicky Jam, Justin Quiles, Sech, Lenny Tavárez, Feid, Rafa Pabön","Cuaderno","Rich Music/Ingrooves Records",5,81,292,"41398"
82,"spotify:track:0mcBgVRVsvESTkEyVHt7Ue","Darell","No Vuelvas Más","Sony Music Latin",73,84,81,"41300"
83,"spotify:track:0nbXyq5TXYPCO7pr3N8S4I","Roddy Ricch","The Box","Atlantic Records",70,77,43,"41226"
84,"spotify:track:2rc7BkzO8qepMFAxHtOrXc","J Balvin","Blanco","UMLE - Latino",54,85,103,"41220"
85,"spotify:track:3D4s7bVcwLr9xA8U0DriRr","Denise Rosenthal","Tiene Sabor","Universal Music Chile",57,74,6,"41158"
86,"spotify:track:1ueLYdeuGMAwUiaezLDObD","Cami, WOS","Funeral","Universal Music Chile",50,70,7,"41064"
87,"spotify:track:59s0s39NFWScuHDbHytI14","Reik, J Balvin, Lalo Ebratt","Indeciso","Indeciso",29,80,187,"40901"
88,"spotify:track:2w8SKQCnT2YQK1qCqKl2uW","Lenny Tavárez, Justin Quiles","La Pared 360","WEA Latina",86,90,19,"40225"
89,"spotify:track:7q3NthaBqFI6s0WnAlnIvq","Darell, Brytiago","Velitas","Sony Music Latin",36,86,229,"40138"
90,"spotify:track:1G2CAJeP7rCwOZjlSJ0Zw3","Major Lazer, J Balvin, El Alfa, Diplo","Que Calor","Mad Decent",42,88,166,"40028"
91,"spotify:track:374Yj1kOLjGLYLOydbCO3i","Lasso, Cami","Odio Que No Te Odio","Universal Music Mexico",19,79,40,"39818"
92,"spotify:track:0OoqRZXnSrgIUAha3iLKG1","Lunay, Myke Towers","La Cama","round2media - LaFamilia",19,87,134,"39740"
93,"spotify:track:16DNJ8y6k97DxuMyV49W7V","KHEA","Dónde Estás","Young Flex - Khea",93,98,13,"39712"
94,"spotify:track:56Ta1O7Jxxpjnc6cWdDKUo","Reik, Farruko, Camilo","Si Me Dices Que Sí","Sony Music México",91,94,6,"39082"
95,"spotify:track:5RClLxkUvnMWFUQ3VAQEHj","Myke Towers","Relación Rota","2020 One World Music & Casablanca Records | Powered by GLAD Empire, LL",69,92,33,"38747"
96,"spotify:track:7xX3wvvcZvxGCa06KlgTCp","Myke Towers","Tú","2020 One World Music & Casablanca Records | Powered by GLAD Empire, LL",89,89,33,"38635"
97,"spotify:track:7BlBVFwvbWvcwNcUarQmjk","ROSALÍA, Ozuna","Yo x Ti, Tu x Mi","Columbia",9,95,195,"38523"
98,"spotify:track:2qG5sZ7Si6sdK74qLxedYM","ROSALÍA, J Balvin, El Guincho","Con Altura","Columbia",12,93,335,"38348"
99,"spotify:track:3cUE3p7E39CzGjQoEsg7sM","Santaferia","EL Gil De Tu Ex","Santaferia",21,97,936,"37842"
100,"spotify:track:6768f4xbHQBpJo5lvFVNvs","Myke Towers","La Playa","2020 One World Music & Casablanca Records | Powered by GLAD Empire, LL",32,96,322,"37784"
101,"spotify:track:5iwz1NiezX7WWjnCgY5TH4","Pedro Capó, Farruko","Calma - Remix","Sony Music Latin",1,76,506,"37603"
102,"spotify:track:1zIshc2P9l5AZsOpJWmdTM","Ricky Martin","Tiburones","Sony Music Latin",59,59,3,"37554"
103,"spotify:track:2b8fOow8UzyDFAE27YhOZM","Maroon 5","Memories","Interscope Records*",101,101,97,"36989"
104,"spotify:track:56f5qnyAlZdlz8wrUDA50h","Mau y Ricky, Manuel Turizo, Camilo","Desconocidos","Sony Music Latin",9,99,499,"36876"
105,"spotify:track:2Fxmhks0bxGSBdJ92vM42m","Billie Eilish","bad guy","Darkroom/Interscope Records",31,91,333,"36731"
106,"spotify:track:1LiN0Z98FkR1t0m8KmLcAH","Anuel AA, Haze","Amanece","House of Haze",2,102,439,"36356"
107,"spotify:track:3QfD4bxxkopZL7XZ8RaezH","Tommy Boysen","Hookah & Sheridan's","Equity Distribution",12,103,525,"35961"
108,"spotify:track:6Xfz4YNwwIcFRyfW3QQZVp","Ceaese, Utopiko, Polimá Westcoast, Young Cister","Te Quiero Ver (feat. Polimá Westcoast y Young Cister)","WM Chile",31,106,430,"35897"
109,"spotify:track:28UP90XhjCovLtieduYr9P","Mon Laferte, Bunbury","Mi Buen Amor","Universal Music Mexico",84,-1,101,"35745"
110,"spotify:track:23o7KuK4jNJInTiOFogpXO","Francisca Valenzuela","Flotando","Sony Music Entertainment Chile S.A",110,-1,1,"35570"
111,"spotify:track:6U3AilMn51njMyILgOlBQl","Adan La Amenaza, Yordano El Menor, Yohancito, Anonimus King, Carlitos Junior, Forest, BlackRoy","Dele Cotele - Remix","Adan La Amenaza | Eyey Networks",54,100,145,"35408"
112,"spotify:track:5widvMUA2hiilH1RpOl5aM","Duki, RONNY J, Pablo Chill-E, Capo Plaza, C.R.O, Asan","Goteo - Remix","SSJ Records / DALE PLAY Records",53,104,33,"34955"
113,"spotify:track:7KbF6AdprOXEEHlsq11Z6d","Maluma","11 PM","Sony Music Latin",20,110,285,"34609"
114,"spotify:track:203uubEQA07to1kbro35qQ","NATTI NATASHA, Nicky Jam, Manuel Turizo, Myke Towers, DJ Luian, Mambo Kingz","Despacio","Pina Records",83,105,8,"34565"
115,"spotify:track:1tpbAGsGpZee5jDHMcLrUJ","Dalex, Lenny Tavárez","Bellaquita","Rich Music",17,107,173,"34408"
116,"spotify:track:4TnjEaWOeW0eKTKIEvJyCa","Trevor Daniel","Falling","Alamo",94,109,71,"33980"
117,"spotify:track:3YntiCUU0Xqq0B68FM3YAt","Myke Towers","Rutina","2019 Casablanca Records & One World Music | Distributed by GLAD Empire",70,114,73,"33829"
118,"spotify:track:2Y1EBfErprYwOlgluV9neb","Feid, Manuel Turizo","BORRAXXA","JP Entertainment (Jorge Pino)",115,120,11,"33691"
119,"spotify:track:1Ej96GIBCTvgH7tNX1r3qr","Sech, Darell","Otro Trago","Rich Music/Ingrooves Records",1,115,313,"33134"
120,"spotify:track:29ShXDWDedEwZkYc8Du08N","Rich Music LTD, Sech, Dalex, Justin Quiles, Lenny Tavárez, Feid, Cazzu","Imaginate","Rich Music",54,117,137,"33102"
121,"spotify:track:5w9c2J52mkdntKOmRLeM2m","Daddy Yankee, Snow","Con Calma","El Cartel Records (EC3)",1,116,398,"32480"
122,"spotify:track:0LHejotBx99f8kN7UQP2o4","Harry Nach, Young Kieff","Norty","Only Perk",114,118,71,"32253"
123,"spotify:track:2vrpcQNg6itmgVZWsNjWe0","Sebastian Yatra, Reik","Un Año","UMLE - Latino",9,119,404,"32226"
124,"spotify:track:3ZCTVFBt2Brf31RLEnCkWJ","Billie Eilish","everything i wanted","Darkroom/Interscope Records",63,111,103,"32153"
125,"spotify:track:1NmQc6rwLv7g0UHL1AFOa9","JHAYCO, Ozuna","Easy - Remix","N&E Entertainment LLC",57,122,98,"31962"
126,"spotify:track:2xuYcmQW7sFoVHygnyP2k1","Músicxs De Chile, Francisca Valenzuela, Cami, Gepe, Moral Distraida, Fernando Milagros, Mon Laferte, Denisse Malebrán, Benjamín Walker, Pedropiedra, C-Funk, Noche de Brujas, Santaferia, Chancho En Piedra, Consuelo Schuster, Schuster, Gianluca, Princesa Alba, Joe Vasconcellos, Illapu, Nano Stern, Javiera Parra, Elizabeth Morris, Rubio, Mariel Mariel, Paz Court, Manuel García, Angel Parra, Juan Angel","El Derecho de Vivir en Paz","Sucesión Víctor Jara",109,154,35,"31940"
127,"spotify:track:0aCTSZQTlmnjQucALTF00s","Harry Nach","Tak Tiki Tak","Sony Music Entertainment Chile S.A",118,123,35,"31868"
128,"spotify:track:26Qhn2T88XqVinXQpmSarj","Nicky Jam, Sech","Atrévete","Sony Music Latin",19,126,208,"31484"
129,"spotify:track:63Z1ToWxe9UJA82d9qF5lo","Simon la Letra, Pablo Chill-E","Es Poco","GGF",94,127,87,"31370"
130,"spotify:track:5px6upUHM3fhOP621Edp4V","Dua Lipa","Physical","Warner Records",72,125,26,"31368"
131,"spotify:track:4PJ3umtW1aWdfh5EITHc6T","Nicky Jam, Ozuna","Te Robaré","Sony Music Latin",4,128,341,"30949"
132,"spotify:track:132ALUzVLmqYB4UsBj5qD6","Paulo Londra","Adan y Eva","WEA Latina",1,124,478,"30537"
133,"spotify:track:35wvL50xvKpCHEJPxLOLPI","Bad Bunny","Si Estuviésemos Juntos","Rimas Entertainment LLC",7,121,428,"30470"
134,"spotify:track:3iQOfefMGDVDwo8dZoco8T","Feid, Justin Quiles","PORFA","JP Entertainment (Jorge Pino)",131,144,41,"30457"
135,"spotify:track:0mvRMcdYe8Wlo9dFbhfXpN","Francisca Valenzuela","Tómame","Sony Music Entertainment Chile S.A",135,-1,1,"29995"
136,"spotify:track:696DnlkuDOXcMAnKlTgXXK","Arizona Zervas","ROXANNE","Arizona Zervas",92,129,92,"29971"
137,"spotify:track:2QyuXBcV1LJ2rq01KhreMF","BTS","ON","BIGHIT MUSIC",75,108,5,"29867"
138,"spotify:track:0GmiGIxXDNrePrHBpijYDp","Yannc, Darkiel, Eladio Carrion, Brray, Myke Towers","Sigue Bailandome","Full Harmony",4,131,491,"29821"
139,"spotify:track:2oGcLhbdlhz7EOwIqcLTcJ","Francisca Valenzuela","Afortunada","Frantastic Records",139,-1,1,"29573"
140,"spotify:track:4xvTPuwHaXoDM3p0QcY7bH","DJ Luian, Mambo Kingz, Farruko, Wisin, Myke Towers, Darell, Arcángel","Música","Hear This Music",56,136,83,"29312"
141,"spotify:track:6ehhkBXzCrzBJ6YCL9tIdd","Pablo Chill-E, 0-600","Jugo y Plata","ShishiGang Récords",95,130,26,"29237"
142,"spotify:track:059bcIhyc2SBwm6sw2AZzd","Piso 21, Micro TDH","Te Vi","WM Mexico",17,134,433,"29127"
143,"spotify:track:6fIVDVyzymH4OAlNhJ93k3","Jerry Di, Zion & Lennox, Lyanno, Noriel, Luis Alberto Ambrosio Cuque, Pablo C Fuentes, Wilmo Belisario","Verano En París - Remix","Nacho",109,139,116,"29123"
144,"spotify:track:6OPl2rRpNsW1BZmtrSxP6X","Ceaese, Utopiko, DrefQuila, THAT","Damelo (feat. DrefQuila y THAT)","WM Chile",31,133,410,"28943"
145,"spotify:track:64kNRze29YqCFzFEpQCaHQ","Gigolo Y La Exce, Myke Towers, Arcángel, El Alfa, Farruko","Rasta Barbie (Remix)","Rimas Entertainment LLC",69,145,132,"28411"
146,"spotify:track:4odViYSPthqtubEZHUvXUj","DJ Snake, J Balvin, Ozuna, Nicky Jam, NATTI NATASHA, Darell, Sech","Loco Contigo (with J. Balvin & Ozuna feat. Nicky Jam, Natti Natasha, Darell & Sech) - REMIX","DJ Snake Music Productions Limited",59,140,61,"28123"
147,"spotify:track:2dy3TKVDEbIeWxeIb8JWqZ","NATTI NATASHA, Romeo Santos","La Mejor Versión de Mi - Remix","Pina Records",86,141,144,"28075"
148,"spotify:track:6b2RcmUt1g9N9mQ3CbjX2Y","Sam Smith","How Do You Sleep?","PLG - Capitol",60,142,219,"28042"
149,"spotify:track:7fa9MBXhVfQ8P8Df9OEbD8","Maroon 5, Cardi B","Girls Like You (feat. Cardi B) - Cardi B Version","Interscope Records*",46,148,368,"27988"
150,"spotify:track:7o0oY5wRcoV7oPuDhD2J1z","Paloma Mami","Fingías","Sony Music Latin",1,137,341,"27936"
151,"spotify:track:5jW3rF4URMdK7tO2xjS5EI","Paulo Londra","Tal Vez","WEA Latina",5,135,328,"27862"
152,"spotify:track:73SpzrcaHk0RQPFP73vqVR","Billie Eilish","No Time To Die","Darkroom/Interscope Records",75,132,12,"27817"
153,"spotify:track:0PaNKfwdqHjmW7hVEQ0lbu","Camilo","La Difícil","Sony Music Latin",117,143,46,"27699"
154,"spotify:track:370og6FUM8StmfUu0HlNHg","Denise Rosenthal, Mala Rodríguez","Agua Segura","Universal Music Chile",30,157,165,"27677"
155,"spotify:track:3f5lA8nnc4YYF1qf78WpHw","Anuel AA, Romeo Santos","Ella Quiere Beber - Remix","Real Hasta La Muerte, LLC",8,155,481,"27641"
156,"spotify:track:6wBrZZ1LyiBxytLnpgnlhf","Cami","Querida Rosa","Universal Music Chile",26,149,625,"27616"
157,"spotify:track:6g0R4XJbkoNpQ9iMLI2t1T","El Futuro Fuera De Orbita, Jey Brown, La Kikada","Sesi","Avatal Records LLC",133,151,6,"27426"
158,"spotify:track:3Dv1eDb0MEgF93GpLXlucZ","Doja Cat","Say So","Kemosabe Records/RCA Records",146,146,20,"27329"
159,"spotify:track:1GBLO0NFODuL31A5fgw0uR","Maluma, Ricky Martin","No Se Me Quita (feat. Ricky Martin)","Sony Music Latin",74,113,177,"27086"
160,"spotify:track:7BuHdm4lQqcyG3qTwdkxus","Wisin & Yandel, Romeo Santos","Aullando","Sony Music Latin",25,167,439,"26994"
161,"spotify:track:5XXRbcWjc6jQhAS6MxyYmu","Denise Rosenthal","Lucha En Equilibrio","Universal Music Chile",66,181,225,"26923"
162,"spotify:track:4Clmg1g8n2yBYG13Z1oSdG","Dayvi, Victor Cardenas, Kelly Ruíz","Baila Conmigo (feat. Kelly Ruiz)","Sony Music México",17,152,257,"26917"
163,"spotify:track:4umIPjkehX1r7uhmGvXiSV","Justin Bieber, Quavo","Intentions (feat. Quavo)","RBMG/Def Jam",94,147,18,"26883"
164,"spotify:track:6ydubKY1r75XKuQheIQB8f","Cami","Aquí Estoy","Universal Music Chile",11,153,246,"26793"
165,"spotify:track:6exje52SuWDGQ2Ol8K4P5I","Pablo Chill-E, Chuchu Retro","Pensando En Ti","ShiShigang Records",70,166,334,"26628"
166,"spotify:track:7DOh0tBGnyMt6C5OO7o8Yq","Cazzu, Lyanno, Rauw Alejandro, Dalex","Nada","Rimas Entertainment LLC",124,156,102,"26511"
167,"spotify:track:4ejyZ4uJEXUURcgKp1kP8v","The Weeknd","After Hours","Republic Records",88,138,6,"26360"
168,"spotify:track:7pxL0DzPpCjjcdfQccvnus","Piso 21, Myke Towers","Una Vida Para Recordar","WM Mexico",43,150,235,"26185"
169,"spotify:track:0ljEFYEFuqspdPCWn75FPP","Maroon 5","Sugar","Interscope Records*",97,179,158,"26146"
170,"spotify:track:6pNjmMB8FTMEcqGSgs7Mji","Farruko, Ozuna, Lunay, Sech, Sharo Towers","Nadie (feat. Sech & Sharo Towers) - Remix","Sony Music Latin",25,158,138,"26064"
171,"spotify:track:4jMwPJMtMF977ciTvD5fwg","Myke Towers, Farruko","Si Se Da","2020 One World Music & Casablanca Records | Powered by GLAD Empire, LL",6,160,363,"26025"
172,"spotify:track:2J9B63FawlTaPdg4eH5X03","Beéle","Loco","Hear This Music",98,173,132,"25753"
173,"spotify:track:5lFl0Aksww4t4CGiYYtpZz","Rauw Alejandro","Detective","Duars Entertainment, Corp.",109,183,190,"25626"
174,"spotify:track:4SJHHpKhcuXwDsCsPqshXj","Rauw Alejandro, Chencho Corleone","El Efecto","Duars Entertainment, Corp.",64,165,345,"25419"
175,"spotify:track:6osaMSJh9NguagEDQcZaKx","DJ Snake, J Balvin, Tyga","Loco Contigo (feat. J. Balvin & Tyga)","DJ Snake Music Productions Limited",33,176,257,"25386"
176,"spotify:track:5W83ErFkO3aKAIS1WMi6u0","Anuel AA, KAROL G","Secreto","Anuel AA & Karol G - Secreto",1,168,407,"25370"
177,"spotify:track:4aN4QlhHVjgvXYkF3hlW2b","Jay Wheeler, DJ Nelson, Farruko","Otra Noche Más - Remix","Linked Music / Dynamic Records / EMPIRE",145,174,34,"25365"
178,"spotify:track:2EEmzqzM70CybVspgM7YRT","Mau y Ricky, Camilo, Lunay","La Boca - Remix","Sony Music Latin",28,170,224,"24967"
179,"spotify:track:2hMemEDS1l5hrjLWwU1MNt","Polimá Westcoast, Pablo Chill-E","MY BLOOD","Sony Music Entertainment Chile S.A",21,169,365,"24879"
180,"spotify:track:3FhiU60cxfN2j4jRy5Y40w","Cauty, Lenny Tavarez, Jay Wheeler, Noriel, Alex Rose","Lloras - Remix","eOne Music",180,195,2,"24863"
181,"spotify:track:0EJu1RBtxzldMG2peczuPv","Paloma Mami","No Te Enamores","Sony Music Latin",1,161,432,"24823"
182,"spotify:track:6qqd7DGn2VXzxsR4k3Ycun","Rauw Alejandro, Farruko","Fantasias - Unplugged","(SME US Latin) Duars Entertainment, Corp. (2)",90,180,106,"24813"
183,"spotify:track:0x1k6gSTSxaLxe0F2IThaX","Mike Bahía, Danny Ocean","Detente","WM Mexico",139,189,43,"24672"
184,"spotify:track:152U4ecGSiYeKm2gnFc4wA","Villa Cariño","Serenata cruel","Clandestino Records",44,191,1066,"24573"
185,"spotify:track:3bCuNSiaBHqxdevMYEnGpe","Jesse & Joy, Luis Fonsi","Tanto","WEA Latina",78,177,112,"24345"
186,"spotify:track:6ifUES3keWjwXgae8pXI3o","Danny Ocean","Me Rehúso","Atlantic Records",1,182,1122,"24230"
187,"spotify:track:1khmgu0pveJbkbpbkyvcQv","Bad Bunny, El Alfa","La Romana","Rimas Entertainment LLC",14,178,429,"24210"
188,"spotify:track:7mWFF4gPADjTQjC97CgFVt","Ozuna, Daddy Yankee, J Balvin, Farruko, Anuel AA","Baila Baila Baila - Remix","VP Records Corp/Dimelo Vi",11,187,307,"24164"
189,"spotify:track:5xbZJo8AFv830Wx1RvmMXX","Drago200, Pablo Chill-E, Polimá Westcoast, Lleflight","Atraco Con 2 - Remix","Nabru Records LLC",119,190,29,"24056"
190,"spotify:track:2ohqtT8jp5VeSBAtBEpSqA","Brytiago, Myke Towers","Toxico","Business Music",58,185,100,"24019"
191,"spotify:track:3CV6tcIs0tqW3aJtu6THaM","Pablo Chill-E","Vibras","ShiShi Gang Records",91,197,345,"23970"
192,"spotify:track:5IkOnAKGDJT5M8KpFIHzsd","Mon Laferte","Antes De Ti","Universal Music Mexico",97,-1,7,"23864"
193,"spotify:track:7ef4DlsgrMEH11cDZd32M6","Calvin Harris, Dua Lipa","One Kiss (with Dua Lipa)","Sony Music UK",32,196,477,"23747"
