rank,uri,artist_names,track_name,source,peak_rank,previous_rank,days_on_chart,streams
1,"spotify:track:7k4t7uLgtOxPwTpFmtJNTY","KAROL G, Nicki Minaj","Tusa","TUSA - Karol G & Nicki Minaj",1,1,66,"399593"
2,"spotify:track:7sQKy5vlPQllr0k9IjYJv3","Arcángel, Sech, Dímelo Flow","Sigues Con El","Rimas Entertainment LLC.",2,2,31,"298387"
3,"spotify:track:5stPVcRqb4qixbafP9e8lt","Dalex, Lenny Tavárez, Chencho Corleone, Juhn, Dímelo Flow","Hola - Remix","Rich Music",2,3,73,"265416"
4,"spotify:track:5DxXgozhkPLgrbKFY91w0c","Bad Bunny","Vete","Rimas Entertainment LLC",1,4,53,"225109"
5,"spotify:track:2pWOMNQJW3g2zmGjP0Vkb0","Nicky Jam, Anuel AA","Whine Up","Sony Music Latin",4,5,76,"209482"
6,"spotify:track:1rgnBhdG2JDFTbYkYRZAku","Tones And I","Dance Monkey","Elektra (NEK)",6,6,97,"203131"
7,"spotify:track:6mAN61JH0dzyZpWslS11jy","Rauw Alejandro, Farruko","Fantasias","(SME US Latin) Duars Entertainment, Corp. (2)",1,7,136,"198002"
8,"spotify:track:37zdqI4r1gswIzczSBkRon","Lunay, Anuel AA, Ozuna","Aventura","round2media - LaFamilia",1,8,80,"179399"
9,"spotify:track:6cy3ki60hLwimwIje7tALf","Black Eyed Peas, J Balvin","RITMO (Bad Boys For Life)","Epic/We The Best",4,9,93,"170817"
10,"spotify:track:3jbT1Y5MoPwEIpZndDDwVq","Tainy, Anuel AA, Ozuna","Adicto (with Anuel AA & Ozuna)","NEON16/Interscope Records",1,10,144,"162468"
11,"spotify:track:2ksOAxtIxY8yElEWw8RhgK","Anuel AA, Daddy Yankee, KAROL G, J Balvin, Ozuna","China","2019 Real Hasta La Muerte, LLC.",1,11,178,"161179"
12,"spotify:track:1Xnn1TPyr5h0hpRAT4B4EA","Dalex, Lenny Tavárez, Anitta, NATTI NATASHA, Farruko, Justin Quiles","Bellaquita - Remix","Rich Music",11,12,52,"150371"
13,"spotify:track:6RyaV7owmVU6fzEPE17sF1","Daddy Yankee","Que Tire Pa Lante","El Cartel Records (EC3)",5,13,87,"142872"
14,"spotify:track:4R8BJggjosTswLxtkw8V7P","JHAYCO, J Balvin, Bad Bunny","No Me Conoce - Remix","N&E Entertainment LLC",2,14,241,"141347"
15,"spotify:track:5Id5B3dxJZhPcV9GzgYZZe","Rich Music LTD, Sech, Dalex, Justin Quiles, Lenny Tavárez, Feid, Wisin, Zion","Quizas","Rich Music",3,15,115,"137244"
16,"spotify:track:4VgYtXCVJ7IbWAZ5ryfvEQ","Nicky Jam, Daddy Yankee","Muévelo","Sony Music Latin",16,16,5,"132317"
17,"spotify:track:2TH65lNHgvLxCKXM3apjxI","Bad Bunny, Tainy","Callaita","Rimas Entertainment LLC",1,17,227,"120269"
18,"spotify:track:0fea68AdmYNygeTGI4RC18","J Balvin, Bad Bunny","LA CANCIÓN","Universal Music Latino / Rimas",4,18,199,"118600"
19,"spotify:track:4z6wo6PJG4Fve45OXK6D9m","Arcángel, Bad Bunny","Infeliz","Rimas Entertainment LLC.",19,19,24,"110102"
20,"spotify:track:6Y4PDQv4XjYjHLeLmvyOt0","Sech, Ozuna","Si Te Vas","Rich Music",5,20,109,"108166"
21,"spotify:track:1aUGxXCz9QimNkKeiJtzZ7","KEVVO, Farruko, Chencho Corleone, Arcángel, Darell, Ñengo Flow, Brytiago, Myke Towers","105 F Remix","Una Vision Quintana",7,21,123,"104031"
22,"spotify:track:684EjRHwNsZQ9hCQxL4NYL","Dímelo Flow, Nicky Jam, Sech, Farruko, Zion, Lunay","El Favor (with Nicky Jam & Sech, feat. Farruko, Zion & Lunay)","Rich Music/Interscope Records",6,22,136,"99486"
23,"spotify:track:4t9a07PAghtQMRAIP9FQ7Z","Lunay, Daddy Yankee, Bad Bunny","Soltera (Remix)","round2media - LaFamilia",2,23,248,"98069"
24,"spotify:track:6K5BsR04ijf3FHNzjbaagD","Myke Towers, Farruko, Arcángel, Sech, Zion","Si Se Da - Remix","2019 Casablanca Records & One World Music | Distributed by GLAD Empire",5,24,164,"96838"
25,"spotify:track:5YrjfKuFd0pMmYTGeRDV6X","Noriel","Piropo","Sony Music Latin/Ganda Entertainment",23,25,79,"96381"
26,"spotify:track:0RDgqtvOHLwcI6yz9bjsZV","Rich Music LTD, Sech, Dalex, Justin Quiles, Lenny Tavárez, Feid","Perreo en La Luna","Rich Music",22,26,94,"93441"
27,"spotify:track:1ndyl3wJCFs872XZ3ztPk6","Justin Quiles, NATTI NATASHA, Farruko, Lenny Tavárez, Dalex, Zion","DJ No Pare (feat. Zion, Dalex, Lenny Tavárez) - Remix","WEA Latina",19,27,129,"92171"
28,"spotify:track:4bTZeO72FwMa6wKOiqoynL","Sech, Ozuna, Anuel AA, Darell, Nicky Jam","Otro Trago - Remix","Rich Music",1,30,171,"88928"
29,"spotify:track:1nocRtwyNPVtGcIJqfgdzZ","Camilo, Pedro Capó","Tutu","Sony Music Latin",6,31,157,"88201"
30,"spotify:track:2B94bbI1a4LyBpK1439oP7","Noriel, Myke Towers, Rauw Alejandro, Almighty","Cuerpo en Venta","Rimas Entertainment LLC",11,29,157,"87840"
31,"spotify:track:4o1DxRjMCHDwBiOKv88rOl","Rvssian, Darell, Zion & Lennox, Myke Towers","B11 (feat. Myke Towers)","Sony Music Latin",14,28,116,"86644"
32,"spotify:track:7FbKipScVxkjQxQXwTd0gL","El Alfa, Lil Pump","Coronao Now","EL JEFE RECORDS LLC",21,33,67,"85022"
33,"spotify:track:40rXWke6SnXiGkSmaT8ZUr","Ozuna","Fantasía","Aura Music Corp.",26,32,45,"84577"
34,"spotify:track:25ZAibhr3bdlMCLmubZDVt","J Balvin, Bad Bunny","QUE PRETENDES","Universal Music Latino / Rimas",5,36,199,"79777"
35,"spotify:track:0i9oiUkWOgvtnjkr0fa3XN","Haze, Myke Towers","Piensan","2019 Casablanca Records & One World Music | Distributed by GLAD Empire",14,34,122,"79369"
36,"spotify:track:64IRsSyqwD0CBbFAfrR0rT","Paloma Mami","Mami","Sony Music Latin",17,35,34,"78685"
37,"spotify:track:70zg99pT51vB4wlMS7e4q7","Myke Towers, Maluma, Farruko","La Playa - Remix","2019 Casablanca Records & One World Music | Distributed by GLAD Empire",33,37,10,"77140"
38,"spotify:track:3mQ6SLdxxaL52Yte7KF2Ks","J Balvin","Morado","UMLE - Latino",38,39,3,"75211"
39,"spotify:track:56BAJvpaWgvr6C4wmc37iU","JHAYCO, Wisin & Yandel","Imaginaste - Remix","N&E Entertainment LLC",26,38,73,"75129"
40,"spotify:track:7BlBVFwvbWvcwNcUarQmjk","ROSALÍA, Ozuna","Yo x Ti, Tu x Mi","Columbia",9,43,151,"73342"
41,"spotify:track:7fODjB7BrQTGqh0hogW6XD","Sech, Justin Quiles, Maluma, Nicky Jam, Farruko, Dalex, Lenny Tavárez","Que Mas Pues - Remix","Rich Music/Ingrooves Records",7,40,277,"70934"
42,"spotify:track:7MRU4vOkywuhZ9kbFiPuiu","Daddy Yankee, Wisin & Yandel","Si Supieras","El Cartel Records (EC3)",6,42,199,"70708"
43,"spotify:track:4lzxJ4jCuFDXXGkE1LmpKR","DJ Luian, Mambo Kingz, Anuel AA, Nicky Jam, Darell, Brytiago","Verte Ir","Hear This Music",1,41,291,"70271"
44,"spotify:track:4fj7e6Tc48Bmomwyz2Z2XC","Manuel Turizo, Anuel AA","Te Quemaste","Sony Music Latin/La Industria",18,45,143,"70120"
45,"spotify:track:7anSoGdgtmJTAPZBzcPhO6","Dalex, Nicky Jam, Justin Quiles, Sech, Lenny Tavárez, Feid, Rafa Pabön","Cuaderno","Rich Music/Ingrooves Records",5,44,248,"69257"
46,"spotify:track:41L3O37CECZt3N7ziG2z7l","Justin Bieber","Yummy","RBMG/Def Jam",42,46,10,"68865"
47,"spotify:track:1KdwnsWOvhM53vezy5ROuf","C. Tangana, Paloma Mami","No Te Debí Besar","Sony Music Entertainment",4,49,123,"67397"
48,"spotify:track:6v3KW9xbzN5yKLt9YKDYA2","Shawn Mendes, Camila Cabello","Señorita","Island Records",11,48,206,"67348"
49,"spotify:track:53uKGbcMjEc2gIWbfmvpdS","Nio Garcia, Rauw Alejandro, Lenny Tavárez, Myke Towers, Casper Magico, Darell","Mírame - Remix","2019 Flow La Movie, Inc. | Distributed by GLAD Empire, LLC.",17,50,178,"66097"
50,"spotify:track:0lbhKycRyqkOMKZ6thzfU4","Eladio Carrion, Zion & Lennox, Wisin & Yandel, Lunay","Mi Error - Remix","Rimas Entertainment LLC",39,47,56,"65826"
51,"spotify:track:6EWWkqE4aFlZRyoFwwOT8u","Javiielo","Pa Los Gustos Los Colores","Oye Saavedra / EMPIRE",42,52,91,"61562"
52,"spotify:track:7g8YaUQABMal0zWe7a2ijz","Dalex, Rafa Pabön, KHEA, Sech, Feid, Cazzu, Lenny Tavárez","Pa Mí (Remix)","Rich Music/Ingrooves Records",2,53,339,"59036"
53,"spotify:track:1G2CAJeP7rCwOZjlSJ0Zw3","Major Lazer, J Balvin, El Alfa, Diplo","Que Calor","Mad Decent",42,55,122,"58086"
54,"spotify:track:27uAea0qcUz3a7jKnAT7KG","Santaferia","Algún Día Volverás","Santaferia",20,60,542,"57729"
55,"spotify:track:0OoqRZXnSrgIUAha3iLKG1","Lunay, Myke Towers","La Cama","round2media - LaFamilia",19,51,90,"57506"
56,"spotify:track:2rc7BkzO8qepMFAxHtOrXc","J Balvin","Blanco","UMLE - Latino",54,54,59,"56191"
57,"spotify:track:74j34STf8L6uADnTN69ohv","Rauw Alejandro, Chencho Corleone, KEVVO, Bryant Myers, Lyanno, Dalex","El Efecto - Remix","(SME US Latin) Duars Entertainment, Corp. (2)",52,56,31,"55607"
58,"spotify:track:2qG5sZ7Si6sdK74qLxedYM","ROSALÍA, J Balvin, El Guincho","Con Altura","Columbia",12,62,291,"55204"
59,"spotify:track:59s0s39NFWScuHDbHytI14","Reik, J Balvin, Lalo Ebratt","Indeciso","Indeciso",29,57,143,"55084"
60,"spotify:track:5NOHsDSfLIH45y3i9PfRyh","Casper Magico, Bryant Myers, Alex Rose, Juhn","Fantasmita - Remix","2019 Flow La Movie, Inc & Los Magicos",55,59,38,"54627"
61,"spotify:track:0wMs7DPFOnToNAoecvAFQc","Rich Music LTD, Sech, Dalex, Justin Quiles, Lenny Tavárez, Feid, De La Ghetto, Zion & Lennox","Uniforme","Rich Music",23,61,94,"54626"
62,"spotify:track:4PJ3umtW1aWdfh5EITHc6T","Nicky Jam, Ozuna","Te Robaré","Sony Music Latin",4,58,297,"53847"
63,"spotify:track:6WrI0LAC5M1Rw2MnX2ZvEg","Dua Lipa","Don't Start Now","Warner Records",50,63,73,"53267"
64,"spotify:track:5QXQy0f2q8wJNpPwJtjifx","DJ Snake, J Balvin, Ozuna, Nicky Jam, NATTI NATASHA, Darell, Sech","Loco Contigo (with J. Balvin & Ozuna feat. Nicky Jam, Natti Natasha, Darell & Sech) - REMIX","DJ Snake Music Productions Limited/Geffen Records",59,64,17,"51152"
65,"spotify:track:5m3jpKkgkfoMcym1qjToFg","Alex Rose, Rafa Pabön","Jangueo","Los Oidos Fresh/ Los Proximos",64,65,50,"50112"
66,"spotify:track:3cUE3p7E39CzGjQoEsg7sM","Santaferia","EL Gil De Tu Ex","Santaferia",21,71,892,"48773"
67,"spotify:track:4Clmg1g8n2yBYG13Z1oSdG","Dayvi, Victor Cardenas, Kelly Ruíz","Baila Conmigo (feat. Kelly Ruiz)","Sony Music México",17,67,213,"48756"
68,"spotify:track:5w9c2J52mkdntKOmRLeM2m","Daddy Yankee, Snow","Con Calma","El Cartel Records (EC3)",1,69,354,"45774"
69,"spotify:track:5iwz1NiezX7WWjnCgY5TH4","Pedro Capó, Farruko","Calma - Remix","Sony Music Latin",1,70,462,"45773"
70,"spotify:track:4xvTPuwHaXoDM3p0QcY7bH","DJ Luian, Mambo Kingz, Farruko, Wisin, Myke Towers, Darell, Arcángel","Música","Hear This Music",56,66,39,"45575"
71,"spotify:track:1Ej96GIBCTvgH7tNX1r3qr","Sech, Darell","Otro Trago","Rich Music/Ingrooves Records",1,68,269,"45537"
72,"spotify:track:1tpbAGsGpZee5jDHMcLrUJ","Dalex, Lenny Tavárez","Bellaquita","Rich Music",17,73,129,"45485"
73,"spotify:track:7q3NthaBqFI6s0WnAlnIvq","Darell, Brytiago","Velitas","Sony Music Latin",36,72,185,"45430"
74,"spotify:track:1LiN0Z98FkR1t0m8KmLcAH","Anuel AA, Haze","Amanece","House of Haze",2,74,395,"44117"
75,"spotify:track:6U3AilMn51njMyILgOlBQl","Adan La Amenaza, Yordano El Menor, Yohancito, Anonimus King, Carlitos Junior, Forest, BlackRoy","Dele Cotele - Remix","Adan La Amenaza | Eyey Networks",54,81,101,"42897"
76,"spotify:track:7KbF6AdprOXEEHlsq11Z6d","Maluma","11 PM","Sony Music Latin",20,75,241,"42815"
77,"spotify:track:3QfD4bxxkopZL7XZ8RaezH","Tommy Boysen","Hookah & Sheridan's","Equity Distribution",12,77,481,"42467"
78,"spotify:track:26Qhn2T88XqVinXQpmSarj","Nicky Jam, Sech","Atrévete","Sony Music Latin",19,76,164,"41985"
79,"spotify:track:0Cn8NxJZz7zUlsaA3rXoIU","JHAYCO, Ozuna","Easy - Remix","N&E Entertainment LLC",57,78,54,"40100"
80,"spotify:track:5jW3rF4URMdK7tO2xjS5EI","Paulo Londra","Tal Vez","WEA Latina",5,82,284,"39404"
81,"spotify:track:0GmiGIxXDNrePrHBpijYDp","Yannc, Darkiel, Eladio Carrion, Brray, Myke Towers","Sigue Bailandome","Full Harmony",4,83,447,"38888"
82,"spotify:track:3f5lA8nnc4YYF1qf78WpHw","Anuel AA, Romeo Santos","Ella Quiere Beber - Remix","Real Hasta La Muerte, LLC",8,80,437,"38858"
83,"spotify:track:56f5qnyAlZdlz8wrUDA50h","Mau y Ricky, Manuel Turizo, Camilo","Desconocidos","Sony Music Latin",9,79,455,"38824"
84,"spotify:track:132ALUzVLmqYB4UsBj5qD6","Paulo Londra","Adan y Eva","WEA Latina",1,86,434,"37927"
85,"spotify:track:6Xfz4YNwwIcFRyfW3QQZVp","Ceaese, Utopiko, Polimá Westcoast, Young Cister","Te Quiero Ver (feat. Polimá Westcoast y Young Cister)","WM Chile",31,87,386,"37430"
86,"spotify:track:0jeS8PyyIRAG0A3t5DtL71","Myke Towers","La Playa","2019 Casablanca Records & One World Music | Distributed by GLAD Empire",32,85,278,"37281"
87,"spotify:track:0dDboLfmRNsTBscy4j3Rnl","Ozuna","Hasta Que Salga el Sol","Aura Music Corp.",42,84,66,"36503"
88,"spotify:track:2vrpcQNg6itmgVZWsNjWe0","Sebastian Yatra, Reik","Un Año","UMLE - Latino",9,88,360,"36016"
89,"spotify:track:6osaMSJh9NguagEDQcZaKx","DJ Snake, J Balvin, Tyga","Loco Contigo (feat. J. Balvin & Tyga)","DJ Snake Music Productions Limited",33,89,213,"35901"
90,"spotify:track:4MR1AZhe1p0zTuH2HGhX9L","Zion & Lennox, Anuel AA, Haze","Guayo","WEA Latina",11,92,241,"34917"
91,"spotify:track:0mcBgVRVsvESTkEyVHt7Ue","Darell","No Vuelvas Más","Sony Music Latin",85,90,37,"34628"
92,"spotify:track:6t94PGXYAuo9GbJEnMpPcW","Super Yei, Sammy Baby, Myke Towers, Lenny Tavárez, Rafa Pabön","La Forma en Que Me Miras","2018 Superiority",58,91,518,"34574"
93,"spotify:track:5BAKerbfUwW5KboNuIPMmn","joel music, Puch Flow","Mueve Lo Que Dios Te Dio","Lody Produccion",93,110,14,"34515"
94,"spotify:track:2EEmzqzM70CybVspgM7YRT","Mau y Ricky, Camilo, Lunay","La Boca - Remix","Sony Music Latin",28,95,180,"34514"
95,"spotify:track:4SJHHpKhcuXwDsCsPqshXj","Rauw Alejandro, Chencho Corleone","El Efecto","Duars Entertainment, Corp.",64,93,301,"34328"
96,"spotify:track:696DnlkuDOXcMAnKlTgXXK","Arizona Zervas","ROXANNE","Arizona Zervas",92,104,48,"34321"
97,"spotify:track:059bcIhyc2SBwm6sw2AZzd","Piso 21, Micro TDH","Te Vi","WM Mexico",17,94,389,"34017"
98,"spotify:track:6OPl2rRpNsW1BZmtrSxP6X","Ceaese, Utopiko, DrefQuila, THAT","Damelo (feat. DrefQuila y THAT)","WM Chile",31,99,366,"33883"
99,"spotify:track:2Fxmhks0bxGSBdJ92vM42m","Billie Eilish","bad guy","Darkroom/Interscope Records",31,101,289,"33815"
100,"spotify:track:63Z1ToWxe9UJA82d9qF5lo","Simon la Letra, Pablo Chill-E","Es Poco","GGF",100,100,43,"33811"
101,"spotify:track:7BuHdm4lQqcyG3qTwdkxus","Wisin & Yandel, Romeo Santos","Aullando","Sony Music Latin",25,97,395,"33791"
102,"spotify:track:34ZngZgo8xicbt1EE8Ob8Z","Rich Music LTD, Sech, Dalex, Justin Quiles, Lenny Tavárez, Feid","Porno","Rich Music",53,98,94,"33553"
103,"spotify:track:7hynhxDoDpgMIV12JuVtNa","J Balvin, Bad Bunny, Marciano Cantero","UN PESO","Universal Music Latino / Rimas",9,96,199,"33170"
104,"spotify:track:5W83ErFkO3aKAIS1WMi6u0","Anuel AA, KAROL G","Secreto","Anuel AA & Karol G - Secreto",1,102,363,"32674"
105,"spotify:track:4MxYiw28F30NGOaTZ1ySqd","Mau y Ricky, Nicky Jam, Dalex, Dímelo Flow, Justin Quiles, Lenny Tavárez","Bota Fuego (feat. Dímelo Flow, Justin Quiles & Lenny Tavárez) - Remix","Sony Music Latin",100,105,16,"32188"
106,"spotify:track:57kdZIOAaolxAjB67d2yU3","Duki","Goteo","SSJ Records / DALE PLAY Records",22,109,158,"32089"
107,"spotify:track:7o0oY5wRcoV7oPuDhD2J1z","Paloma Mami","Fingías","Sony Music Latin",1,108,297,"32043"
108,"spotify:track:64kNRze29YqCFzFEpQCaHQ","Gigolo Y La Exce, Myke Towers, Arcángel, El Alfa, Farruko","Rasta Barbie (Remix)","Rimas Entertainment LLC",69,106,88,"31920"
109,"spotify:track:0EJu1RBtxzldMG2peczuPv","Paloma Mami","No Te Enamores","Sony Music Latin",1,114,388,"30905"
110,"spotify:track:2b8fOow8UzyDFAE27YhOZM","Maroon 5","Memories","Interscope Records*",101,115,53,"30869"
111,"spotify:track:7mWFF4gPADjTQjC97CgFVt","Ozuna, Daddy Yankee, J Balvin, Farruko, Anuel AA","Baila Baila Baila - Remix","VP Records Corp/Dimelo Vi",11,113,263,"30869"
112,"spotify:track:29ShXDWDedEwZkYc8Du08N","Rich Music LTD, Sech, Dalex, Justin Quiles, Lenny Tavárez, Feid, Cazzu","Imaginate","Rich Music",54,111,93,"30840"
113,"spotify:track:4BCPItsB94KDLuERZT3aNM","TINI, Lalo Ebratt","Fresa","5020 Records",58,117,127,"30231"
114,"spotify:track:1khmgu0pveJbkbpbkyvcQv","Bad Bunny, El Alfa","La Romana","Rimas Entertainment LLC",14,119,385,"30064"
115,"spotify:track:2b6i9zx3ULzKrNWmyP0ePD","John C, Neo Pistea, Bhavi, Trueno","C90 (Remix)","Piloto Productions",73,118,25,"29948"
116,"spotify:track:4l0Mvzj72xxOpRrp6h8nHi","Selena Gomez","Lose You To Love Me","Interscope Records",25,107,77,"29946"
117,"spotify:track:6pNjmMB8FTMEcqGSgs7Mji","Farruko, Ozuna, Lunay, Sech, Sharo Towers","Nadie (feat. Sech & Sharo Towers) - Remix","Sony Music Latin",25,112,94,"29896"
118,"spotify:track:3YntiCUU0Xqq0B68FM3YAt","Myke Towers","Rutina","2019 Casablanca Records & One World Music | Distributed by GLAD Empire",108,116,29,"29738"
119,"spotify:track:4TnjEaWOeW0eKTKIEvJyCa","Trevor Daniel","Falling","Alamo",113,127,27,"29328"
120,"spotify:track:7HMmFQsKsljwTw8bS7lu19","Selena Gomez","Rare","Interscope Records",71,103,3,"29218"
121,"spotify:track:0dlFCeKHsPhnLKPbqoOwwH","Santaferia","Haciendo nada","Santaferia",48,131,638,"29141"
122,"spotify:track:152U4ecGSiYeKm2gnFc4wA","Villa Cariño","Serenata cruel","Clandestino Records",44,128,1022,"29071"
123,"spotify:track:2ohqtT8jp5VeSBAtBEpSqA","Brytiago, Myke Towers","Toxico","Business Music",58,120,58,"28878"
124,"spotify:track:1kMUGCt7XLDc5Q64Vl0H8S","Residente, Bad Bunny","Bellacoso","5020 Records",13,125,171,"28617"
125,"spotify:track:3VyjsVV24RmBIbWJAeUJNu","Don Toliver","No Idea","We Run It Ent./Cactus Jack/Atlantic",114,129,17,"28585"
126,"spotify:track:6b2RcmUt1g9N9mQ3CbjX2Y","Sam Smith","How Do You Sleep?","PLG - Capitol",60,123,175,"28329"
127,"spotify:track:74wEiOpnvCe1tCTWKGSYta","Becky G, Paulo Londra","Cuando Te Besé","Kemosabe Records/RCA Records/Sony Music Latin",5,122,526,"28284"
128,"spotify:track:116H0KvKr2Zl4RPuVBruDO","Bad Bunny, Drake","MIA","Rimas Entertainment LLC",1,126,458,"27990"
129,"spotify:track:2dy3TKVDEbIeWxeIb8JWqZ","NATTI NATASHA, Romeo Santos","La Mejor Versión de Mi - Remix","Pina Records",86,121,100,"27385"
130,"spotify:track:3ZCTVFBt2Brf31RLEnCkWJ","Billie Eilish","everything i wanted","Darkroom/Interscope Records",63,132,59,"27351"
131,"spotify:track:5099x34vBakWpGkHourFxP","Maluma, J Balvin","Qué Pena","Sony Music Latin",43,124,107,"27283"
132,"spotify:track:099tjv6oy2opbpCOA3nBwX","Ir Sais, Rauw Alejandro","Dream Girl - Remix","Sony Music Latin",132,136,7,"27210"
133,"spotify:track:0VKkyBKCXyR99navhVRqcP","Zion & Lennox","La player (Bandolera)","WEA Latina",1,130,686,"27149"
134,"spotify:track:65DBZofI0b79kfHTcWWDuU","Soda Stereo","Trátame Suavemente - Remasterizado 2007","Columbia",134,150,227,"26853"
135,"spotify:track:6fIVDVyzymH4OAlNhJ93k3","Jerry Di, Zion & Lennox, Lyanno, Noriel, Luis Alberto Ambrosio Cuque, Pablo C Fuentes, Wilmo Belisario","Verano En París - Remix","Nacho",132,133,72,"26784"
136,"spotify:track:4u7EnebtmKWzUH433cf5Qv","Queen","Bohemian Rhapsody - Remastered 2011","EMI",26,140,574,"26657"
137,"spotify:track:35wvL50xvKpCHEJPxLOLPI","Bad Bunny","Si Estuviésemos Juntos","Rimas Entertainment LLC",7,135,384,"26514"
138,"spotify:track:42ArfZUgGo3k5btIHp08it","Paloma Mami","Not Steady","Sony Music Latin",3,139,513,"26310"
139,"spotify:track:7pxL0DzPpCjjcdfQccvnus","Piso 21, Myke Towers","Una Vida Para Recordar","WM Mexico",43,134,191,"26224"
140,"spotify:track:6MJUCumnQsQEKbCy28tbCP","Daddy Yankee, Anuel AA","Adictiva","El Cartel Records (EC3)",5,137,429,"25772"
141,"spotify:track:6ifUES3keWjwXgae8pXI3o","Danny Ocean","Me Rehúso","Atlantic Records",1,144,1078,"25692"
142,"spotify:track:0PabDDMMzwmn9cfJsfes7W","Wisin & Yandel","Chica Bombastic","Sony Music Latin",88,138,85,"25673"
143,"spotify:track:1GBLO0NFODuL31A5fgw0uR","Maluma, Ricky Martin","No Se Me Quita (feat. Ricky Martin)","Sony Music Latin",74,141,133,"25609"
144,"spotify:track:2hMemEDS1l5hrjLWwU1MNt","Polimá Westcoast, Pablo Chill-E","MY BLOOD","Sony Music Entertainment Chile S.A",21,151,321,"25577"
145,"spotify:track:5lFl0Aksww4t4CGiYYtpZz","Rauw Alejandro","Detective","Duars Entertainment, Corp.",109,149,146,"25480"
146,"spotify:track:3dWpRjCmaHbroNahuSeX11","Guaynaa, Nicky Jam, Farruko, Becky G, Sech","Rebota - Remix","Rebota Remix",21,148,184,"25389"
147,"spotify:track:1g2Z2lOrwayOzDqOc8EfbR","Farruko, Bad Bunny","La Cartera","Sony Music Latin",28,147,259,"25368"
148,"spotify:track:4EKZsrsCKyqr64FBHLc0DU","KAROL G, Maluma","Créeme","UMLE - Latino",32,142,433,"25186"
149,"spotify:track:4whKi0lMYWNiV2IZBkTbYB","Casper Magico, Rauw Alejandro","La Mas Linda","2019 Flow La Movie, Inc & Los Magicos",123,145,28,"25087"
150,"spotify:track:0LHejotBx99f8kN7UQP2o4","Harry Nach, Young Kieff","Norty","Only Perk",150,173,27,"24869"
151,"spotify:track:7BuSE9uTIw931wtZYzvZcQ","Sebastian Yatra, Daddy Yankee, NATTI NATASHA, Jonas Brothers","Runaway","UMLE - Latino",14,152,205,"24780"
152,"spotify:track:0sf12qNH5qcw8qpgymFOqD","The Weeknd","Blinding Lights","Republic Records",130,156,16,"24754"
153,"spotify:track:2J9B63FawlTaPdg4eH5X03","Beéle","Loco","Hear This Music",98,153,88,"24750"
154,"spotify:track:0tJCo71s7HT9Mu5Z4juuLw","Sech, Farruko, Zion & Lennox","Solita","Rich Music/Ingrooves Records",46,143,314,"24602"
155,"spotify:track:7LLXLd0pisbEAdIVK502VM","Wisin & Yandel","Reggaetón en lo Oscuro","Sony Music Latin",13,146,441,"24600"
156,"spotify:track:5qN1G8fSHq4Sv5FRoOkNGu","Paulo Londra","Por Eso Vine","WEA Latina",17,154,232,"24429"
157,"spotify:track:7lk2SWsLObPlO98pOvz6V0","Santaferia, Illapu","Si Te Marchas, No Hay Manera","Santaferia",80,171,278,"24239"
158,"spotify:track:3CACzG9I3AoKUKA3ODE5zW","Damas Gratis, Viru Kumbieron","Me Vas a Extrañar - En Vivo","Pelo Music S.A.",51,172,265,"24187"
159,"spotify:track:41axLDYnS1sPpENZ654sCN","Los Vasquez, Santaferia","Mariajuana","Sello del Sur Producciones Ltda",79,179,110,"24175"
160,"spotify:track:21jGcNKet2qwijlDFuPiPb","Post Malone","Circles","Republic Records",123,161,69,"24022"
161,"spotify:track:27qRmG3zOWPvMYUkpPdQ1g","Bryant Myers, Anuel AA","Gan-Ga - Remix","eOne Music",25,155,58,"23866"
162,"spotify:track:7DOh0tBGnyMt6C5OO7o8Yq","Cazzu, Lyanno, Rauw Alejandro, Dalex","Nada","Rimas Entertainment LLC",124,165,58,"23861"
163,"spotify:track:4cuGZb0iFyHtwaSKdKrJkF","Luis Fonsi, Ozuna","Imposible","UMLE - Latino",7,158,447,"23529"
164,"spotify:track:5suqjbw9bF0T1X3HU1oG1v","Bryant Myers, Alex Rose","Bandolera","eOne Music",78,167,195,"23415"
165,"spotify:track:6qqd7DGn2VXzxsR4k3Ycun","Rauw Alejandro, Farruko","Fantasias - Unplugged","(SME US Latin) Duars Entertainment, Corp. (2)",90,163,62,"23372"
166,"spotify:track:0UfVfRSmy4xMyi67LKH5zZ","Dímelo Flow, Sech, Dalex, Justin Quiles, La Exce, Feid, Zion","La Isla (with Sech & Dalex feat. Justin Quiles, La Exce, Feid, Zion)","Rich Music/Interscope Records",127,157,43,"23326"
167,"spotify:track:1LIqNVhaIgxXUt2eVoIQJ3","Maluma","HP","Sony Music Latin",18,159,317,"23274"
168,"spotify:track:48zFZh27QU5qsrBjn4C2FA","Ozuna, Manuel Turizo","Vaina Loca","VP Records Corp/Dimelo Vi",1,166,560,"23215"
169,"spotify:track:0qZ7oronoocHdFDKGBdgLQ","Zion & Lennox","Sistema","WEA Latina",134,160,25,"23165"
170,"spotify:track:6G4U9avyBNEfP0fAIduev3","Aventura, Don Omar","Ella Y Yo - Featuring Don Omar","Premium Latin Music",131,176,291,"23154"
171,"spotify:track:7ef4DlsgrMEH11cDZd32M6","Calvin Harris, Dua Lipa","One Kiss (with Dua Lipa)","Sony Music UK",32,168,433,"23140"
172,"spotify:track:4RaWbMItxVbuUExNkFsITP","Nio Garcia, Brray, Juanka","La Jeepeta","2019 Flow La Movie, Inc. | Distributed by GLAD Empire, LLC.",172,177,3,"23045"
173,"spotify:track:1fXEkSum1vbTa3w0yvYzYW","Lunay, Lyanno, Anuel AA, Brytiago, Alex Rose","A Solas (Remix)","round2media - LaFamilia",21,169,399,"22932"
174,"spotify:track:2YuxPUZng7DMxnUOnCbE3e","Marvel Boy, Casper Magico, Arcángel, Quimico Ultra Mega, Pablo Chill-E","Mcntm - Remix","2019 Flow La Movie, Inc. | Powered by GLAD Empire, LLC",85,170,37,"22845"
175,"spotify:track:7wUuLKb6d4XnycwcU2C0JE","Carlitos Junior, Yiordano Ignacio, BlackRoy","Desacatao (Remix)","Carlitos Junior 24k",107,182,38,"22831"
176,"spotify:track:3CV6tcIs0tqW3aJtu6THaM","Pablo Chill-E","Vibras","ShiShi Gang Records",91,180,304,"22812"
177,"spotify:track:5KbBGUpIZd6gVFUU8tqYiQ","Myke Towers, Farruko","Si Se Da","2019 Casablanca Records & One World Music | Distributed by GLAD Empire",6,164,319,"22708"
178,"spotify:track:4oPnxZzoc8HM5Pva4FDeIp","Ozuna","Te Soñé de Nuevo","Aura Music Corp.",30,162,218,"22621"
179,"spotify:track:6fatMybX8VmHUpaxVcXzrz","Ms Nina, Beauty Brain","Tu Sicaria","Universal Music Spain S.L.",53,198,101,"22491"
180,"spotify:track:09nSCeCs6eYfAIJVfye1CE","TINI, Sebastian Yatra","Oye","5020 Records",35,181,92,"22300"
181,"spotify:track:1JSTJqkT5qHq8MDJnJbRE1","The Police","Every Breath You Take","Polydor Records",161,190,107,"22296"
182,"spotify:track:6WkJ2OK163XXS2oARUC9JM","Aaron Smith, Krono, Luvli","Dancin (feat. Luvli) - Krono Remix","Sony Music Entertainment",80,194,224,"22250"
183,"spotify:track:4QXdarIBu7JDxVTTF4FHWE","Polimá Westcoast, Young Cister","LuisMi","Sony Music Entertainment Chile S.A",107,174,23,"22236"
184,"spotify:track:0hVXuCcriWRGvwMV1r5Yn9","Ed Sheeran & Justin Bieber, Justin Bieber","I Don't Care (with Justin Bieber)","Atlantic Records UK",28,178,193,"22198"
185,"spotify:track:2uhMYJq2TODWBuZhHRrdWy","Becky G, Myke Towers","DOLLAR","Kemosabe Records/RCA Records/Sony Music Latin",82,186,179,"22091"
186,"spotify:track:3V8UKqhEK5zBkBb6d6ub8i","Nio Garcia, Casper Magico, Bad Bunny, Darell, Ozuna, Nicky Jam","Te Boté - Remix","Flow La Movie, Inc.",1,185,610,"21839"
187,"spotify:track:3YqTzC9YYQmiT5nDZgl01q","Pablo Chill-E, El Futuro Fuera De Orbita","Flyte","ShiShi Gang Records",44,200,334,"21784"
188,"spotify:track:6wBrZZ1LyiBxytLnpgnlhf","Cami","Querida Rosa","Universal Music Chile",26,195,581,"21771"
189,"spotify:track:0937IXPkSlckRCq1WoHSEl","Mon Laferte, Guaynaa","Plata Ta Tá","Universal Music Mexico",51,189,57,"21693"
190,"spotify:track:6exje52SuWDGQ2Ol8K4P5I","Pablo Chill-E, Chuchu Retro","Pensando En Ti","ShiShigang Records",70,-1,290,"21648"
191,"spotify:track:7qiZfU4dY1lWllzX7mPBI3","Ed Sheeran","Shape of You","Atlantic Records UK",2,199,997,"21406"
192,"spotify:track:3LNZSTiwQYL7BnTfHvIOII","Rafaga","Una Cerveza","Leader Music, bajo licencia de Ráfaga",17,-1,30,"21362"
193,"spotify:track:0stKSegkdrfLTDvm5sIO38","Casper Magico, Anuel AA","No Te Veo - Remix","2019 Flow La Movie, Inc & Los Magicos",23,188,255,"21361"
194,"spotify:track:3iQOfefMGDVDwo8dZoco8T","Feid, Justin Quiles","PORFA","JP Entertainment (Jorge Pino)",184,184,5,"21229"
